"","eeg_nr","hersteller","typ","leistung_m","indatum_m","gem_m","b_wgs84","l_wgs84","nabe","rotor","gem_s","plz","ort","leistung_s","indatum_s","eiccode","bnetznr","menge_kwh","lk_nr","lk_name","flh","menge_mwh","vg_nr","vg_name"
"1","E00035056472000000000000012744409","Fuhrländer AG","FL 250",250,"29.05.1996",7143291,"50","8",42,NA,NA,NA,NA,NA,NA,NA,NA,NA,NA,NA,NA,NA,NA,NA
"2","E301610166955AAAD1001086600000000","GE Renewable Germany GmbH","77 1,5",1500,"03.11.2003",7340053,"49,152752","7,572352",85,77,731700000,66955,"Pirmasens",1500,"2003-11-03","11YR000000038602",10000161,2932902,7317,"Pirmasens",1955.268,2933,731700,"Pirmasens"
"3","E301610166957AAAD1005072700000000","Vestas Deutschland GmbH","V150-4.2 MW",4200,"21.08.2020",7340026,"49,166144","7,517801",145,150,NA,NA,NA,NA,NA,NA,NA,NA,NA,NA,NA,NA,NA,NA
"4","E301610166957AAAD1005073500000000","Vestas Deutschland GmbH","V150-4.2 MW",4200,"12.08.2020",7340026,"49,162454","7,517678",166,150,NA,NA,NA,NA,NA,NA,NA,NA,NA,NA,NA,NA,NA,NA
"5","E30254010000000000000523078730168","DeWind GmbH","D-62",1000,"02.11.1999",7335031,"49,382645","7,601927",91.5,NA,NA,NA,NA,NA,NA,NA,NA,NA,NA,NA,NA,NA,NA,NA
"6","E30254010000000000005230787201686","DeWind GmbH","D6 1000 kW",1000,"22.08.2000",7333054,"49,729723","7,744057",68.5,62,733307078,67823,"Unkenbach",1000,"2000-08-22","11YR00000001555H",10002992,1515606,7333,"Donnersbergkreis",1515.606,1516,733307,"Nordpfälzer Land"
"10","E30254010000000000005230787601693","Vestas Deutschland GmbH","V66",1650,"25.07.2001",7340053,"49,155613","7,575723",67,66,734003053,66957,"Vinningen",1650,"2001-07-25","11YR00000001555H",10002992,1286879,7340,"Südwestpfalz",779.926666666667,1287,734003,"Pirmasens Land"
"11","E30254010000000000005230787606677","Vestas Deutschland GmbH","V66",1650,"06.12.2000",7340053,"49,149563","7,574961",67,66,734003053,66957,"Vinningen",1650,"2000-12-06","11YR00000001555H",10002992,1286882,7340,"Südwestpfalz",779.928484848485,1287,734003,"Pirmasens Land"
"12","E30254010000000000005230787721589","ENERCON GmbH","E-40/5.40",500,"22.11.2000",7335029,"49,55759","7,721143",63,40,733510029,67700,"Niederkirchen",500,"2000-11-23","11YR00000001555H",10002992,898278,7335,"Kaiserslautern",1796.556,898,733510,"Otterbach-Otterberg"
"14","E30254010000000000005230788004100","ENERCON GmbH","E66/18.70-2",1800,"18.09.2001",7332027,"49,544255","8,120705",98,70,733207044,67311,"Tiefenthal",1800,"2001-09-19","11YR00000001555H",10002992,3112976,7332,"Bad Dürkheim",1729.43111111111,3113,733207,"Leiningerland"
"15","E30254010000000000005230788101704","ENERCON GmbH","ENERCON E-40/6.44",600,"11.07.2001",7133003,"49,770345","7,796039",65,44,713301030,67824,"Feilbingert",600,"2001-07-09","11YR00000001555H",10002992,732484,7133,"Bad Kreuznach",1220.80666666667,732,713301,"Bad Kreuznach"
"16","E30254010000000000005230788101705","ENERCON GmbH","E-40/6.44",600,"11.07.2001",7133003,"49,768817","7,796151",65,44,713301030,67824,"Feilbingert",600,"2001-07-09","11YR00000001555H",10002992,732484,7133,"Bad Kreuznach",1220.80666666667,732,713301,"Bad Kreuznach"
"17","E30254010000000000005230788104101","ENERCON GmbH","ENERCON E-40/6.44",600,"12.07.2001",7133003,"49,770811","7,793545",65,44,713301030,67824,"Feilbingert",600,"2001-07-09","11YR00000001555H",10002992,732480,7133,"Bad Kreuznach",1220.8,732,713301,"Bad Kreuznach"
"19","E30254010000000000005230788301708","Vestas Deutschland GmbH","V80",2000,"27.06.2002",7340055,"49,319708","7,591083",100,80,734009055,66919,"Weselberg",1800,"2002-06-27","11YR00000001555H",10002992,3170562,7340,"Südwestpfalz",1761.42333333333,3171,734009,"Thaleischweiler-Wallhalben"
"20","E30254010000000000005230788301709","GE Wind Energy GmbH","GE 1,5sl",1500,"04.06.2002",7340055,"49,322341","7,597756",100,77,734009055,66919,"Weselberg",1380,"2002-06-04","11YR00000001555H",10002992,2445573,7340,"Südwestpfalz",1772.15434782609,2446,734009,"Thaleischweiler-Wallhalben"
"21","E30254010000000000005230788306675","Vestas Deutschland GmbH","V80",2000,"15.01.2002",7340055,"49,319475","7,598403",100,80,734009055,66919,"Weselberg",1800,"2002-01-15","11YR00000001555H",10002992,3170560,7340,"Südwestpfalz",1761.42222222222,3171,734009,"Thaleischweiler-Wallhalben"
"22","E30254010000000000005230788501717","ENERCON GmbH","E66.70",1600,"24.12.2003",7336087,"49,529003","7,600984",98,70,733608087,67753,"Rothselberg",1600,"2003-12-19","11YR00000001555H",10002992,1073544,7336,"Kusel",670.965,1074,733608,"Lauterecken-Wolfstein"
"26","E30254010000000000005230788701721","Vestas Deutschland GmbH","V-80",2000,"12.06.2002",7335021,"49,365883","7,619488",100,80,733511037,66851,"Queidersbach",2000,"2002-06-12","11YR00000001555H",10002992,3308188,7335,"Kaiserslautern",1654.094,3308,733511,"Landstuhl"
"27","E30254010000000000005230789301729","GE Renewable Germany GmbH","77 1,5",1500,"21.12.2003",7334001,"49,173358","8,268825",100,77,733401001,76756,"Bellheim",1500,"2003-12-21","11YR00000001555H",10002992,2282789,7334,"Germersheim",1521.85933333333,2283,733401,"Bellheim"
"28","E30254010000000000005230789301730","GE Renewable Germany GmbH","77 1,5",1500,"21.12.2003",7334001,"49,174193","8,262902",100,77,733401001,76756,"Bellheim",1500,"2003-12-21","11YR00000001555H",10002992,2282789,7334,"Germersheim",1521.85933333333,2283,733401,"Bellheim"
"29","E30254010000000000005230789306702","GE Renewable Germany GmbH","77 1,5",1500,"17.12.2003",7334001,"49,175425","8,260155",100,77,733401001,76756,"Bellheim",1500,"2003-12-17","11YR00000001555H",10002992,2282790,7334,"Germersheim",1521.86,2283,733401,"Bellheim"
"30","E30254010000000000005230789401732","ENERCON GmbH","E-66",1800,"16.07.2004",7335033,"49,552833","7,656802",65,66,733510033,67737,"OlsbrÃ¼cken",1800,"2004-07-16","11YR00000001555H",10002992,2073185,7335,"Kaiserslautern",1151.76944444444,2073,733510,"Otterbach-Otterberg"
"31","E30254010000000000005230789401733","ENERCON GmbH","E-66",1800,"27.07.2004",7335033,"49,556707","7,65823",65,66,733510033,67737,"OlsbrÃ¼cken",1800,"2004-07-27","11YR00000001555H",10002992,2073177,7335,"Kaiserslautern",1151.765,2073,733510,"Otterbach-Otterberg"
"32","E30254010000000000005230789401734","ENERCON GmbH","E-66/20.70",2000,"03.12.2004",7332009,"49,577773","7,729247",98,70,733510029,67700,"Niederkirchen",2000,"2005-03-24","11YR00000001555H",10002992,2554238,7335,"Kaiserslautern",1277.119,2554,733510,"Otterbach-Otterberg"
"33","E30254010000000000005230789401735","ENERCON GmbH","E 66/20.70",2000,"30.11.2004",7332009,"49,576873","7,731607",98,77,733510029,67700,"Niederkirchen",2000,"2005-03-24","11YR00000001555H",10002992,2554238,7335,"Kaiserslautern",1277.119,2554,733510,"Otterbach-Otterberg"
"34","E30254010000000000005230789401736","ENERCON GmbH","E-66/20.70",2000,"24.03.2005",7332009,"49,584024","7,731049",98,70,733510029,67700,"Niederkirchen",2000,"2004-11-30","11YR00000001555H",10002992,2554238,7335,"Kaiserslautern",1277.119,2554,733510,"Otterbach-Otterberg"
"35","E30254010000000000005230789401737","ENERCON GmbH","E-66/20.70",2000,"24.03.2005",7332009,"49,585967","7,731109",98,70,733510029,67700,"Niederkirchen",2000,"2004-12-02","11YR00000001555H",10002992,2554238,7335,"Kaiserslautern",1277.119,2554,733510,"Otterbach-Otterberg"
"36","E30254010000000000005230789401738","ENERCON GmbH","E-70-E4",2000,"07.04.2006",7332009,"49,584602","7,720648",98,70,733510029,67700,"Niederkirchen",2000,"2006-03-22","11YR00000001555H",10002992,2882998,7335,"Kaiserslautern",1441.499,2883,733510,"Otterbach-Otterberg"
"37","E30254010000000000005230789401739","ENERCON GmbH","E70-E4",2000,"17.05.2006",7332009,"49,583218","7,723228",98,70,733510029,67700,"Niederkirchen",2000,"2006-05-08","11YR00000001555H",10002992,2882998,7335,"Kaiserslautern",1441.499,2883,733510,"Otterbach-Otterberg"
"38","E30254010000000000005230789401740","ENERCON GmbH","E-70-E4",2000,"30.03.2006",7332009,"49,588547","7,720517",98,70,733510029,67700,"Niederkirchen",2000,"2006-03-30","11YR00000001555H",10002992,2882998,7335,"Kaiserslautern",1441.499,2883,733510,"Otterbach-Otterberg"
"39","E30254010000000000005230789401741","ENERCON GmbH","E-70-E4",2000,"22.03.2006",7332009,"49,586589","7,720637",98,70,733510029,67700,"Niederkirchen",2000,"2006-05-18","11YR00000001555H",10002992,2882998,7335,"Kaiserslautern",1441.499,2883,733510,"Otterbach-Otterberg"
"40","E30254010000000000005230789401742","ENERCON GmbH","E70-E4",2000,"08.05.2006",7332009,"49,587505","7,724652",98,70,733510029,67700,"Niederkirchen",2000,"2006-05-24","11YR00000001555H",10002992,2882998,7335,"Kaiserslautern",1441.499,2883,733510,"Otterbach-Otterberg"
"41","E30254010000000000005230789401743","ENERCON GmbH","E-70-E4",2000,"24.05.2006",7332009,"49,586613","7,727745",98,70,733510029,67700,"Niederkirchen",2000,"2006-04-07","11YR00000001555H",10002992,2882992,7335,"Kaiserslautern",1441.496,2883,733510,"Otterbach-Otterberg"
"42","E30254010000000000005230789408782","ENERCON GmbH","E 70",2300,"08.01.2009",7336086,"49,605","7,65509",65,70,733608036,67753,"Hefersweiler",2300,"2009-01-08","11YR00000001555H",10002992,2344728,7336,"Kusel",1019.44695652174,2345,733608,"Lauterecken-Wolfstein"
"44","E30254010000000000005230789408818","ENERCON GmbH","E 70",2300,"13.01.2009",7336085,"49,60801","7,65637",65,70,733608085,67753,"Reipoltskirchen",2300,"2009-01-14","11YR00000001555H",10002992,2344719,7336,"Kusel",1019.44304347826,2345,733608,"Lauterecken-Wolfstein"
"45","E30254010000000000005230789408838","ENERCON GmbH","E 70",2300,"14.01.2009",7336036,"49,61113","7,66179",65,70,733608086,67753,"Relsberg",2300,"2009-01-12","11YR00000001555H",10002992,2344728,7336,"Kusel",1019.44695652174,2345,733608,"Lauterecken-Wolfstein"
"46","E30254010000000000005230789801746","Fuhrländer AG","FL MD 77",1500,"30.09.2005",7337039,"49,168084","8,251131",100,77,733704039,76863,"Herxheimweyher",1500,"2005-10-01","11YR00000001555H",10002992,2411405,7337,"Südliche Weinstraße",1607.60333333333,2411,733704,"Herxheim"
"47","E30254010000000000005230789801747","Fuhrländer AG","FL MD 77",1500,"10.10.2005",7337039,"49,165615","8,25461",100,77,733704039,76863,"Herxheimweyher",1500,"2005-10-10","11YR00000001555H",10002992,2411405,7337,"Südliche Weinstraße",1607.60333333333,2411,733704,"Herxheim"
"48","E30254010000000000005230789801748","Fuhrländer AG","FL MD 77",1500,"12.10.2005",7334025,"49,163768","8,260973",100,77,733704039,76863,"Herxheimweyher",1500,"2005-12-31","11YR00000001555H",10002992,2411405,7337,"Südliche Weinstraße",1607.60333333333,2411,733704,"Herxheim"
"49","E30254010000000000005230789801749","Fuhrländer AG","FL MD 77",1500,"22.10.2005",7337039,"49,165163","8,25836",100,77,733704039,76863,"Herxheimweyher",1500,"2005-12-31","11YR00000001555H",10002992,2411405,7337,"Südliche Weinstraße",1607.60333333333,2411,733704,"Herxheim"
"50","E30254010000000000005230789801750","Fuhrländer AG","FL MD 77",1500,"17.02.2006",7334025,"49,164089","8,264848",100,77,733704039,76863,"Herxheimweyher",1500,"2005-12-31","11YR00000001555H",10002992,2411405,7337,"Südliche Weinstraße",1607.60333333333,2411,733704,"Herxheim"
"51","E30254010000000000005230789807055","Fuhrländer AG","FL MD 77",1500,"27.09.2005",7337039,"49,167872","8,247555",100,77,733704039,76863,"Herxheimweyher",1500,"2005-10-01","11YR00000001555H",10002992,2411405,7337,"Südliche Weinstraße",1607.60333333333,2411,733704,"Herxheim"
"52","E30254010000000000005230790301752","Fuhrländer AG","FL MD77",1500,"22.12.2005",7316000,"49,386136","8,270259",100,77,733200025,67454,"HaÃŸloch",1500,"2005-12-23","11YR00000001555H",10002992,2143091,7332,"Bad Dürkheim",1428.72733333333,2143,733200,"vfr Bad Dürkheim"
"53","E30254010000000000005230790306701","Fuhrländer AG","FL MD77",1500,"22.12.2005",7316000,"49,381927","8,268697",100,77,733200025,67454,"HaÃŸloch",1500,"2005-12-16","11YR00000001555H",10002992,2143096,7332,"Bad Dürkheim",1428.73066666667,2143,733200,"vfr Bad Dürkheim"
"55","E30254010000000000005230790601755","ENERCON GmbH","E-70 E4",2000,"17.08.2006",7340022,"49,303426","7,616378",113.5,71,734006022,66989,"HÃ¶heinÃ¶d",2000,"2006-08-17","11YR00000001555H",10002992,2852936,7340,"Südwestpfalz",1426.468,2853,734006,"Waldfischbach-Burgalben"
"61","E30254010000000000005230791001762","GE Renewable Germany GmbH","77 1,5",1500,"22.09.2004",7334020,"49,081286","8,155437",100,77,733404020,76872,"Minfeld",1500,"2004-09-22","11YR00000001555H",10002992,2504323,7334,"Germersheim",1669.54866666667,2504,733404,"Kandel"
"62","E30254010000000000005230791001763","GE Renewable Germany GmbH","77 1,5",1500,"14.09.2004",7334020,"49,081483","8,152292",100,77,733404020,76872,"Minfeld",1500,"2004-09-14","11YR00000001555H",10002992,2504323,7334,"Germersheim",1669.54866666667,2504,733404,"Kandel"
"63","E30254010000000000005230791001764","GE Renewable Germany GmbH","77 1,5",1500,"15.09.2004",7334020,"49,079857","8,158007",100,77,733404020,76872,"Minfeld",1500,"2004-09-15","11YR00000001555H",10002992,2504323,7334,"Germersheim",1669.54866666667,2504,733404,"Kandel"
"64","E30254010000000000005230791006703","GE Renewable Germany GmbH","77 1,5",1500,"22.09.2004",7334020,"49,082963","8,147428",100,77,733404020,76872,"Minfeld",1500,"2004-09-22","11YR00000001555H",10002992,2504323,7334,"Germersheim",1669.54866666667,2504,733404,"Kandel"
"65","E30254010000000000005230791008781","Vestas Deutschland GmbH","V 90",2000,"12.02.2009",7334020,"49,085519","8,147192",105,90,733404020,76872,"Minfeld",2000,"2009-02-12","11YR00000001555H",10002992,3610916,7334,"Germersheim",1805.458,3611,733404,"Kandel"
"66","E30254010000000000005230797401809","DeWind GmbH","DeWind D6/64",1250,"28.03.2003",7335003,"49","7",91.5,64,734009216,66894,"KrÃ¤henberg",1250,"2003-03-28","11YR00000001555H",10002992,1252114,7340,"Südwestpfalz",1001.6912,1252,734009,"Thaleischweiler-Wallhalben"
"67","E30254010000000000005230797401810","DeWind GmbH","DeWind D6/64",1250,"25.03.2003",7335003,"49","7",91.5,64,734009216,66894,"KrÃ¤henberg",1250,"2003-03-25","11YR00000001555H",10002992,1252114,7340,"Südwestpfalz",1001.6912,1252,734009,"Thaleischweiler-Wallhalben"
"68","E30254010000000000005230797401811","DeWind GmbH","DeWind D6/64",1250,"19.03.2003",7335003,"49","7",68,64,734009216,66894,"KrÃ¤henberg",1250,"2003-03-19","11YR00000001555H",10002992,1374979,7340,"Südwestpfalz",1099.9832,1375,734009,"Thaleischweiler-Wallhalben"
"69","E30254010000000000005230797401812","DeWind GmbH","DeWind D6/64",1250,"31.03.2003",7335003,"49","7",68,64,734009216,66894,"KrÃ¤henberg",1250,"2003-03-31","11YR00000001555H",10002992,1374979,7340,"Südwestpfalz",1099.9832,1375,734009,"Thaleischweiler-Wallhalben"
"70","E30254010000000000005230797405750","DeWind GmbH","DeWind D6/64",1250,"31.03.2003",7335003,"49","7",91.5,64,734009216,66894,"KrÃ¤henberg",1250,"2003-03-31","11YR00000001555H",10002992,1374978,7340,"Südwestpfalz",1099.9824,1375,734009,"Thaleischweiler-Wallhalben"
"71","E30254010000000000005230797501801","Fuhrländer AG","FL MD77",1500,"17.01.2006",7334028,"49,266912","8,355917",100,77,733405028,67365,"Schwegenheim",1500,"2006-01-17","11YR00000001555H",10002992,1833372,7334,"Germersheim",1222.248,1833,733405,"Lingenfeld"
"72","E30254010000000000005230797501802","Fuhrländer AG","FL MD77",1500,"31.01.2006",7334028,"49,268489","8,362973",100,77,733405028,67365,"Schwegenheim",1500,"2006-01-31","11YR00000001555H",10002992,1833372,7334,"Germersheim",1222.248,1833,733405,"Lingenfeld"
"73","E30254010000000000005230797501803","Fuhrländer AG","FL MD77",1500,"23.12.2005",7334028,"49,265038","8,348838",100,77,733405028,67365,"Schwegenheim",1500,"2005-12-23","11YR00000001555H",10002992,1833372,7334,"Germersheim",1222.248,1833,733405,"Lingenfeld"
"78","E30254010000000000005230822702034","ENERCON GmbH","E-66 /15.66",1500,"10.04.2000",7333008,"49,628597","7,755712",67,66,733307008,67806,"Bisterschied",1500,"2000-04-10","11YR00000001555H",10002992,1975377,7333,"Donnersbergkreis",1316.918,1975,733307,"Nordpfälzer Land"
"79","E30254010000000000005230822702035","ENERCON GmbH","E-66/18.70b",1800,"05.03.2004",7333008,"49,629879","7,755334",98,66,NA,NA,NA,NA,NA,NA,NA,NA,NA,NA,NA,NA,NA,NA
"80","E30254010000000000005230822706687","Enron Wind GmbH","E-40/5.40",500,"04.11.1999",7333008,"49,628729","7,758726",65,40,NA,NA,NA,NA,NA,NA,NA,NA,NA,NA,NA,NA,NA,NA
"83","E30254010000000000005230823402040","ENERCON GmbH","E 40/6.44",600,"28.12.2004",7336074,"49,686775","7,666451",78,44,733608074,67748,"Odenbach",600,"2004-12-28","11YR00000001555H",10002992,716942,7336,"Kusel",1194.90333333333,717,733608,"Lauterecken-Wolfstein"
"84","E30254010000000000005230823407054","ENERCON GmbH","E 40/6.44",600,"28.12.2004",7336074,"49,685214","7,665335",78,44,733608074,67748,"Odenbach",600,"2004-12-28","11YR00000001555H",10002992,716934,7336,"Kusel",1194.89,717,733608,"Lauterecken-Wolfstein"
"87","E30254010000000000005230837706693","ENERCON GmbH","E 40",500,"05.02.1998",7333031,"49,679773","8,076552",65,40,733304031,67294,"Ilbesheim",500,"1998-02-05","11YR00000001555H",10002992,725465,7333,"Donnersbergkreis",1450.93,725,733304,"Kirchheimbolanden"
"88","E30254010000000000005230838106691","ENERCON GmbH","E-66/18.70",1800,"21.12.2000",7333040,"49,677834","7,901341",98,70,733304040,67819,"Kriegsfeld",1800,"2000-12-21","11YR00000001555H",10002992,3120769,7333,"Donnersbergkreis",1733.76055555556,3121,733304,"Kirchheimbolanden"
"89","E30254010000000000005230876501820","ENERCON GmbH","E-40/6.44 E2",600,"07.05.2002",7336069,"49,6504","7,6976",65,44,733608069,67759,"NuÃŸbach",600,"2002-05-07","11YR00000001555H",10002992,1022546,7336,"Kusel",1704.24333333333,1023,733608,"Lauterecken-Wolfstein"
"90","E30254010000000000005230888706707","ENERCON GmbH","E-66/18.70-3",1800,"11.12.2003",7336069,"49,6523","7,7038",98,70,733608069,67759,"NuÃŸbach",1600,"2003-12-12","11YR00000001555H",10002992,3219360,7336,"Kusel",2012.1,3219,733608,"Lauterecken-Wolfstein"
"91","E30254010000000000005230940402446","Vestas Deutschland GmbH","V90-2.0MW",2000,"13.04.2006",7338023,"49,293704","8,379747",105,90,733807023,67354,"RÃ¶merberg",2000,"2006-04-13","11YR00000001555H",10002992,3159743,7338,"Rhein-Pfalz",1579.8715,3160,733807,"Römerberg-Dudenhofen"
"92","E30254010000000000005230940406757","Vestas Deutschland GmbH","V90",2000,"01.10.2008",7338023,"49,296821","8,383127",105,90,733807023,67354,"RÃ¶merberg",2000,"2008-10-01","11YR00000001555H",10002992,3052733,7338,"Rhein-Pfalz",1526.3665,3053,733807,"Römerberg-Dudenhofen"
"93","E30254010000000000005231606303528","Vestas Deutschland GmbH","V-80-2.0",2000,"14.02.2003",7335501,"49,520949","7,530289",100,80,733509501,66879,"Reichenbach-Steegen",2000,"2003-02-14","11YR00000001555H",10002992,2885151,7335,"Kaiserslautern",1442.5755,2885,733509,"Weilerbach"
"94","E30254010000000000005231606303529","Vestas Deutschland GmbH","V-80",2000,"19.01.2003",7335501,"49,519808","7,533332",100,80,733509501,66879,"Reichenbach-Steegen",2000,"2003-01-19","11YR00000001555H",10002992,2885151,7335,"Kaiserslautern",1442.5755,2885,733509,"Weilerbach"
"95","E30254010000000000005231606303530","Vestas Deutschland GmbH","V-80",2000,"16.01.2003",7335501,"49,518207","7,53529",100,80,733509501,66879,"Reichenbach-Steegen",2000,"2003-01-16","11YR00000001555H",10002992,2885151,7335,"Kaiserslautern",1442.5755,2885,733509,"Weilerbach"
"96","E30254010000000000005231606303531","Vestas Deutschland GmbH","V-80",2000,"28.12.2002",7335501,"49,518739","7,539336",100,80,733509501,66879,"Reichenbach-Steegen",2000,"2002-12-28","11YR00000001555H",10002992,2885151,7335,"Kaiserslautern",1442.5755,2885,733509,"Weilerbach"
"97","E30254010000000000005231606303532","Vestas Deutschland GmbH","V-80",2000,"29.12.2002",7335501,"49,519194","7,543122",100,80,733509501,66879,"Reichenbach-Steegen",2000,"2002-12-29","11YR00000001555H",10002992,2885151,7335,"Kaiserslautern",1442.5755,2885,733509,"Weilerbach"
"98","E30254010000000000005231606303533","ENERCON GmbH","E-66/20.70",2000,"08.12.2004",7336087,"49,530546","7,589261",98,70.4,733608087,67753,"Rothselberg",2000,"2004-12-08","11YR00000001555H",10002992,2411487,7336,"Kusel",1205.7435,2411,733608,"Lauterecken-Wolfstein"
"99","E30254010000000000005231606303534","ENERCON GmbH","E-66/20.70",2000,"02.12.2004",7336087,"49,521912","7,607461",98,70.4,733608087,67753,"Rothselberg",2000,"2004-12-02","11YR00000001555H",10002992,2411484,7336,"Kusel",1205.742,2411,733608,"Lauterecken-Wolfstein"
"100","E30254010000000000005231607403543","Vestas Deutschland GmbH","V66",1650,"19.10.2000",7333038,"49,58767","8,079197",67,66,733302038,67304,"Kerzenheim",1650,"2000-10-19","11YR00000001555H",10002992,1396482,7333,"Donnersbergkreis",846.352727272727,1396,733302,"Eisenberg"
"102","E30254010000000000005231640303562","Vestas Deutschland GmbH","V90",2000,"28.02.2007",7336047,"49,499972","7,404166",105,90,733609047,66909,"HÃ¼ffler",2000,"2007-02-28","11YR00000001555H",10002992,3818634,7336,"Kusel",1909.317,3819,733609,"Oberes Glantal"
"103","E30254010000000000005231640307069","Vestas Deutschland GmbH","V90",2000,"21.02.2007",7336047,"49,502427","7,404858",105,90,733609047,66909,"HÃ¼ffler",2000,"2007-02-21","11YR00000001555H",10002992,3818627,7336,"Kusel",1909.3135,3819,733609,"Oberes Glantal"
"104","E30254010000000000005231819004016","ENERCON GmbH","E48",800,"09.08.2007",7340016,"49,192646","7,353584",75.8,48,734006016,66919,"Hermersberg",800,"2007-08-09","11YR00000001555H",10002992,1174216,7340,"Südwestpfalz",1467.77,1174,734006,"Waldfischbach-Burgalben"
"105","E30254010000000000005231819006705","ENERCON GmbH","E48",800,"07.08.2007",7340016,"49,192571","7,354011",75.8,48,734006016,66919,"Hermersberg",800,"2007-08-07","11YR00000001555H",10002992,1174216,7340,"Südwestpfalz",1467.77,1174,734006,"Waldfischbach-Burgalben"
"106","E30254010000000000005231819007703","ENERCON GmbH","E82",2000,"16.07.2008",7340055,"49,185654","7,353584",138,82,734006016,66919,"Hermersberg",2000,"2008-07-10","11YR00000001555H",10002992,4024250,7340,"Südwestpfalz",2012.125,4024,734006,"Waldfischbach-Burgalben"
"107","E30254010000000000005231819007704","ENERCON GmbH","E82",2000,"08.07.2008",7340055,"49,192571","7,354011",138,82,734006016,66919,"Hermersberg",2000,"2008-07-29","11YR00000001555H",10002992,4024251,7340,"Südwestpfalz",2012.1255,4024,734006,"Waldfischbach-Burgalben"
"108","E30254010000000000005231821504019","ENERCON GmbH","E48",800,"13.07.2007",7336021,"49,341545","7,292918",75.8,48,733610103,66887,"Welchweiler",2000,"2007-08-03","11YR00000001555H",10002992,1700281,7336,"Kusel",850.1405,1700,733610,"Kusel-Altenglan"
"109","E30254010000000000005232123306711","ENERCON GmbH","E82",2000,"28.12.2007",7340015,"49,174153","7,372911",108,82,734006054,67714,"Waldfischbach-Burgalben",2000,"2007-12-28","11YR00000001555H",10002992,3092015,7340,"Südwestpfalz",1546.0075,3092,734006,"Waldfischbach-Burgalben"
"110","E30254010000000000005232123306712","ENERCON GmbH","E82",2000,"27.12.2007",7340015,"49,174659","7,375159",108,82,734006022,66989,"HÃ¶heinÃ¶d",2000,"2007-12-27","11YR00000001555H",10002992,3092015,7340,"Südwestpfalz",1546.0075,3092,734006,"Waldfischbach-Burgalben"
"111","E30254010000000000005232123306713","ENERCON GmbH","E82",2000,"30.01.2008",7340015,"49,173073","7,373579",108,82,734006054,67714,"Waldfischbach-Burgalben",2000,"2008-01-30","11YR00000001555H",10002992,3092016,7340,"Südwestpfalz",1546.008,3092,734006,"Waldfischbach-Burgalben"
"112","E30254010000000000005232263805059","Vestas Deutschland GmbH","V90",2000,"04.03.2008",7337061,"49,170983","8,20202",105,90,733707061,76877,"Offenbach",2000,"2008-03-04","11YR00000001555H",10002992,3564919,7337,"Südliche Weinstraße",1782.4595,3565,733707,"Offenbach an der Queich"
"113","E30254010000000000005232263805060","Vestas Deutschland GmbH","V90",2000,"17.03.2008",7337061,"49,167192","8,2064",105,90,733707061,76877,"Offenbach",2000,"2008-03-17","11YR00000001555H",10002992,3564919,7337,"Südliche Weinstraße",1782.4595,3565,733707,"Offenbach an der Queich"
"114","E30254010000000000005232263805061","Vestas Deutschland GmbH","V90",2000,"08.03.2008",7337061,"49,169503","8,205116",105,90,733707061,76877,"Offenbach",2000,"2008-03-08","11YR00000001555H",10002992,3564912,7337,"Südliche Weinstraße",1782.456,3565,733707,"Offenbach an der Queich"
"115","E30254010000000000005232790909814","Vestas Deutschland GmbH","V90",2000,"07.10.2008",7338023,"49,297747","8,377295",105,90,733807023,67354,"RÃ¶merberg",2000,"2008-10-07","11YR00000001555H",10002992,3052724,7338,"Rhein-Pfalz",1526.362,3053,733807,"Römerberg-Dudenhofen"
"116","E30254010000000000005232855709017","ENERCON GmbH","E 70",2300,"27.02.2009",7340221,"49,172108","7,466173",98,71,734008221,66484,"Riedelberg",2300,"2009-02-27","11YR00000001555H",10002992,3114291,7340,"Südwestpfalz",1354.03956521739,3114,734008,"Zweibrücken-Land"
"117","E30254010000000000005232855709018","ENERCON GmbH","E 70",2300,"04.03.2009",7340221,"49,170805","7,469643",98,71,734008221,66484,"Riedelberg",2300,"2009-03-04","11YR00000001555H",10002992,3114293,7340,"Südwestpfalz",1354.04043478261,3114,734008,"Zweibrücken-Land"
"118","E30254010000000000005232855709019","ENERCON GmbH","E 82",2000,"03.03.2009",7340221,"49,170418","7,473716",98,82,734008221,66484,"Riedelberg",2000,"2009-03-03","11YR00000001555H",10002992,3705969,7340,"Südwestpfalz",1852.9845,3706,734008,"Zweibrücken-Land"
"119","E30254010000000000005232855709020","ENERCON GmbH","E 82",2000,"27.02.2009",7340221,"49,169497","7,477531",98,82,734008221,66484,"Riedelberg",2000,"2009-02-27","11YR00000001555H",10002992,3705969,7340,"Südwestpfalz",1852.9845,3706,734008,"Zweibrücken-Land"
"120","E30254010000000000005233312514223","ENERCON GmbH","E82",2000,"26.10.2009",7336003,"49,560905","7,427893",108,82,733610003,66885,"Erdesbach-Patersbach",2000,"2009-10-26","11YR00000001555H",10002992,2812792,7336,"Kusel",1406.396,2813,733610,"Kusel-Altenglan"
"121","E30254010000000000005233312514224","ENERCON GmbH","E82",2000,"03.11.2009",7336003,"49,563606","7,422525",108,82,733610022,66887,"Erdesbach-Patersbach",2000,"2009-11-03","11YR00000001555H",10002992,2812792,7336,"Kusel",1406.396,2813,733610,"Kusel-Altenglan"
"122","E30254010000000000005233312514225","ENERCON GmbH","E82",2000,"03.11.2009",7336003,"49,560124","7,422714",108,82,733610022,66887,"Erdesbach-Patersbach",2000,"2009-11-03","11YR00000001555H",10002992,2812791,7336,"Kusel",1406.3955,2813,733610,"Kusel-Altenglan"
"123","E30254010000000000005233312514226","ENERCON GmbH","E82",2000,"12.10.2009",7336003,"49,557391","7,421888",108,82,733610003,66885,"Erdesbach-Patersbach",2000,"2009-10-12","11YR00000001555H",10002992,2812792,7336,"Kusel",1406.396,2813,733610,"Kusel-Altenglan"
"124","E30254010000000000005233432816109","Vestas Deutschland GmbH","V-90",2000,"28.11.2009",7340226,"49,21603","7,49013",105,90,734008226,66484,"Walshausen",2000,"2009-11-28","11YR00000001555H",10002992,3690572,7340,"Südwestpfalz",1845.286,3691,734008,"Zweibrücken-Land"
"125","E30254010000000000005233432816110","Vestas Deutschland GmbH","V-90",2000,"01.12.2009",7340226,"49,21436","7,49281",105,90,734008226,66484,"Walshausen",2000,"2009-12-01","11YR00000001555H",10002992,3690567,7340,"Südwestpfalz",1845.2835,3691,734008,"Zweibrücken-Land"
"126","E30254010000000000005234010625532","ENERCON GmbH","E-126",7580,"24.11.2010",7333025,"49,678627","7,896039",135,126,733307025,67813,"Gerbach",7580,"2010-11-19","11YR00000001555H",10002992,14409442,7333,"Donnersbergkreis",1900.98179419525,14409,733307,"Nordpfälzer Land"
"127","E30254010000000000005234010639491","ENERCON GmbH","E-101",3000,"28.10.2011",7333025,"49,67732","7,90634",135,101,733307025,67813,"Gerbach",3050,"2011-10-28","11YR00000001555H",10002992,8012878,7333,"Donnersbergkreis",2627.1731147541,8013,733307,"Nordpfälzer Land"
"130","E30254010000000000005234239828155","ENERCON GmbH","Enercon E-82",2000,"30.12.2010",7332010,"49,586289","8,272211",108,82,733207010,67246,"Dirmstein",2000,"2010-12-30","11YR00000001555H",10002992,3285475,7332,"Bad Dürkheim",1642.7375,3285,733207,"Leiningerland"
"131","E30254010000000000005234239828156","ENERCON GmbH","E82",2000,"29.12.2010",7332010,"49,586054","8,278192",108,82,733207010,67246,"Dirmstein",2000,"2010-12-30","11YR00000001555H",10002992,3284043,7332,"Bad Dürkheim",1642.0215,3284,733207,"Leiningerland"
"132","E30254010000000000005234430229628","Vestas Deutschland GmbH",NA,2000,"31.03.2011",7336055,"49,493047","7,357079",105,90,733609041,66909,"Herschweiler-Pettersheim",2000,"2011-03-31","11YR00000001555H",10002992,3412674,7336,"Kusel",1706.337,3413,733609,"Oberes Glantal"
"133","E30254010000000000005234430229629","Vestas Deutschland GmbH","V90",2000,"10.03.2011",7336006,"49,493163","7,36553",105,90,733609101,66909,"Wahnwegen",2000,"2011-03-10","11YR00000001555H",10002992,3412676,7336,"Kusel",1706.338,3413,733609,"Oberes Glantal"
"134","E30254010000000000005234767337518","ENERCON GmbH","E70",2000,"03.08.2007",7336021,"49,343243","7,293455",65,70,733610103,66887,"Welchweiler",800,"2007-07-13","11YR00000001555H",10002992,782829,7336,"Kusel",978.53625,783,733610,"Kusel-Altenglan"
"136","E30254010WEA2GOLLWALD00FLUR474306","GE Wind Energy GmbH","GE 2.5-120",2750,"20.09.2014",7333026,"49,571669","7,988501",139,120,733303026,67307,"GÃ¶llheim",2530,"2014-09-23","11YR00000001555H",10002992,5468956,7333,"Donnersbergkreis",2161.64268774704,5469,733303,"Göllheim"
"137","E30254010WEA2GOLLWALD00FLUR475902","GE Wind Energy GmbH","GE 2.5-120",2750,"04.09.2014",7333026,"49,571299","7,982149",139,120,733303026,67307,"GÃ¶llheim",2530,"2014-09-04","11YR00000001555H",10002992,5468956,7333,"Donnersbergkreis",2161.64268774704,5469,733303,"Göllheim"
"138","E30254010WEA2GOLLWALD00FLUR475903","GE Wind Energy GmbH","GE 2.5-120",2750,"11.09.2014",7333026,"49,573993","7,97977",139,120,733303026,67307,"GÃ¶llheim",2530,"2014-09-11","11YR00000001555H",10002992,5468956,7333,"Donnersbergkreis",2161.64268774704,5469,733303,"Göllheim"
"139","E30254010WEA2GOLLWALD00FLUR476304","GE Wind Energy GmbH","GE 2.5-120",2750,"08.09.2014",7333026,"49,576934","7,976805",139,120,733303026,67307,"GÃ¶llheim",2530,"2014-09-13","11YR00000001555H",10002992,5468956,7333,"Donnersbergkreis",2161.64268774704,5469,733303,"Göllheim"
"140","E30254010WEA2GOLLWALD00FLUR476305","GE Wind Energy GmbH","GE 2.5-120",2750,"20.09.2014",7333026,"49,578424","7,972446",139,120,733303026,67307,"GÃ¶llheim",2530,"2014-09-23","11YR00000001555H",10002992,5468952,7333,"Donnersbergkreis",2161.64110671937,5469,733303,"Göllheim"
"141","E30254010WEA2OBERNDORF0FLUR306006","GE Renewable Germany GmbH","GE 2.5-120",2750,"01.09.2014",7333055,"49,704111","7,830056",139,120,733307055,67821,"Oberndorf",2530,"2014-09-01","11YR00000001555H",10002992,5483960,7333,"Donnersbergkreis",2167.57312252964,5484,733307,"Nordpfälzer Land"
"142","E30254011000000000005231616306700","ENERCON GmbH","Enercon E-70 E4",2000,"30.12.2004",7338013,"49,586441","8,284324",98,70,733806013,67259,"Heuchelheim",2000,"2004-12-30","11YR00000001555H",10002992,2255677,7338,"Rhein-Pfalz",1127.8385,2256,733806,"Lambsheim-Heßheim"
"143","E30254012000000000005231616306700","ENERCON GmbH","E-70 E4",2000,"13.05.2005",7338009,"49,584225","8,290069",113,70,733806013,67259,"Heuchelheim",2000,"2005-05-13","11YR00000001555H",10002992,2355899,7338,"Rhein-Pfalz",1177.9495,2356,733806,"Lambsheim-Heßheim"
"144","E30254013000000000005231616306700","ENERCON GmbH","E-70 E4",2000,"21.04.2005",7338013,"49,586063","8,28925",98,70,733806013,67259,"Heuchelheim",2000,"2005-05-03","11YR00000001555H",10002992,2255677,7338,"Rhein-Pfalz",1127.8385,2256,733806,"Lambsheim-Heßheim"
"145","E30254014000000000005231616306700","ENERCON GmbH","E-70 E 4",2000,"15.04.2005",7338013,"49,58453","8,284287",98,70,733806013,67259,"Heuchelheim",2000,"2005-04-15","11YR00000001555H",10002992,2255674,7338,"Rhein-Pfalz",1127.837,2256,733806,"Lambsheim-Heßheim"
"146","E30254015000000000005231616306700","ENERCON GmbH","E-48",800,"03.02.2005",7338013,"49,583","8,29124",76,48,733806013,67259,"Heuchelheim",800,"2005-02-03","11YR00000001555H",10002992,903367,7338,"Rhein-Pfalz",1129.20875,903,733806,"Lambsheim-Heßheim"
"147","E3025401PVA0000000000009000011337","ENERCON GmbH","E-101",3000,"20.06.2013",7335205,"49,511284","7,88393",135,101,733502004,67677,"Enkenbach-Alsenborn",3000,"2013-05-31","11YR00000001555H",10002992,5211716,7335,"Kaiserslautern",1737.23866666667,5212,733502,"Enkenbach-Alsenborn"
"148","E3025401WEA0000000000ESSELBORN001","Vestas Deutschland GmbH","Vestas V112-3.0MW",3075,"16.10.2013",7331022,"49,702394","8,115272",140,112,733101022,55234,"Esselborn",3075,"2013-10-16","11YR00000001555H",10002992,7476259,7331,"Alzey-Worms",2431.3037398374,7476,733101,"Alzey-Land"
"149","E3025401WEA0000000000ESSELBORN002","Vestas Deutschland GmbH","Vestas V112-3.0MW",3075,"17.10.2013",7331022,"49,699907","8,108869",140,112,733101022,55234,"Esselborn",3075,"2013-10-17","11YR00000001555H",10002992,7476254,7331,"Alzey-Worms",2431.30211382114,7476,733101,"Alzey-Land"
"152","E3025401WEA000000000HUNGERBERG001","Vestas Deutschland GmbH","Vestas V112",3075,"27.12.2013",7333010,"49,647127","8,041429",140,112,733304010,67295,"Bolanden",3075,"2013-12-27","11YR00000001555H",10002992,6542120,7333,"Donnersbergkreis",2127.51869918699,6542,733304,"Kirchheimbolanden"
"153","E3025401WEA000000000HUNGERBERG004","Vestas Deutschland GmbH","Vestas V112",3075,"31.01.2014",7333062,"49,658403","8,048717",140,112,733304022,67294,"Gauersheim",3075,"2014-01-31","11YR00000001555H",10002992,6533594,7333,"Donnersbergkreis",2124.74601626016,6534,733304,"Kirchheimbolanden"
"154","E3025401WEA000000000HUNGERBERG005","Vestas Deutschland GmbH","Vestas V112",3075,"31.01.2014",7333022,"49,654588","8,045203",140,112,733304062,67294,"Rittersheim",3075,"2014-01-31","11YR00000001555H",10002992,6533594,7333,"Donnersbergkreis",2124.74601626016,6534,733304,"Kirchheimbolanden"
"155","E3025401WEA000000000HUNGERBERG006","Vestas Deutschland GmbH","Vestas V112",3075,"27.12.2013",7333022,"49,65165","8,04569",140,112,733304022,67294,"Gauersheim",3075,"2013-12-27","11YR00000001555H",10002992,6542120,7333,"Donnersbergkreis",2127.51869918699,6542,733304,"Kirchheimbolanden"
"156","E3025401WEA000000000HUNGERBERG007","Vestas Deutschland GmbH","Vestas V112",3075,"10.12.2013",7333022,"49,648654","8,048865",140,112,733304022,67294,"Gauersheim",3075,"2013-12-10","11YR00000001555H",10002992,6542120,7333,"Donnersbergkreis",2127.51869918699,6542,733304,"Kirchheimbolanden"
"157","E3025401WEA000000000HUNGERBERG008","Vestas Deutschland GmbH","Vestas V112",3075,"13.02.2014",7333022,"49,656694","8,053087",140,112,733304022,67294,"Gauersheim",3075,"2014-02-13","11YR00000001555H",10002992,6542109,7333,"Donnersbergkreis",2127.51512195122,6542,733304,"Kirchheimbolanden"
"158","E3025401WEA000000000HUNGERBERG009","Vestas Deutschland GmbH","Vestas V112",3075,"29.12.2013",7333022,"49,652515","8,053542",140,112,733304022,67294,"Gauersheim",3075,"2013-12-29","11YR00000001555H",10002992,6542119,7333,"Donnersbergkreis",2127.51837398374,6542,733304,"Kirchheimbolanden"
"159","E3025401WEA000000000HUNGERBERG010","Vestas Deutschland GmbH","Vestas V112",3075,"10.12.2013",7333022,"49,650669","8,057692",140,112,733304022,67294,"Gauersheim",3075,"2013-12-10","11YR00000001555H",10002992,6542120,7333,"Donnersbergkreis",2127.51869918699,6542,733304,"Kirchheimbolanden"
"160","E3025401WEA000000000HUNGERBERG011","Vestas Deutschland GmbH","Vestas V126",3300,"28.11.2015",7333001,"49,646794","8,053501",137,126,733303001,67308,"Albisheim",3300,"2015-11-14",NA,10002992,7631998,7333,"Donnersbergkreis",2312.72666666667,7632,733303,"Göllheim"
"161","E3025401WEA000000000HUNGERBERG012","Vestas Deutschland GmbH","Vestas V112",3075,"18.11.2013",7333001,"49,648599","8,061971",140,112,733303001,67308,"Albisheim",3075,"2013-11-18","11YR00000001555H",10002992,6542120,7333,"Donnersbergkreis",2127.51869918699,6542,733303,"Göllheim"
"162","E3025401WEA000000000HUNGERBERG013","Vestas Deutschland GmbH","Vestas V112",3075,"03.12.2013",7333001,"49,647921","8,068149",140,112,733303001,67308,"Albisheim (Pfrimm)",3075,"2013-12-03","11YR00000001555H",10002992,6542120,7333,"Donnersbergkreis",2127.51869918699,6542,733303,"Göllheim"
"163","E3025401WEA000000000LINDEN8288102","Nordex SE","N117/2400",2400,"09.12.2013",7335023,"49,343409","7,630362",91,117,733511023,66851,"Linden",2400,"2013-12-09","11YR00000001555H",10002992,5889459,7335,"Kaiserslautern",2453.94125,5889,733511,"Landstuhl"
"164","E3025401WEA000000000LINDEN8288201","Nordex SE","N117/2400",2400,"18.12.2013",7335023,"49,345461","7,626117",91,117,733511023,66851,"Linden",2400,"2013-12-18","11YR00000001555H",10002992,5889454,7335,"Kaiserslautern",2453.93916666667,5889,733511,"Landstuhl"
"165","E3025401WEA00000000BUBENHEIM00009","GE Wind Energy GmbH","GE2.5 120",2530,"23.07.2014",7333012,"49,625068","8,141915",139,120,733303012,67308,"Bubenheim",2530,"2014-07-23","11YR00000001555H",10002992,6367134,7333,"Donnersbergkreis",2516.65375494071,6367,733303,"Göllheim"
"166","E3025401WEA00000000BUBENHEIM00011","GE Wind Energy GmbH","GE2.5-120",2530,"23.07.2014",7333012,"49,619405","8,136297",139,120,733303012,67308,"Bubenheim",2530,"2014-07-23","11YR00000001555H",10002992,6367130,7333,"Donnersbergkreis",2516.65217391304,6367,733303,"Göllheim"
"167","E3025401WEA00000000KINDENHEIM0001","ENERCON GmbH","E-101",3050,"28.07.2014",7332029,"49,618512","8,142888",135.4,101,733207029,67271,"Kindenheim",3050,"2014-07-28","11YR00000001555H",10002992,6524247,7332,"Bad Dürkheim",2139.09737704918,6524,733207,"Leiningerland"
"168","E3025401WEA00000000KINDENHEIM0002","ENERCON GmbH","E-101",3050,"12.09.2014",7332029,"49,609493","8,134835",135.4,101,733207029,67271,"Kindenheim",3050,"2014-09-12","11YR00000001555H",10002992,6524243,7332,"Bad Dürkheim",2139.09606557377,6524,733207,"Leiningerland"
"169","E3025401WEA000000GALGENBERT010001","ENERCON GmbH","E-101",3050,"15.12.2014",7336087,"49,532692","7,59481",149,101,733608087,67753,"Rothselberg",3050,"2014-12-15","11YR00000001555H",10002992,7493167,7336,"Kusel",2456.77606557377,7493,733608,"Lauterecken-Wolfstein"
"170","E3025401WEA000000GALGENBERT010002","ENERCON GmbH","E-101",3050,"23.12.2014",7336087,"49,532144","7,60005",149,101,733608087,67753,"Rothselberg",3050,"2014-12-23","11YR00000001555H",10002992,7493167,7336,"Kusel",2456.77606557377,7493,733608,"Lauterecken-Wolfstein"
"171","E3025401WEA000000GALGENBERT010003","ENERCON GmbH","E-101",3050,"30.12.2014",7336087,"49,525607","7,601038",149,101,733608087,67753,"Rothselberg",3050,"2014-12-30","11YR00000001555H",10002992,7493167,7336,"Kusel",2456.77606557377,7493,733608,"Lauterecken-Wolfstein"
"173","E3025401WEA000000GALGENBERT010005","ENERCON GmbH","Enercon E101",3050,"25.06.2015",7336053,"49,535218","7,608822",149,101,733608105,67752,"Wolfstein",3050,"2015-06-25",NA,10002992,7493167,7336,"Kusel",2456.77606557377,7493,733608,"Lauterecken-Wolfstein"
"174","E3025401WEA000000GALGENBERT010006","ENERCON GmbH","E-101",3050,"21.05.2015",7336087,"49,530465","7,610062",149,101,733608105,67752,"Wolfstein",3050,"2015-05-21",NA,10002992,7493167,7336,"Kusel",2456.77606557377,7493,733608,"Lauterecken-Wolfstein"
"175","E3025401WEA000000GALGENBERT010007","ENERCON GmbH","Enercon E101",3050,"28.07.2015",7336053,"49,538499","7,608618",149,101,733608105,67752,"Wolfstein",3050,"2015-07-28",NA,10002992,7493167,7336,"Kusel",2456.77606557377,7493,733608,"Lauterecken-Wolfstein"
"176","E3025401WEA000000GALGENBERT010008","ENERCON GmbH","E-101",3050,"04.08.2015",7336087,"49,541501","7,607648",149,101,733608105,67752,"Wolfstein",3050,"2015-08-04",NA,10002992,7493168,7336,"Kusel",2456.77639344262,7493,733608,"Lauterecken-Wolfstein"
"177","E3025401WEA000000UWOFFENBACH37501","GE Wind Energy GmbH","GE 2.5-120",2530,"03.09.2014",7337061,"49,175251","8,198576",139,120,733707061,76877,"Offenbach",2530,"2014-09-03","11YR00000001555H",10002992,6057058,7337,"Südliche Weinstraße",2394.09407114624,6057,733707,"Offenbach an der Queich"
"178","E3025401WEA000000UWOFFENBACH37502","GE Wind Energy GmbH","GE 2.5-120",2530,"19.08.2014",7337061,"49,175055","8,192418",139,120,733707061,76877,"Offenbach",2530,"2014-08-19","11YR00000001555H",10002992,6057058,7337,"Südliche Weinstraße",2394.09407114624,6057,733707,"Offenbach an der Queich"
"179","E3025401WEA000000UWOFFENBACH37503","GE Wind Energy GmbH","GE 2,5-120",2530,"03.09.2014",7337061,"49,17074","8,19419",139,120,733707061,76877,"Offenbach",2530,"2014-09-03","11YR00000001555H",10002992,6057058,7337,"Südliche Weinstraße",2394.09407114624,6057,733707,"Offenbach an der Queich"
"180","E3025401WEA000000UWOFFENBACH37504","GE Wind Energy GmbH","GE 2.5-120",2530,"03.09.2014",7337061,"49,17717","8,206942",139,120,733707061,76877,"Offenbach",2530,"2014-09-02","11YR00000001555H",10002992,6057058,7337,"Südliche Weinstraße",2394.09407114624,6057,733707,"Offenbach an der Queich"
"181","E3025401WEA000000UWOFFENBACH37505","GE Wind Energy GmbH","GE 2.5-120",2530,"14.08.2014",7337061,"49,174152","8,210159",139,120,733707061,76877,"Offenbach",2530,"2014-08-14","11YR00000001555H",10002992,6057058,7337,"Südliche Weinstraße",2394.09407114624,6057,733707,"Offenbach an der Queich"
"182","E3025401WEA000000UWOFFENBACH37506","GE Wind Energy GmbH","GE 2.5-120",2530,"27.08.2014",7337061,"49,171299","8,212633",139,120,733707061,76877,"Offenbach",2530,"2014-08-27","11YR00000001555H",10002992,6057057,7337,"Südliche Weinstraße",2394.09367588933,6057,733707,"Offenbach an der Queich"
"183","E3025401WEA0004100033530000013176","Vestas Deutschland GmbH","V112",3075,"12.06.2015",7333026,"49,613604","8,122085",NA,112,733302038,67304,"Kerzenheim",3075,"2015-06-12",NA,10002992,6204808,7333,"Donnersbergkreis",2017.8237398374,6205,733302,"Eisenberg"
"184","E3025401WEA0004100033530000013177","Vestas Deutschland GmbH","V112",3075,"18.06.2015",7333026,"49,617282","8,12674",140,112,733302038,67304,"Kerzenheim",3075,"2015-06-17",NA,10002992,6204808,7333,"Donnersbergkreis",2017.8237398374,6205,733302,"Eisenberg"
"186","E3025401WEA0004100033550000013217","Vestas Deutschland GmbH","Vestas V126",3300,"02.09.2015",7333038,"49,584482","8,078446",137,126,733302038,67304,"Kerzenheim",3300,"2015-09-02",NA,10002992,8315479,7333,"Donnersbergkreis",2519.84212121212,8315,733302,"Eisenberg"
"187","E3025401WEA0004100033550000013218","Vestas Deutschland GmbH","Vestas V126",3300,"09.09.2015",7333038,"49,580551","8,081869",137,126,733302038,67304,"Kerzenheim",3300,"2015-09-09",NA,10002992,8315473,7333,"Donnersbergkreis",2519.8403030303,8315,733302,"Eisenberg"
"190","E3025401WEA0004100033660000013421","GE Wind Energy GmbH","GE 2.75-120",2750,"14.11.2014",7333012,"49,6295","8,1452",139,120,733303012,67308,"Bubenheim",2780,"2015-12-19",NA,10002992,6482586,7333,"Donnersbergkreis",2331.8654676259,6483,733303,"Göllheim"
"191","E3025401WEA0004100033660000013422","GE Wind Energy GmbH","GE 2.75-120",2750,"21.11.2014",7333012,"49,63294","8,14657",139,120,733303012,67308,"Bubenheim",2780,"2015-12-22",NA,10002992,6482583,7333,"Donnersbergkreis",2331.86438848921,6483,733303,"Göllheim"
"192","E3025401WEA0004100033710000013499","Vestas Deutschland GmbH","V112-3.0 MW",3075,"03.12.2015",7333076,"49,680895","8,106957",140,112,733304076,67294,"Stetten",3075,"2015-11-25",NA,10002992,6715217,7333,"Donnersbergkreis",2183.81040650407,6715,733304,"Kirchheimbolanden"
"193","E3025401WEA0004100033770000013556","Vestas Deutschland GmbH","V90",2000,"25.12.2015",7336055,"49,49355","7,360808",105,90,733610055,66869,"Kusel",2000,"2015-12-25",NA,10002992,3992794,7336,"Kusel",1996.397,3993,733610,"Kusel-Altenglan"
"195","E3025401WEA0004100033880000013861","Vestas Deutschland GmbH","V112-3.3MW",3300,"26.09.2016",7340022,"49,300234","7,627288",140,112,734006022,66989,"HÃ¶heinÃ¶d",3300,"2016-09-26",NA,10002992,6550331,7340,"Südwestpfalz",1984.94878787879,6550,734006,"Waldfischbach-Burgalben"
"197","E3025401WEA0004100033920000014067","Vestas Deutschland GmbH","V112",3300,"29.09.2016",7340016,"49,309454","7,64019",140,112,734006016,66919,"Hermersberg",3300,"2016-09-29",NA,10002992,6832639,7340,"Südwestpfalz",2070.49666666667,6833,734006,"Waldfischbach-Burgalben"
"198","E3025401WEA0004100033920000014068","Vestas Deutschland GmbH","V112",3300,"29.09.2016",7340016,"49,306378","7,643787",140,112,734006016,66919,"Hermersberg",3300,"2016-09-29",NA,10002992,6832639,7340,"Südwestpfalz",2070.49666666667,6833,734006,"Waldfischbach-Burgalben"
"199","E3025401WEA0004100033920000014069","Vestas Deutschland GmbH","V112",3300,"29.09.2016",7340016,"49,299569","7,648181",140,112,734006016,66919,"Hermersberg",3300,"2016-09-29",NA,10002992,6832639,7340,"Südwestpfalz",2070.49666666667,6833,734006,"Waldfischbach-Burgalben"
"201","E3025401WEA0004100033920000015710","Vestas Deutschland GmbH","V112",3450,"20.09.2018",7340016,"49,305055","7,6514",140,112,734006016,66919,"Hermersberg",3450,"2018-09-20",NA,10002992,6930439,7340,"Südwestpfalz",2008.82289855072,6930,734006,"Waldfischbach-Burgalben"
"202","E3025401WEA0004100033940000014136","Vestas Deutschland GmbH","V 126",3300,"28.12.2016",7340017,"49,245321","7,584188",137,126,734004007,66978,"Donsieders",3300,"2016-12-28",NA,10002992,7856404,7340,"Südwestpfalz",2380.72848484848,7856,734004,"Rodalben"
"203","E3025401WEA0004100033940000014137","Vestas Deutschland GmbH","V 126",3300,"22.12.2016",7317000,"49,24218","7,587025",137,123,734004007,66978,"Donsieders",3300,"2016-12-22",NA,10002992,7856404,7340,"Südwestpfalz",2380.72848484848,7856,734004,"Rodalben"
"204","E3025401WEA0004100033940000014138","Vestas Deutschland GmbH","V 126",3300,"15.12.2016",7317000,"49,245112","7,594348",137,126,734004007,66978,"Donsieders",3300,"2016-12-15",NA,10002992,7856404,7340,"Südwestpfalz",2380.72848484848,7856,734004,"Rodalben"
"205","E3025401WEA0004100034100000014178","Vestas Deutschland GmbH","V 126",3300,"09.01.2017",7337038,"49,169511","8,231607",137,126,733707061,76877,"Offenbach",3300,"2017-01-09",NA,10002992,7142855,7337,"Südliche Weinstraße",2164.50151515152,7143,733707,"Offenbach an der Queich"
"206","E3025401WEA0004100034100000014179","Vestas Deutschland GmbH","V 126",3300,"19.01.2017",7334014,"49,176935","8,24701",137,126,733707061,76877,"Offenbach",3300,"2017-01-19",NA,10002992,7142855,7337,"Südliche Weinstraße",2164.50151515152,7143,733707,"Offenbach an der Queich"
"207","E3025401WEA0004100034100000014180","Vestas Deutschland GmbH","V 126",3300,"24.01.2017",7334014,"49,171414","8,257136",137,126,733707061,76877,"Offenbach",3300,"2017-01-24",NA,10002992,7142855,7337,"Südliche Weinstraße",2164.50151515152,7143,733707,"Offenbach an der Queich"
"208","E3025401WEA0004100034100000014181","Vestas Deutschland GmbH","V126",3300,"20.01.2017",7337039,"49,171873","8,251491",137,126,733707061,76877,"Offenbach",3300,"2017-01-20",NA,10002992,7142855,7337,"Südliche Weinstraße",2164.50151515152,7143,733707,"Offenbach an der Queich"
"209","E3025401WEA0004100034100000014182","Vestas Deutschland GmbH","V 126",3300,"25.01.2017",7337038,"49,166003","8,239782",137,126,733707061,76877,"Offenbach",3300,"2017-01-25",NA,10002992,7142844,7337,"Südliche Weinstraße",2164.49818181818,7143,733707,"Offenbach an der Queich"
"210","E3025401WEA0004100034100000014183","Vestas Deutschland GmbH","V 126",3300,"12.01.2017",7337038,"49,170525","8,239301",137,126,733707061,76877,"Offenbach",3300,"2017-01-12",NA,10002992,7142855,7337,"Südliche Weinstraße",2164.50151515152,7143,733707,"Offenbach an der Queich"
"211","E3025401WEA0004100034210000014184","ENERCON GmbH","E-115",3000,"30.12.2016",7333012,"49,622625","8,145176",133,115,733303501,67308,"Zellertal",3000,"2016-12-21",NA,10002992,7104418,7333,"Donnersbergkreis",2368.13933333333,7104,733303,"Göllheim"
"212","E3025401WEA0004100035420000014294","GE Wind Energy GmbH","GE 2.75-120",2780,"25.01.2017",7332029,"49,619108","8,149617",139,120,733302038,67304,"Kerzenheim",2780,"2017-01-25",NA,10002992,6735903,7333,"Donnersbergkreis",2422.98669064748,6736,733302,"Eisenberg"
"213","E3025401WEA0004100035420000014295","GE Wind Energy GmbH","GE 2.75-120",2780,"27.01.2017",7332029,"49,621477","8,156454",139,120,733302038,67304,"Kerzenheim",2780,"2017-01-27",NA,10002992,6735898,7333,"Donnersbergkreis",2422.98489208633,6736,733302,"Eisenberg"
"214","E3025401WEA0004100035720000014342","ENERCON GmbH","E-115",3000,"30.03.2017",7334009,"49,125655","8,228392",149,115.7,733404013,76870,"Kandel",3000,"2017-03-30",NA,10002992,6661352,7334,"Germersheim",2220.45066666667,6661,733404,"Kandel"
"215","E3025401WEA0004100035720000014343","ENERCON GmbH","E-115",3000,"27.04.2017",7334009,"49,121215","8,230352",149,115.7,733404013,76870,"Kandel",3000,"2017-04-27",NA,10002992,6661352,7334,"Germersheim",2220.45066666667,6661,733404,"Kandel"
"216","E3025401WEA0004100035720000014344","ENERCON GmbH","E-115",3000,"30.05.2017",7334009,"49,124533","8,238278",149,115.7,733404013,76870,"Kandel",3000,"2017-05-30",NA,10002992,6661351,7334,"Germersheim",2220.45033333333,6661,733404,"Kandel"
"217","E3025401WEA0004100035720000014345","ENERCON GmbH","E-115",3000,"17.02.2017",7334009,"49,12524","8,24597",149,115.7,733404013,76870,"Kandel",3000,"2017-02-17",NA,10002992,6661352,7334,"Germersheim",2220.45066666667,6661,733404,"Kandel"
"218","E3025401WEA0004100035720000014346","ENERCON GmbH","E-115",3000,"26.01.2017",7334009,"49,126866","8,253992",149,115.7,733404013,76870,"Kandel",3000,"2017-01-26",NA,10002992,6661352,7334,"Germersheim",2220.45066666667,6661,733404,"Kandel"
"219","E3025401WEA0004100036770000014395","Vestas Deutschland GmbH","V126 - 3,3",3300,"12.05.2017",7333083,"49,765238","7,858052",137,126,733307083,67822,"Winterborn",3300,"2017-05-12",NA,10002992,6621441,7333,"Donnersbergkreis",2006.49727272727,6621,733307,"Nordpfälzer Land"
"220","E3025401WEA0004100036770000014396","Vestas Deutschland GmbH","V126 - 3,3",3300,"12.05.2017",7333083,"49,762742","7,862179",137,126,733307083,67822,"Winterborn",3300,"2017-05-12",NA,10002992,6621432,7333,"Donnersbergkreis",2006.49454545455,6621,733307,"Nordpfälzer Land"
"222","E3025401WEA0004100036800000015525","ENERCON GmbH","Enercon E115",3000,"13.06.2018",7333023,"49,697847","7,878991",149,115.71,733307055,67821,"Oberndorf",3000,"2018-06-13",NA,10002992,7357302,7333,"Donnersbergkreis",2452.434,7357,733307,"Nordpfälzer Land"
"223","E3025401WEA0004100036800000015526","ENERCON GmbH","Enercon E115",3000,"26.06.2018",7333023,"49,695851","7,882767",149,115.71,733307055,67821,"Oberndorf",3000,"2018-06-26",NA,10002992,7357295,7333,"Donnersbergkreis",2452.43166666667,7357,733307,"Nordpfälzer Land"
"224","E3025401WEA0004100036800000015527","ENERCON GmbH","Enercon E115",3000,"19.06.2018",7333023,"49,692797","7,881423",149,115.71,733307055,67821,"Oberndorf",3000,"2018-06-19",NA,10002992,7357302,7333,"Donnersbergkreis",2452.434,7357,733307,"Nordpfälzer Land"
"225","E3025401WEA0004100036800000015528","ENERCON GmbH","Enercon E115",3000,"12.06.2018",7333066,"49,692972","7,875318",149,115.71,733307055,67821,"Oberndorf",3000,"2018-06-12",NA,10002992,7357302,7333,"Donnersbergkreis",2452.434,7357,733307,"Nordpfälzer Land"
"226","E3025401WEA0004100036800000016217","Vestas Deutschland GmbH","V 126",3450,"18.06.2019",7333040,"49,67218","7,905804",149,126,NA,NA,NA,NA,NA,NA,NA,NA,NA,NA,NA,NA,NA,NA
"227","E3025401WEA0004100036800000016218","Vestas Deutschland GmbH","V 126",3450,"07.06.2019",7333040,"49,675794","7,911267",149,126,NA,NA,NA,NA,NA,NA,NA,NA,NA,NA,NA,NA,NA,NA
"228","E3025401WEA0004100036800000016219","Vestas Deutschland GmbH","V126",3450,"31.05.2019",7333040,"49,672422","7,915265",149,126,NA,NA,NA,NA,NA,NA,NA,NA,NA,NA,NA,NA,NA,NA
"229","E3025401WEA0004100036810000014583","Vestas Deutschland GmbH","V126",3450,"25.07.2017",7333026,"49,614699","8,127741",149,126,733207029,67271,"Kindenheim",3450,"2017-07-25",NA,10002992,7493340,7332,"Bad Dürkheim",2171.98260869565,7493,733207,"Leiningerland"
"230","E3025401WEA0004100036820000014665","ENERCON GmbH","E-82 E2",2300,"16.12.2017",7335202,"49,379334","7,518551",138,82,733511027,66851,"Mittelbrunn",2300,"2017-12-16",NA,10002992,5380821,7335,"Kaiserslautern",2339.48739130435,5381,733511,"Landstuhl"
"236","E3025401WEA0004100036880000014695","Vestas Deutschland GmbH","V126",3450,"27.03.2018",7336101,"49,469213","7,368122",137,126,733609102,66914,"Waldmohr",3450,"2018-03-27",NA,10002992,7155831,7336,"Kusel",2074.15391304348,7156,733609,"Oberes Glantal"
"238","E3025401WEA0004100036890000014697","Nordex Energy GmbH","N 131-3.3",3300,"13.02.2018",7334005,"49,084689","8,091252",134,131,733404013,76870,"Kandel",3300,"2018-02-13",NA,10002992,7715392,7334,"Germersheim",2337.99757575758,7715,733404,"Kandel"
"239","E3025401WEA0004100036890000014698","Nordex Energy GmbH","N 131-3.3",3300,"15.03.2018",7334005,"49,083932","8,100195",134,131,733404013,76870,"Kandel",3300,"2018-03-15",NA,10002992,7715392,7334,"Germersheim",2337.99757575758,7715,733404,"Kandel"
"240","E3025401WEA0004100036890000014699","Nordex Energy GmbH","N 131-3.3",3300,"28.12.2017",7334005,"49,081492","8,104621",134,131,733404013,76870,"Kandel",3300,"2017-12-28",NA,10002992,7715392,7334,"Germersheim",2337.99757575758,7715,733404,"Kandel"
"241","E3025401WEA0004100036890000014700","Nordex Energy GmbH","N 131-3.3",3300,"22.03.2018",7334005,"49,080899","8,089691",134,131,733404013,76870,"Kandel",3300,"2018-03-22",NA,10002992,7715396,7334,"Germersheim",2337.99878787879,7715,733404,"Kandel"
"242","E3025401WEA0004100036890000014701","Nordex Energy GmbH","N 131-3.3",3300,"08.03.2018",7334005,"49,07931","8,094718",134,131,733404013,76870,"Kandel",3300,"2018-03-08",NA,10002992,7715392,7334,"Germersheim",2337.99757575758,7715,733404,"Kandel"
"243","E3025401WEA0004100036890000014702","Nordex Energy GmbH","N 131-3.3",3300,"21.12.2017",7334005,"49,078363","8,104828",134,131,733404013,76870,"Kandel",3300,"2017-12-21",NA,10002992,7715392,7334,"Germersheim",2337.99757575758,7715,733404,"Kandel"
"247","E3025401WEA0004100037110000015385","ENERCON GmbH","E-115",3000,"07.08.2018",7333045,"49,627633","8,059418",135,115,733302038,67304,"Kerzenheim",3000,"2018-08-07",NA,10002992,7156506,7333,"Donnersbergkreis",2385.502,7157,733302,"Eisenberg"
"248","E3025401WEA0004100037110000015386","ENERCON GmbH","E-115",3000,"17.08.2018",7333045,"49,623734","8,059547",135,115,733302038,67304,"Kerzenheim",3000,"2018-08-17",NA,10002992,7156505,7333,"Donnersbergkreis",2385.50166666667,7157,733302,"Eisenberg"
"249","E3025401WEA0004100037110000015387","ENERCON GmbH","E-115",3000,"28.06.2018",7333032,"49,620389","8,059472",135,115,733302038,67304,"Kerzenheim",3000,"2018-06-28",NA,10002992,7156506,7333,"Donnersbergkreis",2385.502,7157,733302,"Eisenberg"
"250","E3025401WEA0004100037120000015391","Nordex Energy GmbH","N117",3000,"26.05.2018",7340026,"49,168578","7,495984",140.6,117,734008206,66497,"Contwig",3000,"2018-05-26",NA,10002992,7226309,7340,"Südwestpfalz",2408.76966666667,7226,734008,"Zweibrücken-Land"
"251","E3025401WEA0004100037120000015392","Nordex Energy GmbH","N117",3000,"28.05.2018",7340026,"49,164985","7,498411",140.6,117,734008206,66497,"Contwig",3000,"2018-05-28",NA,10002992,7226307,7340,"Südwestpfalz",2408.769,7226,734008,"Zweibrücken-Land"
"252","E3025401WEA0004100037120000015393","Nordex Energy GmbH","N117",3000,"26.05.2018",7340026,"49,160958","7,495227",140.6,117,734008206,66497,"Contwig",3000,"2018-05-26",NA,10002992,7226309,7340,"Südwestpfalz",2408.76966666667,7226,734008,"Zweibrücken-Land"
"253","E3025401WEA0004100037160000015467","Nordex Energy GmbH","N117/3000",3000,"30.01.2019",7333034,"49,60915","7,757556",141,117,733307034,67808,"Imsweiler",3000,"2019-01-30",NA,10002992,6180879,7333,"Donnersbergkreis",2060.293,6181,733307,"Nordpfälzer Land"
"254","E3025401WEA0004100037160000015468","Nordex Energy GmbH","N117/3000",3000,"30.01.2019",7333034,"49,605765","7,758112",141,117,733307034,67808,"Imsweiler",3000,"2019-01-30",NA,10002992,6180879,7333,"Donnersbergkreis",2060.293,6181,733307,"Nordpfälzer Land"
"255","E3025401WEA0004100037160000015469","Nordex Energy GmbH","N117/3000",3000,"30.01.2019",7333034,"49,606658","7,762519",141,117,NA,NA,NA,NA,NA,NA,NA,NA,NA,NA,NA,NA,NA,NA
"256","E3025401WEA0004100037210000015494","ENERCON GmbH","E-115",3000,"26.09.2018",7336003,"49,554773","7,431559",149,116,733610055,66869,"Kusel",3300,"2018-09-26",NA,10002992,5730953,7336,"Kusel",1736.65242424242,5731,733610,"Kusel-Altenglan"
"257","E3025401WEA0004100037250000015890","Vestas Deutschland GmbH","V136",3450,"27.06.2019",7334028,"49,273047","8,354977",149,136,NA,NA,NA,NA,NA,NA,NA,NA,NA,NA,NA,NA,NA,NA
"258","E3025401WEA0004100037250000015891","Vestas Deutschland GmbH","V136",3450,"02.07.2019",7334028,"49,273042","8,362222",149,136,NA,NA,NA,NA,NA,NA,NA,NA,NA,NA,NA,NA,NA,NA
"259","E3025401WEA0004100037250000015892","Vestas Deutschland GmbH","V136",3450,"27.06.2019",7334028,"49,277615","8,36116",149,136,NA,NA,NA,NA,NA,NA,NA,NA,NA,NA,NA,NA,NA,NA
"260","E3025401WEA0004100037250000015893","Vestas Deutschland GmbH","V136",3450,"24.06.2019",7334028,"49,27587","8,351421",149,136,NA,NA,NA,NA,NA,NA,NA,NA,NA,NA,NA,NA,NA,NA
"261","E3025401WEA0004100037310000016004","Vestas Deutschland GmbH","V112",3450,"05.12.2018",7340055,"49,355858","7,601205",140,112,734009055,66919,"Weselberg",3450,"2018-12-05",NA,10002992,8515072,7340,"Südwestpfalz",2468.1368115942,8515,734009,"Thaleischweiler-Wallhalben"
"262","E3025401WEA0004100037310000016005","Vestas Deutschland GmbH","V112",3450,"22.11.2018",7340055,"49,350085","7,620839",140,112,734009055,66919,"Weselberg",3450,"2018-11-22",NA,10002992,8515069,7340,"Südwestpfalz",2468.13594202899,8515,734009,"Thaleischweiler-Wallhalben"
"263","E3025401WEA0004100037370000016289","Vestas Deutschland GmbH","V112",3300,"24.06.2019",7335202,"49,375023","7,51402",140,114,NA,NA,NA,NA,NA,NA,NA,NA,NA,NA,NA,NA,NA,NA
"264","E3025401WEA0004100037370000016290","Vestas Deutschland GmbH","V112",3300,"24.06.2019",7335202,"49,375497","7,524473",140,112,NA,NA,NA,NA,NA,NA,NA,NA,NA,NA,NA,NA,NA,NA
"265","E3025401WEA0004100037370000016291","Vestas Deutschland GmbH",NA,3300,"24.03.2020",7335202,"49,373582","7,518988",140,112,NA,NA,NA,NA,NA,NA,NA,NA,NA,NA,NA,NA,NA,NA
"266","E3025401WEA0004100037370000016293","Vestas Deutschland GmbH","V112",3300,"24.06.2019",7335011,"49,369841","7,519532",140,112,NA,NA,NA,NA,NA,NA,NA,NA,NA,NA,NA,NA,NA,NA
"267","E3025401WEA0004100045210000016707","ENERCON GmbH","E-115",3000,"14.01.2020",7333028,"49,576024","7,746086",149,115.71,NA,NA,NA,NA,NA,NA,NA,NA,NA,NA,NA,NA,NA,NA
"268","E3025401WEA0004100045470000016717","Vestas Deutschland GmbH","V126",3450,"26.02.2020",7336069,"49,644845","7,711739",137,126,NA,NA,NA,NA,NA,NA,NA,NA,NA,NA,NA,NA,NA,NA
"269","E3025401WEA0004100051000000017300","ENERCON GmbH","E-115",3000,"22.05.2020",7336091,"49,518511","7,406528",149.08,115.71,NA,NA,NA,NA,NA,NA,NA,NA,NA,NA,NA,NA,NA,NA
"270","E3025401WEA0004100051000000017301","ENERCON GmbH","E-115",3000,"22.05.2020",7336091,"49,514409","7,408991",149.08,115.71,NA,NA,NA,NA,NA,NA,NA,NA,NA,NA,NA,NA,NA,NA
"271","E3025401WEA0004100051940000017421","Vestas Deutschland GmbH","V126",3450,"30.01.2020",7336099,"49,577658","7,47541",149,126,NA,NA,NA,NA,NA,NA,NA,NA,NA,NA,NA,NA,NA,NA
"272","E3025401WEA0004100051940000017422","Vestas Deutschland GmbH","V126",3450,"30.12.2019",7336022,"49,57159","7,48524",149,126,NA,NA,NA,NA,NA,NA,NA,NA,NA,NA,NA,NA,NA,NA
"273","E3025401WEA0004100051940000017423","Vestas Deutschland GmbH","V126",3450,"30.12.2019",7336022,"49,574552","7,481981",149,126,NA,NA,NA,NA,NA,NA,NA,NA,NA,NA,NA,NA,NA,NA
"274","E3025401WEA0004100051950000017424","Vestas Deutschland GmbH","V136",3450,"30.12.2019",7336003,"49,557597","7,488286",149,136,NA,NA,NA,NA,NA,NA,NA,NA,NA,NA,NA,NA,NA,NA
"275","E3025401WEA0004100051950000017425","Vestas Deutschland GmbH","V136",3450,"21.02.2020",7336022,"49,337927","7,294245",149,136,NA,NA,NA,NA,NA,NA,NA,NA,NA,NA,NA,NA,NA,NA
"276","E3025401WEA0004100052350000017452","Vestas Deutschland GmbH","V126",3450,"14.01.2020",7336087,"49,529003","7,600984",149,126,NA,NA,NA,NA,NA,NA,NA,NA,NA,NA,NA,NA,NA,NA
"277","E3025401WEA0004100061280000018267","Vestas Deutschland GmbH","V 117 3,45 MW",3450,"30.09.2020",7336090,"49,585505","7,647888",141.5,117,NA,NA,NA,NA,NA,NA,NA,NA,NA,NA,NA,NA,NA,NA
"278","E3025401WEA0004100061280000018268","Vestas Deutschland GmbH","V117 3,45 MW",3450,"02.10.2020",7336090,"49,587196","7,639443",141.5,117,NA,NA,NA,NA,NA,NA,NA,NA,NA,NA,NA,NA,NA,NA
"279","E3025401WEA0005000000KOLLWEILER01","ENERCON GmbH","E 101",3050,"24.07.2014",7335019,"49,526119","7,588366",135.4,101,733509019,66879,"Kollweiler",3050,"2014-07-24","11YR00000001555H",10002992,6140584,7335,"Kaiserslautern",2013.3062295082,6141,733509,"Weilerbach"
"280","E3025401WEA0005000000KOLLWEILER02","ENERCON GmbH","E 101",3050,"24.07.2014",7335019,"49,525471","7,581033",135.4,101,733509019,66879,"Kollweiler",3050,"2014-07-24","11YR00000001555H",10002992,6140576,7335,"Kaiserslautern",2013.30360655738,6141,733509,"Weilerbach"
"281","E3025401WEA0005000060110000004636","ENERCON GmbH","E-101",3050,"15.05.2012",7336069,"49,65111","7,70785",135.4,101,733608069,67759,"NuÃŸbach",3050,"2012-05-15","11YR00000001555H",10002992,6399272,7336,"Kusel",2098.12196721311,6399,733608,"Lauterecken-Wolfstein"
"282","E3025401WEA0005000060110000004637","ENERCON GmbH","E-101",3050,"24.04.2012",7336069,"49,647764","7,70905",135.4,101,733608069,67759,"NuÃŸbach",3050,"2012-04-24","11YR00000001555H",10002992,6399268,7336,"Kusel",2098.1206557377,6399,733608,"Lauterecken-Wolfstein"
"283","E3025401WEA0005000060630000004685","Senvion Deutschland GmbH","3.4XM104",3370,"22.03.2012",7333079,"49,653978","7,710362",128,104,733307079,67822,"Waldgrehweiler",3370,"2012-03-22","11YR00000001555H",10002992,7362753,7333,"Donnersbergkreis",2184.79317507418,7363,733307,"Nordpfälzer Land"
"284","E3025401WEA0005000060630000004686","Senvion Deutschland GmbH","3.4XM104",3370,"22.03.2012",7333079,"49,656595","7,703714",128,104,733307079,67822,"Waldgrehweiler",3370,"2012-03-22","11YR00000001555H",10002992,7362753,7333,"Donnersbergkreis",2184.79317507418,7363,733307,"Nordpfälzer Land"
"285","E3025401WEA0005000068450000005343","Vestas Deutschland GmbH","V-90",2000,"12.01.2012",7133045,"49,771022","7,855421",105,90,713301045,55585,"HochstÃ¤tten",2000,"2012-01-12","11YR00000001555H",10002992,3135739,7133,"Bad Kreuznach",1567.8695,3136,713301,"Bad Kreuznach"
"286","E3025401WEA0005000068450000005344","Vestas Deutschland GmbH","V-90",2000,"29.12.2011",7133045,"49,77204","7,85193",105,90,713301045,55585,"HochstÃ¤tten",2000,"2011-12-29","11YR00000001555H",10002992,3135739,7133,"Bad Kreuznach",1567.8695,3136,713301,"Bad Kreuznach"
"287","E3025401WEA0005000068450000005345","Vestas Deutschland GmbH","V-90",2000,"18.01.2012",7133045,"49,765048","7,851277",105,90,713301045,55585,"HochstÃ¤tten",2000,"2012-01-18","11YR00000001555H",10002992,3118619,7133,"Bad Kreuznach",1559.3095,3119,713301,"Bad Kreuznach"
"288","E3025401WEA0005000077080000006148","Senvion Deutschland GmbH","3.2M114",3170,"14.02.2013",7333076,"49,690702","8,099436",143,114,733304076,67294,"Stetten",3170,"2013-02-14","11YR00000001555H",10002992,7477337,7333,"Donnersbergkreis",2358.78138801262,7477,733304,"Kirchheimbolanden"
"289","E3025401WEA0005000077080000006149","Senvion Deutschland GmbH","3.2M114",3170,"07.02.2013",7333076,"49,686434","8,099806",143,114,733304076,67294,"Stetten",3170,"2013-02-07","11YR00000001555H",10002992,7477337,7333,"Donnersbergkreis",2358.78138801262,7477,733304,"Kirchheimbolanden"
"290","E3025401WEA0005000077080000006150","Senvion Deutschland GmbH","3.2M114",3170,"29.12.2012",7333076,"49,683401","8,102827",143,114,733304076,67294,"Stetten",3170,"2012-12-29","11YR00000001555H",10002992,7477337,7333,"Donnersbergkreis",2358.78138801262,7477,733304,"Kirchheimbolanden"
"291","E3025401WEA0005000085560000006845","Vestas Deutschland GmbH","Vestas V112-3.0 MW",3075,"21.12.2012",7331024,"49,698868","8,117693",140,112,733101024,55234,"Flomborn",3075,"2012-12-21","11YR00000001555H",10002992,6484622,7331,"Alzey-Worms",2108.82016260163,6485,733101,"Alzey-Land"
"292","E3025401WEA0005000085570000006846","Vestas Deutschland GmbH","Vestas V112-3.0 MW",3075,"28.12.2012",7331024,"49,695375","8,118492",140,112,733101024,55234,"Flomborn",3075,"2012-12-28","11YR00000001555H",10002992,6484622,7331,"Alzey-Worms",2108.82016260163,6485,733101,"Alzey-Land"
"293","E3025401WEA0005000085580000006847","Vestas Deutschland GmbH","Vestas V112-3.0 MW",3075,"25.01.2013",7331024,"49,69306","8,120405",140,112,733101024,55234,"Flomborn",3075,"2013-01-25","11YR00000001555H",10002992,6484622,7331,"Alzey-Worms",2108.82016260163,6485,733101,"Alzey-Land"
"294","E3025401WEA0005000085590000006848","Vestas Deutschland GmbH","Vestas V112-3.0 MW",3075,"07.02.2013",7331024,"49,68764","8,12329",140,112,733101024,55234,"Flomborn",3075,"2013-02-07","11YR00000001555H",10002992,6484622,7331,"Alzey-Worms",2108.82016260163,6485,733101,"Alzey-Land"
"295","E3025401WEA0005000087220000006951","Vestas Deutschland GmbH","Vestas V112-3.0 MW",3075,"21.02.2013",7331024,"49,690244","8,121496",140,112,733101024,55234,"Flomborn",3075,"2013-02-21","11YR00000001555H",10002992,6484628,7331,"Alzey-Worms",2108.82211382114,6485,733101,"Alzey-Land"
"296","E3025401WEA0005000093180000007504","ENERCON GmbH","E-82 E2",2300,"29.07.2013",7340221,"49,168909","7,45952",138.4,82,734008221,66484,"Riedelberg",2300,"2013-07-19","11YR00000001555H",10002992,4144935,7340,"Südwestpfalz",1802.14565217391,4145,734008,"Zweibrücken-Land"
"297","E3025401WEA0005000093220000007507","ENERCON GmbH","E-82 E2",2300,"19.07.2013",7340221,"49,169291","7,46407",138.4,82,734008221,66484,"Riedelberg",2300,"2013-07-29","11YR00000001555H",10002992,4144935,7340,"Südwestpfalz",1802.14565217391,4145,734008,"Zweibrücken-Land"
"298","E3025401WEA0005000093240000007509","ENERCON GmbH","E-82 E2",2300,"16.08.2013",7340221,"49,166747","7,4593",138.4,82,734008221,66484,"Riedelberg",2300,"2013-08-02","11YR00000001555H",10002992,4144935,7340,"Südwestpfalz",1802.14565217391,4145,734008,"Zweibrücken-Land"
"299","E3025401WEA0005000093260000007510","ENERCON GmbH","E-82 E2",2300,"02.08.2013",7340221,"49,167138","7,464524",138.4,82,734008221,66484,"Riedelberg",2300,"2013-08-16","11YR00000001555H",10002992,4144927,7340,"Südwestpfalz",1802.14217391304,4145,734008,"Zweibrücken-Land"
"300","E3025401WEA0005000102220000011949","ENERCON GmbH","E82; 2,3MW",2300,"27.12.2013",7133032,"49,76563","7,870572",138,82,713301032,55546,"FÃ¼rfeld",2300,"2013-12-27","11YR00000001555H",10002992,3966213,7133,"Bad Kreuznach",1724.44043478261,3966,713301,"Bad Kreuznach"
"304","E3025401WEA00O4100036880000014696","Vestas Deutschland GmbH","V126",3450,"27.03.2018",7336101,"49,461998","7,368058",137,126,NA,NA,NA,NA,NA,NA,NA,NA,NA,NA,NA,NA,NA,NA
"305","E3025401WEA00UWALSENZ370000000001","Vestas Deutschland GmbH","V112",3075,"01.08.2014",7333003,"49,722701","7,845204",140,112,733307003,67821,"Alsenz",3075,"2014-08-01","11YR00000001555H",10002992,6980442,7333,"Donnersbergkreis",2270.06243902439,6980,733307,"Nordpfälzer Land"
"306","E3025401WEA00UWALSENZ370000000002","Vestas Deutschland GmbH","V112",3075,"28.07.2014",7333003,"49,719999","7,847599",140,112,733307003,67821,"Alsenz",3075,"2014-07-28","11YR00000001555H",10002992,6980442,7333,"Donnersbergkreis",2270.06243902439,6980,733307,"Nordpfälzer Land"
"307","E3025401WEA00UWALSENZ370000000003","Vestas Deutschland GmbH","V112",3075,"12.08.2014",7333003,"49,712375","7,842549",140,112,733307003,67821,"Alsenz",3075,"2014-08-12","11YR00000001555H",10002992,6980442,7333,"Donnersbergkreis",2270.06243902439,6980,733307,"Nordpfälzer Land"
"308","E3025401WEA00UWALSENZ370000000004","Vestas Deutschland GmbH","V112",3075,"19.08.2014",7333003,"49,707528","7,839031",140,112,733307003,67821,"Alsenz",3075,"2014-08-19","11YR00000001555H",10002992,6980442,7333,"Donnersbergkreis",2270.06243902439,6980,733307,"Nordpfälzer Land"
"309","E3025401WEA00UWALSENZ370000000005","Vestas Deutschland GmbH","V112",3075,"25.08.2014",7333003,"49,709958","7,834728",140,112,733307003,67821,"Alsenz",3075,"2014-08-25","11YR00000001555H",10002992,6980442,7333,"Donnersbergkreis",2270.06243902439,6980,733307,"Nordpfälzer Land"
"310","E3025401WEA00UWALSENZ370000000006","Vestas Deutschland GmbH","V112",3075,"13.08.2014",7333049,"49,728688","7,900302",140,112,733307003,67821,"Alsenz",3075,"2014-08-13","11YR00000001555H",10002992,6980442,7333,"Donnersbergkreis",2270.06243902439,6980,733307,"Nordpfälzer Land"
"311","E3025401WEA00UWALSENZ370000000007","Vestas Deutschland GmbH","V112",3075,"22.08.2014",7333049,"49,731707","7,899026",140,112,733307003,67821,"Alsenz",3075,"2014-08-22","11YR00000001555H",10002992,6980442,7333,"Donnersbergkreis",2270.06243902439,6980,733307,"Nordpfälzer Land"
"312","E3025401WEA00UWALSENZ370000000008","Vestas Deutschland GmbH","V112",3075,"22.08.2014",7333049,"49,733478","7,905592",140,112,733307003,67821,"Alsenz",3075,"2014-08-22","11YR00000001555H",10002992,6980442,7333,"Donnersbergkreis",2270.06243902439,6980,733307,"Nordpfälzer Land"
"313","E3025401WEA00UWALSENZ370000000009","Vestas Deutschland GmbH","V112",3075,"17.09.2014",7333050,"49,747342","7,909777",140,112,733307003,67821,"Alsenz",3075,"2014-09-17","11YR00000001555H",10002992,6980442,7333,"Donnersbergkreis",2270.06243902439,6980,733307,"Nordpfälzer Land"
"314","E3025401WEA00UWALSENZ370000000010","Vestas Deutschland GmbH","V112",3075,"04.09.2014",7333050,"49,744968","7,912732",140,112,733307003,67821,"Alsenz",3075,"2014-09-04","11YR00000001555H",10002992,6980442,7333,"Donnersbergkreis",2270.06243902439,6980,733307,"Nordpfälzer Land"
"315","E3025401WEA00UWALSENZ370000000011","Vestas Deutschland GmbH","V112",3075,"19.09.2014",7333050,"49,738819","7,905388",140,112,733307003,67821,"Alsenz",3075,"2014-09-19","11YR00000001555H",10002992,6980442,7333,"Donnersbergkreis",2270.06243902439,6980,733307,"Nordpfälzer Land"
"316","E3025401WEA0ENERGIEPARKGOLLHEIM01","Vestas Deutschland GmbH","V112",3075,"18.07.2014",7333026,"49,58874","8,075503",140,112,733303026,67307,"GÃ¶llheim",3075,"2014-07-18","11YR00000001555H",10002992,6902789,7333,"Donnersbergkreis",2244.80943089431,6903,733303,"Göllheim"
"322","E3025401WEA100BUBENHEIM0003530582","GE Wind Energy GmbH","GE 2.5-120",2750,"06.02.2015",7333012,"49,620999","8,130567",139,120,733303006,67308,"Biedesheim",2530,"2015-02-06",NA,10002992,6152309,7333,"Donnersbergkreis",2431.74268774704,6152,733303,"Göllheim"
"323","E3025401WEA1SIPPERSFELD0337001329","ENERCON GmbH","E101",3050,"30.12.2014",7333009,"49,563997","7,913271",135.4,101,733306009,67725,"BÃ¶rrstadt",3050,"2014-12-30","11YR00000001555H",10002992,7685863,7333,"Donnersbergkreis",2519.95508196721,7686,733306,"Winnweiler"
"324","E3025401WEA2SIPPERSFELD0337001494","ENERCON GmbH","E101",3050,"17.12.2014",7333071,"49,562094","7,916549",135.4,101,733306071,67729,"Sippersfeld",3050,"2014-12-17","11YR00000001555H",10002992,7685863,7333,"Donnersbergkreis",2519.95508196721,7686,733306,"Winnweiler"
"325","E3025401WEA300BUBENHEIM0003530502","GE Wind Energy GmbH","GE 2.5-120",2750,"20.02.2015",7333012,"49,626581","8,1361",139,120,733303006,67308,"Biedesheim",2530,"2015-02-20",NA,10002992,6152305,7333,"Donnersbergkreis",2431.74110671937,6152,733303,"Göllheim"
"326","E3025401WEA3SIPPERSFELD0337001495","ENERCON GmbH","E101",3050,"23.12.2014",7333071,"49,55964","7,918609",135.4,101,733306071,67729,"Sippersfeld",3050,"2014-12-23","11YR00000001555H",10002992,7685863,7333,"Donnersbergkreis",2519.95508196721,7686,733306,"Winnweiler"
"327","E30568011000000000000002251100001","Schütz GmbH & Co. KGaA","VT110",3200,"29.08.2017",7132113,"50,71272","7,947602",143.2,110,713203113,57586,"Weitefeld",3200,"2017-08-29",NA,10003990,5359680,7132,"Altenkirchen",1674.9,5360,713203,"Daaden-Herdorf"
"328","E30613019020000000000000589300001","Vestas Deutschland GmbH","V112-3.0",3075,"05.11.2014",7312000,"49,475803","7,814618",140,112,733502026,67678,"Mehlingen",3075,"2014-11-05","11YR00000002596Z_D_KNS_TWK",10003622,6699240,7335,"Kaiserslautern",2178.61463414634,6699,733502,"Enkenbach-Alsenborn"
"329","E30613019020000000000000589300002","Vestas Deutschland GmbH","V112-3.0",3075,"05.11.2014",7312000,"49,471795","7,806974",140,112,733502026,67678,"Mehlingen",3075,"2014-11-05","11YR00000002596Z_D_KNS_TWK",10003622,6699240,7335,"Kaiserslautern",2178.61463414634,6699,733502,"Enkenbach-Alsenborn"
"330","E30613019020000000000000589300003","Vestas Deutschland GmbH","V112-3.0",3075,"10.11.2014",7312000,"49,469903","7,816209",140,112,733502026,67678,"Mehlingen",3075,"2014-11-10","11YR00000002596Z_D_KNS_TWK",10003622,6699240,7335,"Kaiserslautern",2178.61463414634,6699,733502,"Enkenbach-Alsenborn"
"331","E30773010000000000000000200100013","Vestas Deutschland GmbH","V80",2000,"23.07.2003",7333025,"49,677035","7,902818",100,80,733307025,67813,"Gerbach",2000,"2003-07-23","11YR00000004459Z",10001416,3948094.41,7333,"Donnersbergkreis",1974.047205,3948,733307,"Nordpfälzer Land"
"332","E30773010000000000000000200100014","ENERCON GmbH","E-66/18.70",1800,"27.10.2003",7333025,"49,678704","7,892354",98,70,733307025,67813,"Gerbach",1800,"2003-09-30","11YR00000004459Z",10001416,3553284.97,7333,"Donnersbergkreis",1974.04720555556,3553,733307,"Nordpfälzer Land"
"333","E30773010000000000000000200100015","ENERCON GmbH","E-66/18.70",1800,"23.09.2003",7333025,"49,67524","7,895377",114,70,733307025,67813,"Gerbach",1800,"2003-09-30","11YR00000004459Z",10001416,3553284.97,7333,"Donnersbergkreis",1974.04720555556,3553,733307,"Nordpfälzer Land"
"334","E30856010000000000000000000100064","ENERCON GmbH","Enercon E-82",2000,"29.04.2011",7338016,"49,528511","8,310642",108,82,733806016,67245,"Lambsheim",2000,"2011-03-31","11YR00000001894W",10000856,2921539,7338,"Rhein-Pfalz",1460.7695,2922,733806,"Lambsheim-Heßheim"
"335","E30856010000000000000000000100070","ENERCON GmbH","Enercon E-82",2000,"13.04.2011",7338016,"49,532975","8,309531",108,82,733806016,67245,"Lambsheim",2000,"2011-03-31","11YR00000001894W",10000856,2921539,7338,"Rhein-Pfalz",1460.7695,2922,733806,"Lambsheim-Heßheim"
"336","E30873010003403410000000S00100002","Vestas Deutschland GmbH","V-80",2000,"29.12.2002",7338013,"49,581253","8,29175",100,80,733806013,67259,"Heuchelheim",2012,"2002-12-27","11YR00000001247S",10000873,2508602.28,7338,"Rhein-Pfalz",1246.82021868787,2509,733806,"Lambsheim-Heßheim"
"342","E31060010000000094100991100100155","ENERCON GmbH","E-82",2000,"18.10.2006",7315000,"49,93926","8,24093",108,82,731500000,55129,"Mainz",2000,"2006-10-18","11YR00000001258N",10003079,3792315.81,7315,"Mainz",1896.157905,3792,731500,"Mainz"
"343","E31060010000000094100992100100378","ENERCON GmbH","E-82",2000,"08.11.2006",7315000,"49,93844","8,24408",108,82,731500000,55129,"Mainz",2000,"2006-11-08","11YR00000001258N",10003079,3366844,7315,"Mainz",1683.422,3367,731500,"Mainz"
"344","E31060010000000094100993300100653","ENERCON GmbH","E-82 E2",2000,"22.01.2010",7339032,"49,94255","8,23876",108,82,731500000,55129,"Mainz",2000,"2010-01-22","11YR00000001258N",10003079,3656756.7,7315,"Mainz",1828.37835,3657,731500,"Mainz"
"345","E31102010000000000001008269700001","ENERCON GmbH","E-40/5.40",500,"07.08.1998",7143202,"50,6237","7,8508",65,40.3,714302202,57642,"Alpenrod",500,"1998-08-07","11YR000000018725",10001102,535739.72,7143,"Westerwald",1071.47944,536,714302,"Hachenburg"
"346","E31102010000000000001008269700002","ENERCON GmbH","E-40/5.40",500,"13.08.1998",7143202,"50,6196","7,8544",65,40.3,714302202,57642,"Alpenrod",500,"1998-08-13","11YR000000018725",10001102,535739.72,7143,"Westerwald",1071.47944,536,714302,"Hachenburg"
"347","E31102010000000000001008269700003","ENERCON GmbH","E-40/6.44 E1",600,"22.09.2000",7143202,"50,6208","7,8527",65,44,714302202,57642,"Alpenrod",600,"2000-09-22","11YR000000018725",10001102,630752.03,7143,"Westerwald",1051.25338333333,631,714302,"Hachenburg"
"349","E31102010000000000001273901400001","Fuhrländer AG","FL 250",250,"17.01.1995",7143220,"50,519482","7,882494",41.5,NA,714308220,56244,"Ettinghausen",250,"1995-01-16","11YR000000018725",10001102,202306,7143,"Westerwald",809.224,202,714308,"Wallmerod"
"350","E31102010000000000001273977400001","NEG Micon Deutschland GmbH","M570 200/40",200,"26.11.1993",7143295,"50,670606","8,043634",36,27,714306295,56479,"Stein-Neukirch",200,"1993-11-12","11YR000000018725",10001102,194819.88,7143,"Westerwald",974.0994,195,714306,"Rennerod"
"351","E31102010000000000001274022500001","Fuhrländer AG","FL 1000",1000,"04.12.2001",7143220,"50,530817","7,878062",70,54,714308232,56244,"Hahn am See",1000,"2001-12-04","11YR000000018725",10001102,971282,7143,"Westerwald",971.282,971,714308,"Wallmerod"
"352","E31102010000000000001274253800001","Fuhrländer AG","FUH15 G1 D250",250,"29.11.1994",7143225,"50,694","7,725945",42,30,714302250,57612,"Kroppach",250,"1994-11-29","11YR000000018725",10001102,158788.4,7143,"Westerwald",635.1536,159,714302,"Hachenburg"
"354","E31102010000000000001274308900001","Vestas Deutschland GmbH","V44",600,"13.05.1996",7143222,"50,65","8,00336",53,44,714301222,56472,"Fehl-Ritzhausen",600,"1996-05-13","11YR000000018725",10001102,64294.91,7143,"Westerwald",107.158183333333,64,714301,"Bad Marienberg"
"356","E31102010000000000001274362300001","Fuhrländer AG","FL 800",800,"09.07.1998",7143248,"50","7",70,48,714301248,57629,"Kirburg",800,"1998-07-09","11YR000000018725",10001102,930300,7143,"Westerwald",1162.875,930,714301,"Bad Marienberg"
"358","E31102010000000000001274402600001","AN-Maschinenbau- und Umweltschutzanlagen GmbH","150/30 - 50Hz",150,"26.04.1991",7143253,"50,704533","7,944676",30,23,714301253,57520,"Langenbach bei Kirburg",150,"1991-04-26","11YR000000018725",10001102,148635.43,7143,"Westerwald",990.902866666667,149,714301,"Bad Marienberg"
"359","E31102010000000000001274404200001","ENERCON GmbH","E-40/5.40",500,"24.09.1997",7143253,"50,705","7,9496",65,40.3,714301253,57520,"Langenbach bei Kirburg",500,"1997-09-24","11YR000000018725",10001102,740397.5,7143,"Westerwald",1480.795,740,714301,"Bad Marienberg"
"360","E31102010000000000001274406900001","AN-Maschinenbau- und Umweltschutzanlagen GmbH","AN Bonus 600/41",600,"06.04.1995",7143253,"50,708","7,9456",50,41,714301253,57520,"Langenbach bei Kirburg",600,"1995-04-06","11YR000000018725",10001102,592103.49,7143,"Westerwald",986.83915,592,714301,"Bad Marienberg"
"361","E31102010000000000001274407700001","ENERCON GmbH","E-40/5.40",500,"25.02.1997",7143253,"50,707","7,947",65,40.3,714301253,57520,"Langenbach bei Kirburg",500,"1997-02-25","11YR000000018725",10001102,725955,7143,"Westerwald",1451.91,726,714301,"Bad Marienberg"
"362","E31102010000000000001274409300001","Fuhrländer AG","Fuhrländer FL250",250,"26.10.1998",7143253,"50,270108","7,97512",41.5,NA,714301253,57520,"Langenbach bei Kirburg",250,"1998-10-26","11YR000000018725",10001102,213145,7143,"Westerwald",852.58,213,714301,"Bad Marienberg"
"363","E31102010000000000001274439500001","ENERCON GmbH","E58",950,"03.12.2003",7143243,"50,668215","8,032498",89,58,714301243,56472,"Hof",950,"2003-11-24","11YR000000018725",10001102,2398495.5,7143,"Westerwald",2524.73210526316,2398,714301,"Bad Marienberg"
"365","E31102010000000000001274441700001","Vestas Deutschland GmbH","V39",500,"15.12.1994",7143243,"50,6671","8,0304",53,39,714301243,56472,"Hof",500,"1994-12-12","11YR000000018725",10001102,676070.97,7143,"Westerwald",1352.14194,676,714301,"Bad Marienberg"
"366","E31102010000000000001274442500001","ENERCON GmbH","E-40",500,"19.09.1997",7143243,"50,664279","8,010153",65,40,714301243,56472,"Hof",500,"1997-09-19","11YR000000018725",10001102,668465.5,7143,"Westerwald",1336.931,668,714301,"Bad Marienberg"
"367","E31102010000000000001274443300001","ENERCON GmbH","E40",500,"07.03.1996",7143243,"50,6675","8,0347",65,40,714306291,56479,"Salzburg",500,"1996-03-06","11YR000000018725",10001102,829245.25,7143,"Westerwald",1658.4905,829,714306,"Rennerod"
"368","E31102010000000000001274444100001","Nordex SE","Nordex N29",250,"27.09.1995",7143291,"50,67083","8,05378",50,29,714306291,56479,"Salzburg",250,"1995-09-28","11YR000000018725",10001102,298593.53,7143,"Westerwald",1194.37412,299,714306,"Rennerod"
"369","E31102010000000000001274446800001","ENERCON GmbH","E-40/5.40",500,"11.03.1996",7143291,"50,67","8,051",48,40.3,714306291,56479,"Salzburg",500,"1996-03-11","11YR000000018725",10001102,731240.75,7143,"Westerwald",1462.4815,731,714306,"Rennerod"
"370","E31102010000000000001274448400001","Fuhrländer AG","Astos 100",100,"25.02.1992",7143243,"50,669854","8,020838",33,21,714301243,56472,"Hof",100,"1993-02-25","11YR000000018725",10001102,73006.5,7143,"Westerwald",730.065,73,714301,"Bad Marienberg"
"371","E31102010000000000001274448400002","Fuhrländer AG","Astos 100",100,"25.02.1993",7143243,"50,670973","8,022326",33,21,714301243,56472,"Hof",100,"1993-02-25","11YR000000018725",10001102,73006.5,7143,"Westerwald",730.065,73,714301,"Bad Marienberg"
"372","E31102010000000000001274449200001","ENERCON GmbH","E-40/5.40",500,"18.09.1997",7143243,"50,6683","8,0301",65,40.3,714301243,56472,"Hof",500,"1997-09-18","11YR000000018725",10001102,807690.5,7143,"Westerwald",1615.381,808,714301,"Bad Marienberg"
"374","E31102010000000000001277342500001","ENERCON GmbH","E-66",1800,"31.12.2003",7143252,"50,727294","7,797876",114,70,714302252,57629,"Kundert",1800,"2003-12-30","11YR000000018725",10001102,2409202,7143,"Westerwald",1338.44555555556,2409,714302,"Hachenburg"
"375","E31102010000000000001277342500002","ENERCON GmbH","E-66",1800,"19.12.2003",7143252,"50,727333","7,803342",114,70,714302252,57629,"Kundert",1800,"2003-12-19","11YR000000018725",10001102,2409202,7143,"Westerwald",1338.44555555556,2409,714302,"Hachenburg"
"376","E31102010000000000001278035900001","ENERCON GmbH","E-66/18.70",1800,"30.03.2004",7143222,"50,653402","8,005816",85,70,714301222,56472,"Fehl-Ritzhausen",1800,"2004-03-30","11YR000000018725",10001102,2821749,7143,"Westerwald",1567.63833333333,2822,714301,"Bad Marienberg"
"377","E31102010000000000001279811800001","ENERCON GmbH","E-58/10.58",1000,"09.07.2004",7143242,"50,6265","7,9964",70,58.6,714309242,56462,"HÃ¶hn",1000,"2004-07-09","11YR000000018725",10001102,1459338,7143,"Westerwald",1459.338,1459,714309,"Westerburg"
"378","E31102010000000000002000196200001","Fuhrländer AG","FL MD 77",1500,"17.12.2004",7143302,"50,654519","8,099289",100,77,714306302,56477,"Waigandshain",1500,"2004-12-17","11YR000000018725",10001102,2819228.75,7143,"Westerwald",1879.48583333333,2819,714306,"Rennerod"
"379","E31102010000000000002000196200002","Fuhrländer AG","FL MD 77",1500,"17.12.2004",7143302,"50,653786","8,101897",100,77,714306302,56477,"Waigandshain",1500,"2004-12-17","11YR000000018725",10001102,2819228.75,7143,"Westerwald",1879.48583333333,2819,714306,"Rennerod"
"380","E31102010000000000002000196200003","Fuhrländer AG","FL MD 77",1500,"17.12.2004",7143302,"50,653028","8,105739",100,77,714306302,56477,"Waigandshain",1500,"2004-12-17","11YR000000018725",10001102,2819228.75,7143,"Westerwald",1879.48583333333,2819,714306,"Rennerod"
"381","E31102010000000000002000196200004","Fuhrländer AG","FL MD 77",1500,"17.12.2004",7143302,"50,652394","8,109406",100,77,714306302,56477,"Waigandshain",1500,"2004-12-17","11YR000000018725",10001102,2819228.75,7143,"Westerwald",1879.48583333333,2819,714306,"Rennerod"
"382","E31102010000000000002000196200005","Fuhrländer AG","FL MD 77",1500,"17.12.2004",7143302,"50,651914","8,113228",100,77,714306302,56477,"Waigandshain",1500,"2004-12-17","11YR000000018725",10001102,2819228.75,7143,"Westerwald",1879.48583333333,2819,714306,"Rennerod"
"383","E31102010000000000002000196200006","Fuhrländer AG","FL MD 77",1500,"17.12.2004",7143302,"50,65025","8,117819",100,77,714306244,56479,"Homberg",1500,"2004-12-17","11YR000000018725",10001102,2819228.75,7143,"Westerwald",1879.48583333333,2819,714306,"Rennerod"
"384","E31102010000000000002000196200007","Fuhrländer AG","FL MD 77",1500,"17.12.2004",7143302,"50,651444","8,100603",100,77,714306302,56477,"Waigandshain",1500,"2004-12-17","11YR000000018725",10001102,2819228.75,7143,"Westerwald",1879.48583333333,2819,714306,"Rennerod"
"385","E31102010000000000002000196200008","Fuhrländer AG","FL MD 77",1500,"17.12.2004",7143302,"50,650856","8,104069",100,77,714306302,56477,"Waigandshain",1500,"2004-12-17","11YR000000018725",10001102,2819228.75,7143,"Westerwald",1879.48583333333,2819,714306,"Rennerod"
"386","E31102010000000000002000196200009","Fuhrländer AG","FL MD 77",1500,"17.12.2004",7143302,"50,649344","8,104439",100,77,714306302,56477,"Waigandshain",1500,"2004-12-17","11YR000000018725",10001102,2819228.75,7143,"Westerwald",1879.48583333333,2819,714306,"Rennerod"
"387","E31102010000000000002000196200010","Fuhrländer AG","FL MD 77",1500,"17.12.2004",7143302,"50,650878","8,106461",100,77,714306302,56477,"Waigandshain",1500,"2004-12-17","11YR000000018725",10001102,2819228.75,7143,"Westerwald",1879.48583333333,2819,714306,"Rennerod"
"388","E31102010000000000002000196200011","Fuhrländer AG","FL MD 77",1500,"17.12.2004",7143302,"50,650183","8,107217",100,77,714306302,56477,"Waigandshain",1500,"2004-12-17","11YR000000018725",10001102,2819228.75,7143,"Westerwald",1879.48583333333,2819,714306,"Rennerod"
"389","E31102010000000000002000196200012","Fuhrländer AG","FL MD 77",1500,"17.12.2004",7143302,"50,650742","8,107611",100,77,714306302,56477,"Waigandshain",1500,"2004-12-17","11YR000000018725",10001102,2819228.75,7143,"Westerwald",1879.48583333333,2819,714306,"Rennerod"
"390","E31102010000000000002000219900001","ENERCON GmbH","E-40/6.44 E3",600,"20.06.2002",7143202,"50,6223","7,8513",65,44,714302202,57642,"Alpenrod",600,"2002-06-20","11YR000000018725",10001102,628332,7143,"Westerwald",1047.22,628,714302,"Hachenburg"
"391","E31102010000000000002000249400001","ENERCON GmbH","E-70 E4",2000,"13.06.2006",7143025,"50,615968","7,765482",113,70,714307025,56244,"Hartenfels",2000,"2006-06-13","11YR000000018725",10001102,3161022.66,7143,"Westerwald",1580.51133,3161,714307,"Selters (Westerwald)"
"392","E31102010000000000002000249400002","ENERCON GmbH","E-70 E4",2000,"01.09.2006",7143025,"50,610827","7,772412",113,70,714307025,56244,"Hartenfels",2000,"2006-09-01","11YR000000018725",10001102,2971405.68,7143,"Westerwald",1485.70284,2971,714307,"Selters (Westerwald)"
"393","E31102010000000000002000249400003","ENERCON GmbH","E-70 E4",2000,"01.09.2006",7143025,"50,612453","7,770576",113,70,714307025,56244,"Hartenfels",2000,"2006-08-17","11YR000000018725",10001102,2756309.68,7143,"Westerwald",1378.15484,2756,714307,"Selters (Westerwald)"
"394","E31102010000000000002000249400004","ENERCON GmbH","E-70 E4",2000,"25.09.2006",7143025,"50,61453","7,768996",113,70,714307025,56244,"Hartenfels",2000,"2006-09-25","11YR000000018725",10001102,2749287.66,7143,"Westerwald",1374.64383,2749,714307,"Selters (Westerwald)"
"396","E31102010000000000002000249400006","ENERCON GmbH","E-70 E4",2000,"14.08.2006",7143241,"50,616703","7,761902",114,70,714302241,57629,"HÃ¶chstenbach",2000,"2006-08-14","11YR000000018725",10001102,2808163.7,7143,"Westerwald",1404.08185,2808,714302,"Hachenburg"
"397","E31102010000000000002000249400007","ENERCON GmbH","E-70 E4",2000,"01.09.2006",7143268,"50,606557","7,759739",113,70,714302268,56271,"MÃ¼ndersbach",2000,"2006-06-29","11YR000000018725",10001102,2807601.67,7143,"Westerwald",1403.800835,2808,714302,"Hachenburg"
"398","E31102010000000000002000249400008","ENERCON GmbH","E-70 E4",2000,"06.07.2006",7143268,"50,611068","7,764593",113,70,714302268,56271,"MÃ¼ndersbach",2000,"2006-07-06","11YR000000018725",10001102,3181449.68,7143,"Westerwald",1590.72484,3181,714302,"Hachenburg"
"399","E31102010000000000002000249400009","ENERCON GmbH","E-70 E4",2000,"01.09.2006",7143268,"50,612847","7,761127",113,70,714302268,56271,"MÃ¼ndersbach",2000,"2006-06-22","11YR000000018725",10001102,3097219.64,7143,"Westerwald",1548.60982,3097,714302,"Hachenburg"
"400","E31102010000000000002000249400010","ENERCON GmbH","E-70 E4",2000,"01.09.2006",7143029,"50,603013","7,762049",113,70,714307029,56249,"Herschbach",2000,"2006-07-05","11YR000000018725",10001102,2657524.65,7143,"Westerwald",1328.762325,2658,714307,"Selters (Westerwald)"
"401","E31102010000000000002000249400011","ENERCON GmbH","E-70 E4",2000,"01.09.2006",7143268,"50,609029","7,76565",113,70,714302268,56271,"MÃ¼ndersbach",2000,"2006-07-28","11YR000000018725",10001102,2548943.67,7143,"Westerwald",1274.471835,2549,714302,"Hachenburg"
"402","E31102010000000000002000249400012","ENERCON GmbH","E-70 E4",2000,"01.09.2006",7143029,"50,606671","7,76711",113,70,714302268,56271,"MÃ¼ndersbach",2000,"2006-06-19","11YR000000018725",10001102,2848477.61,7143,"Westerwald",1424.238805,2848,714302,"Hachenburg"
"403","E31102010000000000002000578400001","ENERCON GmbH","E70-E4",2000,"13.06.2007",7143226,"50,518535","7,982332",113.5,70,714309226,56459,"Girkenroth",2000,"2007-06-13","11YR000000018725",10001102,3150671.86,7143,"Westerwald",1575.33593,3151,714309,"Westerburg"
"404","E31102010000000000002000578400002","ENERCON GmbH","E70-E4",2000,"21.06.2007",7143226,"50,517748","7,984887",113.5,70,714309226,56459,"Girkenroth",2000,"2007-06-21","11YR000000018725",10001102,3150671.86,7143,"Westerwald",1575.33593,3151,714309,"Westerburg"
"405","E31102010000000000002000578400003","ENERCON GmbH","E-82",2000,"28.08.2009",7143226,"50,519823","7,994022",138,82,714309226,56459,"Girkenroth",2000,"2009-08-28","11YR000000018725",10001102,4140448.28,7143,"Westerwald",2070.22414,4140,714309,"Westerburg"
"406","E31102010000000000002001123800001","ENERCON GmbH","E82",2000,"03.08.2009",7143025,"50,616579","7,757758",138,82,714302241,57629,"HÃ¶chstenbach",2000,"2009-08-03","11YR000000018725",10001102,3893912,7143,"Westerwald",1946.956,3894,714302,"Hachenburg"
"407","E31102010000000000002001466300001","ENERCON GmbH","E-70 E4",2000,"23.12.2010",7143315,"50,656077","8,062267",113,70,714306286,56477,"Rennerod",2000,"2010-12-23","11YR000000018725",10001102,3003503.03,7143,"Westerwald",1501.751515,3004,714306,"Rennerod"
"408","E31102010000000000002001466300002","ENERCON GmbH","E-82",2000,"16.12.2010",7143315,"50,660242","8,060175",108,82,714306286,56477,"Rennerod",2000,"2010-12-16","11YR000000018725",10001102,3653016.97,7143,"Westerwald",1826.508485,3653,714306,"Rennerod"
"409","E31102010000000000002001749800001","ENERCON GmbH","E 53",800,"29.12.2011",7143252,"50,725391","7,802329",73,53,714302252,57629,"Kundert",800,"2011-12-29","11YR000000018725",10001102,1122621,7143,"Westerwald",1403.27625,1123,714302,"Hachenburg"
"410","E31102010000000000002001749800002","ENERCON GmbH","E 53",800,"29.12.2011",7143252,"50,725213","7,795547",73,53,714302252,57629,"Kundert",800,"2011-12-29","11YR000000018725",10001102,1122621,7143,"Westerwald",1403.27625,1123,714302,"Hachenburg"
"412","E31102010000000000002001763800002","ENERCON GmbH","E 53",800,"31.01.2012",7143203,"50,527725","7,873258",73.25,53,714308203,56244,"ArnshÃ¶fen",800,"2011-12-22","11YR000000018725",10001102,1075047.5,7143,"Westerwald",1343.809375,1075,714308,"Wallmerod"
"413","E31102010000000000002001862100001","Schütz GmbH & Co. KGaA","VT110",3200,"10.02.2013",7143268,"50,60975","7,75289",137.6,110,714302268,56271,"MÃ¼ndersbach",3200,"2013-02-10","11YR000000018725",10001102,6243281.33,7143,"Westerwald",1951.025415625,6243,714302,"Hachenburg"
"414","E31102010000000000002001862100002","Schütz GmbH & Co. KGaA","VT110",3200,"10.02.2014",7143268,"50,61311","7,75533",137.6,110,714302268,56271,"MÃ¼ndersbach",3200,"2014-02-10","11YR000000018725",10001102,6243281.33,7143,"Westerwald",1951.025415625,6243,714302,"Hachenburg"
"415","E31102010000000000002001862100003","Schütz GmbH & Co. KGaA","VT110",3200,"22.07.2014",7143268,"50,61376","7,74884",143.2,110,714302268,56271,"MÃ¼ndersbach",3200,"2014-07-22","11YR000000018725",10001102,6243281.33,7143,"Westerwald",1951.025415625,6243,714302,"Hachenburg"
"416","E31102010000000000002002788000001","Nordex Energy GmbH","N117",2400,"19.12.2014",7143293,"50,566649","7,940786",140.6,116.8,714309308,56457,"Westerburg",2400,"2014-12-19","11YR000000018725",10001102,6176677,7143,"Westerwald",2573.61541666667,6177,714309,"Westerburg"
"417","E31102010000000000002002788000002","Nordex Energy GmbH","N117",2400,"22.12.2014",7143293,"50,565065","7,935738",140.6,116.8,714309308,56457,"Westerburg",2400,"2014-12-22","11YR000000018725",10001102,6176677,7143,"Westerwald",2573.61541666667,6177,714309,"Westerburg"
"418","E31102010000000000002002788000003","Nordex Energy GmbH","N117",2400,"15.12.2014",7143293,"50,563011","7,941263",140.6,116.8,714309308,56457,"Westerburg-Gershasen",2400,"2014-12-15","11YR000000018725",10001102,6176677,7143,"Westerwald",2573.61541666667,6177,714309,"Westerburg"
"419","E31102010000000000002002810800001","Schütz GmbH & Co. KGaA","VT110",3200,"09.02.2015",7143241,"50,61924","7,76666",143.2,110,714302241,57629,"HÃ¶chstenbach",3200,"2015-02-09",NA,10001102,6494274,7143,"Westerwald",2029.460625,6494,714302,"Hachenburg"
"420","E31102010000000000002002810800002","Schütz GmbH & Co. KGaA","VT110",3200,"09.02.2015",7143241,"50,62186","7,76432",143.2,110,714302241,57629,"HÃ¶chstenbach",3200,"2015-02-09",NA,10001102,6494274,7143,"Westerwald",2029.460625,6494,714302,"Hachenburg"
"421","E31102010000000000002002810800003","Schütz GmbH & Co. KGaA","VT110",3200,"14.07.2015",7143241,"50,61936","7,75456",143.2,110,714302241,57629,"HÃ¶chstenbach",3200,"2015-07-14",NA,10001102,6494274,7143,"Westerwald",2029.460625,6494,714302,"Hachenburg"
"422","E31102010000000000002002810800004","Schütz GmbH & Co. KGaA","VT110",3200,"05.08.2015",7143241,"50,62193","7,75805",143.2,110,714302241,57629,"HÃ¶chstenbach",3200,"2015-08-05",NA,10001102,6494274,7143,"Westerwald",2029.460625,6494,714302,"Hachenburg"
"423","E31102010000000000002002810800005","Schütz GmbH & Co. KGaA","VT110",3200,"25.08.2015",7143268,"50,61653","7,75162",143.2,110,714302268,56271,"MÃ¼ndersbach",3200,"2015-08-25",NA,10001102,6494274,7143,"Westerwald",2029.460625,6494,714302,"Hachenburg"
"424","E31102010000000000002003074700001","ENERCON GmbH","E-92",2350,"15.12.2015",7143226,"50,519124","7,988923",138,92,714309226,56459,"Girkenroth",2350,"2015-12-04",NA,10001102,4082526,7143,"Westerwald",1737.24510638298,4083,714309,"Westerburg"
"425","E31102010000000000002003157600001","GE Wind Energy GmbH","GE 2.5-120, 2,53 MW, 139 m Nh",2530,"21.03.2016",7143242,"50,628907","8,008926",139,120,714309242,56462,"HÃ¶hn",2530,"2016-03-21",NA,10001102,6379431,7143,"Westerwald",2521.51422924901,6379,714309,"Westerburg"
"426","E31102010000000000002003157600002","GE Wind Energy GmbH","GE 2.5-120, 2,53 MW, 139 m Nh",2530,"15.03.2016",7143242,"50,628485","8,016412",139,120,714309242,56462,"HÃ¶hn",2530,"2016-03-15",NA,10001102,6379431.01,7143,"Westerwald",2521.51423320158,6379,714309,"Westerburg"
"427","E31102010000000000002003157600003","GE Wind Energy GmbH","GE 2.5-120, 2,53 MW, 139 m Nh",2530,"10.03.2016",7143242,"50,628856","8,001931",139,120,714309242,56462,"HÃ¶hn",2530,"2016-03-10",NA,10001102,6379431,7143,"Westerwald",2521.51422924901,6379,714309,"Westerburg"
"428","E31102010000000000002011142500001","ENERCON GmbH","E-115",3000,"24.11.2017",7143501,"50,536","7,895",149,115.7,714308501,56459,"Elbingen",3000,"2017-09-30",NA,10001102,7848226,7143,"Westerwald",2616.07533333333,7848,714308,"Wallmerod"
"429","E31102010000000000002011142500002","ENERCON GmbH","E-115",3000,"17.11.2017",7143501,"50,54","7,89",149,115.7,714308501,56459,"Elbingen",3000,"2017-11-17",NA,10001102,7848226,7143,"Westerwald",2616.07533333333,7848,714308,"Wallmerod"
"431","E31102010000000000002011282000001","GE Wind Energy GmbH","GE 3.2-130, 3,23 MW, 134 m Nh",3230,"27.03.2018",7143242,"50,625571","8,008841",134,130,714309242,56462,"HÃ¶hn",3230,"2018-03-27",NA,10001102,7176318,7143,"Westerwald",2221.77027863777,7176,714309,"Westerburg"
"432","E31102010000000000002011282000002","GE Wind Energy GmbH","GE 3.2-130, 3,23 MW, 134 m Nh",3230,"27.03.2018",7143242,"50,628856","8,001931",134,130,714309242,56462,"HÃ¶hn",3230,"2018-03-27",NA,10001102,7176318,7143,"Westerwald",2221.77027863777,7176,714309,"Westerburg"
"433","E311400100000000000W3TR0S00000552","Nordex SE","N-117",2400,"23.01.2020",7338016,"49,527819","8,30147",141,116.8,NA,NA,NA,NA,NA,NA,NA,NA,NA,NA,NA,NA,NA,NA
"434","E31238001000001021200000017791804","Südwind Borsig Energy GmbH","S 70",1500,"01.04.2001",7233010,"50,059996","6,476662",85,70,NA,NA,NA,NA,NA,NA,NA,NA,NA,NA,NA,NA,NA,NA
"435","E31238010000000000000000114699324","ENERCON GmbH","E-101",3050,"22.08.2014",7134019,"49,706402","7,412187",149,101,NA,NA,NA,NA,NA,NA,NA,NA,NA,NA,NA,NA,NA,NA
"436","E31238010000000000000000251307557","ENERCON GmbH","E-92",2350,"30.09.2017",7134042,"49,602232","7,219564",138,92,713401075,55776,"Ruschberg",2350,"2017-09-30",NA,10003764,4611838,7134,"Birkenfeld",1962.48425531915,4612,713401,"Baumholder"
"437","E31238010000000000000000251370106","ENERCON GmbH","E-82 E2",2300,"30.07.2014",7134042,"49,597276","7,217835",138,82,713401075,55776,"Ruschberg",2300,"2014-07-30","11YR00000003039P",10003764,4230378,7134,"Birkenfeld",1839.2947826087,4230,713401,"Baumholder"
"438","E31238010000000000000000617332516","Vestas Deutschland GmbH","V90",2000,"07.08.2007",7140111,"49,573671","7,22213",105,90,714004145,55487,"Sohren",2000,"2007-08-07","11YR00000003039P",10003764,2963855,7140,"Rhein-Hundsrück",1481.9275,2964,714004,"Kirchberg (Hunsrück)"
"439","E31238010000000000000000617332517","Vestas Deutschland GmbH","V90",2000,"30.07.2007",7140111,"49,57379","7,215399",105,90,714004145,55487,"Sohren",2000,"2007-07-30","11YR00000003039P",10003764,2963855,7140,"Rhein-Hundsrück",1481.9275,2964,714004,"Kirchberg (Hunsrück)"
"440","E31238010000000000000000617339031","Vestas Deutschland GmbH","V90",2000,"09.08.2007",7140111,"49,573032","7,222754",105,90,714004145,55487,"Sohren",2000,"2007-08-09","11YR00000003039P",10003764,2963855,7140,"Rhein-Hundsrück",1481.9275,2964,714004,"Kirchberg (Hunsrück)"
"441","E31238010000000000000000832515818","Nordex Energy GmbH","N60",1300,"19.10.2000",7232024,"49,852829","6,535372",85,60,723507501,54298,"Welschbillig",1300,"2000-10-19","11YR00000003039P",10003764,1513216,7235,"Trier-Saarburg",1164.01230769231,1513,723507,"Trier-Land"
"442","E31238010000000000000000832518851","Nordex Energy GmbH","N60",1300,"11.10.2000",7232024,"49,850782","6,536796",85,60,723507501,54298,"Welschbillig",1300,"2000-10-11","11YR00000003039P",10003764,1495735,7235,"Trier-Saarburg",1150.56538461538,1496,723507,"Trier-Land"
"443","E31238010000000000000000832518852","Nordex Energy GmbH","N60",1300,"10.10.2000",7232024,"49,845009","6,540861",85,60,723507501,54298,"Welschbillig",1300,"2000-10-12","11YR00000003039P",10003764,1420579,7235,"Trier-Saarburg",1092.75307692308,1421,723507,"Trier-Land"
"444","E31238010000000000000000832518853","Nordex Energy GmbH","N60",1300,"19.10.2000",7232024,"49,842084","6,543303",85,60,723507501,54298,"Welschbillig",1300,"2001-01-17","11YR00000003039P",10003764,1487101,7235,"Trier-Saarburg",1143.92384615385,1487,723507,"Trier-Land"
"445","E31238010000000000000000832518854","Nordex Energy GmbH","N60",1300,"19.10.2000",7232024,"49,845155","6,534662",85,60,723507501,54298,"Welschbillig",1300,"2000-10-19","11YR00000003039P",10003764,1593567,7235,"Trier-Saarburg",1225.82076923077,1594,723507,"Trier-Land"
"446","E31238010000000000000000832518855","Nordex Energy GmbH","S70",1500,"21.12.2000",7232024,"49,844018","6,529491",85,70,723507501,54298,"Welschbillig",1500,"2000-12-27","11YR00000003039P",10003764,1711244,7235,"Trier-Saarburg",1140.82933333333,1711,723507,"Trier-Land"
"447","E31238010000000000000000832518856","Nordex Energy GmbH","S70",1500,"27.12.2000",7232024,"49,844816","6,520129",85,70,723507501,54298,"Welschbillig",1500,"2000-12-29","11YR00000003039P",10003764,1680107,7235,"Trier-Saarburg",1120.07133333333,1680,723507,"Trier-Land"
"448","E31238010000000000000000832518857","Nordex Energy GmbH","S70",1500,"29.12.2000",7232024,"49,843604","6,51176",85,70,723507501,54298,"Welschbillig",1500,"2000-12-21","11YR00000003039P",10003764,1797538,7235,"Trier-Saarburg",1198.35866666667,1798,723507,"Trier-Land"
"449","E31238010000000000000000832518858","Nordex Energy GmbH","S70",1500,"26.04.2001",7232024,"49,864775","6,555144",85,70,723507501,54298,"Welschbillig",1500,"2001-04-26","11YR00000003039P",10003764,1787767,7235,"Trier-Saarburg",1191.84466666667,1788,723507,"Trier-Land"
"450","E31238010000000000000000832518859","Nordex Energy GmbH","S70",1500,"24.04.2001",7232061,"49,868302","6,554489",85,70,723507501,54298,"Welschbillig",1500,"2001-04-26","11YR00000003039P",10003764,1566272,7235,"Trier-Saarburg",1044.18133333333,1566,723507,"Trier-Land"
"451","E31238010000000000000000832518861","Nordex Energy GmbH","S70",1500,"06.05.2001",7232024,"49,866087","6,54762",85,70,723507501,54298,"Welschbillig",1500,"2001-05-28","11YR00000003039P",10003764,1542925,7235,"Trier-Saarburg",1028.61666666667,1543,723507,"Trier-Land"
"452","E31238010000000000000000832518862","Nordex Energy GmbH","S70",1500,"31.05.2001",7232024,"49,872355","6,547329",85,70,723507501,54298,"Welschbillig",1500,"2001-05-06","11YR00000003039P",10003764,1805593,7235,"Trier-Saarburg",1203.72866666667,1806,723507,"Trier-Land"
"453","E31238010000000000000000832518863","Nordex Energy GmbH","S70",1500,"28.05.2001",7232024,"49,86939","6,550704",85,70,723507501,54298,"Welschbillig",1500,"2001-05-31","11YR00000003039P",10003764,1642587,7235,"Trier-Saarburg",1095.058,1643,723507,"Trier-Land"
"454","E31238010000000000000000832518864","Nordex Energy GmbH","S70",1500,"29.06.2002",7232024,"49,840868","6,528345",85,70,723507501,54298,"Welschbillig",1500,"2002-06-29","11YR00000003039P",10003764,1703338,7235,"Trier-Saarburg",1135.55866666667,1703,723507,"Trier-Land"
"455","E31238010000000000000000832518865","Nordex Energy GmbH","S70",1500,"03.06.2002",7232024,"49,836955","6,534599",85,70,723507501,54298,"Welschbillig",1500,"2002-06-03","11YR00000003039P",10003764,1529632,7235,"Trier-Saarburg",1019.75466666667,1530,723507,"Trier-Land"
"456","E31238010000000000000001100406639","Senvion Deutschland GmbH","3.4M104",3370,"06.05.2013",7134058,"49,694337","7,214744",128,104,713400045,55743,"Idar-Oberstein",3370,"2013-05-06","11YR00000003039P",10003764,4916706,7134,"Birkenfeld",1458.96320474777,4917,713400,"vfr Birkenfeld"
"457","E31238010000000000000001100472125","Senvion Deutschland GmbH","3.4M104",3370,"10.06.2013",7134058,"49,6959","7,211443",128,104,713400045,55743,"Idar-Oberstein",3370,"2013-06-10","11YR00000003039P",10003764,4916706,7134,"Birkenfeld",1458.96320474777,4917,713400,"vfr Birkenfeld"
"458","E31238010000000000000001100472126","Senvion Deutschland GmbH","3.4M104",3370,"27.05.2013",7134058,"49,694475","7,205905",128,104,713400045,55743,"Idar-Oberstein",3370,"2013-05-27","11YR00000003039P",10003764,4916706,7134,"Birkenfeld",1458.96320474777,4917,713400,"vfr Birkenfeld"
"459","E31238010000000000000001100472129","Senvion Deutschland GmbH","3.4M104",3370,"01.07.2013",7134058,"49,697265","7,203908",128,104,713400045,55743,"Idar-Oberstein",3370,"2013-07-01","11YR00000003039P",10003764,4916706,7134,"Birkenfeld",1458.96320474777,4917,713400,"vfr Birkenfeld"
"460","E31238010000000000000001100472130","Senvion Deutschland GmbH","3.4M104",3370,"12.06.2013",7134094,"49,699992","7,202756",128,104,713400045,55743,"Idar-Oberstein",3370,"2013-06-12","11YR00000003039P",10003764,4916706,7134,"Birkenfeld",1458.96320474777,4917,713400,"vfr Birkenfeld"
"461","E31238010000000000000001128806256","Vestas Deutschland GmbH","V112 3.0 Gridstreamer",3000,"29.12.2014",7134058,"49,676955","7,186357",119,112,713402031,55767,"Gollenberg",3000,"2014-12-29",NA,10003764,5252493,7134,"Birkenfeld",1750.831,5252,713402,"Birkefeld"
"465","E31238010000000000000001151176809","Nordex SE","N117",2400,"29.08.2015",7336050,"49,648055","7,488316",120,117,733608100,67746,"Unterjeckenbach",2400,"2015-08-29",NA,10003764,6057022,7336,"Kusel",2523.75916666667,6057,733608,"Lauterecken-Wolfstein"
"466","E31238010000000000000001151176810","Nordex SE","N117",2400,"17.09.2015",7336050,"49,646372","7,493034",120,117,733608100,67746,"Unterjeckenbach",2400,"2015-09-17",NA,10003764,6057022,7336,"Kusel",2523.75916666667,6057,733608,"Lauterecken-Wolfstein"
"467","E31238010000000000000001151176811","Nordex SE","N117",2400,"25.08.2015",7336050,"49,642359","7,492147",120,117,733608100,67746,"Unterjeckenbach",2400,"2015-08-25",NA,10003764,6057022,7336,"Kusel",2523.75916666667,6057,733608,"Lauterecken-Wolfstein"
"468","E31238010000000000000001171704502","ENERCON GmbH","E 101",3050,"10.12.2014",7134002,"49,627821","7,068706",135,101,713402010,55765,"Birkenfeld",3050,"2014-12-10","11YR00000003039P",10003764,5769180,7134,"Birkenfeld",1891.53442622951,5769,713402,"Birkefeld"
"469","E31238010000000000000001171796208","ENERCON GmbH","E 101",3050,"26.11.2014",7134002,"49,635112","7,063023",135,101,713402010,55765,"Birkenfeld",3050,"2014-11-26","11YR00000003039P",10003764,5769180,7134,"Birkenfeld",1891.53442622951,5769,713402,"Birkefeld"
"470","E31238010000000000000001171796209","ENERCON GmbH","E 101",3050,"07.12.2014",7134002,"49,635238","7,067844",135,101,713402010,55765,"Birkenfeld",3050,"2014-12-07","11YR00000003039P",10003764,5769180,7134,"Birkenfeld",1891.53442622951,5769,713402,"Birkefeld"
"471","E31238010000000000000001171796211","ENERCON GmbH","E 101",3050,"31.12.2014",7134002,"49,634587","7,072107",135,101,713402010,55765,"Birkenfeld",3050,"2014-12-31","11YR00000003039P",10003764,5769180,7134,"Birkenfeld",1891.53442622951,5769,713402,"Birkefeld"
"472","E31238010000000000000001172031041","ENERCON GmbH","E 92",2350,"16.12.2014",7134010,"49,628894","7,146748",138,92,713402010,55765,"Birkenfeld",2350,"2014-12-16","11YR00000003039P",10003764,1628,7134,"Birkenfeld",0.692765957446808,2,713402,"Birkefeld"
"473","E31238010000000000000001172096212","ENERCON GmbH","E 92",2350,"17.12.2014",7134010,"49,62612","7,14659",138,92,713402010,55765,"Birkenfeld",2350,"2014-12-17","11YR00000003039P",10003764,1628,7134,"Birkenfeld",0.692765957446808,2,713402,"Birkefeld"
"474","E31238010000000000000001172096213","ENERCON GmbH","E 92",2350,"19.12.2014",7134010,"49,624972","7,153543",138,92,713402010,55765,"Birkenfeld",2350,"2014-12-19","11YR00000003039P",10003764,1628,7134,"Birkenfeld",0.692765957446808,2,713402,"Birkefeld"
"476","E31238010000000000000001172292046","ENERCON GmbH","E 101",3050,"24.07.2014",7134053,"49,607316","7,08449",135,101,713402010,55765,"Birkenfeld",3050,"2014-07-24","11YR00000003039P",10003764,5690953,7134,"Birkenfeld",1865.8862295082,5691,713402,"Birkefeld"
"477","E31238010000000000000001172292048","ENERCON GmbH","E 101",3050,"15.07.2014",7134053,"49,615259","7,081397",135,101,713402010,55765,"Birkenfeld",3050,"2014-07-15","11YR00000003039P",10003764,5690953,7134,"Birkenfeld",1865.8862295082,5691,713402,"Birkefeld"
"478","E31238010000000000000001172292049","ENERCON GmbH","E 92",2350,"11.09.2014",7134053,"49,612571","7,080439",138,92,713402010,55765,"Birkenfeld",2350,"2014-09-11","11YR00000003039P",10003764,4476693,7134,"Birkenfeld",1904.97574468085,4477,713402,"Birkefeld"
"479","E31238010000000000000001172292050","ENERCON GmbH","E 92",2350,"04.08.2014",7134053,"49,603713","7,08449",138,92,713402010,55765,"Birkenfeld",2350,"2014-08-04","11YR00000003039P",10003764,4476693,7134,"Birkenfeld",1904.97574468085,4477,713402,"Birkefeld"
"480","E31238010000000000000001172400216","REpower Systems SE","REpower 3.2M114",3200,"29.08.2016",7134026,"49,60046","7,30144",143,114,713401075,55776,"Ruschberg",3170,"2016-08-29",NA,10003764,6004805,7134,"Birkenfeld",1894.26025236593,6005,713401,"Baumholder"
"481","E31238010000000000000001172406137","Senvion Deutschland GmbH","REpower 3.2M114",3200,"29.08.2016",7134026,"49,59715","7,30215",143,114,713401075,55776,"Ruschberg",3170,"2016-08-29",NA,10003764,6004805,7134,"Birkenfeld",1894.26025236593,6005,713401,"Baumholder"
"482","E31238010000000000000001172406138","Senvion Deutschland GmbH","REpower 3.2M114",3200,"03.09.2016",7134026,"49,60582","7,29641",143,114,713401075,55776,"Ruschberg",3170,"2016-09-03",NA,10003764,6004805,7134,"Birkenfeld",1894.26025236593,6005,713401,"Baumholder"
"483","E31238010000000000000001172406139","Senvion Deutschland GmbH","REpower 3.2M114",3200,"01.09.2016",7134026,"49,60314","7,29734",143,114,713401075,55776,"Ruschberg",3170,"2016-09-01",NA,10003764,6004805,7134,"Birkenfeld",1894.26025236593,6005,713401,"Baumholder"
"484","E31238010000000000000001256208450","ENERCON GmbH","E-70 E4",2000,"28.09.2007",7140076,"50,005359","7,511563",98,71,714008144,55469,"Simmern",2000,"2007-09-28","11YR00000003039P",10003764,2128880,7140,"Rhein-Hundsrück",1064.44,2129,714008,"Simmern-Rheinböllen"
"485","E31238010000000000000001256241038","ENERCON GmbH","E 70-E4",2000,"28.09.2007",7140076,"50,00789","7,513257",98,71,714008144,55469,"Simmern",2000,"2007-09-28","11YR00000003039P",10003764,2128880,7140,"Rhein-Hundsrück",1064.44,2129,714008,"Simmern-Rheinböllen"
"486","E31238010000000000000001256241039","ENERCON GmbH","E-70 E4",2000,"10.10.2007",7140076,"50,010168","7,514094",98,71,714008144,55469,"Simmern",2000,"2007-10-10","11YR00000003039P",10003764,2128880,7140,"Rhein-Hundsrück",1064.44,2129,714008,"Simmern-Rheinböllen"
"487","E31238010000000000000001256241040","ENERCON GmbH","E-70 E4",2000,"16.10.2007",7140076,"50,011944","7,513034",98,71,714008144,55469,"Simmern",2000,"2007-10-16","11YR00000003039P",10003764,2128880,7140,"Rhein-Hundsrück",1064.44,2129,714008,"Simmern-Rheinböllen"
"488","E31238010000000000000001256257990","ENERCON GmbH","E-82 E2",2300,"06.06.2013",7140076,"50,015933","7,51622",138,82,714008144,55469,"Simmern",2300,"2013-05-29","11YR00000003039P",10003764,2932957,7140,"Rhein-Hundsrück",1275.19869565217,2933,714008,"Simmern-Rheinböllen"
"489","E31238010000000000000003031635350","Vestas Deutschland GmbH","V90",2000,"05.12.2007",7232320,"50,195398","6,341968",105,90,723206320,54595,"Watzerath",2000,"2007-12-27","11YR00000003039P",10003764,2630211,7232,"Eifelkreis Bitburg-Prüm",1315.1055,2630,723206,"Prüm"
"490","E31238010000000000000003031645431","Vestas Deutschland GmbH","V90",2000,"15.11.2007",7232320,"50,193575","6,336968",105,90,723206320,54595,"Watzerath",2000,"2007-11-15","11YR00000003039P",10003764,2630211,7232,"Eifelkreis Bitburg-Prüm",1315.1055,2630,723206,"Prüm"
"491","E31238010000000000000003031645432","Vestas Deutschland GmbH","V90",2000,"27.11.2007",7232320,"50,195618","6,332342",105,90,723206320,54595,"Watzerath",2000,"2007-11-19","11YR00000003039P",10003764,2630211,7232,"Eifelkreis Bitburg-Prüm",1315.1055,2630,723206,"Prüm"
"492","E31238010000000000000003031645433","Vestas Deutschland GmbH","V90",2000,"13.12.2007",7232320,"50,190417","6,332632",105,90,723206320,54595,"Watzerath",2000,"2007-12-20","11YR00000003039P",10003764,2630211,7232,"Eifelkreis Bitburg-Prüm",1315.1055,2630,723206,"Prüm"
"493","E31238010000000000000003031645434","Vestas Deutschland GmbH","V90",2000,"13.12.2007",7232320,"50,187662","6,325893",105,90,723206320,54595,"Watzerath",2000,"2007-12-20","11YR00000003039P",10003764,2630211,7232,"Eifelkreis Bitburg-Prüm",1315.1055,2630,723206,"Prüm"
"494","E31238010000000000000003031645435","Vestas Deutschland GmbH","V90",2000,"19.11.2007",7232320,"50,190647","6,339121",105,90,723206320,54595,"Watzerath",2000,"2007-12-18","11YR00000003039P",10003764,2630211,7232,"Eifelkreis Bitburg-Prüm",1315.1055,2630,723206,"Prüm"
"495","E31238010000000000000003031645436","Vestas Deutschland GmbH","V90",2000,"20.11.2007",7232320,"50,192987","6,345072",105,90,723206320,54595,"Watzerath",2000,"2007-12-13","11YR00000003039P",10003764,2630211,7232,"Eifelkreis Bitburg-Prüm",1315.1055,2630,723206,"Prüm"
"496","E31238010000000000000003031645437","Vestas Deutschland GmbH","V90",2000,"20.12.2007",7232320,"50,184486","6,33959",105,90,723206320,54595,"Watzerath",2000,"2007-12-18","11YR00000003039P",10003764,2630211,7232,"Eifelkreis Bitburg-Prüm",1315.1055,2630,723206,"Prüm"
"497","E31238010000000000000003031645438","Vestas Deutschland GmbH","V90",2000,"18.12.2007",7232320,"50,183887","6,324464",105,90,723206320,54595,"Watzerath",2000,"2007-12-13","11YR00000003039P",10003764,2630211,7232,"Eifelkreis Bitburg-Prüm",1315.1055,2630,723206,"Prüm"
"498","E31238010000000000000003031645439","Vestas Deutschland GmbH","V90",2000,"18.12.2007",7232320,"50,186406","6,329942",105,90,723206320,54595,"Watzerath",2000,"2007-11-27","11YR00000003039P",10003764,2630211,7232,"Eifelkreis Bitburg-Prüm",1315.1055,2630,723206,"Prüm"
"499","E31238010000000000000003031645440","Vestas Deutschland GmbH","V90",2000,"20.12.2007",7232320,"50,186505","6,342125",105,90,723206320,54595,"Watzerath",2000,"2007-11-27","11YR00000003039P",10003764,2630206,7232,"Eifelkreis Bitburg-Prüm",1315.103,2630,723206,"Prüm"
"500","E31238010000000000000003031645441","Vestas Deutschland GmbH","V90",2000,"27.12.2007",7232320,"50,179649","6,324029",105,90,723206320,54595,"Watzerath",2000,"2007-12-05","11YR00000003039P",10003764,2630206,7232,"Eifelkreis Bitburg-Prüm",1315.103,2630,723206,"Prüm"
"501","E31238010000000000000003031645442",NA,"V90",2000,"27.12.2007",7232320,"50,183529","6,329248",105,90,723206320,54595,"Watzerath",2000,"2007-11-20","11YR00000003039P",10003764,2630206,7232,"Eifelkreis Bitburg-Prüm",1315.103,2630,723206,"Prüm"
"502","E31238010000000000000003290216178","Gamesa Corporación Tecnológica S.A.","G80",2000,"05.02.2008",7232329,"50,191909","6,246049",78,80,723206296,54595,"PrÃ¼m",2000,"2007-12-20","11YR00000003039P",10003764,2447788,7232,"Eifelkreis Bitburg-Prüm",1223.894,2448,723206,"Prüm"
"503","E31238010000000000000003290245026","Gamesa Corporación Tecnológica S.A.","G80",2000,"05.01.2008",7232329,"50,1872","6,241669",100,80,723206296,54595,"PrÃ¼m",2000,"2007-12-20","11YR00000003039P",10003764,2447788,7232,"Eifelkreis Bitburg-Prüm",1223.894,2448,723206,"Prüm"
"504","E31238010000000000000003290245027","Gamesa Corporación Tecnológica S.A.","G80",2000,"06.02.2008",7232329,"50,189603","6,241374",100,80,723206296,54595,"PrÃ¼m",2000,"2007-12-20","11YR00000003039P",10003764,2447788,7232,"Eifelkreis Bitburg-Prüm",1223.894,2448,723206,"Prüm"
"505","E31238010000000000000003290245028","Gamesa Corporación Tecnológica S.A.","G80",2000,"16.06.2008",7232329,"50,191208","6,238743",100,80,723206296,54595,"PrÃ¼m",2000,"2007-12-20","11YR00000003039P",10003764,2447788,7232,"Eifelkreis Bitburg-Prüm",1223.894,2448,723206,"Prüm"
"506","E31238010000000000000003290245029","Gamesa Corporación Tecnológica S.A.","G87",2000,"30.12.2007",7232329,"50,191754","6,213214",100,87,723206296,54595,"PrÃ¼m",2000,"2007-12-20","11YR00000003039P",10003764,2447786,7232,"Eifelkreis Bitburg-Prüm",1223.893,2448,723206,"Prüm"
"507","E31238010000000000000003290245031","Gamesa Corporación Tecnológica S.A.","G87",2000,"20.12.2007",7232329,"50,19432","6,210596",100,87,723206296,54595,"PrÃ¼m",2000,"2007-12-20","11YR00000003039P",10003764,2447786,7232,"Eifelkreis Bitburg-Prüm",1223.893,2448,723206,"Prüm"
"508","E31238010000000000000003309412930","Vestas Deutschland GmbH","V90",2000,"29.12.2007",7232218,"49,849572","6,528277",105,90,723507501,54298,"Welschbillig",2000,"2007-12-29","11YR00000003039P",10003764,3314600,7235,"Trier-Saarburg",1657.3,3315,723507,"Trier-Land"
"509","E31238010000000000000003309444520","Vestas Deutschland GmbH","V90",2000,"28.12.2007",7232218,"49,846834","6,5264",105,90,723507501,54298,"Welschbillig",2000,"2007-12-28","11YR00000003039P",10003764,3314600,7235,"Trier-Saarburg",1657.3,3315,723507,"Trier-Land"
"511","E31238010000000000000004616514668","ENERCON GmbH","E70",2000,"07.05.2008",7232201,"50,113337","6,31222",113.5,71,723201201,54687,"Arzfeld",2000,"2008-05-07","11YR00000003039P",10003764,2767460,7232,"Eifelkreis Bitburg-Prüm",1383.73,2767,723201,"Arzfeld"
"512","E31238010000000000000004616542072","ENERCON GmbH","E70",2000,"08.05.2008",7232201,"50,11384","6,325267",113.5,71,723201201,54687,"Arzfeld",2000,"2008-05-08","11YR00000003039P",10003764,2767460,7232,"Eifelkreis Bitburg-Prüm",1383.73,2767,723201,"Arzfeld"
"513","E31238010000000000000004660800067","Vestas Deutschland GmbH","V80 - 2,0 MW",2000,"24.12.2002",7133057,"49,730308","7,598812",60,80,713310057,55568,"Lauschied",2000,"2002-12-24","11YR00000003039P",10003764,2041007,7133,"Bad Kreuznach",1020.5035,2041,713310,"Nahe Glan"
"514","E31238010000000000000004872343798","Vestas Deutschland GmbH","Vestas V90",2000,"23.07.2008",7135075,"50,2525","7,2475",105,90,713502075,56754,"Roes",2000,"2008-07-23","11YR00000003039P",10003764,4023848,7135,"Cochem-Zell",2011.924,4024,713502,"Kaisersesch"
"515","E31238010000000000000005336042487","Südwind Borsig Energy GmbH","S 70",1500,"13.01.2004",7232223,"50,059996","6,476662",85,70,NA,NA,NA,NA,NA,NA,NA,NA,NA,NA,NA,NA,NA,NA
"525","E31238010000000000000005883130321","Vestas Deutschland GmbH","V90",2000,"07.11.2008",7140001,"50,04195","7,47698",105,90,714008144,55469,"Simmern",2000,"2008-11-07","11YR00000003039P",10003764,2842645,7140,"Rhein-Hundsrück",1421.3225,2843,714008,"Simmern-Rheinböllen"
"526","E31238010000000000000005883156156","Vestas Deutschland GmbH","V90",2000,"07.11.2008",7140001,"50,041294","7,482628",105,90,714008144,55469,"Simmern",2000,"2008-11-07","11YR00000003039P",10003764,2842645,7140,"Rhein-Hundsrück",1421.3225,2843,714008,"Simmern-Rheinböllen"
"527","E31238010000000000000005883156158","Vestas Deutschland GmbH","V90",2000,"10.11.2008",7140001,"50,044681","7,482816",105,90,714008144,55469,"Simmern",2000,"2008-11-10","11YR00000003039P",10003764,2842645,7140,"Rhein-Hundsrück",1421.3225,2843,714008,"Simmern-Rheinböllen"
"528","E31238010000000000000005883156161","Vestas Deutschland GmbH","V90",2000,"12.11.2008",7140147,"50,04431","7,47803",105,90,714008144,55469,"Simmern",2000,"2008-11-10","11YR00000003039P",10003764,2842645,7140,"Rhein-Hundsrück",1421.3225,2843,714008,"Simmern-Rheinböllen"
"529","E31238010000000000000005883156162","Vestas Deutschland GmbH","V90",2000,"14.11.2008",7140147,"50,046803","7,477171",105,90,714008144,55469,"Simmern",2000,"2008-11-12","11YR00000003039P",10003764,2842646,7140,"Rhein-Hundsrück",1421.323,2843,714008,"Simmern-Rheinböllen"
"530","E31238010000000000000005883156165","Vestas Deutschland GmbH","V90",2000,"12.11.2008",7140147,"50,049247","7,477246",105,90,714008144,55469,"Simmern",2000,"2008-11-14","11YR00000003039P",10003764,2842646,7140,"Rhein-Hundsrück",1421.323,2843,714008,"Simmern-Rheinböllen"
"531","E31238010000000000000005883156166","Vestas Deutschland GmbH","V90",2000,"10.11.2008",7140147,"50,051917","7,47656",105,90,714008144,55469,"Simmern",2000,"2008-11-12","11YR00000003039P",10003764,2842646,7140,"Rhein-Hundsrück",1421.323,2843,714008,"Simmern-Rheinböllen"
"534","E31238010000000000000006535245179","ENERCON GmbH","E 53",800,"19.01.2009",7233036,"50,266316","6,598163",73,53,723306036,54570,"Kalenborn-Scheuern",800,"2009-01-19","11YR00000003039P",10003764,1162481,7233,"Vulkaneifel",1453.10125,1162,723306,"Geroldstein"
"535","E31238010000000000000007278100131","Fuhrländer AG","MD77",1500,"07.04.2009",7135042,"50,2132","7,1596",111.5,77,713502042,56814,"Illerich",1500,"2009-03-20","11YR00000003039P",10003764,2216607,7135,"Cochem-Zell",1477.738,2217,713502,"Kaisersesch"
"536","E31238010000000000000007278122515","Fuhrländer AG","MD77",1500,"14.04.2009",7135042,"50,2134","7,1656",111.5,77,713502042,56814,"Illerich",1500,"2009-03-20","11YR00000003039P",10003764,2216607,7135,"Cochem-Zell",1477.738,2217,713502,"Kaisersesch"
"537","E31238010000000000000007336849889","ENERCON GmbH","E-82",2000,"12.05.2009",7140123,"50,019142","7,43312",108,82,714003001,56288,"AlterkÃ¼lz",2000,"2009-05-12","11YR00000003039P",10003764,3282823,7140,"Rhein-Hundsrück",1641.4115,3283,714003,"Kastellaun"
"538","E31238010000000000000007336849890","ENERCON GmbH","E-82",2000,"04.05.2009",7140123,"50,018168","7,436217",108,82,714003001,56288,"AlterkÃ¼lz",2000,"2009-05-04","11YR00000003039P",10003764,3282823,7140,"Rhein-Hundsrück",1641.4115,3283,714003,"Kastellaun"
"539","E31238010000000000000007336857996","ENERCON GmbH","E-82",2000,"04.08.2010",7140001,"50,038993","7,479737",108,82,714003001,56288,"AlterkÃ¼lz",2000,"2010-08-04","11YR00000003039P",10003764,3282823,7140,"Rhein-Hundsrück",1641.4115,3283,714003,"Kastellaun"
"541","E31238010000000000000007743039721","Vestas Deutschland GmbH","Vestas V 90",2000,"24.09.2009",7232061,"49,875298","6,549011",105,90,723507501,54298,"Welschbillig",2000,"2009-09-24","11YR00000003039P",10003764,3458648,7235,"Trier-Saarburg",1729.324,3459,723507,"Trier-Land"
"542","E31238010000000000000007743051643","Vestas Deutschland GmbH","V90",2000,"19.06.2009",7232061,"49,870928","6,554417",105,90,723507501,54298,"Welschbillig",2000,"2009-06-19","11YR00000003039P",10003764,3456837,7235,"Trier-Saarburg",1728.4185,3457,723507,"Trier-Land"
"543","E31238010000000000000007743051644","Vestas Deutschland GmbH","V90",2000,"27.05.2009",7232061,"49,866267","6,551583",105,90,723507501,54298,"Welschbillig",2000,"2009-05-27","11YR00000003039P",10003764,3456837,7235,"Trier-Saarburg",1728.4185,3457,723507,"Trier-Land"
"544","E31238010000000000000007743051645","Vestas Deutschland GmbH","V90",2000,"03.06.2009",7232061,"49,877706","6,550489",105,90,723507501,54298,"Welschbillig",2000,"2009-06-03","11YR00000003039P",10003764,3456837,7235,"Trier-Saarburg",1728.4185,3457,723507,"Trier-Land"
"550","E31238010000000000000009847346438","Nordex Energy GmbH","N90",2500,"17.12.2009",7135093,"50,220924","7,208903",100,90,713502045,56759,"Kaisersesch",2500,"2009-12-17","11YR00000003039P",10003764,3068603,7135,"Cochem-Zell",1227.4412,3069,713502,"Kaisersesch"
"551","E31238010000000000000009847346441","Nordex Energy GmbH","N90",2500,"08.12.2009",7135093,"50,220301","7,213584",100,90,713502045,56759,"Kaisersesch",2500,"2009-12-08","11YR00000003039P",10003764,3068603,7135,"Cochem-Zell",1227.4412,3069,713502,"Kaisersesch"
"552","E31238010000000000000009847346442","Nordex Energy GmbH","N90",2500,"17.12.2009",7135093,"50,217923","7,20431",100,90,713502045,56759,"Kaisersesch",2500,"2009-12-17","11YR00000003039P",10003764,3068604,7135,"Cochem-Zell",1227.4416,3069,713502,"Kaisersesch"
"553","E31238010000000000000009847346443","Nordex Energy GmbH","N90",2500,"15.12.2009",7135093,"50,217462","7,209056",100,90,713502045,56759,"Kaisersesch",2500,"2009-12-15","11YR00000003039P",10003764,3068604,7135,"Cochem-Zell",1227.4416,3069,713502,"Kaisersesch"
"554","E31238010000000000000009847346444","Nordex Energy GmbH","N90",2500,"14.12.2009",7135093,"50,214479","7,18508",100,90,713502045,56759,"Kaisersesch",2500,"2009-12-14","11YR00000003039P",10003764,3068604,7135,"Cochem-Zell",1227.4416,3069,713502,"Kaisersesch"
"555","E31238010000000000000009847346445","Nordex Energy GmbH","N90",2500,"25.06.2010",7135011,"50,223249","7,214657",100,90,713502045,56759,"Kaisersesch",2500,"2010-06-25","11YR00000003039P",10003764,3068604,7135,"Cochem-Zell",1227.4416,3069,713502,"Kaisersesch"
"556","E31238010000000000000009948159604","Vestas Deutschland GmbH","V-90",2000,"08.12.2009",7140153,"50,08938","7,40991",105,90,714003153,56290,"Uhler",2000,"2009-12-08","11YR00000003039P",10003764,3571686,7140,"Rhein-Hundsrück",1785.843,3572,714003,"Kastellaun"
"557","E31238010000000000000009948159613","Vestas Deutschland GmbH","V-90",2000,"10.12.2009",7140153,"50,09362","7,40648",105,90,714003153,56290,"Uhler",2000,"2009-12-10","11YR00000003039P",10003764,3571686,7140,"Rhein-Hundsrück",1785.843,3572,714003,"Kastellaun"
"558","E31238010000000000000009948159616","Vestas Deutschland GmbH","V-90",2000,"15.12.2009",7140153,"50,0919","7,40939",105,90,714003153,56290,"Uhler",2000,"2009-12-15","11YR00000003039P",10003764,3572761,7140,"Rhein-Hundsrück",1786.3805,3573,714003,"Kastellaun"
"565","E31238010000000000000011115023665","VENSYS Energy AG","V82",1500,"25.03.2011",7235114,"49,687656","6,904489",NA,82,723501045,54411,"Hermeskeil",1500,"2011-03-25","11YR00000003039P",10003764,2708443,7235,"Trier-Saarburg",1805.62866666667,2708,723501,"Hermeskeil"
"566","E31238010000000000000011115080695","VENSYS Energy AG","V77",1500,"30.12.2009",7235114,"49,691497","6,89164",NA,77,723501045,54411,"Hermeskeil",1500,"2009-12-30","11YR00000003039P",10003764,2553277,7235,"Trier-Saarburg",1702.18466666667,2553,723501,"Hermeskeil"
"567","E31238010000000000000011115080697","VENSYS Energy AG","V77",1500,"29.12.2009",7235114,"49,690041","6,895224",NA,77,723501045,54411,"Hermeskeil",1500,"2009-12-29","11YR00000003039P",10003764,2553277,7235,"Trier-Saarburg",1702.18466666667,2553,723501,"Hermeskeil"
"568","E31238010000000000000011154760198","ENERCON GmbH","E53",800,"16.04.2010",7232250,"50,273752","15,998677",72,53,723206250,54597,"Kleinlangenfeld",800,"2010-04-16","11YR00000003039P",10003764,1243756,7232,"Eifelkreis Bitburg-Prüm",1554.695,1244,723206,"Prüm"
"569","E31238010000000000000011686110338","ENERCON GmbH","E 53",800,"17.08.2010",7135028,"55,6739","25,845",73,53,713502028,56761,"Eulgem",800,"2010-06-07","11YR00000003039P",10003764,1497007,7135,"Cochem-Zell",1871.25875,1497,713502,"Kaisersesch"
"570","E31238010000000000000011693445364","ENERCON GmbH","E-53",800,"08.06.2010",7135028,"50,2348","7,185411",73,53,713502028,56761,"Eulgem",800,"2010-06-08","11YR00000003039P",10003764,1449438,7135,"Cochem-Zell",1811.7975,1449,713502,"Kaisersesch"
"571","E31238010000000000000012063458671","ENERCON GmbH","E-48",800,"24.06.2010",7233036,"50,267572","6,595617",76,48,723306036,54570,"Kalenborn-Scheuern",800,"2010-07-09","11YR00000003039P",10003764,996808,7233,"Vulkaneifel",1246.01,997,723306,"Geroldstein"
"575","E31238010000000000000012414517207","Vestas Deutschland GmbH","V90",2000,"20.08.2010",7232321,"50,128275","6,490794",105,90,723208070,54655,"Kyllburg",2000,"2010-08-20","11YR00000003039P",10003764,1767024,7232,"Eifelkreis Bitburg-Prüm",883.512,1767,723208,"Bitburger Land"
"576","E31238010000000000000012414517209","Vestas Deutschland GmbH",NA,2000,"05.08.2010",7232321,"50,12925","6,495508",105,90,723208070,54655,"Kyllburg",2000,"2010-08-05","11YR00000003039P",10003764,1767024,7232,"Eifelkreis Bitburg-Prüm",883.512,1767,723208,"Bitburger Land"
"577","E31238010000000000000012414517212","Vestas Deutschland GmbH","V90",2000,"03.08.2010",7232321,"50,126578","6,497078",105,90,723208070,54655,"Kyllburg",2000,"2010-08-03","11YR00000003039P",10003764,1767024,7232,"Eifelkreis Bitburg-Prüm",883.512,1767,723208,"Bitburger Land"
"578","E31238010000000000000012414517213","Vestas Deutschland GmbH","V90",2000,"03.08.2010",7232321,"50,130503","6,500467",105,90,723208070,54655,"Kyllburg",2000,"2010-08-03","11YR00000003039P",10003764,1767024,7232,"Eifelkreis Bitburg-Prüm",883.512,1767,723208,"Bitburger Land"
"579","E31238010000000000000012414517226","Vestas Deutschland GmbH","V90",2000,"29.07.2010",7232321,"50,128036","6,502308",105,90,723208070,54655,"Kyllburg",2000,"2010-07-29","11YR00000003039P",10003764,1767024,7232,"Eifelkreis Bitburg-Prüm",883.512,1767,723208,"Bitburger Land"
"581","E31238010000000000000012414595385","Vestas Deutschland GmbH","V90",2000,"23.08.2010",7232321,"50,130956","6,509025",105,90,723208070,54655,"Kyllburg",2000,"2010-08-23","11YR00000003039P",10003764,1767024,7232,"Eifelkreis Bitburg-Prüm",883.512,1767,723208,"Bitburger Land"
"582","E31238010000000000000012637822952","ENERCON GmbH","E-82 2,3 MW",2300,"02.04.2012",7235141,"49,752933","6,766932",138.38,82,723504085,54318,"Mertesdorf",2300,"2012-04-02","11YR00000003039P",10003764,4938506,7235,"Trier-Saarburg",2147.17652173913,4939,723504,"Ruwer"
"583","E31238010000000000000012637822953","ENERCON GmbH","E-82 2,3 MW",2300,"03.02.2012",7235141,"49,753127","6,77201",138.38,82,723504085,54318,"Mertesdorf",2300,"2012-02-03","11YR00000003039P",10003764,4938506,7235,"Trier-Saarburg",2147.17652173913,4939,723504,"Ruwer"
"584","E31238010000000000000012637880079","ENERCON GmbH","E 82",2000,"19.08.2010",7235141,"49,749601","6,775268",138.38,82,723504085,54318,"Mertesdorf",2000,"2010-08-19","11YR00000003039P",10003764,4778931,7235,"Trier-Saarburg",2389.4655,4779,723504,"Ruwer"
"585","E31238010000000000000013032718701","ENERCON GmbH","E-82",2000,"29.10.2010",7143202,"50,632995","7,852586",107,82,714302259,57629,"Lochum",2000,"2010-10-29","11YR00000003039P",10003764,3558993,7143,"Westerwald",1779.4965,3559,714302,"Hachenburg"
"586","E31238010000000000000013032718703","ENERCON GmbH","E-82",2000,"29.10.2010",7143202,"50,635188","7,855206",107,82,714302259,57629,"Lochum",2000,"2010-10-29","11YR00000003039P",10003764,3558993,7143,"Westerwald",1779.4965,3559,714302,"Hachenburg"
"590","E31238010000000000000013604606370","REpower Systems SE","Repower MM92",2050,"03.02.2011",7140064,"50,064771","7,525792",100,92.5,714003064,56288,"Kastellaun",2050,"2011-02-03","11YR00000003039P",10003764,3670321,7140,"Rhein-Hundsrück",1790.40048780488,3670,714003,"Kastellaun"
"591","E31238010000000000000013698603179","ENERCON GmbH","E-53",800,"24.11.2010",7235068,"49,648067","6,665281",73,53,723508081,54429,"Mandern",800,"2010-11-24","11YR00000003039P",10003764,1219158,7235,"Trier-Saarburg",1523.9475,1219,723508,"Saarburg-Kell"
"592","E31238010000000000000013698603184","ENERCON GmbH","E-53",800,"12.11.2010",7235068,"49,649386","6,665775",73,53,723508081,54429,"Mandern",800,"2010-11-12","11YR00000003039P",10003764,1219158,7235,"Trier-Saarburg",1523.9475,1219,723508,"Saarburg-Kell"
"593","E31238010000000000000013698603185","ENERCON GmbH","E-53",800,"12.11.2010",7235068,"49,647157","6,663391",73,53,723508081,54429,"Mandern",800,"2010-11-12","11YR00000003039P",10003764,1219158,7235,"Trier-Saarburg",1523.9475,1219,723508,"Saarburg-Kell"
"594","E31238010000000000000013823808944","Senvion Deutschland GmbH","MM92",2050,"30.03.2011",7140087,"50,095527","7,590104",100,92,714009087,56291,"Lingerhahn",2050,"2011-03-30","11YR00000003039P",10003764,4441335,7140,"Rhein-Hundsrück",2166.50487804878,4441,714009,"Hundsrück-Mittelrhein"
"595","E31238010000000000000013823817507","Senvion Deutschland GmbH","MM92",2050,"22.03.2011",7140087,"50,089985","7,586088",100,92,714009087,56291,"Lingerhahn",2050,"2011-03-22","11YR00000003039P",10003764,4441335,7140,"Rhein-Hundsrück",2166.50487804878,4441,714009,"Hundsrück-Mittelrhein"
"596","E31238010000000000000013823817508","Senvion Deutschland GmbH","MM92",2050,"18.03.2011",7140087,"50,092098","7,585397",100,92,714009087,56291,"Lingerhahn",2050,"2011-03-18","11YR00000003039P",10003764,4441335,7140,"Rhein-Hundsrück",2166.50487804878,4441,714009,"Hundsrück-Mittelrhein"
"597","E31238010000000000000013823817509","Senvion Deutschland GmbH","MM92",2050,"25.03.2011",7140087,"50,093625","7,591935",100,92,714009087,56291,"Lingerhahn",2050,"2011-03-25","11YR00000003039P",10003764,4441335,7140,"Rhein-Hundsrück",2166.50487804878,4441,714009,"Hundsrück-Mittelrhein"
"601","E31238010000000000000013823905752","ENERCON GmbH","E-82 E2",2300,"18.05.2011",7339062,"49,97566","7,78635",138,82,733901062,55425,"Waldalgesheim",2300,"2011-05-18","11YR00000003039P",10003764,4078871,7339,"Mainz-Bingen",1773.42217391304,4079,733901,"Rhein-Nahe"
"602","E31238010000000000000013823917675","ENERCON GmbH","E-82 E2",2300,"27.05.2011",7339062,"49,9765","7,78238",138,82,733901062,55425,"Waldalgesheim",2300,"2011-05-27","11YR00000003039P",10003764,4078871,7339,"Mainz-Bingen",1773.42217391304,4079,733901,"Rhein-Nahe"
"603","E31238010000000000000013823917677","ENERCON GmbH","E-82 E2",2300,"26.05.2011",7339062,"49,97496","7,79034",138,82,733901062,55425,"Waldalgesheim",2300,"2011-05-26","11YR00000003039P",10003764,4078871,7339,"Mainz-Bingen",1773.42217391304,4079,733901,"Rhein-Nahe"
"604","E31238010000000000000013823917678","ENERCON GmbH","E-82 E2",2300,"18.05.2011",7339062,"49,97298","7,79178",138,82,733901062,55425,"Waldalgesheim",2300,"2011-05-18","11YR00000003039P",10003764,4078871,7339,"Mainz-Bingen",1773.42217391304,4079,733901,"Rhein-Nahe"
"605","E31238010000000000000013823920866","ENERCON GmbH","E-101",3050,"26.10.2012",7339062,"49,97208","7,79765",135,101,733901062,55425,"Waldalgesheim",3050,"2012-10-26","11YR00000003039P",10003764,5721788,7339,"Mainz-Bingen",1875.99606557377,5722,733901,"Rhein-Nahe"
"612","E31238010000000000000014044562753","ENERCON GmbH","E-82-2,3",2300,"12.01.2011",7140010,"50,118379","7,445045",138,82,714003010,56290,"Beltheim",2300,"2010-12-23","11YR00000003039P",10003764,4796518,7140,"Rhein-Hundsrück",2085.44260869565,4797,714003,"Kastellaun"
"613","E31238010000000000000014044562755","ENERCON GmbH","E-82-2,3",2300,"23.12.2010",7140010,"50,120114","7,44286",138,82,714003010,56290,"Beltheim",2300,"2010-12-23","11YR00000003039P",10003764,4796518,7140,"Rhein-Hundsrück",2085.44260869565,4797,714003,"Kastellaun"
"617","E31238010000000000000014538613981","ENERCON GmbH","E-82E2/2.0MW",2000,"11.02.2011",7232258,"50,078323","6,33148",138,82,723201258,54649,"Lauperath",2000,"2011-02-11","11YR00000003039P",10003764,5083655,7232,"Eifelkreis Bitburg-Prüm",2541.8275,5084,723201,"Arzfeld"
"621","E31238010000000000000015218318567","GE Wind Energy GmbH","GE-70-1,5",1500,"20.12.2002",7331024,"49,675406","8,120753",65,70.5,714009087,56291,"Lingerhahn",2300,"2011-06-21","11YR00000003039P",10003764,4065737,7140,"Rhein-Hundsrück",1767.71173913043,4066,714009,"Hundsrück-Mittelrhein"
"626","E31238010000000000000015228514816","ENERCON GmbH","E82",2300,"17.06.2011",7231204,"49,784017","6,938028",138,82,723106035,54424,"Gielert",2300,"2011-06-17","11YR00000003039P",10003764,3728298,7231,"Bernkastel-Wittlich",1620.99913043478,3728,723106,"Thalfang am Erbeskopf"
"627","E31238010000000000000015228514817","ENERCON GmbH","E82",2300,"29.06.2011",7231204,"49,777017","6,953028",138,82,723106035,54424,"Gielert",2300,"2011-06-29","11YR00000003039P",10003764,3728298,7231,"Bernkastel-Wittlich",1620.99913043478,3728,723106,"Thalfang am Erbeskopf"
"632","E31238010000000000000015403445487","Nordex Energy GmbH","N90/2500 LS",2500,"28.06.2011",7131211,"50,408029","7,170577",100,90,713104211,56745,"Weibern",2500,"2011-06-28","11YR00000003039P",10003764,3206689,7131,"Ahrweiler",1282.6756,3207,713104,"Brohltal"
"633","E31238010000000000000015403446541","Nordex Energy GmbH","N90/2500 LS",2500,"28.06.2011",7131211,"50,398376","7,159579",100,90,713104211,56745,"Weibern",2500,"2011-06-28","11YR00000003039P",10003764,3206689,7131,"Ahrweiler",1282.6756,3207,713104,"Brohltal"
"634","E31238010000000000000015868338222","ENERCON GmbH","Enercon E82",2300,"19.10.2011",7140122,"49,99611","7,38836",138,82,714004067,55481,"Kirchberg",2300,"2011-10-19","11YR00000003039P",10003764,4315977,7140,"Rhein-Hundsrück",1876.51173913043,4316,714004,"Kirchberg (Hunsrück)"
"635","E31238010000000000000015868339714","ENERCON GmbH","Enercon E82",2300,"12.10.2011",7140122,"49,99351","7,38809",138,82,714004067,55481,"Kirchberg",2300,"2011-10-12","11YR00000003039P",10003764,4315977,7140,"Rhein-Hundsrück",1876.51173913043,4316,714004,"Kirchberg (Hunsrück)"
"636","E31238010000000000000015868339715","ENERCON GmbH","Enercon E82",2300,"18.10.2011",7140062,"49,99975","7,38551",138,82,714004067,55481,"Kirchberg",2300,"2011-10-18","11YR00000003039P",10003764,4315977,7140,"Rhein-Hundsrück",1876.51173913043,4316,714004,"Kirchberg (Hunsrück)"
"637","E31238010000000000000015877515598","ENERCON GmbH","E101",3050,"07.04.2014",7232258,"50,074867","6,331567",135,110,723201258,54649,"Lauperath",3050,"2014-04-07","11YR00000003039P",10003764,6540446,7232,"Eifelkreis Bitburg-Prüm",2144.40852459016,6540,723201,"Arzfeld"
"638","E31238010000000000000016243661581","ENERCON GmbH","E-82",2000,"24.08.2011",7131211,"50,399956","7,156931",108,82,713104211,56745,"Weibern",2000,"2011-08-24","11YR00000003039P",10003764,4577413,7131,"Ahrweiler",2288.7065,4577,713104,"Brohltal"
"639","E31238010000000000000016243661584","ENERCON GmbH","E-82",2000,"24.08.2011",7137049,"50,401402","7,160624",108,82,713704093,56745,"Rieden",2000,"2011-08-24","11YR00000003039P",10003764,4577413,7137,"Mayen-Koblenz",2288.7065,4577,713704,"Mendig"
"640","E31238010000000000000016243661586","ENERCON GmbH","E-82",2000,"24.08.2011",7131211,"50,403488","7,161519",113,82,713104211,56745,"Weibern",2000,"2011-08-24","11YR00000003039P",10003764,4577413,7131,"Ahrweiler",2288.7065,4577,713104,"Brohltal"
"641","E31238010000000000000016243661587","ENERCON GmbH","E-82",2000,"25.08.2011",7137049,"50,402727","7,171079",108,82,713704093,56745,"Rieden",2000,"2011-08-25","11YR00000003039P",10003764,4577413,7137,"Mayen-Koblenz",2288.7065,4577,713704,"Mendig"
"642","E31238010000000000000016243661588","ENERCON GmbH","E-70",2300,"27.01.2012",7137049,"50,403535","7,167639",113,70,713704093,56745,"Rieden",2300,"2012-01-27","11YR00000003039P",10003764,3916107,7137,"Mayen-Koblenz",1702.6552173913,3916,713704,"Mendig"
"643","E31238010000000000000016243661589","ENERCON GmbH","E-70",2300,"15.02.2012",7131211,"50,410798","7,173993",113,70,713104211,56745,"Weibern",2300,"2012-02-16","11YR00000003039P",10003764,3916107,7131,"Ahrweiler",1702.6552173913,3916,713104,"Brohltal"
"644","E31238010000000000000016892432529","ENERCON GmbH","E 82",2300,"23.11.2011",7232059,"49,926379","6,309587",NA,82,723205122,54675,"Sinspelt",2300,"2011-11-23","11YR00000003039P",10003764,3952985,7232,"Eifelkreis Bitburg-Prüm",1718.68913043478,3953,723205,"Südeifel"
"645","E31238010000000000000016892437942","ENERCON GmbH","E 82",2300,"27.10.2011",7232095,"49,927373","6,314148",NA,82,723205122,54675,"Sinspelt",2300,"2011-10-27","11YR00000003039P",10003764,3952985,7232,"Eifelkreis Bitburg-Prüm",1718.68913043478,3953,723205,"Südeifel"
"646","E31238010000000000000016892437943","ENERCON GmbH","E 82",2300,"13.10.2011",7232095,"49,928386","6,318792",NA,82,723205122,54675,"Sinspelt",2300,"2011-10-13","11YR00000003039P",10003764,4063773,7232,"Eifelkreis Bitburg-Prüm",1766.85782608696,4064,723205,"Südeifel"
"647","E31238010000000000000016892437944","ENERCON GmbH","E 82",2300,"01.12.2011",7232059,"49,923172","6,308453",NA,82,723205122,54675,"Sinspelt",2300,"2011-12-01","11YR00000003039P",10003764,3952985,7232,"Eifelkreis Bitburg-Prüm",1718.68913043478,3953,723205,"Südeifel"
"648","E31238010000000000000016892437945","ENERCON GmbH","E 82",2300,"23.11.2011",7232095,"49,924462","6,313544",NA,82,723205122,54675,"Sinspelt",2300,"2011-11-23","11YR00000003039P",10003764,4335031,7232,"Eifelkreis Bitburg-Prüm",1884.79608695652,4335,723205,"Südeifel"
"649","E31238010000000000000016892437946","ENERCON GmbH","E 82",2300,"23.11.2011",7232095,"49,923492","6,316587",NA,82,723205122,54675,"Sinspelt",2300,"2011-11-23","11YR00000003039P",10003764,4335031,7232,"Eifelkreis Bitburg-Prüm",1884.79608695652,4335,723205,"Südeifel"
"650","E31238010000000000000016892437947","ENERCON GmbH","E 82",2300,"07.10.2011",7232095,"49,919001","6,308106",NA,82,723205122,54675,"Sinspelt",2300,"2011-10-07","11YR00000003039P",10003764,4020860,7232,"Eifelkreis Bitburg-Prüm",1748.2,4021,723205,"Südeifel"
"651","E31238010000000000000016892437948","ENERCON GmbH","E 82",2300,"17.02.2012",7232054,"49,924053","6,321688",NA,82,723205122,54675,"Sinspelt",2300,"2012-02-17","11YR00000003039P",10003764,4335031,7232,"Eifelkreis Bitburg-Prüm",1884.79608695652,4335,723205,"Südeifel"
"652","E31238010000000000000016892437949","ENERCON GmbH","E 82",2300,"24.02.2012",7232054,"49,918642","6,311543",NA,82,723205122,54675,"Sinspelt",2300,"2012-02-24","11YR00000003039P",10003764,4335017,7232,"Eifelkreis Bitburg-Prüm",1884.79,4335,723205,"Südeifel"
"653","E31238010000000000000016892437950","ENERCON GmbH","E 82",2300,"10.02.2012",7232054,"49,914552","6,304471",NA,82,723205122,54675,"Sinspelt",2300,"2012-02-10","11YR00000003039P",10003764,4335031,7232,"Eifelkreis Bitburg-Prüm",1884.79608695652,4335,723205,"Südeifel"
"654","E31238010000000000000016892437951","ENERCON GmbH","E 82",2300,"30.12.2011",7232095,"49,92814","6,335601",NA,82,723205122,54675,"Sinspelt",2300,"2011-12-30","11YR00000003039P",10003764,3738750,7232,"Eifelkreis Bitburg-Prüm",1625.54347826087,3739,723205,"Südeifel"
"655","E31238010000000000000016892437952","ENERCON GmbH","E 82",2300,"29.12.2011",7232095,"49,931586","6,337839",NA,82,723205122,54675,"Sinspelt",2300,"2011-12-29","11YR00000003039P",10003764,3738750,7232,"Eifelkreis Bitburg-Prüm",1625.54347826087,3739,723205,"Südeifel"
"656","E31238010000000000000016892437953","ENERCON GmbH","E 82",2300,"26.09.2011",7232095,"49,928341","6,331368",NA,82,723205122,54675,"Sinspelt",2300,"2011-09-26","11YR00000003039P",10003764,3738750,7232,"Eifelkreis Bitburg-Prüm",1625.54347826087,3739,723205,"Südeifel"
"657","E31238010000000000000016959918840","ENERCON GmbH","E82 - 2,3 MW",2300,"26.09.2011",7211000,"49,9","6,3",108,82,723205080,54675,"Mettendorf",2300,"2011-09-26","11YR00000003039P",10003764,3906128,7232,"Eifelkreis Bitburg-Prüm",1698.31652173913,3906,723205,"Südeifel"
"658","E31238010000000000000016991762747","Senvion Deutschland GmbH","3.4M128-104",3370,"12.10.2011",7140144,"50,039265","7,524465",128,104,714008144,55469,"Simmern",3370,"2011-10-12","11YR00000003039P",10003764,4960205,7140,"Rhein-Hundsrück",1471.87091988131,4960,714008,"Simmern-Rheinböllen"
"659","E31238010000000000000016991762748","Senvion Deutschland GmbH","3.4M128-104",3370,"10.11.2011",7140144,"50,033013","7,508018",128,104,714008144,55469,"Simmern",3370,"2011-11-10","11YR00000003039P",10003764,4960205,7140,"Rhein-Hundsrück",1471.87091988131,4960,714008,"Simmern-Rheinböllen"
"660","E31238010000000000000016991762749","Senvion Deutschland GmbH","3.4M128-104",3370,"27.10.2011",7140144,"50,038665","7,512687",128,104,714008144,55469,"Simmern",3370,"2011-10-27","11YR00000003039P",10003764,4960205,7140,"Rhein-Hundsrück",1471.87091988131,4960,714008,"Simmern-Rheinböllen"
"661","E31238010000000000000016991762750","Senvion Deutschland GmbH","3.4M128-104",3370,"25.10.2011",7140144,"50,042025","7,51384",128,104,714008144,55469,"Simmern",3370,"2011-10-25","11YR00000003039P",10003764,4960205,7140,"Rhein-Hundsrück",1471.87091988131,4960,714008,"Simmern-Rheinböllen"
"662","E31238010000000000000016991762751","Senvion Deutschland GmbH","3.4M128-104",3370,"01.11.2011",7140144,"50,041524","7,521841",128,104,714008144,55469,"Simmern",3370,"2011-11-01","11YR00000003039P",10003764,4960205,7140,"Rhein-Hundsrück",1471.87091988131,4960,714008,"Simmern-Rheinböllen"
"663","E31238010000000000000016991762752","Senvion Deutschland GmbH","3.4M128-104",3370,"08.11.2011",7140144,"50,034228","7,503221",128,104,714008144,55469,"Simmern",3370,"2011-11-08","11YR00000003039P",10003764,4960205,7140,"Rhein-Hundsrück",1471.87091988131,4960,714008,"Simmern-Rheinböllen"
"664","E31238010000000000000017426823324","ENERCON GmbH","Enercon E82",2300,"17.11.2011",7140062,"50,00778","7,388",138,82,714004067,55481,"Kirchberg",2300,"2011-11-17","11YR00000003039P",10003764,4315977,7140,"Rhein-Hundsrück",1876.51173913043,4316,714004,"Kirchberg (Hunsrück)"
"665","E31238010000000000000017426823325","ENERCON GmbH","Enercon E82",2300,"10.11.2011",7140122,"50,00031","7,39611",138,82,714004067,55481,"Kirchberg",2300,"2011-11-10","11YR00000003039P",10003764,4315977,7140,"Rhein-Hundsrück",1876.51173913043,4316,714004,"Kirchberg (Hunsrück)"
"666","E31238010000000000000017426823326","ENERCON GmbH","Enercon E82",2300,"17.11.2011",7140062,"50,00557","7,38842",138,82,714004067,55481,"Kirchberg",2300,"2011-11-17","11YR00000003039P",10003764,4315977,7140,"Rhein-Hundsrück",1876.51173913043,4316,714004,"Kirchberg (Hunsrück)"
"667","E31238010000000000000017426823327","ENERCON GmbH","Enercon E82",2300,"10.11.2011",7140122,"49,99774","7,39747",138,82,714004067,55481,"Kirchberg",2300,"2011-11-10","11YR00000003039P",10003764,4315977,7140,"Rhein-Hundsrück",1876.51173913043,4316,714004,"Kirchberg (Hunsrück)"
"668","E31238010000000000000017426823328","ENERCON GmbH","Enercon E82",2300,"21.11.2011",7140122,"49,997279","7,403123",138,82,714004067,55481,"Kirchberg",2300,"2011-11-21","11YR00000003039P",10003764,4315977,7140,"Rhein-Hundsrück",1876.51173913043,4316,714004,"Kirchberg (Hunsrück)"
"669","E31238010000000000000017426823330","ENERCON GmbH","Enercon E82",2300,"17.11.2011",7140122,"49,99447","7,40446",138,82,714004067,55481,"Kirchberg",2300,"2011-11-17","11YR00000003039P",10003764,4315977,7140,"Rhein-Hundsrück",1876.51173913043,4316,714004,"Kirchberg (Hunsrück)"
"670","E31238010000000000000017426823331","ENERCON GmbH","Enercon E82",2300,"17.12.2011",7140122,"50,0022","7,39329",138,82,714004067,55481,"Kirchberg",2300,"2011-12-17","11YR00000003039P",10003764,4315977,7140,"Rhein-Hundsrück",1876.51173913043,4316,714004,"Kirchberg (Hunsrück)"
"671","E31238010000000000000017426823332","ENERCON GmbH","Enercon E82",2300,"08.12.2011",7140122,"50,00432","7,39162",138,82,714004067,55481,"Kirchberg",2300,"2011-12-08","11YR00000003039P",10003764,4315977,7140,"Rhein-Hundsrück",1876.51173913043,4316,714004,"Kirchberg (Hunsrück)"
"672","E31238010000000000000017426823334","ENERCON GmbH","Enercon E82",2300,"30.11.2011",7140062,"50,00965","7,38608",138,82,714004067,55481,"Kirchberg",2300,"2011-11-30","11YR00000003039P",10003764,4315977,7140,"Rhein-Hundsrück",1876.51173913043,4316,714004,"Kirchberg (Hunsrück)"
"673","E31238010000000000000017426823335","ENERCON GmbH","Enercon E82",2300,"19.12.2011",7140122,"50,01261","7,38744",138,82,714004067,55481,"Kirchberg",2300,"2011-12-19","11YR00000003039P",10003764,4315977,7140,"Rhein-Hundsrück",1876.51173913043,4316,714004,"Kirchberg (Hunsrück)"
"674","E31238010000000000000017426823336","ENERCON GmbH","Enercon E82",2300,"23.12.2011",7140062,"50,00926","7,37629",138,82,714004067,55481,"Kirchberg",2300,"2011-12-23","11YR00000003039P",10003764,4315977,7140,"Rhein-Hundsrück",1876.51173913043,4316,714004,"Kirchberg (Hunsrück)"
"675","E31238010000000000000017426823337","ENERCON GmbH","Enercon E82",2300,"15.12.2011",7140062,"50,01192","7,37721",138,82,714004067,55481,"Kirchberg",2300,"2011-12-15","11YR00000003039P",10003764,4315977,7140,"Rhein-Hundsrück",1876.51173913043,4316,714004,"Kirchberg (Hunsrück)"
"676","E31238010000000000000017426823338","ENERCON GmbH","Enercon E82",2300,"30.12.2011",7140123,"49,99968","7,41075",138,82,714004067,55481,"Kirchberg",2300,"2011-12-30","11YR00000003039P",10003764,4315977,7140,"Rhein-Hundsrück",1876.51173913043,4316,714004,"Kirchberg (Hunsrück)"
"677","E31238010000000000000017426823339","ENERCON GmbH","Enercon E82",2300,"30.12.2011",7140123,"49,99422","7,41235",138,82,714004067,55481,"Kirchberg",2300,"2011-12-30","11YR00000003039P",10003764,4315977,7140,"Rhein-Hundsrück",1876.51173913043,4316,714004,"Kirchberg (Hunsrück)"
"678","E31238010000000000000017426823340","ENERCON GmbH","Enercon E82",2300,"30.11.2011",7140062,"49,99755","7,384967",138,82,714004067,55481,"Kirchberg",2300,"2011-11-30","11YR00000003039P",10003764,4315977,7140,"Rhein-Hundsrück",1876.51173913043,4316,714004,"Kirchberg (Hunsrück)"
"679","E31238010000000000000017426837219","ENERCON GmbH","Enercon E82",2300,"01.02.2012",7140123,"49,99261","7,41596",138,82,714004067,55481,"Kirchberg",2300,"2012-02-01","11YR00000003039P",10003764,4315977,7140,"Rhein-Hundsrück",1876.51173913043,4316,714004,"Kirchberg (Hunsrück)"
"680","E31238010000000000000017426837220","ENERCON GmbH","Enercon E82",2300,"13.02.2012",7140071,"49,97957","7,3791",138,82,714004067,55481,"Kirchberg",2300,"2012-02-13","11YR00000003039P",10003764,4315977,7140,"Rhein-Hundsrück",1876.51173913043,4316,714004,"Kirchberg (Hunsrück)"
"681","E31238010000000000000017426837221","ENERCON GmbH","Enercon E82",2300,"10.02.2012",7140071,"49,9775","7,37299",138,82,714004067,55481,"Kirchberg",2300,"2012-02-10","11YR00000003039P",10003764,4315977,7140,"Rhein-Hundsrück",1876.51173913043,4316,714004,"Kirchberg (Hunsrück)"
"682","E31238010000000000000017426837222","ENERCON GmbH","Enercon E82",2300,"30.12.2011",7140071,"49,97566","7,37494",138,82,714004067,55481,"Kirchberg",2300,"2011-12-30","11YR00000003039P",10003764,4315977,7140,"Rhein-Hundsrück",1876.51173913043,4316,714004,"Kirchberg (Hunsrück)"
"683","E31238010000000000000017426837223","ENERCON GmbH","Enercon E82",2300,"10.02.2012",7140094,"49,9748","7,37832",138,82,714004067,55481,"Kirchberg",2300,"2012-02-10","11YR00000003039P",10003764,4315977,7140,"Rhein-Hundsrück",1876.51173913043,4316,714004,"Kirchberg (Hunsrück)"
"691","E31238010000000000000017469738276","ENERCON GmbH","E-82",2300,"19.12.2011",7140101,"50,022259","7,510464",138,82,714004067,55481,"Kirchberg",2300,"2011-12-19","11YR00000003039P",10003764,3641552,7140,"Rhein-Hundsrück",1583.28347826087,3642,714004,"Kirchberg (Hunsrück)"
"695","E31238010000000000000017469738280","Vestas Deutschland GmbH","V90",2000,"28.12.2011",7140154,"49,325061","-3,337834",105,90,714004067,55481,"Kirchberg",2000,"2011-12-28","11YR00000003039P",10003764,3142912,7140,"Rhein-Hundsrück",1571.456,3143,714004,"Kirchberg (Hunsrück)"
"699","E31238010000000000000017469798730","Senvion Deutschland GmbH","3.2M114",3170,"20.12.2014",7140101,"50,49343","7,495376",143,114,714004067,55481,"Kirchberg",3170,"2014-12-20",NA,10003764,5885873,7140,"Rhein-Hundsrück",1856.74227129338,5886,714004,"Kirchberg (Hunsrück)"
"700","E31238010000000000000017848969787","Senvion Deutschland GmbH","3.4M 104",3370,"14.02.2013",7140144,"50,030767","7,584268",128,104,NA,NA,NA,NA,NA,NA,NA,NA,NA,NA,NA,NA,NA,NA
"701","E31238010000000000000017901225101","Senvion Deutschland GmbH","RE3.4M104",3400,"11.02.2012",7331003,"49,76506","8,05435",128,104,733101043,55237,"Lonsheim",3370,"2012-02-11","11YR00000003039P",10003764,5846961,7331,"Alzey-Worms",1735.00326409496,5847,733101,"Alzey-Land"
"702","E31238010000000000000017901225106","Senvion Deutschland GmbH","RE3.4M104",3400,"15.01.2012",7331003,"49,76888","8,05842",128,104,733101043,55237,"Lonsheim",3370,"2012-01-30","11YR00000003039P",10003764,5846961,7331,"Alzey-Worms",1735.00326409496,5847,733101,"Alzey-Land"
"703","E31238010000000000000017901225107","Senvion Deutschland GmbH","RE3.4M104",3400,"13.02.2012",7331003,"49,76369","8,06296",128,104,733101043,55237,"Lonsheim",3370,"2012-02-11","11YR00000003039P",10003764,5846961,7331,"Alzey-Worms",1735.00326409496,5847,733101,"Alzey-Land"
"704","E31238010000000000000017901225108","Senvion Deutschland GmbH","RE3.4M104",3400,"30.01.2012",7331003,"49,77034","8,06404",128,104,733101043,55237,"Lonsheim",3370,"2012-01-15","11YR00000003039P",10003764,5846961,7331,"Alzey-Worms",1735.00326409496,5847,733101,"Alzey-Land"
"705","E31238010000000000000017901225109","Senvion Deutschland GmbH","RE3.4M104",3400,"25.02.2012",7331003,"49,75874","8,0526",128,104,733101043,55237,"Lonsheim",3370,"2012-02-23","11YR00000003039P",10003764,5846961,7331,"Alzey-Worms",1735.00326409496,5847,733101,"Alzey-Land"
"706","E31238010000000000000017901225110","Senvion Deutschland GmbH","RE3.4M104",3400,"17.02.2012",7331003,"49,7656","8,05962",128,104,733101043,55237,"Lonsheim",3370,"2012-02-17","11YR00000003039P",10003764,5846961,7331,"Alzey-Worms",1735.00326409496,5847,733101,"Alzey-Land"
"707","E31238010000000000000017901225111","Senvion Deutschland GmbH","RE3.4M104",3400,"11.02.2012",7331003,"49,76755","8,06719",128,104,733101043,55237,"Lonsheim",3370,"2012-02-13","11YR00000003039P",10003764,5846961,7331,"Alzey-Worms",1735.00326409496,5847,733101,"Alzey-Land"
"708","E31238010000000000000017901225112","Senvion Deutschland GmbH","RE3.4M104",3400,"25.02.2012",7331003,"49,75531","8,05962",128,104,733101043,55237,"Lonsheim",3370,"2012-02-25","11YR00000003039P",10003764,5846961,7331,"Alzey-Worms",1735.00326409496,5847,733101,"Alzey-Land"
"709","E31238010000000000000017901225115","Senvion Deutschland GmbH","RE3.4M104",3400,"15.08.2012",7331003,"49,76199","8,05416",128,104,733101043,55237,"Lonsheim",3370,"2012-08-15","11YR00000003039P",10003764,5846961,7331,"Alzey-Worms",1735.00326409496,5847,733101,"Alzey-Land"
"710","E31238010000000000000017901253468","Senvion Deutschland GmbH","RE3.4M104",3400,"06.09.2012",7331003,"49,76761","8,06261",128,104,733101043,55237,"Lonsheim",3370,"2012-09-06","11YR00000003039P",10003764,5846961,7331,"Alzey-Worms",1735.00326409496,5847,733101,"Alzey-Land"
"711","E31238010000000000000019260122470","REpower Systems SE","MM-92",2050,"15.03.2012",7137089,"50,30129","7,250016",100.38,92.5,713700068,56727,"Mayen",2050,"2012-03-15","11YR00000003039P",10003764,3624020,7137,"Mayen-Koblenz",1767.81463414634,3624,713700,"vfr Mayen-Koblenz"
"712","E31238010000000000000019260122805","REpower Systems SE","MM-92",2050,"22.03.2012",7137089,"50,30036","7,260337",100.38,92.5,713700068,56727,"Mayen",2050,"2012-03-17","11YR00000003039P",10003764,3624020,7137,"Mayen-Koblenz",1767.81463414634,3624,713700,"vfr Mayen-Koblenz"
"713","E31238010000000000000019260122806","REpower Systems SE","MM-92",2050,"17.03.2012",7137089,"50,297965","7,263165",100.38,92.5,713700068,56727,"Mayen",2050,"2012-03-22","11YR00000003039P",10003764,3624020,7137,"Mayen-Koblenz",1767.81463414634,3624,713700,"vfr Mayen-Koblenz"
"714","E31238010000000000000019260122807","REpower Systems SE","MM-92",2050,"17.03.2012",7137089,"50,296742","7,251581",100.38,92.5,713700068,56727,"Mayen",2050,"2012-03-19","11YR00000003039P",10003764,3624020,7137,"Mayen-Koblenz",1767.81463414634,3624,713700,"vfr Mayen-Koblenz"
"715","E31238010000000000000019260122808","REpower Systems SE","MM-92",2050,"19.03.2012",7137089,"50,30416","7,278671",100.38,92.5,713700068,56727,"Mayen",2050,"2012-03-17","11YR00000003039P",10003764,3624020,7137,"Mayen-Koblenz",1767.81463414634,3624,713700,"vfr Mayen-Koblenz"
"716","E31238010000000000000019878140147","ENERCON GmbH","E-82 E2",2300,"01.06.2012",7140077,"50,003414","7,519857",138,82,714008144,55469,"Simmern",2300,"2012-06-01","11YR00000003039P",10003764,3348693,7140,"Rhein-Hundsrück",1455.95347826087,3349,714008,"Simmern-Rheinböllen"
"717","E31238010000000000000019878140148","ENERCON GmbH","E-83 E2",2300,"03.08.2012",7140076,"50,013854","7,511189",138,82,714008144,55469,"Simmern",2300,"2012-08-03","11YR00000003039P",10003764,3348698,7140,"Rhein-Hundsrück",1455.95565217391,3349,714008,"Simmern-Rheinböllen"
"718","E31238010000000000000019878140149","ENERCON GmbH","E-82 E2",2300,"13.07.2012",7140076,"50,014941","7,516725",138,82,714008144,55469,"Simmern",2300,"2012-07-13","11YR00000003039P",10003764,3348698,7140,"Rhein-Hundsrück",1455.95565217391,3349,714008,"Simmern-Rheinböllen"
"719","E31238010000000000000019878140150","ENERCON GmbH","E-82 E2",2300,"28.06.2012",7140076,"50,011465","7,517823",138,82,714008144,55469,"Simmern",2300,"2012-06-28","11YR00000003039P",10003764,3348698,7140,"Rhein-Hundsrück",1455.95565217391,3349,714008,"Simmern-Rheinböllen"
"720","E31238010000000000000019878142980","ENERCON GmbH","E-82 E2",2300,"15.06.2012",7140076,"50,008818","7,518281",138,82,714008144,55469,"Simmern",2300,"2012-06-15","11YR00000003039P",10003764,3348693,7140,"Rhein-Hundsrück",1455.95347826087,3349,714008,"Simmern-Rheinböllen"
"721","E31238010000000000000019878157993","ENERCON GmbH","E-82 E2",2300,"22.06.2012",7140076,"50,005964","7,518048",138,82,714008144,55469,"Simmern",2300,"2012-06-22","11YR00000003039P",10003764,3348698,7140,"Rhein-Hundsrück",1455.95565217391,3349,714008,"Simmern-Rheinböllen"
"722","E31238010000000000000020051300377","ENERCON GmbH","E-82 E2/2.3 MW",2300,"10.10.2012",7235137,"49,778839","6,562963",138,82,723507137,54311,"Trierweiler",2300,"2012-10-10","11YR00000003039P",10003764,5017962,7235,"Trier-Saarburg",2181.72260869565,5018,723507,"Trier-Land"
"723","E31238010000000000000020051364934","ENERCON GmbH","E-82 E2/2.3 MW",2300,"31.10.2012",7235137,"49,775141","6,563628",138,82,723507137,54311,"Trierweiler",2300,"2012-10-31","11YR00000003039P",10003764,5018009,7235,"Trier-Saarburg",2181.74304347826,5018,723507,"Trier-Land"
"726","E31238010000000000000020589038553","ENERCON GmbH","E-82 E2",2300,"13.12.2012",7339201,"49,755387","8,277112",138,82,733907201,67585,"Dorn-DÃ¼rkheim",2300,"2012-11-08","11YR00000003039P",10003764,3971649,7339,"Mainz-Bingen",1726.80391304348,3972,733907,"Rhein-Selz"
"727","E31238010000000000000020589068575","ENERCON GmbH","E-82 E2",2300,"11.03.2013",7331015,"49,751951","8,272588",138,82,733907201,67585,"Dorn-DÃ¼rkheim",2300,"2013-03-11","11YR00000003039P",10003764,4122963,7339,"Mainz-Bingen",1792.59260869565,4123,733907,"Rhein-Selz"
"728","E31238010000000000000020589068576","ENERCON GmbH","E-82 E2",2300,"30.01.2013",7331015,"49,747944","8,275065",138,82,733907201,67585,"Dorn-DÃ¼rkheim",2300,"2012-12-30","11YR00000003039P",10003764,4122963,7339,"Mainz-Bingen",1792.59260869565,4123,733907,"Rhein-Selz"
"729","E31238010000000000000020589068577","ENERCON GmbH","E-82 E2",2300,"26.10.2012",7339201,"49,756982","8,287872",138,82,733907201,67585,"Dorn-DÃ¼rkheim",2300,"2012-11-16","11YR00000003039P",10003764,3971649,7339,"Mainz-Bingen",1726.80391304348,3972,733907,"Rhein-Selz"
"730","E31238010000000000000020589068578","ENERCON GmbH","E-82 E2",2300,"08.11.2012",7339201,"49,754797","8,28932",138,82,733907201,67585,"Dorn-DÃ¼rkheim",2300,"2012-11-30","11YR00000003039P",10003764,3971649,7339,"Mainz-Bingen",1726.80391304348,3972,733907,"Rhein-Selz"
"731","E31238010000000000000020589068579","ENERCON GmbH","E-82 E2",2300,"08.02.2013",7331015,"49,750232","8,274486",138,82,733907201,67585,"Dorn-DÃ¼rkheim",2300,"2013-02-08","11YR00000003039P",10003764,4122963,7339,"Mainz-Bingen",1792.59260869565,4123,733907,"Rhein-Selz"
"732","E31238010000000000000020589068580","ENERCON GmbH","E-82 E2",2300,"02.12.2012",7339201,"49,755851","8,293995",138,82,733907201,67585,"Dorn-DÃ¼rkheim",2300,"2012-12-14","11YR00000003039P",10003764,3971649,7339,"Mainz-Bingen",1726.80391304348,3972,733907,"Rhein-Selz"
"733","E31238010000000000000020589068581","ENERCON GmbH","E-82 E2",2300,"14.12.2012",7339201,"49,749585","8,283978",138,82,733907201,67585,"Dorn-DÃ¼rkheim",2300,"2012-11-08","11YR00000003039P",10003764,3971649,7339,"Mainz-Bingen",1726.80391304348,3972,733907,"Rhein-Selz"
"734","E31238010000000000000020589068582","ENERCON GmbH","E-82 E2",2300,"26.09.2013",7331002,"49,750967","8,296351",138,82,733907201,67585,"Dorn-DÃ¼rkheim",2300,"2013-09-26","11YR00000003039P",10003764,4110213,7339,"Mainz-Bingen",1787.04913043478,4110,733907,"Rhein-Selz"
"735","E31238010000000000000020589068583","ENERCON GmbH","E-82 E2",2300,"18.04.2013",7331015,"49,75404","8,271404",138,82,733907201,67585,"Dorn-DÃ¼rkheim",2300,"2013-04-18","11YR00000003039P",10003764,4122963,7339,"Mainz-Bingen",1792.59260869565,4123,733907,"Rhein-Selz"
"736","E31238010000000000000020589068584","ENERCON GmbH","E-82 E2",2300,"06.09.2013",7331002,"49,753074","8,293326",138,82,733907201,67585,"Dorn-DÃ¼rkheim",2300,"2013-09-06","11YR00000003039P",10003764,4110213,7339,"Mainz-Bingen",1787.04913043478,4110,733907,"Rhein-Selz"
"737","E31238010000000000000020589068585","ENERCON GmbH","E-82 E2",2300,"16.11.2012",7339201,"49,758067","8,293269",138,82,733907201,67585,"Dorn-DÃ¼rkheim",2300,"2012-12-13","11YR00000003039P",10003764,3971649,7339,"Mainz-Bingen",1726.80391304348,3972,733907,"Rhein-Selz"
"738","E31238010000000000000020589068586","ENERCON GmbH","E-82 E2",2300,"09.11.2012",7339201,"49,754202","8,280162",138,82,733907201,67585,"Dorn-DÃ¼rkheim",2300,"2012-10-26","11YR00000003039P",10003764,3971649,7339,"Mainz-Bingen",1726.80391304348,3972,733907,"Rhein-Selz"
"739","E31238010000000000000020589068587","ENERCON GmbH","E-82 E2",2300,"02.09.2013",7331002,"49,750218","8,289635",138,82,733907201,67585,"Dorn-DÃ¼rkheim",2300,"2013-09-02","11YR00000003039P",10003764,4110213,7339,"Mainz-Bingen",1787.04913043478,4110,733907,"Rhein-Selz"
"741","E31238010000000000000021070019132","ENERCON GmbH","E101",3050,"03.05.2013",7140125,"49,975627","7,667196",135.4,101,714008125,55494,"RheinbÃ¶llen",3000,"2013-05-03","11YR00000003039P",10003764,8063976,7140,"Rhein-Hundsrück",2687.992,8064,714008,"Simmern-Rheinböllen"
"742","E31238010000000000000021070019134","ENERCON GmbH","E126",7580,"29.10.2012",7140125,"49,978479","7,682222",135,127,714008125,55494,"RheinbÃ¶llen",7580,"2012-10-29","11YR00000003039P",10003764,14449829,7140,"Rhein-Hundsrück",1906.3098944591,14450,714008,"Simmern-Rheinböllen"
"743","E31238010000000000000021070019135","ENERCON GmbH","E101",3050,"18.07.2013",7133023,"49,968903","7,673866",135.4,101,713311095,55444,"Seibersbach",3050,"2013-07-18","11YR00000003039P",10003764,8063976,7133,"Bad Kreuznach",2643.92655737705,8064,713311,"Langenlonsheim-Stromberg"
"744","E31238010000000000000021070019138","ENERCON GmbH","E101",3050,"14.06.2013",7140035,"49,966809","7,650566",135.4,101,714008035,55497,"Ellern (HunsrÃ¼ck)",3000,"2013-06-14","11YR00000003039P",10003764,8063976,7140,"Rhein-Hundsrück",2687.992,8064,714008,"Simmern-Rheinböllen"
"745","E31238010000000000000021070019140","ENERCON GmbH","E101",3050,"13.06.2013",7133023,"49,974275","7,677972",135.4,101,713311095,55444,"Seibersbach",3000,"2013-06-13","11YR00000003039P",10003764,8063976,7133,"Bad Kreuznach",2687.992,8064,713311,"Langenlonsheim-Stromberg"
"746","E31238010000000000000021070019141","ENERCON GmbH","E101",3050,"29.08.2013",7133023,"49,947672","7,669612",135.4,101,713311095,55444,"Seibersbach",3050,"2013-08-29","11YR00000003039P",10003764,8063976,7133,"Bad Kreuznach",2643.92655737705,8064,713311,"Langenlonsheim-Stromberg"
"747","E31238010000000000000021070025246","ENERCON GmbH","E126",7580,"22.11.2012",7140035,"49,967849","7,661163",135,127,714008035,55497,"Ellern (HunsrÃ¼ck)",7580,"2012-11-22","11YR00000003039P",10003764,14449829,7140,"Rhein-Hundsrück",1906.3098944591,14450,714008,"Simmern-Rheinböllen"
"748","E31238010000000000000021070025250","ENERCON GmbH","E101",3050,"22.07.2013",7133023,"49,948864","7,676284",135.4,101,713311095,55444,"Seibersbach",3050,"2013-07-22","11YR00000003039P",10003764,8063976,7133,"Bad Kreuznach",2643.92655737705,8064,713311,"Langenlonsheim-Stromberg"
"749","E31238010000000000000021070025253","ENERCON GmbH",NA,3050,"04.07.2013",7133023,"49,976692","7,687306",135.4,101,713311095,55444,"Seibersbach",3000,"2013-07-04","11YR00000003039P",10003764,8063976,7133,"Bad Kreuznach",2687.992,8064,713311,"Langenlonsheim-Stromberg"
"750","E31238010000000000000021070025254","ENERCON GmbH","E126",7580,"17.12.2012",7140125,"49,976332","7,67461",135,127,714008125,55494,"RheinbÃ¶llen",7580,"2012-12-17","11YR00000003039P",10003764,14449829,7140,"Rhein-Hundsrück",1906.3098944591,14450,714008,"Simmern-Rheinböllen"
"751","E31238010000000000000021070025269","ENERCON GmbH","E126",7580,"28.12.2012",7140035,"49,963953","7,653295",135,127,714008035,55497,"Ellern (HunsrÃ¼ck)",7580,"2012-12-28","11YR00000003039P",10003764,14449829,7140,"Rhein-Hundsrück",1906.3098944591,14450,714008,"Simmern-Rheinböllen"
"752","E31238010000000000000021070025271","ENERCON GmbH","E126",7580,"27.11.2012",7140035,"49,971947","7,665554",135,127,714008035,55497,"Ellern (HunsrÃ¼ck)",7580,"2012-11-27","11YR00000003039P",10003764,14449829,7140,"Rhein-Hundsrück",1906.3098944591,14450,714008,"Simmern-Rheinböllen"
"753","E31238010000000000000021070025273","ENERCON GmbH","E101",3050,"12.04.2013",7140125,"49,983956","7,684542",135.4,101,714008125,55494,"RheinbÃ¶llen",3000,"2013-04-14","11YR00000003039P",10003764,8063976,7140,"Rhein-Hundsrück",2687.992,8064,714008,"Simmern-Rheinböllen"
"754","E31238010000000000000021070025274","ENERCON GmbH","E101",3050,"19.08.2013",7133025,"49,944813","7,671252",135.4,101,713311025,55444,"DÃ¶rrebach",3050,"2013-08-19","11YR00000003039P",10003764,8063976,7133,"Bad Kreuznach",2643.92655737705,8064,713311,"Langenlonsheim-Stromberg"
"755","E31238010000000000000021070060483","ENERCON GmbH","E101",3050,"13.12.2012",7133025,"49,942203","7,665609",135.4,101,713311025,55444,"DÃ¶rrebach",3000,"2012-12-13","11YR00000003039P",10003764,8063976,7133,"Bad Kreuznach",2687.992,8064,713311,"Langenlonsheim-Stromberg"
"756","E31238010000000000000021070083365","ENERCON GmbH","E101",3050,"16.09.2013",7133023,"49,94473","7,664062",135.4,101,713311095,55444,"Seibersbach",3050,"2013-09-16","11YR00000003039P",10003764,8063976,7133,"Bad Kreuznach",2643.92655737705,8064,713311,"Langenlonsheim-Stromberg"
"757","E31238010000000000000021070083374","ENERCON GmbH","E101",3050,"09.09.2013",7140027,"49,999384","7,723401",135.4,101,714008027,55494,"Dichtelbach",3050,"2013-09-09","11YR00000003039P",10003764,8063976,7140,"Rhein-Hundsrück",2643.92655737705,8064,714008,"Simmern-Rheinböllen"
"758","E31238010000000000000021070084475","ENERCON GmbH","E101",3050,"16.09.2013",7140027,"49,998801","7,728495",135.4,101,714008027,55494,"Dichtelbach",3050,"2013-09-16","11YR00000003039P",10003764,8063976,7140,"Rhein-Hundsrück",2643.92655737705,8064,714008,"Simmern-Rheinböllen"
"759","E31238010000000000000021070177809","ENERCON GmbH","E-101",3050,"09.05.2014",7133023,"49,99803","7,741864",135.4,101,733901045,55413,"Oberheimbach",3050,"2014-05-09","11YR00000003039P",10003764,8107432,7339,"Mainz-Bingen",2658.17442622951,8107,733901,"Rhein-Nahe"
"760","E31238010000000000000021070193150","ENERCON GmbH","E-101",3050,"09.05.2014",7133023,"49,999055","7,736063",135.4,101,733901045,55413,"Oberheimbach",3050,"2014-05-09","11YR00000003039P",10003764,8107432,7339,"Mainz-Bingen",2658.17442622951,8107,733901,"Rhein-Nahe"
"761","E31238010000000000000021070199050","ENERCON GmbH","E-101",3050,"28.01.2015",7339040,"49,995659","7,736503",135,101,733901045,55413,"Oberheimbach",3050,"2015-01-28",NA,10003764,8315940,7339,"Mainz-Bingen",2726.53770491803,8316,733901,"Rhein-Nahe"
"763","E31238010000000000000021093158907","Senvion Deutschland GmbH","3.4M104",3370,"26.03.2013",7140025,"50,096673","7,618678",128,104,714009087,56291,"Lingerhahn",3370,"2013-03-26","11YR00000003039P",10003764,7194905,7140,"Rhein-Hundsrück",2134.98664688427,7195,714009,"Hundsrück-Mittelrhein"
"764","E31238010000000000000021093158908","Senvion Deutschland GmbH","3.4M104",3370,"07.02.2013",7140025,"50,096332","7,624826",128,104,714009087,56291,"Lingerhahn",3370,"2013-02-07","11YR00000003039P",10003764,7194905,7140,"Rhein-Hundsrück",2134.98664688427,7195,714009,"Hundsrück-Mittelrhein"
"767","E31238010000000000000021093158911","Senvion Deutschland GmbH","3.4M104",3370,"12.03.2013",7140025,"50,092996","7,621859",128,104,714009087,56291,"Lingerhahn",3370,"2013-03-12","11YR00000003039P",10003764,7194905,7140,"Rhein-Hundsrück",2134.98664688427,7195,714009,"Hundsrück-Mittelrhein"
"770","E31238010000000000000021093177875","Senvion Deutschland GmbH","3.4M104",3370,"16.05.2013",7140025,"50,099593","7,626746",128,104,714009087,56291,"Lingerhahn",3370,"2013-05-16","11YR00000003039P",10003764,7194905,7140,"Rhein-Hundsrück",2134.98664688427,7195,714009,"Hundsrück-Mittelrhein"
"774","E31238010000000000000021093180966","Senvion Deutschland GmbH","3.2 M114",3170,"07.06.2013",7140010,"50,104107","7,505736",143,114,714009087,56291,"Lingerhahn",3170,"2013-06-07","11YR00000003039P",10003764,7030958,7140,"Rhein-Hundsrück",2217.96782334385,7031,714009,"Hundsrück-Mittelrhein"
"778","E31238010000000000000021093190264","Senvion Deutschland GmbH","3.4M104",3370,"25.05.2013",7140025,"50,100719","7,617806",128,104,714009087,56291,"Lingerhahn",3370,"2013-05-25","11YR00000003039P",10003764,7194905,7140,"Rhein-Hundsrück",2134.98664688427,7195,714009,"Hundsrück-Mittelrhein"
"779","E31238010000000000000021093190265","Senvion Deutschland GmbH","3.4M104",3370,"29.05.2013",7140025,"50,101988","7,62465",128,104,714009087,56291,"Lingerhahn",3370,"2013-05-29","11YR00000003039P",10003764,7194905,7140,"Rhein-Hundsrück",2134.98664688427,7195,714009,"Hundsrück-Mittelrhein"
"780","E31238010000000000000021450735908","ENERCON GmbH","E 82",2300,"06.09.2012",7232231,"50,170214","6,242352",138,82,723201247,54619,"Kesfeld",2300,"2012-09-06","11YR00000003039P",10003764,4951803,7232,"Eifelkreis Bitburg-Prüm",2152.95782608696,4952,723201,"Arzfeld"
"781","E31238010000000000000021881171929","ENERCON GmbH","E-82",2300,"15.02.2013",7140204,"50,047853","7,347756",108,82,714003204,56869,"Mastershausen",2300,"2013-02-15","11YR00000003039P",10003764,3926539,7140,"Rhein-Hundsrück",1707.19086956522,3927,714003,"Kastellaun"
"782","E31238010000000000000021881557561","ENERCON GmbH","E-82",2300,"26.02.2013",7140204,"50,037653","7,347317",98,82,714003204,56869,"Mastershausen",2300,"2013-02-26","11YR00000003039P",10003764,3811699,7140,"Rhein-Hundsrück",1657.26043478261,3812,714003,"Kastellaun"
"783","E31238010000000000000021881571346","ENERCON GmbH","E-82",2300,"14.03.2013",7140204,"50,031164","7,347136",98,82,714003204,56869,"Mastershausen",2300,"2013-03-14","11YR00000003039P",10003764,3811699,7140,"Rhein-Hundsrück",1657.26043478261,3812,714003,"Kastellaun"
"784","E31238010000000000000021881571347","ENERCON GmbH","E-82",2300,"28.12.2012",7140204,"50,048205","7,347613",108,82,714003204,56869,"Mastershausen",2300,"2012-12-28","11YR00000003039P",10003764,3926539,7140,"Rhein-Hundsrück",1707.19086956522,3927,714003,"Kastellaun"
"785","E31238010000000000000022277370792","Vestas Deutschland GmbH","Vestas V112-3.0 MW",3075,"09.11.2012",7140123,"50,013507","7,439135",140,112,714008123,55471,"Reich",3075,"2012-11-09","11YR00000003039P",10003764,7408585,7140,"Rhein-Hundsrück",2409.29593495935,7409,714008,"Simmern-Rheinböllen"
"786","E31238010000000000000022292206214","Vestas Deutschland GmbH","Vestas V112-3.0 MW",3075,"22.12.2012",7140021,"50,080959","7,409925",140,112,713505010,56865,"Blankenrath",3075,"2012-12-22","11YR00000003039P",10003764,6925614,7135,"Cochem-Zell",2252.23219512195,6926,713505,"Zell (Mosel)"
"787","E31238010000000000000022292270704","Vestas Deutschland GmbH","Vestas V112-3.0 MW",3075,"15.01.2013",7140021,"50,083059","7,404963",140,112,713505010,56865,"Blankenrath",3075,"2013-01-15","11YR00000003039P",10003764,6925614,7135,"Cochem-Zell",2252.23219512195,6926,713505,"Zell (Mosel)"
"788","E31238010000000000000022292270705","Vestas Deutschland GmbH","Vestas V112-3.0 MW",3075,"18.12.2012",7140021,"50,078539","7,411878",140,112,713505010,56865,"Blankenrath",3075,"2012-12-18","11YR00000003039P",10003764,6925614,7135,"Cochem-Zell",2252.23219512195,6926,713505,"Zell (Mosel)"
"789","E31238010000000000000027452419553","ENERCON GmbH","E-82",2300,"28.12.2012",7232201,"50,115439","6,312377",138,82,723201260,54619,"Lichtenborn",2300,"2012-12-28","11YR00000003039P",10003764,3726992,7232,"Eifelkreis Bitburg-Prüm",1620.43130434783,3727,723201,"Arzfeld"
"790","E31238010000000000000027714787105","VENSYS Energy AG","Vensys 100",2500,"12.12.2012",7235037,"49,424277","6,42083",100,100,723504037,54317,"Gusterath",2500,"2012-12-12","11YR00000003039P",10003764,5661155,7235,"Trier-Saarburg",2264.462,5661,723504,"Ruwer"
"791","E31238010000000000000027717626067","ENERCON GmbH","E-82 E2",2300,"04.02.2013",7235072,"49,651606","6,678841",138,82,723503106,54331,"Pellingen",2300,"2013-02-04","11YR00000003039P",10003764,4617099,7235,"Trier-Saarburg",2007.43434782609,4617,723503,"Konz"
"792","E31238010000000000000027717691254","ENERCON GmbH","E-82 E2",2300,"25.09.2013",7235068,"49,648947","6,662443",138,82,723503106,54331,"Pellingen",2300,"2013-09-25","11YR00000003039P",10003764,5929939,7235,"Trier-Saarburg",2578.23434782609,5930,723503,"Konz"
"794","E31238010000000000000028780032674","ENERCON GmbH","E 101",3050,"02.09.2015",7137025,"50,32","7,13",149,101,713700068,56727,"Mayen",3050,"2015-09-02",NA,10003764,5906205,7137,"Mayen-Koblenz",1936.4606557377,5906,713700,"vfr Mayen-Koblenz"
"795","E31238010000000000000028780058402","ENERCON GmbH","e-101",3050,"01.07.2015",7137025,"50,33","7,14",149,101,713700068,56727,"Mayen",3050,"2015-07-01",NA,10003764,5906205,7137,"Mayen-Koblenz",1936.4606557377,5906,713700,"vfr Mayen-Koblenz"
"796","E31238010000000000000028780058403","ENERCON GmbH","E-101",3050,"26.06.2015",7137025,"50,32","7,14",149,101,713700068,56727,"Mayen",3050,"2015-06-26",NA,10003764,5906205,7137,"Mayen-Koblenz",1936.4606557377,5906,713700,"vfr Mayen-Koblenz"
"797","E31238010000000000000028780058404","ENERCON GmbH","E-101",3050,"27.06.2015",7137025,"50,32","7,14",149,101,713700068,56727,"Mayen",3050,"2015-06-27",NA,10003764,5906205,7137,"Mayen-Koblenz",1936.4606557377,5906,713700,"vfr Mayen-Koblenz"
"798","E31238010000000000000028780080833","ENERCON GmbH","E-101",3050,"29.06.2015",7137025,"50,33","7,14",149,101,713700068,56727,"Mayen",3050,"2015-06-29",NA,10003764,5906205,7137,"Mayen-Koblenz",1936.4606557377,5906,713700,"vfr Mayen-Koblenz"
"799","E31238010000000000000028961522394","Nordex Energy GmbH","N117",2400,"25.11.2014",7140005,"50,121888","7,602783",141,117,714009005,56291,"Badenhard",2400,"2014-11-25","11YR00000003039P",10003764,8554824,7140,"Rhein-Hundsrück",3564.51,8555,714009,"Hundsrück-Mittelrhein"
"800","E31238010000000000000028961522400","Nordex Energy GmbH","N117",2400,"20.11.2014",7140005,"50,123714","7,605051",141,117,714009005,56291,"Badenhard",2400,"2014-11-20","11YR00000003039P",10003764,8554824,7140,"Rhein-Hundsrück",3564.51,8555,714009,"Hundsrück-Mittelrhein"
"801","E31238010000000000000029185206103","ENERCON GmbH","E 53",800,"17.05.2013",7135028,"50,234606","7,16902",73.3,53,713502028,56761,"Eulgem",800,"2013-05-17","11YR00000003039P",10003764,1470560,7135,"Cochem-Zell",1838.2,1471,713502,"Kaisersesch"
"802","E31238010000000000000029306073247","ENERCON GmbH","E82",2300,"24.07.2013",7233237,"50,37029","6,418413",108,82,723306237,54611,"Scheid",2300,"2013-07-24","11YR00000003039P",10003764,3634366,7233,"Vulkaneifel",1580.15913043478,3634,723306,"Geroldstein"
"803","E31238010000000000000029577072006","Vestas Deutschland GmbH","V112-3.3MW",3300,"14.03.2016",7135043,"50,252081","7,239221",119,112,713502043,56761,"Kaifenheim",3300,"2016-03-14",NA,10003764,7211987,7135,"Cochem-Zell",2185.45060606061,7212,713502,"Kaisersesch"
"804","E31238010000000000000029577072007","Vestas Deutschland GmbH","V112-3.3MW",3300,"17.03.2016",7135043,"50,389202","7,238948",119,112,713502043,56761,"Kaifenheim",3300,"2016-03-17",NA,10003764,7211987,7135,"Cochem-Zell",2185.45060606061,7212,713502,"Kaisersesch"
"805","E31238010000000000000029577072009","Vestas Deutschland GmbH","V112-3.3MW",3300,"29.03.2016",7135043,"50,246862","7,243275",94,112,713502043,56761,"Kaifenheim",3300,"2016-03-29",NA,10003764,6763265,7135,"Cochem-Zell",2049.47424242424,6763,713502,"Kaisersesch"
"806","E31238010000000000000031144807471","ENERCON GmbH","E-92",2350,"11.08.2015",7140002,"50,004264","7,575526",138.38,92,714008144,55469,"Simmern",2350,"2015-08-11",NA,10003764,4052544,7140,"Rhein-Hundsrück",1724.48680851064,4053,714008,"Simmern-Rheinböllen"
"807","E31238010000000000000031144807475","ENERCON GmbH","E-92",2350,"24.08.2015",7140002,"50,004129","7,571149",138.38,92,714008144,55469,"Simmern",2350,"2015-08-24",NA,10003764,4052544,7140,"Rhein-Hundsrück",1724.48680851064,4053,714008,"Simmern-Rheinböllen"
"808","E31238010000000000000031144807476","ENERCON GmbH","E-92",2350,"27.08.2015",7140002,"50,006713","7,577213",138.38,92,714008144,55469,"Simmern",2350,"2015-08-27",NA,10003764,4052544,7140,"Rhein-Hundsrück",1724.48680851064,4053,714008,"Simmern-Rheinböllen"
"809","E31238010000000000000031144807477","ENERCON GmbH","E-92",2350,"12.10.2015",7140002,"49,992947","7,57974",138.38,92,714008144,55469,"Simmern",2350,"2015-10-12",NA,10003764,4052544,7140,"Rhein-Hundsrück",1724.48680851064,4053,714008,"Simmern-Rheinböllen"
"810","E31238010000000000000031144812791","ENERCON GmbH","E-82 E2",2300,"29.11.2013",7140015,"50,003983","7,453118",138,82,714008144,55469,"Simmern",2300,"2013-11-29","11YR00000003039P",10003764,3717320,7140,"Rhein-Hundsrück",1616.22608695652,3717,714008,"Simmern-Rheinböllen"
"811","E31238010000000000000031144871948","ENERCON GmbH","E-82 E2",2300,"12.08.2013",7140015,"50,01458","7,385889",138,82,714008144,55469,"Simmern",2300,"2013-08-12","11YR00000003039P",10003764,3717320,7140,"Rhein-Hundsrück",1616.22608695652,3717,714008,"Simmern-Rheinböllen"
"812","E31238010000000000000031144872060","ENERCON GmbH","E-82 E2",2300,"16.08.2013",7140123,"50,016839","7,39765",138,82,714008144,55469,"Simmern",2300,"2013-08-16","11YR00000003039P",10003764,3717320,7140,"Rhein-Hundsrück",1616.22608695652,3717,714008,"Simmern-Rheinböllen"
"813","E31238010000000000000031144872062","ENERCON GmbH","E-82 E2",2300,"13.08.2013",7140123,"50,020284","7,399602",138,82,714008144,55469,"Simmern",2300,"2013-08-13","11YR00000003039P",10003764,3717320,7140,"Rhein-Hundsrück",1616.22608695652,3717,714008,"Simmern-Rheinböllen"
"814","E31238010000000000000031144872063","ENERCON GmbH","E-82 E2",2300,"02.12.2013",7140015,"50,004657","7,449064",138,82,714008144,55469,"Simmern",2300,"2013-12-02","11YR00000003039P",10003764,3717320,7140,"Rhein-Hundsrück",1616.22608695652,3717,714008,"Simmern-Rheinböllen"
"815","E31238010000000000000031144872064","ENERCON GmbH","E-82 E2",2300,"20.11.2013",7140039,"50,001533","7,456895",138,82,714008144,55469,"Simmern",2300,"2013-11-20","11YR00000003039P",10003764,3717320,7140,"Rhein-Hundsrück",1616.22608695652,3717,714008,"Simmern-Rheinböllen"
"816","E31238010000000000000031144888142","ENERCON GmbH","E-82 E2",2300,"20.12.2013",7140076,"50,003318","7,462672",138,82,714008144,55469,"Simmern",2300,"2013-12-23","11YR00000003039P",10003764,3717320,7140,"Rhein-Hundsrück",1616.22608695652,3717,714008,"Simmern-Rheinböllen"
"817","E31238010000000000000031144888144","ENERCON GmbH","E-82 E2",2300,"18.12.2013",7140076,"50,003016","7,467705",138,82,714008144,55469,"Simmern",2300,"2013-12-18","11YR00000003039P",10003764,3717320,7140,"Rhein-Hundsrück",1616.22608695652,3717,714008,"Simmern-Rheinböllen"
"818","E31238010000000000000031144894855","ENERCON GmbH","E-92",2350,"24.07.2014",7140023,"50,030548","7,550956",138,92,714008144,55469,"Simmern",2350,"2014-07-24","11YR00000003039P",10003764,4052954,7140,"Rhein-Hundsrück",1724.66127659574,4053,714008,"Simmern-Rheinböllen"
"819","E31238010000000000000031144894856","ENERCON GmbH","E-92",2350,"29.07.2014",7140023,"50,028031","7,55254",138,92,714008144,55469,"Simmern",2350,"2014-07-27","11YR00000003039P",10003764,4052954,7140,"Rhein-Hundsrück",1724.66127659574,4053,714008,"Simmern-Rheinböllen"
"820","E31238010000000000000031144894857","ENERCON GmbH","E-92",2350,"23.07.2014",7140023,"50,032951","7,548957",138,92,714008144,55469,"Simmern",2350,"2014-07-23","11YR00000003039P",10003764,4052954,7140,"Rhein-Hundsrück",1724.66127659574,4053,714008,"Simmern-Rheinböllen"
"821","E31238010000000000000031144895998","ENERCON GmbH","E-92",2350,"07.10.2014",7140100,"49,97783","7,460806",138.8,92,714008144,55469,"Simmern",2350,"2014-10-07","11YR00000003039P",10003764,4052544,7140,"Rhein-Hundsrück",1724.48680851064,4053,714008,"Simmern-Rheinböllen"
"822","E31238010000000000000031144896000","ENERCON GmbH","E-92",2350,"27.08.2014",7140100,"49,983707","7,455666",138,92,714008144,55469,"Simmern",2350,"2014-08-27","11YR00000003039P",10003764,4052544,7140,"Rhein-Hundsrück",1724.48680851064,4053,714008,"Simmern-Rheinböllen"
"823","E31238010000000000000031144896001","ENERCON GmbH","E-92",2350,"04.09.2014",7140100,"49,981177","7,462931",138,92,714008144,55469,"Simmern",2350,"2014-09-04","11YR00000003039P",10003764,4052544,7140,"Rhein-Hundsrück",1724.48680851064,4053,714008,"Simmern-Rheinböllen"
"824","E31238010000000000000031300806124","Senvion Deutschland GmbH","3.2M114",3200,"25.06.2014",7140036,"50,196857","7,572795",143,114,714009036,56281,"Emmelshausen",3200,"2014-06-25","11YR00000003039P",10003764,7306201,7140,"Rhein-Hundsrück",2283.1878125,7306,714009,"Hundsrück-Mittelrhein"
"825","E31238010000000000000031300806125","Senvion Deutschland GmbH","3.2M114",3200,"05.06.2014",7140036,"50,196715","7,563485",143,114,714009036,56281,"Emmelshausen",3200,"2014-06-05","11YR00000003039P",10003764,7306201,7140,"Rhein-Hundsrück",2283.1878125,7306,714009,"Hundsrück-Mittelrhein"
"826","E31238010000000000000031300806126","Senvion Deutschland GmbH","3.2M114",3200,"18.06.2014",7140036,"50,199441","7,559958",143,114,714009036,56281,"Emmelshausen",3200,"2014-06-18","11YR00000003039P",10003764,7306201,7140,"Rhein-Hundsrück",2283.1878125,7306,714009,"Hundsrück-Mittelrhein"
"827","E31238010000000000000031300806127","Senvion Deutschland GmbH","3.2M114",3200,"31.05.2014",7140036,"50,199154","7,569533",143,114,714009036,56281,"Emmelshausen",3200,"2014-05-31","11YR00000003039P",10003764,7306201,7140,"Rhein-Hundsrück",2283.1878125,7306,714009,"Hundsrück-Mittelrhein"
"828","E31238010000000000000031300806128","Senvion Deutschland GmbH","3.2M114",3200,"17.04.2015",7140036,"50,20128","7,543052",143,114,714009036,56281,"Emmelshausen",3200,"2015-04-17",NA,10003764,7307510,7140,"Rhein-Hundsrück",2283.596875,7308,714009,"Hundsrück-Mittelrhein"
"829","E31238010000000000000031300806129","Senvion Deutschland GmbH","3.2M114",3200,"17.04.2015",7140036,"50,201989","7,550132",143,114,714009036,56281,"Emmelshausen",3200,"2015-04-17",NA,10003764,7307510,7140,"Rhein-Hundsrück",2283.596875,7308,714009,"Hundsrück-Mittelrhein"
"830","E31238010000000000000031300806130","Senvion Deutschland GmbH","3.2M114",3200,"22.04.2015",7140036,"50,198952","7,553221",143,114,714009036,56281,"Emmelshausen",3200,"2015-04-22",NA,10003764,7307510,7140,"Rhein-Hundsrück",2283.596875,7308,714009,"Hundsrück-Mittelrhein"
"831","E31238010000000000000031300806131","Senvion Deutschland GmbH","3.2M114",3200,"11.05.2015",7140036,"50,19391","7,567813",143,114,714009036,56281,"Emmelshausen",3200,"2015-05-11",NA,10003764,7307510,7140,"Rhein-Hundsrück",2283.596875,7308,714009,"Hundsrück-Mittelrhein"
"832","E31238010000000000000031300806134","Senvion Deutschland GmbH","3.2M114",3200,"07.05.2015",7140036,"50,191366","7,570788",143,114,714009036,56281,"Emmelshausen",3200,"2015-05-07",NA,10003764,7307510,7140,"Rhein-Hundsrück",2283.596875,7308,714009,"Hundsrück-Mittelrhein"
"833","E31238010000000000000031365816050","ENERCON GmbH","E-82 E2",2300,"18.12.2014",7235137,"49,772958","6,56667",108,82,723507137,54311,"Trierweiler",2300,"2014-12-18","11YR00000003039P",10003764,3689759,7235,"Trier-Saarburg",1604.24304347826,3690,723507,"Trier-Land"
"834","E31238010000000000000031365816065","ENERCON GmbH","E-82 E2",2300,"18.12.2014",7235137,"49,773305","6,563633",108,82,723507137,54311,"Trierweiler",2300,"2014-12-18","11YR00000003039P",10003764,3689759,7235,"Trier-Saarburg",1604.24304347826,3690,723507,"Trier-Land"
"835","E31238010000000000000031394500337","ENERCON GmbH","E-101",3050,"29.11.2013",7235137,"49,7756","6,56897",149,101,723507137,54311,"Trierweiler",3050,"2013-11-29","11YR00000003039P",10003764,7585343,7235,"Trier-Saarburg",2486.99770491803,7585,723507,"Trier-Land"
"838","E31238010000000000000031464051056","ENERCON GmbH","E-82 E2",2300,"06.09.2013",7232302,"50,322224","6,422498",138.38,82,723206302,54597,"Roth",2300,"2013-09-06","11YR00000003039P",10003764,4200517,7232,"Eifelkreis Bitburg-Prüm",1826.31173913043,4201,723206,"Prüm"
"839","E31238010000000000000031719600309","Vestas Deutschland GmbH","V90",2000,"06.09.2013",7232065,"49,103025","-4,194624",105,90,723205225,54298,"Gilzem",2000,"2013-08-29","11YR00000003039P",10003764,3902604,7232,"Eifelkreis Bitburg-Prüm",1951.302,3903,723205,"Südeifel"
"840","E31238010000000000000031965879980","Vestas Deutschland GmbH","Vestas V 90",2000,"13.06.2014",7140070,"50,061088","7,520611",125,90,714008079,56288,"Laubach",2000,"2014-06-13","11YR00000003039P",10003764,4760698,7140,"Rhein-Hundsrück",2380.349,4761,714008,"Simmern-Rheinböllen"
"841","E31238010000000000000032054536389","Vestas Deutschland GmbH","Vestas V112-3.0 MW",3075,"03.02.2014",7140084,"50,129148","7,597385",140,112,714009031,56281,"DÃ¶rth",3075,"2014-02-03","11YR00000003039P",10003764,7917458,7140,"Rhein-Hundsrück",2574.78308943089,7917,714009,"Hundsrück-Mittelrhein"
"842","E31238010000000000000032054536390","Vestas Deutschland GmbH","Vestas V112-3.0 MW",3075,"07.03.2014",7140084,"50,127337","7,603104",140,112,714009031,56281,"DÃ¶rth",3075,"2014-03-07","11YR00000003039P",10003764,7917458,7140,"Rhein-Hundsrück",2574.78308943089,7917,714009,"Hundsrück-Mittelrhein"
"843","E31238010000000000000032054536391","Vestas Deutschland GmbH","Vestas V112-3.0 MW",3075,"30.12.2013",7140084,"50,132726","7,598708",140,112,714009031,56281,"DÃ¶rth",3075,"2013-12-30","11YR00000003039P",10003764,7917458,7140,"Rhein-Hundsrück",2574.78308943089,7917,714009,"Hundsrück-Mittelrhein"
"844","E31238010000000000000032111456373","ENERCON GmbH","Enercon E 82  2,3 MW",2300,"15.08.2014",7135042,"50,213285","7,173052",138.38,82,713502042,56814,"Illerich",2300,"2014-08-15",NA,10003764,3622570,7135,"Cochem-Zell",1575.03043478261,3623,713502,"Kaisersesch"
"845","E31238010000000000000032262645164","Senvion Deutschland GmbH","3.2M114",3170,"22.10.2013",7140158,"50,008833","7,606139",143,114,714008037,55494,"Erbach",3170,"2013-10-22","11YR00000003039P",10003764,7076708,7140,"Rhein-Hundsrück",2232.4,7077,714008,"Simmern-Rheinböllen"
"846","E31238010000000000000032262645169","Senvion Deutschland GmbH","3.2M114",3170,"05.11.2013",7140158,"50,010361","7,602861",143,114,714008037,55494,"Erbach",3170,"2013-10-22","11YR00000003039P",10003764,7076708,7140,"Rhein-Hundsrück",2232.4,7077,714008,"Simmern-Rheinböllen"
"847","E31238010000000000000032262645172","Senvion Deutschland GmbH","3.2M114",3170,"12.11.2013",7140158,"50,011278","7,598056",143,114,714008037,55494,"Erbach",3170,"2013-10-22","11YR00000003039P",10003764,7076708,7140,"Rhein-Hundsrück",2232.4,7077,714008,"Simmern-Rheinböllen"
"848","E31238010000000000000033032053555","Nordex Energy GmbH",NA,2400,"19.12.2014",7140503,"50,119929","7,314095",141,117,714003503,56290,"MÃ¶rsdorf",2400,"2014-12-19","11YR00000003039P",10003764,5554163,7140,"Rhein-Hundsrück",2314.23458333333,5554,714003,"Kastellaun"
"849","E31238010000000000000033032084131","Nordex Energy GmbH",NA,2400,"19.12.2014",7140503,"50,119929","7,314095",141,117,714003010,56290,"Beltheim",2400,"2014-12-19","11YR00000003039P",10003764,5554163,7140,"Rhein-Hundsrück",2314.23458333333,5554,714003,"Kastellaun"
"850","E31238010000000000000033032084132",NA,NA,2400,"27.11.2014",7140503,"50,115544","7,321788",141,117,714003010,56290,"Beltheim",2400,"2014-11-27","11YR00000003039P",10003764,5554163,7140,"Rhein-Hundsrück",2314.23458333333,5554,714003,"Kastellaun"
"852","E31238010000000000000033032084134","Nordex Energy GmbH","N117/2400",2400,"29.12.2014",7140503,"50,110413","7,319674",141,117,714003010,56290,"Beltheim",2400,"2014-12-29","11YR00000003039P",10003764,5554163,7140,"Rhein-Hundsrück",2314.23458333333,5554,714003,"Kastellaun"
"853","E31238010000000000000033032084135","Nordex Energy GmbH","N117/2400",2400,"23.01.2015",7140503,"50,108974","7,324647",141,117,714003010,56290,"Beltheim",2400,"2015-01-23",NA,10003764,5554163,7140,"Rhein-Hundsrück",2314.23458333333,5554,714003,"Kastellaun"
"854","E31238010000000000000033032084136",NA,NA,2400,"05.11.2014",7140503,"50,109348","7,331292",141,117,714003010,56290,"Beltheim",2400,"2014-11-05","11YR00000003039P",10003764,5554163,7140,"Rhein-Hundsrück",2314.23458333333,5554,714003,"Kastellaun"
"855","E31238010000000000000033032084137","Nordex Energy GmbH",NA,2400,"22.01.2015",7140503,"50,10279","7,324933",141,117,714003010,56290,"Beltheim",2400,"2015-01-22",NA,10003764,5554163,7140,"Rhein-Hundsrück",2314.23458333333,5554,714003,"Kastellaun"
"856","E31238010000000000000033166679160","Nordex SE","N117/2400",2400,"21.06.2016",7133051,"49,726317","7,599801",140.6,116.8,713310057,55568,"Lauschied",2400,"2016-06-21",NA,10003764,5430154,7133,"Bad Kreuznach",2262.56416666667,5430,713310,"Nahe Glan"
"857","E31238010000000000000033166679161","Nordex SE","N117/2400",2400,"29.06.2016",7133051,"49,727984","7,594106",140.6,116.8,713310057,55568,"Lauschied",2400,"2016-06-29",NA,10003764,5430154,7133,"Bad Kreuznach",2262.56416666667,5430,713310,"Nahe Glan"
"858","E31238010000000000000033333324829","Vestas Deutschland GmbH","V112",3075,"06.11.2014",7140131,"50,07958","7,472659",140,112,714003131,56288,"Roth",3075,"2014-11-06","11YR00000003039P",10003764,6829221,7140,"Rhein-Hundsrück",2220.88487804878,6829,714003,"Kastellaun"
"859","E31238010000000000000033333326371","Vestas Deutschland GmbH","V112",3075,"31.10.2014",7140131,"50,078615","7,466987",140,112,714003131,56288,"Roth",3075,"2014-10-31","11YR00000003039P",10003764,6829221,7140,"Rhein-Hundsrück",2220.88487804878,6829,714003,"Kastellaun"
"860","E31238010000000000000034694384309","Vestas Deutschland GmbH","V90 MK 8 GridStream",2000,"20.11.2014",7233237,"50,366779","6,412268",125,90,723306237,54611,"Scheid",2000,"2014-11-20","11YR00000003039P",10003764,4054007,7233,"Vulkaneifel",2027.0035,4054,723306,"Geroldstein"
"862","E31238010000000000000035299200234","GE Wind Energy GmbH","GE 2.5-120",2530,"16.08.2014",7336061,"49,679706","7,602055",139,120,733608061,67744,"Medard",2530,"2014-08-16","11YR00000003039P",10003764,6161015,7336,"Kusel",2435.1837944664,6161,733608,"Lauterecken-Wolfstein"
"863","E31238010000000000000035299258706","GE Wind Energy GmbH","GE 2.5-120",2530,"15.08.2014",7336061,"49,676793","7,595527",139,120,733608061,67744,"Medard",2530,"2014-08-15","11YR00000003039P",10003764,6161015,7336,"Kusel",2435.1837944664,6161,733608,"Lauterecken-Wolfstein"
"865","E31238010000000000000036444501321","Südwind Borsig Energy GmbH","70026",1500,"20.06.2001",7140084,"50,130569","7,587522",60,70,714009110,56291,"Norath",1500,"2001-06-20","11YR00000003039P",10003764,1672424,7140,"Rhein-Hundsrück",1114.94933333333,1672,714009,"Hundsrück-Mittelrhein"
"866","E31238010000000000000036447701507","Nordex Energy GmbH","S70",1500,"19.06.2001",7140084,"50,132128","7,590078",65,70,714009110,56291,"Norath",1500,"2001-06-19","11YR00000003039P",10003764,1944445,7140,"Rhein-Hundsrück",1296.29666666667,1944,714009,"Hundsrück-Mittelrhein"
"867","E31238010000000000000036721381801","GE Wind Energy GmbH","GE2,5-120",2500,"29.07.2014",7331024,"49,68085","8,200499",139,120,733107036,67598,"Gundersheim",2530,"2014-07-28","11YR00000003039P",10003764,6123855,7331,"Alzey-Worms",2420.49604743083,6124,733107,"Wonnegau"
"868","E31238010000000000000036721394753","GE Wind Energy GmbH","GE 2,5-120",2500,"23.07.2014",7331024,"49,677332","8,19382",139,120,733107036,67598,"Gundersheim",2530,"2014-07-21","11YR00000003039P",10003764,6123855,7331,"Alzey-Worms",2420.49604743083,6124,733107,"Wonnegau"
"869","E31238010000000000000036721394754","GE Wind Energy GmbH","GE 2,5-120",2500,"23.07.2014",7331024,"49,676658","8,199043",139,120,733107036,67598,"Gundersheim",2530,"2014-07-21","11YR00000003039P",10003764,6123855,7331,"Alzey-Worms",2420.49604743083,6124,733107,"Wonnegau"
"870","E31238010000000000000036721395990","GE Wind Energy GmbH","GE 2,5-120",2500,"11.07.2014",7331009,"49,680316","8,206468",139,120,733107036,67598,"Gundersheim",2530,"2014-07-09","11YR00000003039P",10003764,6123855,7331,"Alzey-Worms",2420.49604743083,6124,733107,"Wonnegau"
"871","E31238010000000000000036721395991","GE Wind Energy GmbH","GE 2,5-120",2530,"31.07.2014",7331024,"49,68074","8,193639",139,120,733107036,67598,"Gundersheim",2530,"2014-07-30","11YR00000003039P",10003764,6123855,7331,"Alzey-Worms",2420.49604743083,6124,733107,"Wonnegau"
"872","E31238010000000000000036721395992","GE Wind Energy GmbH","GE 2,5-120",2500,"16.07.2014",7331009,"49,677269","8,206754",139,120,733107036,67598,"Gundersheim",2530,"2014-07-15","11YR00000003039P",10003764,6123855,7331,"Alzey-Worms",2420.49604743083,6124,733107,"Wonnegau"
"873","E31238010000000000000036802801443","Südwind Borsig Energy GmbH","Südwind S70",1500,"19.06.2001",7140084,"50,1327","7,5915",65,70,714009110,56291,"Norath",1500,"2001-06-19","11YR00000003039P",10003764,1560385,7140,"Rhein-Hundsrück",1040.25666666667,1560,714009,"Hundsrück-Mittelrhein"
"874","E31238010000000000000036889601506","GE Wind Energy GmbH","GE 1.5s",1500,"26.07.2001",7133024,"49,708969","7,63143",65,70,713310024,55592,"Desloch",1500,"2001-07-26","11YR00000003039P",10003764,1497411,7133,"Bad Kreuznach",998.274,1497,713310,"Nahe Glan"
"875","E31238010000000000000036889621300","GE Wind Energy GmbH","GE 1.5s",1500,"01.08.2001",7133024,"49,709377","7,62458",65,70,713310024,55592,"Desloch",1500,"2001-08-01","11YR00000003039P",10003764,1497411,7133,"Bad Kreuznach",998.274,1497,713310,"Nahe Glan"
"876","E31238010000000000000037106001302","Nordex Energy GmbH","N80",2500,"24.09.2001",7232120,"50,046816","6,516792",80,80,723200018,54634,"Bitburg",2500,"2001-09-24","11YR00000003039P",10003764,1417195,7232,"Eifelkreis Bitburg-Prüm",566.878,1417,723200,"vfr Eifelkreis Bitburg-Prüm"
"877","E31238010000000000000037106008008","Nordex Energy GmbH","N80",2500,"11.09.2001",7232120,"50,05096","6,525241",80,80,723208120,54636,"Sefferweich",2500,"2001-09-11","11YR00000003039P",10003764,1416769,7232,"Eifelkreis Bitburg-Prüm",566.7076,1417,723208,"Bitburger Land"
"878","E31238010000000000000037106008010","Nordex Energy GmbH","N80",2500,"20.09.2001",7232120,"50,046344","6,521711",80,80,723200018,54634,"Bitburg",2500,"2001-09-20","11YR00000003039P",10003764,1416769,7232,"Eifelkreis Bitburg-Prüm",566.7076,1417,723200,"vfr Eifelkreis Bitburg-Prüm"
"883","E31238010000000000000037435291689","Nordex Energy GmbH","Nordex N117",2400,"23.11.2015",7140503,"50,094542","7,36086",141,117,714003503,56290,"MÃ¶rsdorf",2400,"2015-11-23",NA,10003764,6068461,7140,"Rhein-Hundsrück",2528.52541666667,6068,714003,"Kastellaun"
"884","E31238010000000000000037435291690","Nordex Energy GmbH","Nordex N117",2400,"23.11.2015",7140503,"50,088092","7,352511",141,117,714003503,56290,"MÃ¶rsdorf",2400,"2015-11-23",NA,10003764,6068461,7140,"Rhein-Hundsrück",2528.52541666667,6068,714003,"Kastellaun"
"885","E31238010000000000000037435291691","Nordex Energy GmbH","Nordex N117",2400,"24.11.2015",7140503,"50,099252","7,369551",141,117,714003503,56290,"MÃ¶rsdorf",2400,"2015-11-24",NA,10003764,6068461,7140,"Rhein-Hundsrück",2528.52541666667,6068,714003,"Kastellaun"
"887","E31238010000000000000038070590875","ENERCON GmbH","E82",2300,"24.07.2015",7232231,"50,16766","6,242885",138,82,723206231,54597,"Habscheid",2300,"2015-07-24",NA,10003764,4981752,7232,"Eifelkreis Bitburg-Prüm",2165.97913043478,4982,723206,"Prüm"
"888","E31238010000000000000038070594730","ENERCON GmbH","E 82",2300,"16.10.2014",7232231,"50,17042","6,247182",138,82,723206231,54597,"Habscheid",2300,"2014-10-16","11YR00000003039P",10003764,4981752,7232,"Eifelkreis Bitburg-Prüm",2165.97913043478,4982,723206,"Prüm"
"889","E31238010000000000000038233790237","ENERCON GmbH","E-82 E2",2300,"05.12.2014",7232077,"49,881276","6,519976",138.38,82,723208077,54636,"Meckel",2300,"2014-12-05","11YR00000003039P",10003764,4172844,7232,"Eifelkreis Bitburg-Prüm",1814.28,4173,723208,"Bitburger Land"
"914","E31238010000000000000039857811484","ENERCON GmbH","E-58/10.58",1000,"23.11.2001",7232226,"50,21628","6,483001",73,58,723206226,54595,"Weinsheim",1000,"2001-11-23","11YR00000003039P",10003764,1403576,7232,"Eifelkreis Bitburg-Prüm",1403.576,1404,723206,"Prüm"
"915","E31238010000000000000039857811485","ENERCON GmbH","E-58/10.58",1000,"11.03.2002",7232300,"50,213095","6,473026",73,58,723206226,54595,"Weinsheim",1000,"2002-03-11","11YR00000003039P",10003764,1403576,7232,"Eifelkreis Bitburg-Prüm",1403.576,1404,723206,"Prüm"
"916","E31238010000000000000039857820597","ENERCON GmbH","E-66/18.70-3",1800,"08.03.2002",7232300,"50,210753","6,474545",98,70,723206226,54595,"Weinsheim",1800,"2002-03-08","11YR00000003039P",10003764,2363762,7232,"Eifelkreis Bitburg-Prüm",1313.20111111111,2364,723206,"Prüm"
"917","E31238010000000000000040056000033","ENERCON GmbH","E40/6.44",600,"10.12.2001",7232250,"50,2806","6,4859",65,44,723206250,54597,"Kleinlangenfeld",600,"2001-12-10","11YR00000003039P",10003764,789602,7232,"Eifelkreis Bitburg-Prüm",1316.00333333333,790,723206,"Prüm"
"921","E31238010000000000000040482109118","Vestas Deutschland GmbH","Vestas V 47 - 660/200 kW",660,"05.12.2001",7131211,"50,40571","7,17005",65,47,713704093,56745,"Rieden",660,"2001-12-05","11YR00000003039P",10003764,871954,7137,"Mayen-Koblenz",1321.14242424242,872,713704,"Mendig"
"922","E31238010000000000000040482118052","Vestas Deutschland GmbH","Vestas V 47 - 660/200 kW",660,"07.12.2001",7131211,"50,409069","7,176052",65,47,713704093,56745,"Rieden",660,"2001-12-07","11YR00000003039P",10003764,871954,7137,"Mayen-Koblenz",1321.14242424242,872,713704,"Mendig"
"923","E31238010000000000000040482118053","Vestas Deutschland GmbH","Vestas V 47 - 660/200 kW",660,"12.12.2001",7137049,"50,409683","7,178616",65,47,713704093,56745,"Rieden",660,"2001-12-12","11YR00000003039P",10003764,871954,7137,"Mayen-Koblenz",1321.14242424242,872,713704,"Mendig"
"924","E31238010000000000000040482118054","Vestas Deutschland GmbH","Vestas V 47 - 660/200 kW",660,"13.12.2001",7137049,"50,406866","7,176266",65,47,713704093,56745,"Rieden",660,"2001-12-13","11YR00000003039P",10003764,871954,7137,"Mayen-Koblenz",1321.14242424242,872,713704,"Mendig"
"926","E31238010000000000000041314206859","ENERCON GmbH","E-82E2/2.3MW",2350,"03.02.2016",7233214,"50,339457","6,423745",138,82,723306214,54611,"Hallschlag",2350,"2016-02-03",NA,10003764,5398089,7233,"Vulkaneifel",2297.05914893617,5398,723306,"Geroldstein"
"927","E31238010000000000000041391801422","Fuhrländer AG","MD70",1500,"28.03.2002",7140058,"50,052528","7,547417",85,77,714008002,55469,"Altweidelbach",1500,"2002-03-28","11YR00000003039P",10003764,1641405,7140,"Rhein-Hundsrück",1094.27,1641,714008,"Simmern-Rheinböllen"
"928","E31238010000000000000041391801423","Fuhrländer AG","MD 1000",1000,"21.03.2002",7140058,"50,050278","7,547222",70,54,714008002,55469,"Altweidelbach",1000,"2002-03-21","11YR00000003039P",10003764,1094272,7140,"Rhein-Hundsrück",1094.272,1094,714008,"Simmern-Rheinböllen"
"929","E31238010000000000000041391810142","Fuhrländer AG","MD70",1500,"11.04.2002",7140058,"50,0515","7,549444",85,77,714008002,55469,"Altweidelbach",1500,"2002-04-11","11YR00000003039P",10003764,1641405,7140,"Rhein-Hundsrück",1094.27,1641,714008,"Simmern-Rheinböllen"
"930","E31238010000000000000041397901547","DeWind GmbH","D6",1250,"21.01.2002",7233037,"50,264167","6,898333",91.5,62,723304037,54552,"Katzwinkel",1250,"2002-01-21","11YR00000003039P",10003764,1598922,7233,"Vulkaneifel",1279.1376,1599,723304,"Kelberg"
"931","E31238010000000000000041397917079","DeWind GmbH","D6",1250,"21.01.2002",7233003,"50,256944","6,907222",91.5,62,723304003,54552,"Beinhausen",1250,"2002-01-21","11YR00000003039P",10003764,1598922,7233,"Vulkaneifel",1279.1376,1599,723304,"Kelberg"
"932","E31238010000000000000042338300055",NA,NA,1250,"22.05.2002",7232069,"49,899722","6,298611",NA,NA,723205069,54675,"Kruchten",1250,"2002-05-22","11YR00000003039P",10003764,1318773,7232,"Eifelkreis Bitburg-Prüm",1055.0184,1319,723205,"Südeifel"
"934","E31238010000000000000042634490878","Vestas Deutschland GmbH","V126",3300,"15.06.2016",7133009,"49,435271","7,345533",137,126,713310024,55592,"Desloch",3300,"2016-06-15",NA,10003764,6851171,7133,"Bad Kreuznach",2076.11242424242,6851,713310,"Nahe Glan"
"935","E31238010000000000000042634490879","Vestas Deutschland GmbH","V126",3300,"13.06.2016",7133009,"49,435174","7,351712",137,126,713310024,55592,"Desloch",3300,"2016-06-13",NA,10003764,6851171,7133,"Bad Kreuznach",2076.11242424242,6851,713310,"Nahe Glan"
"936","E31238010000000000000042663209086","Südwind Borsig Energy GmbH","MD-70",1500,"14.06.2002",7233030,"50,239936","6,769625",85,77,723301030,54570,"Hinterweiler",1500,"2002-06-14","11YR00000003039P",10003764,2901437,7233,"Vulkaneifel",1934.29133333333,2901,723301,"Daun"
"939","E31238010000000000000042679611481","ENERCON GmbH","E-40/6.44 E2",600,"05.06.2002",7232258,"50,077478","6,330202",44,43.7,723201258,54649,"Lauperath",600,"2002-06-06","11YR00000003039P",10003764,902709,7232,"Eifelkreis Bitburg-Prüm",1504.515,903,723201,"Arzfeld"
"940","E31238010000000000000042978184374","Nordex Energy GmbH","N131",3000,"22.04.2016",7140502,"50,116184","7,36671",134,131,714003502,56288,"Lahr",3000,"2016-04-22",NA,10003764,6957537,7140,"Rhein-Hundsrück",2319.179,6958,714003,"Kastellaun"
"942","E31238010000000000000043151618058","Enron Wind GmbH","GE 1,5sl",1500,"27.06.2002",7233075,"50,238897","6,826161",85,77,723301039,54570,"Kirchweiler",1500,"2002-06-27","11YR00000003039P",10003764,2450069,7233,"Vulkaneifel",1633.37933333333,2450,723301,"Daun"
"943","E31238010000000000000043202822365","GE Renewable Germany GmbH","GE 1,5",1500,"02.07.2002",7140145,"49,953811","7,37215",85,77,714004145,55487,"Sohren",1500,"2002-07-02","11YR00000003039P",10003764,1662217,7140,"Rhein-Hundsrück",1108.14466666667,1662,714004,"Kirchberg (Hunsrück)"
"944","E31238010000000000000043202822366","GE Renewable Germany GmbH","GE 1,5",1500,"04.07.2002",7140145,"49,955302","7,370707",85,77,714004145,55487,"Sohren",1500,"2002-07-04","11YR00000003039P",10003764,1662217,7140,"Rhein-Hundsrück",1108.14466666667,1662,714004,"Kirchberg (Hunsrück)"
"945","E31238010000000000000043202822367","GE Renewable Germany GmbH","GE 1,5",1500,"10.07.2002",7140145,"49,957166","7,368819",85,77,714004145,55487,"Sohren",1500,"2002-07-10","11YR00000003039P",10003764,1662217,7140,"Rhein-Hundsrück",1108.14466666667,1662,714004,"Kirchberg (Hunsrück)"
"946","E31238010000000000000043202822368","GE Renewable Germany GmbH","GE 1,5",1500,"28.06.2002",7140145,"49,95778","7,365311",85,77,714004145,55487,"Sohren",1500,"2002-06-28","11YR00000003039P",10003764,1662217,7140,"Rhein-Hundsrück",1108.14466666667,1662,714004,"Kirchberg (Hunsrück)"
"947","E31238010000000000000043202838857","GE Renewable Germany GmbH","GE 1,5",1500,"27.06.2002",7140145,"49,955166","7,36306",85,77,714004145,55487,"Sohren",1500,"2002-06-27","11YR00000003039P",10003764,1662217,7140,"Rhein-Hundsrück",1108.14466666667,1662,714004,"Kirchberg (Hunsrück)"
"949","E31238010000000000000044433301513","Vestas Deutschland GmbH","V52",850,"04.09.2002",7133057,"49,727633","7,587917",74,52,713310057,55568,"Lauschied",850,"2002-09-04","11YR00000003039P",10003764,852820,7133,"Bad Kreuznach",1003.31764705882,853,713310,"Nahe Glan"
"950","E31238010000000000000044433322370","Vestas Deutschland GmbH","V52",850,"09.09.2002",7133057,"49,72927","7,600934",74,52,713310057,55568,"Lauschied",850,"2002-09-09","11YR00000003039P",10003764,852820,7133,"Bad Kreuznach",1003.31764705882,853,713310,"Nahe Glan"
"951","E31238010000000000000044433322371","Vestas Deutschland GmbH","V52",850,"04.09.2002",7133057,"49,729509","7,593556",74,52,713310057,55568,"Lauschied",850,"2002-09-04","11YR00000003039P",10003764,852820,7133,"Bad Kreuznach",1003.31764705882,853,713310,"Nahe Glan"
"952","E31238010000000000000044523800085","Nordex Energy GmbH","S70",1500,"25.09.2002",7235047,"49,691152","6,89954",85,70,723501047,54421,"Hinzert-PÃ¶lert",1500,"2002-11-01","11YR00000003039P",10003764,1786683,7235,"Trier-Saarburg",1191.122,1787,723501,"Hermeskeil"
"953","E31238010000000000000044523818895","Nordex Energy GmbH","S70",1500,"25.09.2002",7235047,"49,693306","6,896874",85,70,723501047,54421,"Hinzert-PÃ¶lert",1500,"2002-11-01","11YR00000003039P",10003764,1786683,7235,"Trier-Saarburg",1191.122,1787,723501,"Hermeskeil"
"954","E31238010000000000000044523818896","Nordex Energy GmbH","S70",1500,"24.09.2002",7235047,"49,691152","6,902226",85,70,723501047,54421,"Hinzert-PÃ¶lert",1500,"2002-11-01","11YR00000003039P",10003764,1786683,7235,"Trier-Saarburg",1191.122,1787,723501,"Hermeskeil"
"955","E31238010000000000000044523818897","Nordex Energy GmbH","S70",1500,"26.09.2002",7235047,"49,694662","6,900628",85,70,723501047,54421,"Hinzert-PÃ¶lert",1500,"2002-11-01","11YR00000003039P",10003764,1786683,7235,"Trier-Saarburg",1191.122,1787,723501,"Hermeskeil"
"959","E31238010000000000000044872517907","Nordex Energy GmbH","S70",1500,"15.10.2002",7235045,"49,684644","6,907732",85,70,723501114,54421,"Reinsfeld",1500,"2002-10-15","11YR00000003039P",10003764,1434761,7235,"Trier-Saarburg",956.507333333333,1435,723501,"Hermeskeil"
"960","E31238010000000000000044872518891","Nordex Energy GmbH","S70",1500,"16.10.2002",7235045,"49,682294","6,911554",85,70,723501114,54421,"Reinsfeld",1500,"2002-10-16","11YR00000003039P",10003764,1434761,7235,"Trier-Saarburg",956.507333333333,1435,723501,"Hermeskeil"
"961","E31238010000000000000044872518892","Nordex Energy GmbH","S70",1500,"17.10.2002",7235045,"49,682013","6,91536",85,70,723501114,54421,"Reinsfeld",1500,"2002-11-01","11YR00000003039P",10003764,1434761,7235,"Trier-Saarburg",956.507333333333,1435,723501,"Hermeskeil"
"962","E31238010000000000000044872518893","Nordex Energy GmbH","S70",1500,"16.10.2002",7235045,"49,684727","6,91433",85,70,723501114,54421,"Reinsfeld",1500,"2002-10-16","11YR00000003039P",10003764,1434761,7235,"Trier-Saarburg",956.507333333333,1435,723501,"Hermeskeil"
"963","E31238010000000000000044872518894","Nordex Energy GmbH","S70",1500,"22.10.2002",7235045,"49,685502","6,910769",85,70,723501114,54421,"Reinsfeld",1500,"2002-11-01","11YR00000003039P",10003764,1434761,7235,"Trier-Saarburg",956.507333333333,1435,723501,"Hermeskeil"
"964","E31238010000000000000045112601194","ENERCON GmbH","E - 44",600,"17.10.2002",7235141,"49,748192","6,776861",78,44,723504141,54320,"Waldrach",600,"2002-10-01","11YR00000003039P",10003764,984024,7235,"Trier-Saarburg",1640.04,984,723504,"Ruwer"
"965","E31238010000000000000045112614240","ENERCON GmbH","E - 44",600,"18.10.2002",7235141,"49,744992","6,779782",78,44,723504141,54320,"Waldrach",600,"2002-10-01","11YR00000003039P",10003764,984024,7235,"Trier-Saarburg",1640.04,984,723504,"Ruwer"
"966","E31238010000000000000045112618243","ENERCON GmbH","E - 44",600,"14.10.2002",7235141,"49,74329","6,783441",78,44,723504141,54320,"Waldrach",600,"2002-10-01","11YR00000003039P",10003764,984024,7235,"Trier-Saarburg",1640.04,984,723504,"Ruwer"
"967","E31238010000000000000045704800037","Vestas Deutschland GmbH","V-80",2000,"07.11.2002",7231502,"49,827275","7,104657",100,80,723100502,54497,"Morbach",2000,"2002-11-07","11YR00000003039P",10003764,1620882,7231,"Bernkastel-Wittlich",810.441,1621,723100,"vfr Bernkastel-Wittlich"
"970","E31238010000000000000045704818818","Vestas Deutschland GmbH","V80",2000,"06.02.2003",7231087,"49,142675","-3,622044",100,80,723100502,54497,"Morbach",2000,"2002-11-08","11YR00000003039P",10003764,457126,7231,"Bernkastel-Wittlich",228.563,457,723100,"vfr Bernkastel-Wittlich"
"971","E31238010000000000000045704818820","Vestas Deutschland GmbH","V80",2000,"12.02.2003",7231502,"49,834014","7,112609",100,80,723100502,54497,"Morbach",2000,"2003-02-12","11YR00000003039P",10003764,1014974,7231,"Bernkastel-Wittlich",507.487,1015,723100,"vfr Bernkastel-Wittlich"
"972","E31238010000000000000045704818821","Vestas Deutschland GmbH","V80",2000,"11.11.2002",7231502,"49,832603","7,115273",100,80,723100502,54497,"Morbach",2000,"2002-11-10","11YR00000003039P",10003764,1080891,7231,"Bernkastel-Wittlich",540.4455,1081,723100,"vfr Bernkastel-Wittlich"
"973","E31238010000000000000045704818823","Vestas Deutschland GmbH","V-80",2000,"14.03.2003",7231502,"49,835399","7,11998",100,80,723100502,54497,"Morbach",2000,"2003-03-14","11YR00000003039P",10003764,1642095,7231,"Bernkastel-Wittlich",821.0475,1642,723100,"vfr Bernkastel-Wittlich"
"983","E31238010000000000000046572617024","ENERCON GmbH","E-58/10.58",1000,"20.12.2002",7143253,"50,7047","7,9463",89,52.9,713203036,57520,"Friedewald",1000,"2002-12-17","11YR00000003039P",10003764,2434047,7132,"Altenkirchen",2434.047,2434,713203,"Daaden-Herdorf"
"984","E31238010000000000000046594100038","ENERCON GmbH","E40  6.44",600,"20.12.2002",7232056,"50,018301","6,248464",78,44,723205056,54673,"HÃ¼tten",600,"2002-12-20","11YR00000003039P",10003764,1019758,7232,"Eifelkreis Bitburg-Prüm",1699.59666666667,1020,723205,"Südeifel"
"985","E31238010000000000000046621201359","ENERCON GmbH","ENERCON-58/10.58",1000,"19.12.2002",7235137,"49,777852","6,566256",70.5,58.6,723507137,54311,"Trierweiler",1000,"2002-12-19","11YR00000003039P",10003764,1662899,7235,"Trier-Saarburg",1662.899,1663,723507,"Trier-Land"
"987","E31238010000000000000047990201327","ENERCON GmbH","E-66/18.70-2",1800,"19.03.2003",7232201,"50,101575","6,296611",86,70,723201260,54619,"Lichtenborn",1800,"2003-03-19","11YR00000003039P",10003764,2607508,7232,"Eifelkreis Bitburg-Prüm",1448.61555555556,2608,723201,"Arzfeld"
"988","E31238010000000000000047990301233","Fuhrländer AG","FL MD 77",1500,"28.12.2003",7232201,"50,112961","6,304454",100,77,723201260,54619,"Lichtenborn",1500,"2003-12-28","11YR00000003039P",10003764,2589450,7232,"Eifelkreis Bitburg-Prüm",1726.3,2589,723201,"Arzfeld"
"989","E31238010000000000000047990318671","Fuhrländer AG","FL MD 77",1500,"31.12.2003",7232201,"50,111736","6,307201",100,77,723201201,54687,"Arzfeld",1500,"2003-12-31","11YR00000003039P",10003764,2589450,7232,"Eifelkreis Bitburg-Prüm",1726.3,2589,723201,"Arzfeld"
"992","E31238010000000000000050236400025","Vestas Deutschland GmbH","V80",2000,"15.07.2003",7233048,"50,26496","6,89335",100,80,723304003,54552,"Beinhausen",2000,"2003-07-15","11YR00000003039P",10003764,2889320,7233,"Vulkaneifel",1444.66,2889,723304,"Kelberg"
"993","E31238010000000000000050236418040","Vestas Deutschland GmbH","V80",2000,"07.08.2003",7233003,"50,264332","6,901234",100,80,723304048,54552,"Neichen",2000,"2003-08-07","11YR00000003039P",10003764,2889320,7233,"Vulkaneifel",1444.66,2889,723304,"Kelberg"
"994","E31238010000000000000050272000030","ENERCON GmbH","E66",1800,"16.10.2003",7232292,"50,174399","6,3269",98,70,723206292,54595,"Pittenbach",1800,"2003-10-16","11YR00000003039P",10003764,2116266,7232,"Eifelkreis Bitburg-Prüm",1175.70333333333,2116,723206,"Prüm"
"995","E31238010000000000000050272011489","ENERCON GmbH","E58",1000,"30.07.2003",7232292,"50,171813","6,325573",89,58,723206292,54595,"Pittenbach",1000,"2003-07-30","11YR00000003039P",10003764,1175705,7232,"Eifelkreis Bitburg-Prüm",1175.705,1176,723206,"Prüm"
"996","E31238010000000000000051980701032","ENERCON GmbH","E40/6.44",600,"23.10.2003",7232284,"50,160591","6,413087",78,44,723206284,54614,"Oberlauch",600,"2003-10-23","11YR00000003039P",10003764,954244,7232,"Eifelkreis Bitburg-Prüm",1590.40666666667,954,723206,"Prüm"
"997","E31238010000000000000052080300684","ENERCON GmbH","E-66/18.70-3",1800,"21.03.2003",7232201,"50,100102","6,298855",86,70,723201201,54687,"Arzfeld",1800,"2003-03-21","11YR00000003039P",10003764,2489980,7232,"Eifelkreis Bitburg-Prüm",1383.32222222222,2490,723201,"Arzfeld"
"998","E31238010000000000000052080300685","ENERCON GmbH","E-66/18.70-3",1800,"11.06.2003",7232264,"50,095499","6,305912",98,70,723201201,54687,"Arzfeld",1800,"2003-06-11","11YR00000003039P",10003764,2593715,7232,"Eifelkreis Bitburg-Prüm",1440.95277777778,2594,723201,"Arzfeld"
"999","E31238010000000000000052080300686","ENERCON GmbH","E-66/18.70-3",1800,"07.11.2003",7232264,"50,089499","6,307146",98,70,723201201,54687,"Arzfeld",1800,"2003-11-07","11YR00000003039P",10003764,2593715,7232,"Eifelkreis Bitburg-Prüm",1440.95277777778,2594,723201,"Arzfeld"
"1000","E31238010000000000000052080301988","ENERCON GmbH","E-53 800 kW",800,"21.03.2011",7232258,"50,085399","6,303864",73,53,723201201,54687,"Arzfeld",800,"2011-03-21","11YR00000003039P",10003764,1342729,7232,"Eifelkreis Bitburg-Prüm",1678.41125,1343,723201,"Arzfeld"
"1001","E31238010000000000000052080301990","ENERCON GmbH","E-82E2/2.3MW",2300,"20.09.2011",7232201,"50,086801","6,293686",138,82,723201201,54687,"Arzfeld",2300,"2011-09-20","11YR00000003039P",10003764,4104394,7232,"Eifelkreis Bitburg-Prüm",1784.51913043478,4104,723201,"Arzfeld"
"1002","E31238010000000000000052080320622","ENERCON GmbH","E-66/18.70-3",1800,"26.07.2004",7232201,"50,088297","6,299383",98,70,723201201,54687,"Arzfeld",1800,"2004-07-26","11YR00000003039P",10003764,2593715,7232,"Eifelkreis Bitburg-Prüm",1440.95277777778,2594,723201,"Arzfeld"
"1003","E31238010000000000000052080320626","ENERCON GmbH","E-66/18.70-3",1800,"14.11.2003",7232201,"50,085704","6,300624",98,70,723201201,54687,"Arzfeld",1800,"2003-11-14","11YR00000003039P",10003764,2593715,7232,"Eifelkreis Bitburg-Prüm",1440.95277777778,2594,723201,"Arzfeld"
"1004","E31238010000000000000052080320627","ENERCON GmbH","E-66/18.70-3",1800,"17.11.2003",7232201,"50,085501","6,295704",98,70,723201201,54687,"Arzfeld",1800,"2003-11-17","11YR00000003039P",10003764,2593715,7232,"Eifelkreis Bitburg-Prüm",1440.95277777778,2594,723201,"Arzfeld"
"1005","E31238010000000000000052080320628","ENERCON GmbH","E-66/18.70-3",1800,"19.11.2003",7232201,"50,083197","6,296794",98,70,723201201,54687,"Arzfeld",1800,"2003-11-19","11YR00000003039P",10003764,2593715,7232,"Eifelkreis Bitburg-Prüm",1440.95277777778,2594,723201,"Arzfeld"
"1006","E31238010000000000000052080320629","ENERCON GmbH","E-66/18.70",1800,"29.07.2004",7232201,"50,083609","6,290965",114,70,723201201,54687,"Arzfeld",1800,"2004-07-29","11YR00000003039P",10003764,2723350,7232,"Eifelkreis Bitburg-Prüm",1512.97222222222,2723,723201,"Arzfeld"
"1007","E31238010000000000000052582251969","Nordex SE","N117/2400 PH141",2400,"05.09.2017",7231006,"49,776099","6,968023",140.6,116.8,723106006,54426,"Berglicht",2400,"2017-09-05",NA,10003764,6287325,7231,"Bernkastel-Wittlich",2619.71875,6287,723106,"Thalfang am Erbeskopf"
"1013","E31238010000000000000053249301550","ENERCON GmbH","E-58",1000,"12.11.2003",7233232,"50,340169","6,441389",70,58,723306232,54597,"Ormont",1000,"2003-11-12","11YR00000003039P",10003764,1028982,7233,"Vulkaneifel",1028.982,1029,723306,"Geroldstein"
"1014","E31238010000000000000053249318044","ENERCON GmbH","E-58",1000,"12.11.2003",7233232,"50,343302","6,439071",70,58,723306232,54597,"Ormont",1000,"2003-11-12","11YR00000003039P",10003764,1028982,7233,"Vulkaneifel",1028.982,1029,723306,"Geroldstein"
"1018","E31238010000000000000054522000390","ENERCON GmbH","E-66/18.70",1800,"13.03.2004",7232128,"50,050387","6,322693",85,70,723205128,54673,"Uppershausen",1800,"2004-03-13","11YR00000003039P",10003764,3057470,7232,"Eifelkreis Bitburg-Prüm",1698.59444444444,3057,723205,"Südeifel"
"1023","E31238010000000000000055084501543","ENERCON GmbH","E66-18.70",1800,"23.12.2003",7232305,"50,218767","6,519803",86,70,723206226,54595,"Weinsheim",1800,"2003-12-23","11YR00000003039P",10003764,2718529,7232,"Eifelkreis Bitburg-Prüm",1510.29388888889,2719,723206,"Prüm"
"1024","E31238010000000000000055084518903","ENERCON GmbH","E66-18.70",1800,"30.03.2003",7232223,"50,218234","6,516267",86,70,723206226,54595,"Weinsheim",1800,"2004-03-30","11YR00000003039P",10003764,2722145,7232,"Eifelkreis Bitburg-Prüm",1512.30277777778,2722,723206,"Prüm"
"1025","E31238010000000000000055084518905","ENERCON GmbH","E82",2300,"27.07.2012",7232223,"50,217692","6,508723",84,82,723206226,54595,"Weinsheim",2300,"2012-07-27","11YR00000003039P",10003764,3910350,7232,"Eifelkreis Bitburg-Prüm",1700.15217391304,3910,723206,"Prüm"
"1026","E31238010000000000000055549227987","Nordex SE","S-77",1500,"11.05.2005",7232302,"50,318722","6,412223",85,77,723206302,54597,"Roth",1500,"2005-05-11","11YR00000003039P",10003764,2385455,7232,"Eifelkreis Bitburg-Prüm",1590.30333333333,2385,723206,"Prüm"
"1027","E31238010000000000000055549250890","Nordex SE","S-77",1500,"11.05.2005",7232302,"50,320529","6,417279",85,77,723206302,54597,"Roth",1500,"2005-05-11","11YR00000003039P",10003764,2385455,7232,"Eifelkreis Bitburg-Prüm",1590.30333333333,2385,723206,"Prüm"
"1028","E31238010000000000000055549250891","Nordex SE","S-77",1500,"26.05.2005",7232302,"50,321589","6,397124",85,77,723206302,54597,"Roth",1500,"2005-05-26","11YR00000003039P",10003764,2385455,7232,"Eifelkreis Bitburg-Prüm",1590.30333333333,2385,723206,"Prüm"
"1029","E31238010000000000000055549250892","Nordex SE","S-77",1500,"01.06.2005",7232302,"50,320783","6,393495",85,77,723206302,54597,"Roth",1500,"2005-06-01","11YR00000003039P",10003764,2385455,7232,"Eifelkreis Bitburg-Prüm",1590.30333333333,2385,723206,"Prüm"
"1030","E31238010000000000000055549250893","Nordex SE","S-70",1500,"02.06.2005",7233232,"50,33411","6,463257",65,79,723206302,54597,"Roth",1500,"2005-06-02","11YR00000003039P",10003764,1968466,7232,"Eifelkreis Bitburg-Prüm",1312.31066666667,1968,723206,"Prüm"
"1031","E31238010000000000000055549250894","Nordex SE","S-77",1500,"02.06.2005",7232302,"50,320319","6,389756",85,77,723206302,54597,"Roth",1500,"2005-06-02","11YR00000003039P",10003764,2385455,7232,"Eifelkreis Bitburg-Prüm",1590.30333333333,2385,723206,"Prüm"
"1032","E31238010000000000000055549250895","Nordex SE","S-77",1500,"09.06.2005",7232302,"50,321655","6,382592",85,77,723206302,54597,"Roth",1500,"2005-06-09","11YR00000003039P",10003764,2385455,7232,"Eifelkreis Bitburg-Prüm",1590.30333333333,2385,723206,"Prüm"
"1033","E31238010000000000000055549250896","Nordex SE","S-70",1500,"11.06.2005",7233232,"50,336675","6,466976",65,70,723206302,54597,"Roth",1500,"2005-06-11","11YR00000003039P",10003764,1968466,7232,"Eifelkreis Bitburg-Prüm",1312.31066666667,1968,723206,"Prüm"
"1034","E31238010000000000000055549250897","Nordex SE","S-70",1500,"16.06.2005",7233232,"50,338326","6,465573",65,70,723206302,54597,"Roth",1500,"2005-06-16","11YR00000003039P",10003764,1968466,7232,"Eifelkreis Bitburg-Prüm",1312.31066666667,1968,723206,"Prüm"
"1035","E31238010000000000000055549250898","Nordex SE","S-70",1500,"23.06.2005",7233232,"50,339966","6,462373",65,70,723206302,54597,"Roth",1500,"2005-06-23","11YR00000003039P",10003764,1968466,7232,"Eifelkreis Bitburg-Prüm",1312.31066666667,1968,723206,"Prüm"
"1036","E31238010000000000000055549250899","Nordex SE","S-70",1500,"23.06.2005",7233232,"50,340322","6,46548",65,70,723206302,54597,"Roth",1500,"2005-06-23","11YR00000003039P",10003764,1968466,7232,"Eifelkreis Bitburg-Prüm",1312.31066666667,1968,723206,"Prüm"
"1037","E31238010000000000000055549250900","Nordex SE","S-70",1500,"28.06.2005",7233232,"50,336228","6,464064",65,70,723206302,54597,"Roth",1500,"2005-06-28","11YR00000003039P",10003764,1968466,7232,"Eifelkreis Bitburg-Prüm",1312.31066666667,1968,723206,"Prüm"
"1038","E31238010000000000000055549250901","Nordex SE","S-70",1500,"29.06.2005",7233232,"50,342373","6,467341",65,70,723206302,54597,"Roth",1500,"2005-06-29","11YR00000003039P",10003764,1968466,7232,"Eifelkreis Bitburg-Prüm",1312.31066666667,1968,723206,"Prüm"
"1039","E31238010000000000000055549250903","Nordex SE","S-70",1500,"30.06.2005",7233232,"50,338493","6,468679",65,70,723206302,54597,"Roth",1500,"2005-06-30","11YR00000003039P",10003764,1968466,7232,"Eifelkreis Bitburg-Prüm",1312.31066666667,1968,723206,"Prüm"
"1040","E31238010000000000000055549250904","Nordex SE","S-70",1500,"06.07.2005",7233232,"50,34082","6,469039",65,70,723206302,54597,"Roth",1500,"2005-07-06","11YR00000003039P",10003764,1968466,7232,"Eifelkreis Bitburg-Prüm",1312.31066666667,1968,723206,"Prüm"
"1041","E31238010000000000000055549250905","ENERCON GmbH","E-70",2000,"19.12.2006",7232302,"50,310779","6,365265",114,70,723206302,54597,"Roth",2000,"2006-12-19","11YR00000003039P",10003764,3062834,7232,"Eifelkreis Bitburg-Prüm",1531.417,3063,723206,"Prüm"
"1042","E31238010000000000000055549250907","ENERCON GmbH","E-70",2000,"29.12.2006",7232302,"50,310147","6,369191",65,70,723206302,54597,"Roth",2000,"2006-12-29","11YR00000003039P",10003764,2550837,7232,"Eifelkreis Bitburg-Prüm",1275.4185,2551,723206,"Prüm"
"1043","E31238010000000000000055549250908","ENERCON GmbH","E-70",2000,"21.12.2006",7232302,"50,311932","6,361652",114,70,723206302,54597,"Roth",2000,"2006-12-21","11YR00000003039P",10003764,3062834,7232,"Eifelkreis Bitburg-Prüm",1531.417,3063,723206,"Prüm"
"1044","E31238010000000000000055549250909","ENERCON GmbH","E-70",2000,"27.12.2006",7232302,"50,309119","6,361574",114,70,723206302,54597,"Roth",2000,"2006-12-27","11YR00000003039P",10003764,3062834,7232,"Eifelkreis Bitburg-Prüm",1531.417,3063,723206,"Prüm"
"1045","E31238010000000000000055549250910","Nordex SE","S-77",1500,"18.02.2007",7232302,"50,316179","6,411044",100,77,723206302,54597,"Roth",1500,"2007-02-18","11YR00000003039P",10003764,2501972,7232,"Eifelkreis Bitburg-Prüm",1667.98133333333,2502,723206,"Prüm"
"1046","E31238010000000000000055549250911","Nordex SE","S-77",1500,"10.10.2007",7232302,"50,319867","6,384978",85,77,723206302,54597,"Roth",1500,"2007-10-10","11YR00000003039P",10003764,2385455,7232,"Eifelkreis Bitburg-Prüm",1590.30333333333,2385,723206,"Prüm"
"1047","E31238010000000000000055549250913","Nordex SE","S-77",1500,"11.10.2007",7232302,"50,322062","6,400723",85,77,723206302,54597,"Roth",1500,"2007-10-11","11YR00000003039P",10003764,2385455,7232,"Eifelkreis Bitburg-Prüm",1590.30333333333,2385,723206,"Prüm"
"1048","E31238010000000000000055549250914","Nordex SE","S-77",1500,"17.10.2007",7232302,"50,308273","6,364768",85,77,723206302,54597,"Roth",1500,"2007-10-17","11YR00000003039P",10003764,2385455,7232,"Eifelkreis Bitburg-Prüm",1590.30333333333,2385,723206,"Prüm"
"1049","E31238010000000000000056095100950","Siemens Wind Power GmbH & Co. KG","SWT 2.3",2300,"21.12.2005",7232247,"50,16083","6,232942",90,82,723201221,54597,"Euscheid",2300,"2005-12-21","11YR00000003039P",10003764,2443568,7232,"Eifelkreis Bitburg-Prüm",1062.42086956522,2444,723201,"Arzfeld"
"1050","E31238010000000000000056095101562","Siemens Wind Power GmbH & Co. KG","SWT 1.3",1300,"08.12.2005",7232247,"50,160005","6,245029",90,62,723201221,54597,"Euscheid",1300,"2005-12-08","11YR00000003039P",10003764,1426133,7232,"Eifelkreis Bitburg-Prüm",1097.02538461538,1426,723201,"Arzfeld"
"1051","E31238010000000000000056095101563","Siemens Wind Power GmbH & Co. KG","SWT 2.3",2300,"18.12.2005",7232247,"50,164059","6,231964",90,82,723201221,54597,"Euscheid",2300,"2005-12-18","11YR00000003039P",10003764,2443568,7232,"Eifelkreis Bitburg-Prüm",1062.42086956522,2444,723201,"Arzfeld"
"1052","E31238010000000000000056095150931","Siemens Wind Power GmbH & Co. KG","SWT 2.3",2300,"28.12.2005",7232247,"50,163719","6,235909",90,82,723201221,54597,"Euscheid",2300,"2005-12-28","11YR00000003039P",10003764,2443568,7232,"Eifelkreis Bitburg-Prüm",1062.42086956522,2444,723201,"Arzfeld"
"1053","E31238010000000000000056095150932","Siemens Wind Power GmbH & Co. KG","SWT 1.3",1300,"30.12.2005",7232247,"50,163753","6,241298",90,62,723201221,54597,"Euscheid",1300,"2005-12-30","11YR00000003039P",10003764,1426133,7232,"Eifelkreis Bitburg-Prüm",1097.02538461538,1426,723201,"Arzfeld"
"1054","E31238010000000000000056095150933","Siemens Wind Power GmbH & Co. KG","SWT 2.3",2300,"31.12.2005",7232229,"50,186032","6,213196",93,93,723201221,54597,"Euscheid",2300,"2005-12-31","11YR00000003039P",10003764,2914676,7232,"Eifelkreis Bitburg-Prüm",1267.25043478261,2915,723201,"Arzfeld"
"1055","E31238010000000000000056095150935","Siemens Wind Power GmbH & Co. KG","SWT 2.3",2300,"02.02.2006",7232229,"50,18916","6,22283",93,93,723201221,54597,"Euscheid",2300,"2006-02-02","11YR00000003039P",10003764,2914676,7232,"Eifelkreis Bitburg-Prüm",1267.25043478261,2915,723201,"Arzfeld"
"1056","E31238010000000000000056095150936","Siemens Wind Power GmbH & Co. KG","SWT 2.3",2300,"02.02.2006",7232229,"50,189522","6,216825",93,93,723201221,54597,"Euscheid",2300,"2006-02-02","11YR00000003039P",10003764,2914676,7232,"Eifelkreis Bitburg-Prüm",1267.25043478261,2915,723201,"Arzfeld"
"1057","E31238010000000000000056095150937","Siemens Wind Power GmbH & Co. KG","SWT 2.3",2300,"06.02.2006",7232229,"50,191905","6,221429",93,93,723201221,54597,"Euscheid",2300,"2006-02-06","11YR00000003039P",10003764,2914676,7232,"Eifelkreis Bitburg-Prüm",1267.25043478261,2915,723201,"Arzfeld"
"1058","E31238010000000000000056095150938","Siemens Wind Power GmbH & Co. KG","SWT 2.3",2300,"06.02.2006",7232229,"50,188471","6,211387",93,93,723201221,54597,"Euscheid",2300,"2006-02-06","11YR00000003039P",10003764,2914676,7232,"Eifelkreis Bitburg-Prüm",1267.25043478261,2915,723201,"Arzfeld"
"1059","E31238010000000000000056095150939","Siemens Wind Power GmbH & Co. KG","SWT 2.3",2300,"10.02.2006",7232231,"50,188151","6,246112",103,93,723201221,54597,"Euscheid",2300,"2006-02-10","11YR00000003039P",10003764,3003139,7232,"Eifelkreis Bitburg-Prüm",1305.71260869565,3003,723201,"Arzfeld"
"1060","E31238010000000000000056095150940","Siemens Wind Power GmbH & Co. KG","SWT 2.3",2300,"12.02.2006",7232333,"50,147652","6,261643",103,93,723201221,54597,"Euscheid",2300,"2006-02-12","11YR00000003039P",10003764,3003139,7232,"Eifelkreis Bitburg-Prüm",1305.71260869565,3003,723201,"Arzfeld"
"1061","E31238010000000000000056095150941","Siemens Wind Power GmbH & Co. KG","SWT 2.3",2300,"02.02.2006",7232229,"50,171237","6,239236",90,82,723201221,54597,"Euscheid",2300,"2006-02-02","11YR00000003039P",10003764,2443568,7232,"Eifelkreis Bitburg-Prüm",1062.42086956522,2444,723201,"Arzfeld"
"1062","E31238010000000000000056095150942","Siemens Wind Power GmbH & Co. KG","SWT 2.3",2300,"04.11.2006",7232231,"50,185319","6,246181",103,93,723201221,54597,"Euscheid",2300,"2006-11-04","11YR00000003039P",10003764,3003136,7232,"Eifelkreis Bitburg-Prüm",1305.71130434783,3003,723201,"Arzfeld"
"1063","E31238010000000000000056095150943","Siemens Wind Power GmbH & Co. KG","SWT 2.3",2300,"08.12.2006",7232231,"50,190455","6,249162",103,93,723201221,54597,"Euscheid",2300,"2006-12-08","11YR00000003039P",10003764,3003136,7232,"Eifelkreis Bitburg-Prüm",1305.71130434783,3003,723201,"Arzfeld"
"1065","E31238010000000000000059508601130","GE Wind Energy GmbH","GE1.5sl",1500,"22.12.2004",7235062,"49,570858","6,477665",85,77,723508062,54441,"Kirf",1500,"2004-12-22","11YR00000003039P",10003764,3032203,7235,"Trier-Saarburg",2021.46866666667,3032,723508,"Saarburg-Kell"
"1072","E31238010000000000000060638000677","Vestas Deutschland GmbH","V80",2000,"05.03.2005",7232048,"50,051398","6,474987",100,85,723208048,54636,"Heilenbach",2000,"2005-03-05","11YR00000003039P",10003764,2166963,7232,"Eifelkreis Bitburg-Prüm",1083.4815,2167,723208,"Bitburger Land"
"1073","E31238010000000000000060638009839","Vestas Deutschland GmbH","V80",2000,"01.03.2005",7232048,"50,053553","6,473757",100,85,723208048,54636,"Heilenbach",2000,"2005-03-01","11YR00000003039P",10003764,1697045,7232,"Eifelkreis Bitburg-Prüm",848.5225,1697,723208,"Bitburger Land"
"1074","E31238010000000000000060638014133","Vestas Deutschland GmbH","V80",2000,"03.02.2005",7232048,"50,054268","6,46739",100,85,723208048,54636,"Heilenbach",2000,"2005-02-03","11YR00000003039P",10003764,1511661,7232,"Eifelkreis Bitburg-Prüm",755.8305,1512,723208,"Bitburger Land"
"1075","E31238010000000000000060638018544","Vestas Deutschland GmbH","V80",2000,"31.12.2004",7232048,"50,057373","6,46837",100,85,723208048,54636,"Heilenbach",2000,"2004-12-31","11YR00000003039P",10003764,2051869,7232,"Eifelkreis Bitburg-Prüm",1025.9345,2052,723208,"Bitburger Land"
"1076","E31238010000000000000060638018545","Vestas Deutschland GmbH","V80",2000,"26.01.2005",7232048,"50,055874","6,472498",100,85,723208048,54636,"Heilenbach",2000,"2005-01-26","11YR00000003039P",10003764,1783304,7232,"Eifelkreis Bitburg-Prüm",891.652,1783,723208,"Bitburger Land"
"1077","E31238010000000000000060638018546","Vestas Deutschland GmbH","V80",2000,"31.12.2004",7232048,"50,060706","6,469544",100,85,723208048,54636,"Heilenbach",2000,"2004-12-31","11YR00000003039P",10003764,2162913,7232,"Eifelkreis Bitburg-Prüm",1081.4565,2163,723208,"Bitburger Land"
"1078","E31238010000000000000060638018548","Vestas Deutschland GmbH","V80",2000,"31.12.2004",7232048,"50,064227","6,474845",100,80,723208048,54636,"Heilenbach",2000,"2004-12-31","11YR00000003039P",10003764,1834775,7232,"Eifelkreis Bitburg-Prüm",917.3875,1835,723208,"Bitburger Land"
"1081","E31238010000000000000063819801659","ENERCON GmbH","E-66/18.70",2000,"27.06.2005",7135088,"50,033917","7,277394",114.09,70,713505088,56865,"Walhausen",2000,"2005-06-14","11YR00000003039P",10003764,3007366,7135,"Cochem-Zell",1503.683,3007,713505,"Zell (Mosel)"
"1084","E31238010000000000000066298909657","Nordex Energy GmbH","N 90",2300,"10.09.2005",7231122,"49,770278","6,952778",100,90,723106123,54424,"Thalfang",2300,"2005-09-10","11YR00000003039P",10003764,3637699,7231,"Bernkastel-Wittlich",1581.60826086957,3638,723106,"Thalfang am Erbeskopf"
"1085","E31238010000000000000066298917530","Nordex Energy GmbH","N 90",2300,"23.09.2005",7231122,"49,768056","6,954722",100,90,723106123,54424,"Thalfang",2300,"2005-09-23","11YR00000003039P",10003764,3637699,7231,"Bernkastel-Wittlich",1581.60826086957,3638,723106,"Thalfang am Erbeskopf"
"1086","E31238010000000000000067358518954","ENERCON GmbH","E-40/6.44",600,"20.09.2005",7232021,"49,96434","6,366736",65,44,723208502,54646,"Hisel",600,"2005-09-20","11YR00000003039P",10003764,714423,7232,"Eifelkreis Bitburg-Prüm",1190.705,714,723208,"Bitburger Land"
"1087","E31238010000000000000067358518955","ENERCON GmbH","E-40/6.44",600,"29.09.2005",7232021,"49,96553","6,369426",65,44,723208502,54646,"Hisel",600,"2005-09-29","11YR00000003039P",10003764,714423,7232,"Eifelkreis Bitburg-Prüm",1190.705,714,723208,"Bitburger Land"
"1088","E31238010000000000000067358518956","ENERCON GmbH","E-40/6.44",600,"21.09.2005",7232021,"49,961709","6,363417",65,44,723208502,54646,"Brimingen",600,"2005-09-21","11YR00000003039P",10003764,714423,7232,"Eifelkreis Bitburg-Prüm",1190.705,714,723208,"Bitburger Land"
"1089","E31238010000000000000067358518958","ENERCON GmbH","E-40/6.44",600,"15.09.2005",7232021,"49,963365","6,36201",65,44,723208502,54646,"Brimingen",600,"2005-09-15","11YR00000003039P",10003764,714423,7232,"Eifelkreis Bitburg-Prüm",1190.705,714,723208,"Bitburger Land"
"1090","E31238010000000000000069321501133","Nordex SE","S77",1500,"01.03.2006",7235062,"49,56789","6,476463",85,77,723508062,54441,"Kirf",1500,"2006-02-25","11YR00000003039P",10003764,2564374,7235,"Trier-Saarburg",1709.58266666667,2564,723508,"Saarburg-Kell"
"1091","E31238010000000000000069475809395","REpower Systems SE","MD77",1500,"02.12.2009",7232077,"49,878675","6,522047",NA,77,723507501,54298,"Welschbillig",1500,"2005-12-31","11YR00000003039P",10003764,2080735,7235,"Trier-Saarburg",1387.15666666667,2081,723507,"Trier-Land"
"1092","E31238010000000000000069475821478","REpower Systems SE","MD 77",1500,"29.12.2005",7232077,"49,874112","6,510129",NA,77,723507501,54298,"Welschbillig",1500,"2005-12-29","11YR00000003039P",10003764,2294918,7235,"Trier-Saarburg",1529.94533333333,2295,723507,"Trier-Land"
"1093","E31238010000000000000069475821480","REpower Systems SE","MD77",1500,"30.12.2005",7232065,"49,866194","6,534683",NA,77,723507501,54298,"Welschbillig",1500,"2005-12-30","11YR00000003039P",10003764,2403350,7235,"Trier-Saarburg",1602.23333333333,2403,723507,"Trier-Land"
"1094","E31238010000000000000069475821494",NA,NA,1500,"17.07.2010",7232077,"49,87663","6,511639",NA,NA,723507501,54298,"Welschbillig",1500,"2009-12-02","11YR00000003039P",10003764,2403350,7235,"Trier-Saarburg",1602.23333333333,2403,723507,"Trier-Land"
"1095","E31238010000000000000069475821495","REpower Systems SE","MD77",1500,"13.07.2010",7232077,"49,878343","6,515727",NA,77,723507501,54298,"Welschbillig",1500,"2009-12-09","11YR00000003039P",10003764,2403350,7235,"Trier-Saarburg",1602.23333333333,2403,723507,"Trier-Land"
"1096","E31238010000000000000069475821496","REpower Systems SE","MM 82 Evolution",2000,"09.12.2009",7232065,"49,862289","6,529467",NA,82,723507501,54298,"Welschbillig",2050,"2010-07-17","11YR00000003039P",10003764,2810640,7235,"Trier-Saarburg",1371.04390243902,2811,723507,"Trier-Land"
"1099","E31238010000000000000071074223999","Gamesa Corporación Tecnológica S.A.","Gamesa G80",2000,"16.05.2006",7135093,"50,21482","7,20772",100,80,713502093,56761,"Zettingen",2000,"2006-05-16","11YR00000003039P",10003764,1854903,7135,"Cochem-Zell",927.4515,1855,713502,"Kaisersesch"
"1100","E31238010000000000000071074224000","Gamesa Corporación Tecnológica S.A.","Gamesa G80",2000,"19.05.2006",7135093,"50,21028","7,20835",100,80,713502093,56761,"Zettingen",2000,"2006-05-19","11YR00000003039P",10003764,1854903,7135,"Cochem-Zell",927.4515,1855,713502,"Kaisersesch"
"1101","E31238010000000000000071074224001","Gamesa Corporación Tecnológica S.A.","Gamesa G80",2000,"23.05.2006",7135093,"50,21114","7,20454",100,80,713502093,56761,"Zettingen",2000,"2006-05-23","11YR00000003039P",10003764,1854903,7135,"Cochem-Zell",927.4515,1855,713502,"Kaisersesch"
"1102","E31238010000000000000071074224002","Gamesa Corporación Tecnológica S.A.","Gamesa G80",2000,"25.05.2006",7135093,"50,21281","7,19841",100,80,713502011,56761,"Brachtendorf",2000,"2006-05-25","11YR00000003039P",10003764,1854903,7135,"Cochem-Zell",927.4515,1855,713502,"Kaisersesch"
"1103","E31238010000000000000071074231438","Gamesa Corporación Tecnológica S.A.","Gamesa G80",2000,"29.12.2006",7135090,"50,21276","7,20913",100,80,713502093,56761,"Zettingen",2000,"2006-12-29","11YR00000003039P",10003764,1854903,7135,"Cochem-Zell",927.4515,1855,713502,"Kaisersesch"
"1104","E31238010000000000000073171622754","Fuhrländer AG","FL MD 77",1500,"21.12.2006",7135039,"50,027785","7,323162",85,77,713505039,56858,"Haserich",1500,"2006-12-21","11YR00000003039P",10003764,2284443,7135,"Cochem-Zell",1522.962,2284,713505,"Zell (Mosel)"
"1105","E31238010000000000000073171622755","Fuhrländer AG","FL MD 77",1500,"19.12.2006",7135039,"50,027576","7,329605",85,77,713505039,56858,"Haserich",1500,"2006-12-19","11YR00000003039P",10003764,2284443,7135,"Cochem-Zell",1522.962,2284,713505,"Zell (Mosel)"
"1106","E31238010000000000000073171630136","ENERCON GmbH","E-48",800,"19.12.2006",7135070,"50,024803","7,323736",76.8,48,713505039,56858,"Haserich",800,"2006-12-19","11YR00000003039P",10003764,1124710,7135,"Cochem-Zell",1405.8875,1125,713505,"Zell (Mosel)"
"1107","E31238010000000000000073171630138","ENERCON GmbH","E-48",800,"15.09.2006",7135070,"50,023657","7,324877",76.8,48,713505039,56858,"Haserich",800,"2006-09-15","11YR00000003039P",10003764,1124710,7135,"Cochem-Zell",1405.8875,1125,713505,"Zell (Mosel)"
"1108","E31238010000000000000073171630139","ENERCON GmbH","E-48",800,"22.12.2006",7135070,"50,022799","7,326723",76.8,48,713505039,56858,"Haserich",800,"2006-12-22","11YR00000003039P",10003764,1124710,7135,"Cochem-Zell",1405.8875,1125,713505,"Zell (Mosel)"
"1109","E31238010000000000000073171630140","ENERCON GmbH","E-48",800,"20.09.2006",7135070,"50,022414","7,328932",76.8,48,713505039,56858,"Haserich",800,"2006-09-20","11YR00000003039P",10003764,1124710,7135,"Cochem-Zell",1405.8875,1125,713505,"Zell (Mosel)"
"1110","E31238010000000000000073171630141","ENERCON GmbH","E-48",800,"22.09.2006",7135070,"50,02534","7,329403",76.8,48,713505039,56858,"Haserich",800,"2006-09-22","11YR00000003039P",10003764,1124710,7135,"Cochem-Zell",1405.8875,1125,713505,"Zell (Mosel)"
"1111","E31238010000000000000073171654995","ENERCON GmbH","E-53",800,"04.08.2009",7135071,"50,022667","7,339028",76,52.9,713505039,56858,"Haserich",800,"2009-08-04","11YR00000003039P",10003764,1265745,7135,"Cochem-Zell",1582.18125,1266,713505,"Zell (Mosel)"
"1112","E31238010000000000000073171654996","ENERCON GmbH","E-53",800,"06.08.2009",7135071,"50,023428","7,344003",76,52.9,713505039,56858,"Haserich",800,"2009-08-06","11YR00000003039P",10003764,1265745,7135,"Cochem-Zell",1582.18125,1266,713505,"Zell (Mosel)"
"1113","E31238010000000000000073171654997","ENERCON GmbH","E-53",800,"19.08.2009",7135071,"50,024742","7,343035",76,52.9,713505039,56858,"Haserich",800,"2009-08-19","11YR00000003039P",10003764,1265745,7135,"Cochem-Zell",1582.18125,1266,713505,"Zell (Mosel)"
"1114","E31238010000000000000074058413748","Nordex SE","N90",2300,"24.11.2006",7132039,"50,736797","7,795258",100,90,713209071,57520,"Molzhain",2300,"2006-11-24","11YR00000003039P",10003764,3503933,7132,"Altenkirchen",1523.44913043478,3504,713209,"Betzdorf-Gebhardshain"
"1115","E31238010000000000000074058424875","Nordex Energy GmbH","N 90",2300,"24.11.2006",7132039,"50,734458","7,806467",100,90,713209071,57520,"Molzhain",2300,"2006-11-24","11YR00000003039P",10003764,3503933,7132,"Altenkirchen",1523.44913043478,3504,713209,"Betzdorf-Gebhardshain"
"1116","E31238010000000000000074058424876","Nordex Energy GmbH","N 90",2300,"30.10.2006",7132039,"50,736122","7,801325",100,90,713209071,57520,"Molzhain",2300,"2006-10-16","11YR00000003039P",10003764,3503933,7132,"Altenkirchen",1523.44913043478,3504,713209,"Betzdorf-Gebhardshain"
"1117","E31238010000000000000074058424877","Nordex Energy GmbH","N 90",2300,"09.11.2006",7132039,"50,733267","7,799018",100,90,713209071,57520,"Molzhain",2300,"2006-11-14","11YR00000003039P",10003764,3503933,7132,"Altenkirchen",1523.44913043478,3504,713209,"Betzdorf-Gebhardshain"
"1118","E31238010000000000000074058424878","Nordex SE","N90",2300,"25.11.2006",7132039,"50,733267","7,799018",100,90,713209071,57520,"Molzhain",2300,"2006-10-25","11YR00000003039P",10003764,3503933,7132,"Altenkirchen",1523.44913043478,3504,713209,"Betzdorf-Gebhardshain"
"1119","E31238010000000000000074058424879","Nordex SE","N90",2300,"16.10.2006",7132039,"50,734458","7,806467",100,90,713209071,57520,"Molzhain",2300,"2006-11-15","11YR00000003039P",10003764,3503933,7132,"Altenkirchen",1523.44913043478,3504,713209,"Betzdorf-Gebhardshain"
"1120","E31238010000000000000074058424880","Nordex Energy GmbH","N 90",2300,"24.11.2006",7132039,"50,739006","7,800231",100,90,713209071,57520,"Molzhain",2300,"2006-10-30","11YR00000003039P",10003764,3503939,7132,"Altenkirchen",1523.45173913043,3504,713209,"Betzdorf-Gebhardshain"
"1121","E31238010000000000000074280431244","ENERCON GmbH","E-70 E4",2000,"02.10.2006",7233214,"50,3461","6,41977",64,71,723306214,54611,"Hallschlag",2000,"2006-10-02","11YR00000003039P",10003764,2631873,7233,"Vulkaneifel",1315.9365,2632,723306,"Geroldstein"
"1122","E31238010000000000000074530128826","Fuhrländer AG","MD77",1500,"25.10.2006",7232300,"50,211117","6,478267",100,77,723206300,54597,"Rommersheim",1500,"2006-10-23","11YR00000003039P",10003764,1902667,7232,"Eifelkreis Bitburg-Prüm",1268.44466666667,1903,723206,"Prüm"
"1125","E31238010000000000000075007409393","Nordex SE","S77",1500,"13.12.2006",7235062,"49,565048","6,47524",85,77,723508136,54441,"Trassem",1500,"2006-12-13","11YR00000003039P",10003764,2502360,7235,"Trier-Saarburg",1668.24,2502,723508,"Saarburg-Kell"
"1126","E31238010000000000000075007409394","Nordex SE","S77",1500,"13.12.2006",7235062,"49,562858","6,471757",85,77,723508136,54441,"Trassem",1500,"2006-12-13","11YR00000003039P",10003764,2502360,7235,"Trier-Saarburg",1668.24,2502,723508,"Saarburg-Kell"
"1131","E31238010000000000000075007458464","Nordex Energy GmbH","S77",1500,"11.02.2009",7235062,"49,56117","6,473158",85,77,723508136,54441,"Trassem",1500,"2009-02-06","11YR00000003039P",10003764,2502360,7235,"Trier-Saarburg",1668.24,2502,723508,"Saarburg-Kell"
"1132","E31238010000000000000075007472319","ENERCON GmbH","Enercon E-82",2300,"21.03.2014",7235062,"49,563567","6,468267",138,82,723508136,54441,"Trassem",2300,"2014-03-21","11YR00000003039P",10003764,4238143,7235,"Trier-Saarburg",1842.67086956522,4238,723508,"Saarburg-Kell"
"1133","E31238010000000000000075007472320","ENERCON GmbH","E-53",800,"20.12.2012",7235062,"49,562889","6,477315",73,53,723508136,54441,"Trassem",800,"2012-12-20","11YR00000003039P",10003764,1386485,7235,"Trier-Saarburg",1733.10625,1386,723508,"Saarburg-Kell"
"1135","E31238010000000000000075954028290","ENERCON GmbH","E-70 E4",2300,"21.11.2006",7140068,"50,052502","7,631231",113,70,714008068,56291,"Kisselbach",2000,"2006-10-09","11YR00000003039P",10003764,3200137,7140,"Rhein-Hundsrück",1600.0685,3200,714008,"Simmern-Rheinböllen"
"1136","E31238010000000000000075954046787","ENERCON GmbH","E-82",2000,"26.10.2006",7140068,"50,054568","7,631102",108,82,714008068,56291,"Kisselbach",2000,"2006-10-26","11YR00000003039P",10003764,3200137,7140,"Rhein-Hundsrück",1600.0685,3200,714008,"Simmern-Rheinböllen"
"1137","E31238010000000000000075954050979","ENERCON GmbH","E-82",2000,"01.10.2006",7140068,"50,062963","7,630165",108,82,714008068,56291,"Kisselbach",2300,"2006-10-09","11YR00000003039P",10003764,2832482,7140,"Rhein-Hundsrück",1231.51391304348,2832,714008,"Simmern-Rheinböllen"
"1138","E31238010000000000000075954050980","ENERCON GmbH","E-70 E4",2300,"08.11.2006",7140068,"50,058745","7,630802",113,70,714008068,56291,"Kisselbach",2300,"2006-11-08","11YR00000003039P",10003764,2832482,7140,"Rhein-Hundsrück",1231.51391304348,2832,714008,"Simmern-Rheinböllen"
"1139","E31238010000000000000075954050981","ENERCON GmbH","E-70 E4",2300,"15.11.2006",7140068,"50,058745","7,630802",113,70,714008068,56291,"Kisselbach",2300,"2006-11-15","11YR00000003039P",10003764,2832482,7140,"Rhein-Hundsrück",1231.51391304348,2832,714008,"Simmern-Rheinböllen"
"1140","E31238010000000000000075954050982","ENERCON GmbH","E-70 E4",2300,"25.09.2006",7140068,"50,060677","7,630719",113,70,714008068,56291,"Kisselbach",2300,"2006-10-09","11YR00000003039P",10003764,2832482,7140,"Rhein-Hundsrück",1231.51391304348,2832,714008,"Simmern-Rheinböllen"
"1141","E31238010000000000000075954050983","ENERCON GmbH","E-70 E4",2300,"30.11.2006",7140068,"50,050615","7,631354",113,70,714008068,56291,"Kisselbach",2300,"2006-11-30","11YR00000003039P",10003764,2832482,7140,"Rhein-Hundsrück",1231.51391304348,2832,714008,"Simmern-Rheinböllen"
"1142","E31238010000000000000075954050985","ENERCON GmbH","E-70 E4",2300,"22.02.2007",7140068,"50,048736","7,632106",113,70,714008068,56291,"Kisselbach",2300,"2007-02-22","11YR00000003039P",10003764,2832482,7140,"Rhein-Hundsrück",1231.51391304348,2832,714008,"Simmern-Rheinböllen"
"1143","E31238010000000000000075954050986","ENERCON GmbH","E-70 E4",2300,"01.03.2007",7140068,"50,046978","7,633203",113,70,714008068,56291,"Kisselbach",2300,"2007-03-01","11YR00000003039P",10003764,2832482,7140,"Rhein-Hundsrück",1231.51391304348,2832,714008,"Simmern-Rheinböllen"
"1144","E31238010000000000000075954050987","ENERCON GmbH","E-70 E4",2300,"12.03.2007",7140085,"50,045461","7,634935",113,70,714008068,56291,"Kisselbach",2300,"2007-03-12","11YR00000003039P",10003764,2832482,7140,"Rhein-Hundsrück",1231.51391304348,2832,714008,"Simmern-Rheinböllen"
"1145","E31238010000000000000075954050988","Vestas Deutschland GmbH","V90",2000,"08.02.2008",7140127,"50,054799","7,552825",105,90,714008125,55494,"RheinbÃ¶llen",2000,"2008-02-08","11YR00000003039P",10003764,3121742,7140,"Rhein-Hundsrück",1560.871,3122,714008,"Simmern-Rheinböllen"
"1146","E31238010000000000000075954050989","Vestas Deutschland GmbH","V90",2000,"19.02.2008",7140127,"50,060016","7,547962",105,90,714008125,55494,"RheinbÃ¶llen",2000,"2008-02-19","11YR00000003039P",10003764,3121742,7140,"Rhein-Hundsrück",1560.871,3122,714008,"Simmern-Rheinböllen"
"1147","E31238010000000000000075954050990","Vestas Deutschland GmbH","V90",2000,"21.02.2008",7140127,"50,056565","7,543821",105,90,714008125,55494,"RheinbÃ¶llen",2000,"2008-02-21","11YR00000003039P",10003764,3121742,7140,"Rhein-Hundsrück",1560.871,3122,714008,"Simmern-Rheinböllen"
"1148","E31238010000000000000075954050991","Vestas Deutschland GmbH","V90",2000,"22.02.2008",7140127,"50,056541","7,549812",105,90,714008125,55494,"RheinbÃ¶llen",2000,"2008-02-22","11YR00000003039P",10003764,3121742,7140,"Rhein-Hundsrück",1560.871,3122,714008,"Simmern-Rheinböllen"
"1149","E31238010000000000000076713230900","ENERCON GmbH","E-70",2000,"17.07.2007",7140204,"50,032525","7,344494",98,70,714003204,56869,"Mastershausen",2000,"2007-06-29","11YR00000003039P",10003764,3373511,7140,"Rhein-Hundsrück",1686.7555,3374,714003,"Kastellaun"
"1150","E31238010000000000000076713250972","ENERCON GmbH","E-70",2000,"06.07.2007",7140204,"50,044869","7,343736",98,70,714003204,56869,"Mastershausen",2000,"2007-07-06","11YR00000003039P",10003764,3373511,7140,"Rhein-Hundsrück",1686.7555,3374,714003,"Kastellaun"
"1151","E31238010000000000000076713250973","ENERCON GmbH","E-70",2000,"29.06.2007",7140204,"50,049398","7,345496",98,70,714003204,56869,"Mastershausen",2000,"2007-07-17","11YR00000003039P",10003764,3373511,7140,"Rhein-Hundsrück",1686.7555,3374,714003,"Kastellaun"
"1152","E31238010000000000000076713250974","ENERCON GmbH","E-70",2000,"01.08.2007",7140204,"50,032525","7,344494",85,70,714003204,56869,"Mastershausen",2000,"2007-08-01","11YR00000003039P",10003764,3373511,7140,"Rhein-Hundsrück",1686.7555,3374,714003,"Kastellaun"
"1153","E31238010000000000000076713250975","ENERCON GmbH","E-70",2000,"03.08.2007",7140204,"50,035206","7,343592",98,70,714003204,56869,"Mastershausen",2000,"2007-08-03","11YR00000003039P",10003764,3223418,7140,"Rhein-Hundsrück",1611.709,3223,714003,"Kastellaun"
"1154","E31238010000000000000076713250976","ENERCON GmbH","E-70",2000,"09.08.2007",7140204,"50,040661","7,343004",85,70,714003204,56869,"Mastershausen",2000,"2007-08-09","11YR00000003039P",10003764,3223418,7140,"Rhein-Hundsrück",1611.709,3223,714003,"Kastellaun"
"1155","E31238010000000000000076713250977","ENERCON GmbH","E-70",2000,"10.08.2007",7140204,"50,046899","7,343136",114,70,714003204,56869,"Mastershausen",2000,"2007-08-10","11YR00000003039P",10003764,3523400,7140,"Rhein-Hundsrück",1761.7,3523,714003,"Kastellaun"
"1156","E31238010000000000000076713293227","ENERCON GmbH","E-82",2300,"07.09.2010",7140204,"50,047718","7,334544",98,82,714003204,56869,"Mastershausen",2300,"2010-09-07","11YR00000003039P",10003764,4229274,7140,"Rhein-Hundsrück",1838.8147826087,4229,714003,"Kastellaun"
"1157","E31238010000000000000076713293229","ENERCON GmbH","E-82",2300,"26.08.2010",7140204,"50,052475","7,333671",108,82,714003204,56869,"Mastershausen",2300,"2010-08-26","11YR00000003039P",10003764,4356694,7140,"Rhein-Hundsrück",1894.2147826087,4357,714003,"Kastellaun"
"1158","E31238010000000000000076713293828","ENERCON GmbH","E-82",2300,"26.08.2010",7140204,"50,050187","7,334054",108,82,714003204,56869,"Mastershausen",2300,"2010-08-26","11YR00000003039P",10003764,4356694,7140,"Rhein-Hundsrück",1894.2147826087,4357,714003,"Kastellaun"
"1163","E31238010000010120000008529201417","ENERCON GmbH","E-66/15.66",1500,"01.08.1999",7133023,"49,994312","7,727852",67,66,714008027,55494,"Dichtelbach",1500,"1999-08-01","11YR00000003039P",10003764,2314690.7,7140,"Rhein-Hundsrück",1543.12713333333,2315,714008,"Simmern-Rheinböllen"
"1164","E31238010000010120000008529201418","ENERCON GmbH","E-66/18.70",1800,"01.11.2000",7133023,"49,993678","7,729912",65,70,714008027,55494,"Dichtelbach",1800,"2000-11-01","11YR00000003039P",10003764,2323194.04,7140,"Rhein-Hundsrück",1290.66335555556,2323,714008,"Simmern-Rheinböllen"
"1165","E31238010000010120000008529219428","ENERCON GmbH","E-70 E4",2000,"18.10.2005",7133023,"49,996305","7,730813",113.5,71,NA,NA,NA,NA,NA,NA,NA,NA,NA,NA,NA,NA,NA,NA
"1166","E31238010000010170000000298001456","Nordex Energy GmbH","N54 MK3",1000,"30.06.2000",7232077,"49,876308","6,516614",70,54,723205225,54298,"Gilzem",1000,"2000-06-30","11YR00000003039P",10003764,1180388,7232,"Eifelkreis Bitburg-Prüm",1180.388,1180,723205,"Südeifel"
"1168","E31238010000010170000001432601324","Nordex SE","N60",1300,"16.12.1999",7235106,"49,65576","6,671539",69,60,NA,NA,NA,NA,NA,NA,NA,NA,NA,NA,NA,NA,NA,NA
"1169","E31238010000010170000001432611721","Nordex SE","N60",1300,"16.12.1999",7235106,"49,653406","6,672594",69,60,723503106,54331,"Pellingen",1300,"1999-12-16","11YR00000003039P",10003764,1694940,7235,"Trier-Saarburg",1303.8,1695,723503,"Konz"
"1170","E31238010000010170000001432618384","Nordex SE","S70",1500,"07.02.2002",7235072,"49,653695","6,682487",65,70,723508072,54316,"Lampaden",1500,"2002-02-07","11YR00000003039P",10003764,2249569,7235,"Trier-Saarburg",1499.71266666667,2250,723508,"Saarburg-Kell"
"1171","E31238010000010170000001432618841","Nordex SE","N60",1300,"15.12.1999",7235072,"49,65038","6,67598",69,60,723508072,54316,"Lampaden",1300,"1999-12-16","11YR00000003039P",10003764,1694940,7235,"Trier-Saarburg",1303.8,1695,723508,"Saarburg-Kell"
"1172","E31238010000010170000001432618842","Nordex SE","N60",1300,"15.12.1999",7235072,"49,648878","6,679142",69,60,723508072,54316,"Lampaden",1300,"1999-12-16","11YR00000003039P",10003764,1694940,7235,"Trier-Saarburg",1303.8,1695,723508,"Saarburg-Kell"
"1173","E31238010000010170000001432618843","Nordex SE","N62",1300,"15.07.2000",7235072,"49,646353","6,68019",69,62,723508072,54316,"Lampaden",1300,"2000-07-15","11YR00000003039P",10003764,1797895,7235,"Trier-Saarburg",1382.99615384615,1798,723508,"Saarburg-Kell"
"1174","E31238010000010170000001432618844","Nordex Energy GmbH","N 62",1300,"28.12.2000",7235037,"49","6",68.9,62,723504037,54317,"Gusterath",1300,"2000-12-28","11YR00000003039P",10003764,1797895,7235,"Trier-Saarburg",1382.99615384615,1798,723504,"Ruwer"
"1175","E31238010000010170000001432618846","Südwind Borsig Energy GmbH","S70",1500,"30.12.2001",7235072,"49","6",65,70,723508072,54316,"Lampaden",1500,"2001-12-30","11YR00000003039P",10003764,2249569,7235,"Trier-Saarburg",1499.71266666667,2250,723508,"Saarburg-Kell"
"1178","E31238010000010170000002251818493","Vestas Deutschland GmbH","V47-660/200",660,"24.08.2000",7235037,"49,718618","6,706328",65,47,723504037,54317,"Gusterath",660,"2000-08-24","11YR00000003039P",10003764,1042853,7235,"Trier-Saarburg",1580.0803030303,1043,723504,"Ruwer"
"1179","E31238010000010170000002253311482","Südwind Borsig Energy GmbH","N3127/40",NA,"21.04.1995",7235037,"49,71441","6,703769",40,31,723504037,54317,"Gusterath",270,"1995-04-21","11YR00000003039P",10003764,137294,7235,"Trier-Saarburg",508.496296296296,137,723504,"Ruwer"
"1180","E31238010000010170000002744400397","ENERCON GmbH","E - 44",600,"02.10.2002",7235141,"49,753983","6,769904",78,44,723504141,54320,"Waldrach",600,"2002-10-04","11YR00000003039P",10003764,1023145,7235,"Trier-Saarburg",1705.24166666667,1023,723504,"Ruwer"
"1181","E31238010000010170000002744418233","ENERCON GmbH","E - 44",600,"01.10.2002",7235141,"49,752332","6,770849",78,44,723504141,54320,"Waldrach",600,"2002-10-02","11YR00000003039P",10003764,1023145,7235,"Trier-Saarburg",1705.24166666667,1023,723504,"Ruwer"
"1184","E31238010000010212000000177909116","Südwind Borsig Energy GmbH","S 70",1500,"01.05.2001",7233010,"50,059996","6,47666",85,70,723304212,53539,"Gelenberg",1500,"2001-03-22","11YR00000003039P",10003764,1948232,7233,"Vulkaneifel",1298.82133333333,1948,723304,"Kelberg"
"1186","E31238010000020120000002354110152","GE Wind Energy GmbH","1.5 sl",1500,"08.11.2001",7333078,"49,722543","7,734702",100,77,713310065,55590,"Meisenheim",1500,"2001-11-08","11YR00000003039P",10003764,1342094,7133,"Bad Kreuznach",894.729333333333,1342,713310,"Nahe Glan"
"1187","E31238010000020120000002354110153","Vestas Deutschland GmbH","V-80",2000,"15.01.2002",7333078,"49,723121","7,732454",100,80,713310065,55590,"Meisenheim",2000,"2002-01-15","11YR00000003039P",10003764,1686130,7133,"Bad Kreuznach",843.065,1686,713310,"Nahe Glan"
"1192","E31238010000020170000008995100041","ENERCON GmbH","E-40 / 5.40",500,"07.09.1994",7232068,"50,005499","6,252443",42,40,723205068,54673,"Koxhausen",500,"1994-09-07","11YR00000003039P",10003764,643579,7232,"Eifelkreis Bitburg-Prüm",1287.158,644,723205,"Südeifel"
"1193","E31238010000020170000008995119010","ENERCON GmbH","E-40 / 5.40",500,"06.09.1994",7232056,"50,006996","6,258603",42,40,723205056,54673,"HÃ¼tten",500,"1994-09-06","11YR00000003039P",10003764,643579,7232,"Eifelkreis Bitburg-Prüm",1287.158,644,723205,"Südeifel"
"1194","E31238010000020170000008995119012","ENERCON GmbH","E-40 / 5.40",500,"14.06.1994",7232056,"50,008397","6,263284",42,40,723205056,54673,"HÃ¼tten",500,"1994-06-14","11YR00000003039P",10003764,643579,7232,"Eifelkreis Bitburg-Prüm",1287.158,644,723205,"Südeifel"
"1195","E31238010000020170000009043109633","ENERCON GmbH","E-40 / 5.40",500,"25.03.1994",7232068,"50,003002","6,247283",42,40,723205068,54673,"Koxhausen",500,"1994-03-25","11YR00000003039P",10003764,641234,7232,"Eifelkreis Bitburg-Prüm",1282.468,641,723205,"Südeifel"
"1196","E31238010000020170000009043119002","ENERCON GmbH","E-40 / 5.40",500,"24.03.1994",7232068,"50,002901","6,252416",42,40,723205068,54673,"Koxhausen",500,"1994-03-24","11YR00000003039P",10003764,641234,7232,"Eifelkreis Bitburg-Prüm",1282.468,641,723205,"Südeifel"
"1197","E31238010000020170000009043119003","ENERCON GmbH","E-40 / 5.40",500,"09.06.1994",7232068,"50,004114","15,570218",42,40,723205068,54673,"Koxhausen",500,"1994-06-09","11YR00000003039P",10003764,641234,7232,"Eifelkreis Bitburg-Prüm",1282.468,641,723205,"Südeifel"
"1198","E31238010000020170000009048200040","ENERCON GmbH","E-40 / 5.40",500,"03.10.1994",7232005,"50,020101","6,251906",50,40,723205073,54673,"Leimbach",500,"1994-10-04","11YR00000003039P",10003764,629116,7232,"Eifelkreis Bitburg-Prüm",1258.232,629,723205,"Südeifel"
"1199","E31238010000020170000009048219013","ENERCON GmbH","E-40 / 5.40",500,"03.10.1994",7232005,"50,021","6,255776",50,40,723205073,54673,"Leimbach",500,"1994-10-04","11YR00000003039P",10003764,629116,7232,"Eifelkreis Bitburg-Prüm",1258.232,629,723205,"Südeifel"
"1200","E31238010000020170000009179900042","ENERCON GmbH","E-40 / 5.40",500,"31.05.1995",7232005,"50,004096","6,279874",65,40,723205088,54673,"Neuerburg",500,"1995-05-31","11YR00000003039P",10003764,722271,7232,"Eifelkreis Bitburg-Prüm",1444.542,722,723205,"Südeifel"
"1201","E31238010000020170000009179919015","ENERCON GmbH","E-40 / 5.40",500,"18.05.1995",7232005,"50,004097","6,279846",65,40,723205088,54673,"Neuerburg",500,"1995-05-18","11YR00000003039P",10003764,722271,7232,"Eifelkreis Bitburg-Prüm",1444.542,722,723205,"Südeifel"
"1202","E31238010000020170000009179919016","ENERCON GmbH","E-40 / 5.40",500,"23.05.1995",7232005,"50,004402","6,272594",65,40,723205088,54673,"Neuerburg",500,"1995-05-23","11YR00000003039P",10003764,722271,7232,"Eifelkreis Bitburg-Prüm",1444.542,722,723205,"Südeifel"
"1203","E31238010000020170000009179919018","ENERCON GmbH","E-40 / 5.40",500,"31.05.1995",7232005,"50,001301","6,279634",65,40,723205088,54673,"Neuerburg",500,"1995-05-31","11YR00000003039P",10003764,722271,7232,"Eifelkreis Bitburg-Prüm",1444.542,722,723205,"Südeifel"
"1204","E31238010000020170000009529211700","NEG Micon Deutschland GmbH","NM60/1000",1000,"19.01.2001",7232045,"49,929547","6,363864",80,60,723205122,54675,"Sinspelt",1000,"2001-01-19","11YR00000003039P",10003764,1280046,7232,"Eifelkreis Bitburg-Prüm",1280.046,1280,723205,"Südeifel"
"1205","E31238010000020170000009529211702","NEG Micon Deutschland GmbH","NM60/1000",1000,"28.12.2000",7232045,"49,933508","6,362125",80,60,723205122,54675,"Sinspelt",1000,"2000-12-28","11YR00000003039P",10003764,1280046,7232,"Eifelkreis Bitburg-Prüm",1280.046,1280,723205,"Südeifel"
"1206","E31238010000020170000009529211703","NEG Micon Deutschland GmbH","NM60/1000",1000,"20.12.2000",7232045,"49,932317","6,366992",80,60,723205122,54675,"Sinspelt",1000,"2000-12-20","11YR00000003039P",10003764,1280046,7232,"Eifelkreis Bitburg-Prüm",1280.046,1280,723205,"Südeifel"
"1207","E31238010000020170000009529218880","NEG Micon Deutschland GmbH","NM60/1000",1000,"21.12.2000",7232045,"49,937461","6,359925",80,60,723205122,54675,"Sinspelt",1000,"2000-12-21","11YR00000003039P",10003764,1280046,7232,"Eifelkreis Bitburg-Prüm",1280.046,1280,723205,"Südeifel"
"1208","E31238010000020170000009529218881","NEG Micon Deutschland GmbH","NM60/1000",1000,"22.12.2000",7232045,"49,935781","6,362867",80,60,723205122,54675,"Sinspelt",1000,"2000-12-22","11YR00000003039P",10003764,1280046,7232,"Eifelkreis Bitburg-Prüm",1280.046,1280,723205,"Südeifel"
"1209","E31238010000020170000009529218882","NEG Micon Deutschland GmbH","NM60/1000",1000,"20.12.2000",7232045,"49,93485","6,367317",80,60,723205122,54675,"Sinspelt",1000,"2000-12-20","11YR00000003039P",10003764,1280046,7232,"Eifelkreis Bitburg-Prüm",1280.046,1280,723205,"Südeifel"
"1210","E31238010000020170000009529218883","NEG Micon Deutschland GmbH","NM60/1000",1000,"21.12.2000",7232045,"49,941467","6,364275",80,60,723205122,54675,"Sinspelt",1000,"2000-12-20","11YR00000003039P",10003764,1280046,7232,"Eifelkreis Bitburg-Prüm",1280.046,1280,723205,"Südeifel"
"1211","E31238010000020170000009529218884","NEG Micon Deutschland GmbH","NM60/1000",1000,"21.12.2000",7232045,"49,938533","6,365394",80,60,723205122,54675,"Sinspelt",1000,"2000-12-21","11YR00000003039P",10003764,1280046,7232,"Eifelkreis Bitburg-Prüm",1280.046,1280,723205,"Südeifel"
"1212","E31238010000020170000009529218885","NEG Micon Deutschland GmbH","NM60/1000",1000,"22.12.2000",7232045,"49,937806","6,369861",80,60,723205122,54675,"Sinspelt",1000,"2000-12-22","11YR00000003039P",10003764,1280046,7232,"Eifelkreis Bitburg-Prüm",1280.046,1280,723205,"Südeifel"
"1213","E31238010000020170000009529218886","NEG Micon Deutschland GmbH","NM60/1000",1000,"20.12.2000",7232045,"49,940753","6,368419",80,60,723205122,54675,"Sinspelt",1000,"2000-12-20","11YR00000003039P",10003764,1280046,7232,"Eifelkreis Bitburg-Prüm",1280.046,1280,723205,"Südeifel"
"1214","E31238010000020170000009529227090","Südwind Borsig Energy GmbH","S70",1500,"21.12.2001",7232022,"50,059996","6,476662",85,70,723205122,54675,"Sinspelt",1500,"2001-11-05","11YR00000003039P",10003764,1855479,7232,"Eifelkreis Bitburg-Prüm",1236.986,1855,723205,"Südeifel"
"1216","E31238010000020170000009529434415","Nordex Energy GmbH","N62/1300",1300,"28.06.2002",7232022,"49,968564","6,347789",69,62,723205122,54675,"Sinspelt",1300,"2002-07-01","11YR00000003039P",10003764,977312,7232,"Eifelkreis Bitburg-Prüm",751.778461538462,977,723205,"Südeifel"
"1217","E31238010000020170000009529434417","Nordex Energy GmbH","N62/1300",1300,"28.06.2002",7232502,"49,970008","6,346912",69,62,723205122,54675,"Sinspelt",1300,"2002-06-29","11YR00000003039P",10003764,977312,7232,"Eifelkreis Bitburg-Prüm",751.778461538462,977,723205,"Südeifel"
"1218","E31238010000030212000000318501209","ENERCON GmbH","Enercon-40",500,"22.04.1998",7232226,"50,1329","6,2743",65,40.3,723206226,54595,"Weinsheim",500,"1998-04-23","11YR00000003039P",10003764,664270,7232,"Eifelkreis Bitburg-Prüm",1328.54,664,723206,"Prüm"
"1219","E31238010000030212000000318518850","ENERCON GmbH","Enercon-40",500,"22.04.1998",7232226,"50,1323","6,2729",65,40.3,723206226,54595,"Weinsheim",500,"1998-04-22","11YR00000003039P",10003764,664270,7232,"Eifelkreis Bitburg-Prüm",1328.54,664,723206,"Prüm"
"1221","E31238010000030212000000430418902","ENERCON GmbH","E40  6.44",600,"09.10.2000",7232223,"50,216071","6,513539",65,44,723206223,54597,"Fleringen",600,"2000-10-09","11YR00000003039P",10003764,945060,7232,"Eifelkreis Bitburg-Prüm",1575.1,945,723206,"Prüm"
"1224","E31238010000030212000000558701424","ENERCON GmbH","E40",500,"30.09.1998",7232290,"50,1547","6,391396",65,40,723206290,54595,"Orlenbach",500,"1998-09-30","11YR00000003039P",10003764,555047,7232,"Eifelkreis Bitburg-Prüm",1110.094,555,723206,"Prüm"
"1236","E31238010000030212000000704401224","ENERCON GmbH","E40",1000,"01.12.1998",7232293,"50,093056","6,439111",68,40,723201293,54597,"PlÃ¼tscheid",500,"1998-12-01","11YR00000003039P",10003764,830063,7232,"Eifelkreis Bitburg-Prüm",1660.126,830,723201,"Arzfeld"
"1237","E31238010000030212000000704402583","ENERCON GmbH","E40",500,"01.12.1998",7232293,"50,093103","6,438984",65,40,723201293,54597,"PlÃ¼tscheid",500,"1998-12-01","11YR00000003039P",10003764,830063,7232,"Eifelkreis Bitburg-Prüm",1660.126,830,723201,"Arzfeld"
"1238","E31238010000030212000000704418670","ENERCON GmbH","E-66",1500,"01.10.1999",7232293,"50,093885","6,437259",67,66,723201293,54597,"PlÃ¼tscheid",1500,"1998-12-01","11YR00000003039P",10003764,2490186,7232,"Eifelkreis Bitburg-Prüm",1660.124,2490,723201,"Arzfeld"
"1239","E31238010000030212000000859901229","DeWind GmbH","D4/600",600,"19.11.1998",7232307,"50,140246","6,495148",70,48,723206307,54597,"Seiwerath",600,"1998-11-19","11YR00000003039P",10003764,760278,7232,"Eifelkreis Bitburg-Prüm",1267.13,760,723206,"Prüm"
"1246","E31238010000030212000001160302382","ENERCON GmbH","E 40/500 kw",500,"22.06.1998",7233214,"50,339312","6,420661",65,40,723306214,54611,"Hallschlag",500,"1998-06-22","11YR00000003039P",10003764,682965,7233,"Vulkaneifel",1365.93,683,723306,"Geroldstein"
"1247","E31238010000030212000001160302383","ENERCON GmbH","E-66/15.66",1500,"18.10.2000",7233214,"50,337516","6,417142",65,66,723306214,54611,"Hallschlag",1500,"2000-10-19","11YR00000003039P",10003764,2048887,7233,"Vulkaneifel",1365.92466666667,2049,723306,"Geroldstein"
"1249","E31238010000030212000001161109134","ENERCON GmbH","E 40",500,"06.07.1998",7233214,"50,345261","6,423824",63,40.3,723306214,54611,"Hallschlag",500,"1998-07-06","11YR00000003039P",10003764,691775,7233,"Vulkaneifel",1383.55,692,723306,"Geroldstein"
"1250","E31238010000030212000001161901230","DeWind GmbH","D4/600",500,"12.06.1998",7233214,"50","6",70,46,723306214,54611,"Hallschlag",500,"1998-06-12","11YR00000003039P",10003764,698039,7233,"Vulkaneifel",1396.078,698,723306,"Geroldstein"
"1251","E31238010000030212000001161911805","DeWind GmbH","De/600",500,"28.06.1998",7233214,"50","6",70,46,723306214,54611,"Hallschlag",500,"1998-06-28","11YR00000003039P",10003764,698039,7233,"Vulkaneifel",1396.078,698,723306,"Geroldstein"
"1255","E31238010000030212000001164301226","ENERCON GmbH","E40",500,"06.06.1997",7233214,"50,2017","6,2518",63,40.3,723306214,54611,"Hallschlag",500,"1997-06-06","11YR00000003039P",10003764,781762,7233,"Vulkaneifel",1563.524,782,723306,"Geroldstein"
"1263","E31238010000030212000001165323316","ENERCON GmbH","E82",2300,"30.03.2011",7233214,"50,322878","6,418151",138,82,723306214,54611,"Hallschlag",2300,"2011-03-30","11YR00000003039P",10003764,3907550,7233,"Vulkaneifel",1698.9347826087,3908,723306,"Geroldstein"
"1264","E31238010000030212000001165323318","ENERCON GmbH","E82",2300,"14.12.2011",7233214,"50,317889","6,415537",138,82,723306214,54611,"Hallschlag",2300,"2011-12-14","11YR00000003039P",10003764,3907550,7233,"Vulkaneifel",1698.9347826087,3908,723306,"Geroldstein"
"1265","E31238010000030212000001165350614","DeWind GmbH","D6/1000",1000,"29.12.1999",7233214,"50","6",68.5,62,723306214,54611,"Hallschlag",1000,"1999-12-29","11YR00000003039P",10003764,1510331,7233,"Vulkaneifel",1510.331,1510,723306,"Geroldstein"
"1271","E31238010000030212000001165350620","DeWind GmbH","D6/1000",1000,"30.03.2000",7233214,"50","6",68.5,62,723306214,54611,"Hallschlag",1000,"2000-03-30","11YR00000003039P",10003764,1510331,7233,"Vulkaneifel",1510.331,1510,723306,"Geroldstein"
"1272","E31238010000030212000001165350621","DeWind GmbH","D6/1000",1000,"13.04.2000",7233214,"50","6",68.5,62,723306214,54611,"Hallschlag",1000,"2000-04-13","11YR00000003039P",10003764,1510331,7233,"Vulkaneifel",1510.331,1510,723306,"Geroldstein"
"1274","E31238010000030212000001165350623","DeWind GmbH","D6/1000",1000,"17.04.2000",7233214,"50","6",68.5,62,723306214,54611,"Hallschlag",1000,"2000-04-17","11YR00000003039P",10003764,1510331,7233,"Vulkaneifel",1510.331,1510,723306,"Geroldstein"
"1275","E31238010000030212000001165350624","NEG Micon Deutschland GmbH","NM60/1000",1000,"26.10.2000",7233214,"50,339569","6,434389",70,60,723306214,54611,"Hallschlag",1000,"2000-10-26","11YR00000003039P",10003764,1376621,7233,"Vulkaneifel",1376.621,1377,723306,"Geroldstein"
"1276","E31238010000030212000001165350625","NEG Micon Deutschland GmbH","NM60/1000",1000,"01.11.2000",7233214,"50,341214","6,434542",70,60,723306214,54611,"Hallschlag",1000,"2000-11-01","11YR00000003039P",10003764,1376621,7233,"Vulkaneifel",1376.621,1377,723306,"Geroldstein"
"1277","E31238010000030212000001165350626","DeWind GmbH","D6/1000",1000,"01.12.2000",7233214,"50,366772","6,420114",68.5,62,723306214,54611,"Hallschlag",1000,"2000-12-01","11YR00000003039P",10003764,1510331,7233,"Vulkaneifel",1510.331,1510,723306,"Geroldstein"
"1278","E31238010000030212000001165350627","GE Wind Energy GmbH","GE1.5s",1500,"16.12.2000",7233235,"50,298678","6,50475",80,70,723306214,54611,"Hallschlag",1500,"2000-12-16","11YR00000003039P",10003764,2089021,7233,"Vulkaneifel",1392.68066666667,2089,723306,"Geroldstein"
"1279","E31238010000030212000001165350628","GE Wind Energy GmbH","GE1.5s",1500,"18.12.2000",7233235,"50,299","6,511461",80,70,723306214,54611,"Hallschlag",1500,"2000-12-18","11YR00000003039P",10003764,2089021,7233,"Vulkaneifel",1392.68066666667,2089,723306,"Geroldstein"
"1280","E31238010000030212000001165350629","GE Wind Energy GmbH","GE 1.5s",1500,"20.12.2000",7233235,"50,290231","6,507747",80,70,723306214,54611,"Hallschlag",1500,"2000-12-20","11YR00000003039P",10003764,2089021,7233,"Vulkaneifel",1392.68066666667,2089,723306,"Geroldstein"
"1281","E31238010000030212000001165350630","GE Wind Energy GmbH","GE1.5s",1500,"21.12.2000",7233235,"50,294714","6,528147",80,70,723306214,54611,"Hallschlag",1500,"2000-12-21","11YR00000003039P",10003764,2089021,7233,"Vulkaneifel",1392.68066666667,2089,723306,"Geroldstein"
"1282","E31238010000030212000001165350631","GE Wind Energy GmbH","GE 15.5s",1500,"21.12.2000",7233235,"50,291206","6,502439",80,70,723306214,54611,"Hallschlag",1500,"2000-12-21","11YR00000003039P",10003764,2089021,7233,"Vulkaneifel",1392.68066666667,2089,723306,"Geroldstein"
"1283","E31238010000030212000001165350632","GE Wind Energy GmbH","GE1.5s",1500,"21.12.2000",7233235,"50,296772","6,506722",80,70,723306214,54611,"Hallschlag",1500,"2000-12-21","11YR00000003039P",10003764,2089021,7233,"Vulkaneifel",1392.68066666667,2089,723306,"Geroldstein"
"1284","E31238010000030212000001165350633","GE Wind Energy GmbH","GE1.5s",1500,"28.12.2000",7233235,"50,293297","6,509772",80,70,723306214,54611,"Hallschlag",1500,"2000-12-28","11YR00000003039P",10003764,2089021,7233,"Vulkaneifel",1392.68066666667,2089,723306,"Geroldstein"
"1285","E31238010000030212000001165350634","GE Wind Energy GmbH","GE 1,5s",1500,"28.12.2000",7233235,"50,286172","6,498106",80,70,723306214,54611,"Hallschlag",1500,"2000-12-28","11YR00000003039P",10003764,2089021,7233,"Vulkaneifel",1392.68066666667,2089,723306,"Geroldstein"
"1286","E31238010000030212000001165350635","GE Wind Energy GmbH","GE1.5s",1500,"29.12.2000",7233235,"50,28731","6,506431",80,70,723306214,54611,"Hallschlag",1500,"2000-12-29","11YR00000003039P",10003764,2089021,7233,"Vulkaneifel",1392.68066666667,2089,723306,"Geroldstein"
"1287","E31238010000030212000001165350636","NEG Micon Deutschland GmbH","NM60/1000",1000,"11.09.2001",7233214,"50,342806","6,464414",70,60,723306214,54611,"Hallschlag",1000,"2001-09-11","11YR00000003039P",10003764,1376621,7233,"Vulkaneifel",1376.621,1377,723306,"Geroldstein"
"1293","E31238010000030212000001174009128","NEG Micon Deutschland GmbH","NTK 1500",1500,"23.12.1997",7233237,"50,355069","6,400996",67.5,64,723306237,54611,"Scheid",1500,"1997-12-23","11YR00000003039P",10003764,1333306,7233,"Vulkaneifel",888.870666666667,1333,723306,"Geroldstein"
"1295","E31238010000030212000001384101214","ENERCON GmbH","E-40",500,"03.11.1998",7232327,"50,143029","6,408291",65,40,723206327,54614,"Winringen",500,"1998-01-01","11YR00000003039P",10003764,737035,7232,"Eifelkreis Bitburg-Prüm",1474.07,737,723206,"Prüm"
"1296","E31238010000030212000001384118673","ENERCON GmbH","E-40",500,"03.11.1998",7232327,"50,143022","6,409794",65,40,723206327,54614,"Winringen",500,"1998-01-01","11YR00000003039P",10003764,737035,7232,"Eifelkreis Bitburg-Prüm",1474.07,737,723206,"Prüm"
"1297","E31238010000030212000001384118675","ENERCON GmbH","E-44",600,"30.09.1999",7232327,"50,144199","6,414994",65,44,723206327,54614,"Winringen",600,"1999-01-01","11YR00000003039P",10003764,867746,7232,"Eifelkreis Bitburg-Prüm",1446.24333333333,868,723206,"Prüm"
"1298","E31238010000030212000001384118676","GE Wind Energy GmbH","GE1.5sl",1500,"02.08.2001",7232327,"50,140386","6,41058",100,77,723206327,54614,"Winringen",1500,"2001-01-01","11YR00000003039P",10003764,2784875,7232,"Eifelkreis Bitburg-Prüm",1856.58333333333,2785,723206,"Prüm"
"1299","E31238010000030212000001442711726","Nordex SE","Nordex N-29",250,"01.11.1994",7232234,"50,14475","6,16678",50,29,723201234,54617,"Harspelt",250,"1994-11-01","11YR00000003039P",10003764,256802,7232,"Eifelkreis Bitburg-Prüm",1027.208,257,723201,"Arzfeld"
"1304","E31238010000030212000002017518048","Fuhrländer AG","FL1000",1000,"19.12.2000",7233242,"50,24601","6,421906",70,54,723304242,56767,"Uersfeld",1000,"2000-12-19","11YR00000003039P",10003764,621120,7233,"Vulkaneifel",621.12,621,723304,"Kelberg"
"1305","E31238010000030212000002108801238","Fuhrländer AG","FL 1000",1000,"01.12.2000",7233215,"50,239314","7,046343",82,54,723304224,56767,"Lirstal",1000,"2000-09-01","11YR00000003039P",10003764,1121004,7233,"Vulkaneifel",1121.004,1121,723304,"Kelberg"
"1306","E31238010000030212000002108818056","Fuhrländer AG","FL 1000",1000,"01.12.2000",7233215,"50,239794","7,044793",82,54,723304224,56767,"Lirstal",1000,"2000-09-01","11YR00000003039P",10003764,1121018,7233,"Vulkaneifel",1121.018,1121,723304,"Kelberg"
"1307","E31238010000040311000003033209143","SEEWIND Windenergiesysteme GmbH","Seewind 20 / 110",110,"14.04.1994",7131211,"50,397525","7,156191",25,20,713104211,56745,"Weibern",110,"1994-04-14","11YR00000003039P",10003764,110542,7131,"Ahrweiler",1004.92727272727,111,713104,"Brohltal"
"1308","E31238010000050311000000236501176","Tacke GmbH & Co. KG","GEWE K600",600,"20.08.1996",7135075,"50,239356","7,236769",60,43,713502075,56754,"Roes",600,"1996-08-20","11YR00000003039P",10003764,686649,7135,"Cochem-Zell",1144.415,687,713502,"Kaisersesch"
"1309","E31238010000050311000000236518006","Tacke GmbH & Co. KG","GEWE K600",600,"20.08.1996",7135075,"50,238397","7,241017",60,43,713502075,56754,"Roes",600,"1996-08-20","11YR00000003039P",10003764,686649,7135,"Cochem-Zell",1144.415,687,713502,"Kaisersesch"
"1310","E31238010000050311000000236518007","Tacke GmbH & Co. KG","GEWE K600",600,"20.08.1996",7135075,"50,240206","7,244317",60,43,713502075,56754,"Roes",600,"1996-08-20","11YR00000003039P",10003764,686649,7135,"Cochem-Zell",1144.415,687,713502,"Kaisersesch"
"1311","E31238010000050311000000236518008","Tacke GmbH & Co. KG","GEWE K600",600,"20.08.1996",7135075,"50,241889","7,242742",60,43,713502075,56754,"Roes",600,"1996-08-20","11YR00000003039P",10003764,686649,7135,"Cochem-Zell",1144.415,687,713502,"Kaisersesch"
"1312","E31238010000050311000000250509150","ENERCON GmbH","E 40",500,"19.06.1997",7135026,"50,24278","7,068274",65,40,713502026,56759,"Eppenberg",500,"1997-06-19","11YR00000003039P",10003764,737113,7135,"Cochem-Zell",1474.226,737,713502,"Kaisersesch"
"1313","E31238010000050311000000250518050","ENERCON GmbH","E 40",500,"19.06.1997",7135026,"50,24278","7,068274",65,40,713502026,56759,"Eppenberg",500,"1997-06-19","11YR00000003039P",10003764,737113,7135,"Cochem-Zell",1474.226,737,713502,"Kaisersesch"
"1315","E3123801V000000000000000719614944","Nordex Energy GmbH","N80",2500,"09.11.2001",7232018,"50,001367","6,527038",60,80,723200018,54634,"Bitburg",2500,"2001-11-09","11YR00000003039P",10003764,1747446,7232,"Eifelkreis Bitburg-Prüm",698.9784,1747,723200,"vfr Eifelkreis Bitburg-Prüm"
"1316","E3123801V000000000000000719641320","Nordex Energy GmbH","N80",2500,"25.08.2001",7232018,"49,994444","6,525833",80,80,723200018,54634,"Bitburg",2500,"2001-08-25","11YR00000003039P",10003764,1945654,7232,"Eifelkreis Bitburg-Prüm",778.2616,1946,723200,"vfr Eifelkreis Bitburg-Prüm"
"1317","E3123801V000000000000000719641323","Nordex Energy GmbH","N80",2500,"01.09.2001",7232018,"49,997222","6,526388",80,80,723200018,54634,"Bitburg",2500,"2001-09-01","11YR00000003039P",10003764,1945654,7232,"Eifelkreis Bitburg-Prüm",778.2616,1946,723200,"vfr Eifelkreis Bitburg-Prüm"
"1318","E3123801V000000000000000719641325","Nordex Energy GmbH","S70",1500,"07.06.2001",7232120,"50,061111","6,533055",85,70,723200018,54634,"Bitburg",1500,"2001-06-07","11YR00000003039P",10003764,1421877,7232,"Eifelkreis Bitburg-Prüm",947.918,1422,723200,"vfr Eifelkreis Bitburg-Prüm"
"1319","E3123801V000000000000000719641327","Nordex Energy GmbH","S70",1500,"21.06.2001",7232120,"50,065","6,537777",85,70,723200018,54634,"Bitburg",1500,"2001-06-21","11YR00000003039P",10003764,1421877,7232,"Eifelkreis Bitburg-Prüm",947.918,1422,723200,"vfr Eifelkreis Bitburg-Prüm"
"1321","E3123801V000000000000000719641330","Nordex Energy GmbH","S70",1500,"14.06.2001",7232120,"50,068333","6,5375",85,70,723200018,54634,"Bitburg",1500,"2001-06-14","11YR00000003039P",10003764,1421877,7232,"Eifelkreis Bitburg-Prüm",947.918,1422,723200,"vfr Eifelkreis Bitburg-Prüm"
"1322","E3123801V000000000000000719641331","Nordex Energy GmbH","S70",1500,"20.06.2001",7232120,"50,070833","6,533055",85,70,723200018,54634,"Bitburg",1500,"2001-06-20","11YR00000003039P",10003764,1421877,7232,"Eifelkreis Bitburg-Prüm",947.918,1422,723200,"vfr Eifelkreis Bitburg-Prüm"
"1323","E3123801V000000000000000719641333","Nordex Energy GmbH","S70",1500,"10.07.2001",7232120,"50,0675","6,530833",85,70,723200018,54634,"Bitburg",1500,"2001-07-10","11YR00000003039P",10003764,1421928,7232,"Eifelkreis Bitburg-Prüm",947.952,1422,723200,"vfr Eifelkreis Bitburg-Prüm"
"1324","E3123801V000000000000000719641335","Nordex Energy GmbH","S70",1500,"11.09.2001",7232120,"50,064166","6,531388",85,70,723200018,54634,"Bitburg",1500,"2001-09-11","11YR00000003039P",10003764,1421875,7232,"Eifelkreis Bitburg-Prüm",947.916666666667,1422,723200,"vfr Eifelkreis Bitburg-Prüm"
"1325","E3123801V000000000000000719644618","Nordex Energy GmbH","S70",1500,"16.07.2002",7232120,"50,071111","6,536666",85,70,723200018,54634,"Bitburg",1500,"2002-07-16","11YR00000003039P",10003764,1421875,7232,"Eifelkreis Bitburg-Prüm",947.916666666667,1422,723200,"vfr Eifelkreis Bitburg-Prüm"
"1326","E3123801V000000000000004229008778","ENERCON GmbH","E-70 E4",2000,"24.12.2004",7235044,"49,749726","6,86983",85,70,723504044,54317,"Herl",2000,"2004-12-24","11YR00000003039P",10003764,2809452,7235,"Trier-Saarburg",1404.726,2809,723504,"Ruwer"
"1327","E3123801V000000000000004229018712","ENERCON GmbH","E-70 E4",2000,"30.12.2004",7235044,"49,747031","6,870539",85,70,723504044,54317,"Herl",2000,"2004-12-30","11YR00000003039P",10003764,2809452,7235,"Trier-Saarburg",1404.726,2809,723504,"Ruwer"
"1328","E3123801V000000000000004229018713","ENERCON GmbH","E-70 E4",2000,"11.02.2005",7235044,"49,744398","6,870248",85,70,723504044,54317,"Herl",2000,"2005-02-11","11YR00000003039P",10003764,2809452,7235,"Trier-Saarburg",1404.726,2809,723504,"Ruwer"
"1329","E3123801V000000000000004229018714","ENERCON GmbH","E-70 E4",2000,"11.04.2005",7235044,"49,763008","6,845557",113.5,70,723504044,54317,"Herl",2000,"2005-04-11","11YR00000003039P",10003764,3070915,7235,"Trier-Saarburg",1535.4575,3071,723504,"Ruwer"
"1330","E3123801V000000000000004229018715","ENERCON GmbH","E-70 E4",2000,"17.06.2005",7235044,"49,761096","6,847882",113.5,70,723504044,54317,"Herl",2000,"2005-06-17","11YR00000003039P",10003764,3070915,7235,"Trier-Saarburg",1535.4575,3071,723504,"Ruwer"
"1331","E3123801V000000000000004229018716","ENERCON GmbH","E-70 E4",2000,"22.06.2005",7235044,"49,758675","6,846453",113.5,70,723504044,54317,"Herl",2000,"2005-06-22","11YR00000003039P",10003764,3070915,7235,"Trier-Saarburg",1535.4575,3071,723504,"Ruwer"
"1332","E3123801V000000000000004229018720","ENERCON GmbH","E-70 E4",2000,"07.07.2005",7235044,"49,754719","6,872969",85,70,723504044,54317,"Herl",2000,"2005-07-07","11YR00000003039P",10003764,2809452,7235,"Trier-Saarburg",1404.726,2809,723504,"Ruwer"
"1333","E3123801V000000000000004229019076","ENERCON GmbH","E-82 E2",2300,"31.03.2011",7235044,"49,751261","6,874302",85,82,723504044,54317,"Herl",2300,"2011-03-31","11YR00000003039P",10003764,3530159,7235,"Trier-Saarburg",1534.85173913043,3530,723504,"Ruwer"
"1334","E3123801V000000000000004229050945","ENERCON GmbH","E-70 E4",2000,"11.07.2005",7235044,"49,749395","6,87474",85,70,723504044,54317,"Herl",2000,"2005-07-11","11YR00000003039P",10003764,2809452,7235,"Trier-Saarburg",1404.726,2809,723504,"Ruwer"
"1335","E3123801V000000000000004229050946","ENERCON GmbH","E-70 E4",2000,"11.08.2006",7235044,"49,754421","6,850858",113.5,70,723504044,54317,"Herl",2000,"2006-08-11","11YR00000003039P",10003764,3070915,7235,"Trier-Saarburg",1535.4575,3071,723504,"Ruwer"
"1336","E3123801V000000000000004229050947","ENERCON GmbH","E-70 E4",2000,"17.08.2006",7235044,"49,755324","6,848253",113.5,70,723504044,54317,"Herl",2000,"2006-08-17","11YR00000003039P",10003764,3070915,7235,"Trier-Saarburg",1535.4575,3071,723504,"Ruwer"
"1337","E3123801V000000000000004229050948","ENERCON GmbH","E-70 E4",2000,"25.08.2006",7235083,"49,753735","6,85408",113,70,723504044,54317,"Herl",2000,"2006-08-25","11YR00000003039P",10003764,3070915,7235,"Trier-Saarburg",1535.4575,3071,723504,"Ruwer"
"1338","E3123801V000000000000004229050949","ENERCON GmbH","E-70 E4",2000,"29.04.2009",7235083,"49,753749","6,865473",113,70,723504044,54317,"Herl",2000,"2009-04-29","11YR00000003039P",10003764,3070915,7235,"Trier-Saarburg",1535.4575,3071,723504,"Ruwer"
"1339","E3123801V000000000000004229050950","ENERCON GmbH","E-70 E4",2000,"12.09.2006",7235083,"49,753819","6,858425",113,70,723504044,54317,"Herl",2000,"2006-08-31","11YR00000003039P",10003764,3070915,7235,"Trier-Saarburg",1535.4575,3071,723504,"Ruwer"
"1340","E3123801V000000000000004229050951","ENERCON GmbH","E-70 E4",2000,"31.08.2006",7235083,"49,753216","6,862244",113,70,723504044,54317,"Herl",2000,"2006-09-12","11YR00000003039P",10003764,3070915,7235,"Trier-Saarburg",1535.4575,3071,723504,"Ruwer"
"1341","E3123801V000000000000004229050952","ENERCON GmbH","E-70 E4",2000,"26.09.2006",7235083,"49,751583","6,868932",113,70,723504044,54317,"Herl",2000,"2006-09-26","11YR00000003039P",10003764,3070915,7235,"Trier-Saarburg",1535.4575,3071,723504,"Ruwer"
"1342","E3123801V000000000000012802802672","ENERCON GmbH","E-82",2000,"27.08.2010",7235141,"49,750245","6,768498",138,82,723504141,54320,"Waldrach",2000,"2010-08-28","11YR00000003039P",10003764,4757099,7235,"Trier-Saarburg",2378.5495,4757,723504,"Ruwer"
"1343","E3123801V000000000000013889117229","Vestas Deutschland GmbH","V90",2000,"27.07.2010",7232321,"50,130261","6,504964",95,90,NA,NA,NA,NA,NA,NA,NA,NA,NA,NA,NA,NA,NA,NA
"1344","E3123801V000000000000014048818303","Vestas Deutschland GmbH","V90-2.0MW",2000,"29.09.2010",7232077,"49,878922","6,511003",105,90,723507501,54298,"Welschbillig",2000,"2010-09-29","11YR00000003039P",10003764,3458648,7235,"Trier-Saarburg",1729.324,3459,723507,"Trier-Land"
"1347","E3123801V000000000000015729530067","Vestas Deutschland GmbH","V90-2.0 MW",2000,"16.06.2011",7232061,"49,871","6,554",105,90,723507501,54298,"Welschbillig",2000,"2011-06-16","11YR00000003039P",10003764,3458648,7235,"Trier-Saarburg",1729.324,3459,723507,"Trier-Land"
"1350","E3123801V000000000000021528569943","Senvion Deutschland GmbH","3.4M 104",3370,"27.02.2013",7140144,"50,031404","7,590056",128,104,714008144,55469,"Simmern",3370,"2013-02-27","11YR00000003039P",10003764,5211177,7140,"Rhein-Hundsrück",1546.34332344214,5211,714008,"Simmern-Rheinböllen"
"1351","E3123801V000000000000021528569944","Senvion Deutschland GmbH","3.4M 104",3370,"29.12.2012",7140144,"50,028786","7,5921",128,104,714008144,55469,"Simmern",3370,"2012-12-29","11YR00000003039P",10003764,5211177,7140,"Rhein-Hundsrück",1546.34332344214,5211,714008,"Simmern-Rheinböllen"
"1352","E3123801V000000000000021528569945","Senvion Deutschland GmbH","3.4M 104",3370,"14.12.2012",7140144,"50,027814","7,577293",128,104,714008144,55469,"Simmern",3370,"2012-12-14","11YR00000003039P",10003764,5211177,7140,"Rhein-Hundsrück",1546.34332344214,5211,714008,"Simmern-Rheinböllen"
"1353","E3123801V000000000000021528569946","Senvion Deutschland GmbH","3.4M 104",3370,"08.03.2013",7140144,"50,031757","7,59694",128,104,714008144,55469,"Simmern",3370,"2013-03-08","11YR00000003039P",10003764,5211177,7140,"Rhein-Hundsrück",1546.34332344214,5211,714008,"Simmern-Rheinböllen"
"1354","E3123801V000000000000021528691907","Nordex Energy GmbH","Nordex N117",2400,"08.05.2014",7140070,"50,048699","7,488935",141,117,714008144,55469,"Simmern",2400,"2014-05-08","11YR00000003039P",10003764,5526318,7140,"Rhein-Hundsrück",2302.6325,5526,714008,"Simmern-Rheinböllen"
"1355","E3123801V000000000000021528692652","Nordex Energy GmbH","Nordex N117",2400,"09.05.2014",7140070,"50,051661","7,48711",141,117,714008144,55469,"Simmern",2400,"2014-05-09","11YR00000003039P",10003764,5526318,7140,"Rhein-Hundsrück",2302.6325,5526,714008,"Simmern-Rheinböllen"
"1356","E3123801V000000000000021528693398","REpower Systems SE","Senvion 3.2M114",3200,"25.06.2014",7140118,"50,01749","7,551112",143,114,714008144,55469,"Simmern",3200,"2014-07-04","11YR00000003039P",10003764,6329138,7140,"Rhein-Hundsrück",1977.855625,6329,714008,"Simmern-Rheinböllen"
"1361","E3123801V000000000000027432370736","Kenersys Europe GmbH","K110 – 2.4",2400,"14.02.2013",7331030,"49,813432","8,018174",145,109,733105030,55599,"Gau-Bickelheim",2400,"2013-02-14","11YR00000003039P",10003764,2430759,7331,"Alzey-Worms",1012.81625,2431,733105,"Wöllstein"
"1363","E3123801V000000000000027432568493","Kenersys Europe GmbH","K110",2400,"04.12.2012",7331030,"49,736282","5,432516",145,109,NA,NA,NA,NA,NA,NA,NA,NA,NA,NA,NA,NA,NA,NA
"1364","E3123801V000000000000027432768487","Kenersys Europe GmbH","K110 – 2.4",2400,"12.12.2012",7331030,"49,807167","8,020774",145,109,733105030,55599,"Gau-Bickelheim",2400,"2012-12-12","11YR00000003039P",10003764,2525628,7331,"Alzey-Worms",1052.345,2526,733105,"Wöllstein"
"1367","E3123801V000000000000027838466394","Senvion Deutschland GmbH","RE3.4M104",3370,"17.01.2013",7333078,"49,71652","7,724155",128,104,733307078,67823,"Unkenbach",3370,"2013-01-17","11YR00000003039P",10003764,5151581,7333,"Donnersbergkreis",1528.6590504451,5152,733307,"Nordpfälzer Land"
"1368","E3123801V000000000000027838566396","Senvion Deutschland GmbH","RE3.4M104",3370,"30.12.2012",7333078,"49,7202","7,727777",128,104,733307078,67823,"Unkenbach",3370,"2012-12-30","11YR00000003039P",10003764,5587827,7333,"Donnersbergkreis",1658.10890207715,5588,733307,"Nordpfälzer Land"
"1369","E3123801V000000000000027838666397","Senvion Deutschland GmbH","3.4M104 DFIG",3370,"21.12.2012",7333078,"49,725845","7,737166",128,104,733307078,67823,"Unkenbach",3370,"2012-12-21","11YR00000003039P",10003764,5630099,7333,"Donnersbergkreis",1670.65252225519,5630,733307,"Nordpfälzer Land"
"1371","E3123801V000000000000031195976466","ENERCON GmbH",NA,2300,"16.08.2013",7140204,"49,898822","13,690011",138.4,82,714003204,56869,"Mastershausen",2300,"2013-08-16","11YR00000003039P",10003764,4233373,7140,"Rhein-Hundsrück",1840.59695652174,4233,714003,"Kastellaun"
"1374","E3123801V000000000000031195976470","ENERCON GmbH",NA,2300,"02.09.2013",7140204,"47,589821","7,589024",138.4,82,714003204,56869,"Mastershausen",2300,"2013-09-02","11YR00000003039P",10003764,4233373,7140,"Rhein-Hundsrück",1840.59695652174,4233,714003,"Kastellaun"
"1375","E3123801V000000000000031195976471","ENERCON GmbH","E70-E4",2300,"03.09.2013",7140204,"50,002117","7,383585",NA,NA,714003204,56869,"Mastershausen",2300,"2013-09-03","11YR00000003039P",10003764,3339418,7140,"Rhein-Hundsrück",1451.92086956522,3339,714003,"Kastellaun"
"1378","E3123801V000000000000031195984899","ENERCON GmbH","E 82",2300,"12.09.2013",7140062,"50,01384","7,37215",138.38,82,714003204,56869,"Mastershausen",2300,"2013-09-12","11YR00000003039P",10003764,3968473,7140,"Rhein-Hundsrück",1725.42304347826,3968,714003,"Kastellaun"
"1379","E3123801V000000000000031195984900","ENERCON GmbH","E 82",2300,"12.09.2013",7140062,"50,01759","7,378417",138.38,82,714003204,56869,"Mastershausen",2300,"2013-09-12","11YR00000003039P",10003764,3968473,7140,"Rhein-Hundsrück",1725.42304347826,3968,714003,"Kastellaun"
"1380","E3123801V000000000000031196276455","ENERCON GmbH","E-101",3050,"03.09.2014",7140204,"50,045237","7,362371",138,101,714003204,56869,"Mastershausen",3050,"2014-09-03","11YR00000003039P",10003764,6077181,7140,"Rhein-Hundsrück",1992.51836065574,6077,714003,"Kastellaun"
"1381","E3123801V000000000000031196276457","ENERCON GmbH","E-101",3050,"09.10.2014",7140204,"50,045943","7,368841",138,101,714003204,56869,"Mastershausen",3050,"2014-10-09","11YR00000003039P",10003764,6077181,7140,"Rhein-Hundsrück",1992.51836065574,6077,714003,"Kastellaun"
"1382","E3123801V000000000000031196276461","ENERCON GmbH","E-101",3050,"21.10.2014",7140009,"50,044244","7,372994",135,101,714003204,56869,"Mastershausen",3050,"2014-10-21","11YR00000003039P",10003764,6077181,7140,"Rhein-Hundsrück",1992.51836065574,6077,714003,"Kastellaun"
"1383","E3123801V000000000000031196276462","ENERCON GmbH","E-101",3050,"31.10.2014",7140009,"50,041611","7,377664",138,NA,714003204,56869,"Mastershausen",3050,"2014-10-31","11YR00000003039P",10003764,6077181,7140,"Rhein-Hundsrück",1992.51836065574,6077,714003,"Kastellaun"
"1385","E3123801V000000000000032193294368","ENERCON GmbH","E-101",3050,"30.07.2014",7339063,"50,002616","7,7336",149,101,733901063,55413,"Weiler bei Bingen",3050,"2014-07-30","11YR00000003039P",10003764,8337302,7339,"Mainz-Bingen",2733.54163934426,8337,733901,"Rhein-Nahe"
"1386","E3123801V000000000000032193393403","ENERCON GmbH","E-101",3050,"24.06.2014",7133023,"49,991421","7,719049",149,101,733901063,55413,"Weiler",3050,"2014-06-24","11YR00000003039P",10003764,9573437,7339,"Mainz-Bingen",3138.83180327869,9573,733901,"Rhein-Nahe"
"1387","E3123801V000000000000032193394121","ENERCON GmbH","E-101",3050,"18.07.2014",7133023,"49,995065","7,723306",149,101,733901063,55413,"Weiler",3050,"2014-07-18","11YR00000003039P",10003764,9573437,7339,"Mainz-Bingen",3138.83180327869,9573,733901,"Rhein-Nahe"
"1388","E3123801V000000000000032193394124","ENERCON GmbH","E-101",3050,"19.07.2014",7133023,"49,990386","7,728843",149,101,733901063,55413,"Weiler",3050,"2014-07-19","11YR00000003039P",10003764,9573437,7339,"Mainz-Bingen",3138.83180327869,9573,733901,"Rhein-Nahe"
"1389","E3123801V000000000000032193394372","ENERCON GmbH","E-101",3050,"30.07.2014",7339063,"50,001159","7,740992",149,101,733901063,55413,"Weiler",3050,"2014-07-30","11YR00000003039P",10003764,9573437,7339,"Mainz-Bingen",3138.83180327869,9573,733901,"Rhein-Nahe"
"1390","E3123801V000000000000032193400851","ENERCON GmbH","E-101",3050,"23.10.2013",7133023,"49,99036","7,723882",149,101,733901063,55413,"Weiler bei Bingen",3050,"2013-10-23","11YR00000003039P",10003764,8922424,7339,"Mainz-Bingen",2925.38491803279,8922,733901,"Rhein-Nahe"
"1391","E3123801V000000000000032193483982","ENERCON GmbH","E-101",3050,"14.10.2013",7133023,"49,992622","7,734761",149,101,733901063,55413,"Weiler bei Bingen",3050,"2013-10-14","11YR00000003039P",10003764,8922424,7339,"Mainz-Bingen",2925.38491803279,8922,733901,"Rhein-Nahe"
"1392","E3123801V000000000000032519687348","Vestas Deutschland GmbH","Vestas V112-3.0 MW",3075,"30.12.2013",7331021,"49,746003","8,01959",140,112,733100003,55232,"Alzey",3075,"2013-12-30","11YR00000003039P",10003764,7091736,7331,"Alzey-Worms",2306.2556097561,7092,733100,"Alzey"
"1393","E3123801V000000000000032519687351","Vestas Deutschland GmbH","Vestas V112-3.0 MW",3075,"30.12.2013",7331021,"49,741697","8,023022",140,112,733101043,55237,"Lonsheim",3075,"2013-12-30","11YR00000003039P",10003764,6594009,7331,"Alzey-Worms",2144.39317073171,6594,733101,"Alzey-Land"
"1394","E3123801V000000000000032519689461","Vestas Deutschland GmbH","Vestas V112-3.0 MW",3075,"21.01.2014",7331021,"49,738066","8,022387",140,112,733101043,55237,"Lonsheim",3075,"2014-01-21","11YR00000003039P",10003764,6594009,7331,"Alzey-Worms",2144.39317073171,6594,733101,"Alzey-Land"
"1395","E3123801V000000000000032519689463","Vestas Deutschland GmbH","Vestas V112-3.0 MW",3075,"23.01.2014",7331021,"49,741691","8,028782",140,112,733101043,55237,"Lonsheim",3075,"2014-01-23","11YR00000003039P",10003764,6594009,7331,"Alzey-Worms",2144.39317073171,6594,733101,"Alzey-Land"
"1396","E3123801V000000000000032519689465","Vestas Deutschland GmbH","Vestas V112-3.0 MW",3075,"11.02.2014",7331021,"49,738772","8,030395",140,112,733101043,55237,"Lonsheim",3075,"2014-02-11","11YR00000003039P",10003764,6594009,7331,"Alzey-Worms",2144.39317073171,6594,733101,"Alzey-Land"
"1397","E3123801V000000000000032519787770","Vestas Deutschland GmbH","Vestas V112-3.0 MW",3075,"30.12.2013",7331021,"49,745082","8,02455",140,112,733101043,55237,"Lonsheim",3075,"2013-12-30","11YR00000003039P",10003764,6594009,7331,"Alzey-Worms",2144.39317073171,6594,733101,"Alzey-Land"
"1398","E3123801V000000000000032519789456","Vestas Deutschland GmbH","V112-3.0 MW",3075,"31.01.2014",7331021,"49,738802","8,013684",140,112,733100003,55232,"Alzey",3075,"2014-01-31","11YR00000003039P",10003764,7091736,7331,"Alzey-Worms",2306.2556097561,7092,733100,"Alzey"
"1399","E3123801V000000000000032519789458","Vestas Deutschland GmbH","V112-3.0 MW",3075,"03.03.2014",7331021,"49,735981","8,016129",140,112,733100003,55232,"Alzey",3075,"2014-03-03","11YR00000003039P",10003764,7091736,7331,"Alzey-Worms",2306.2556097561,7092,733100,"Alzey"
"1400","E3123801V000000000000032519789459","Vestas Deutschland GmbH","V112-3.0 MW",3075,"26.02.2014",7331021,"49,742814","8,017961",140,112,733100003,55232,"Alzey",3075,"2014-02-26","11YR00000003039P",10003764,7091736,7331,"Alzey-Worms",2306.2556097561,7092,733100,"Alzey"
"1403","E3123801V000000000000033790488660","GE Wind Energy GmbH","GE 2,5-120",2530,"20.12.2013",7133083,"49,72168","7,70919",139,120,713310065,55590,"Meisenheim",2530,"2013-12-20","11YR00000003039P",10003764,5321490,7133,"Bad Kreuznach",2103.3557312253,5321,713310,"Nahe Glan"
"1404","E3123801V000000000000033790488662","GE Wind Energy GmbH","GE 2,5-120",2530,"14.12.2013",7133083,"49,71779","7,718912",139,120,713310065,55590,"Meisenheim",2530,"2013-12-14","11YR00000003039P",10003764,5321490,7133,"Bad Kreuznach",2103.3557312253,5321,713310,"Nahe Glan"
"1405","E3123801V000000000000033790489272","GE Wind Energy GmbH","GE 2,5-120",2530,"08.03.2014",7133083,"49,726944","7,703056",139,120,713310065,55590,"Meisenheim",2530,"2014-03-08","11YR00000003039P",10003764,5321490,7133,"Bad Kreuznach",2103.3557312253,5321,713310,"Nahe Glan"
"1406","E3123801V000000000000033790489273","GE Wind Energy GmbH","GE 2,5-120",2530,"28.02.2014",7133083,"49,723891","7,703889",139,120,713310065,55590,"Meisenheim",2530,"2014-02-28","11YR00000003039P",10003764,5321490,7133,"Bad Kreuznach",2103.3557312253,5321,713310,"Nahe Glan"
"1407","E3123801V000000000000033790588672","GE Wind Energy GmbH","GE 2,5-120",2530,"27.01.2014",7133083,"49,712513","7,718356",139,120,713310065,55590,"Meisenheim",2530,"2014-01-27","11YR00000003039P",10003764,5297175,7133,"Bad Kreuznach",2093.74505928854,5297,713310,"Nahe Glan"
"1408","E3123801V000000000000033790588673","GE Wind Energy GmbH","GE 2,5-120",2530,"15.02.2014",7133083,"49,719444","7,704722",139,120,713310065,55590,"Meisenheim",2530,"2014-02-15","11YR00000003039P",10003764,5297175,7133,"Bad Kreuznach",2093.74505928854,5297,713310,"Nahe Glan"
"1410","E3123801V000000000000033790688666","GE Wind Energy GmbH","GE 2,5-120",2530,"11.12.2013",7333054,"49,727512","7,744745",139,120,713310065,55590,"Meisenheim",2530,"2013-12-11","11YR00000003039P",10003764,5321490,7133,"Bad Kreuznach",2103.3557312253,5321,713310,"Nahe Glan"
"1411","E3123801V000000000000033790988668","GE Wind Energy GmbH","GE 2,5-120",2530,"12.02.2014",7133083,"49,715846","7,718356",139,120,713310065,55590,"Meisenheim",2530,"2014-02-12","11YR00000003039P",10003764,5297175,7133,"Bad Kreuznach",2093.74505928854,5297,713310,"Nahe Glan"
"1412","E3123801V000000000000033790988976","GE Wind Energy GmbH","GE 2,5-120",2530,"28.02.2014",7133083,"49,718056","7,696667",139,120,713310065,55590,"Meisenheim",2530,"2014-02-28","11YR00000003039P",10003764,5297175,7133,"Bad Kreuznach",2093.74505928854,5297,713310,"Nahe Glan"
"1413","E3123801V000000000000033790989274","GE Wind Energy GmbH","GE 2,5-120",2530,"09.03.2014",7133083,"49,721402","7,696134",139,120,713310065,55590,"Meisenheim",2530,"2014-03-09","11YR00000003039P",10003764,5297175,7133,"Bad Kreuznach",2093.74505928854,5297,713310,"Nahe Glan"
"1414","E3123801V000000000000033790989275","GE Wind Energy GmbH","GE 2,5-120",2530,"08.03.2014",7133083,"49,721124","7,688356",139,120,713310065,55590,"Meisenheim",2530,"2014-03-08","11YR00000003039P",10003764,5297175,7133,"Bad Kreuznach",2093.74505928854,5297,713310,"Nahe Glan"
"1415","E3123801V000000000000038295395669","GE Wind Energy GmbH","GE 2.5-120",2530,"21.11.2014",7339062,"49,978233","7,791959",139,120,733901045,55413,"Oberheimbach",2530,"2014-11-21","11YR00000003039P",10003764,6928471,7339,"Mainz-Bingen",2738.52608695652,6928,733901,"Rhein-Nahe"
"1416","E3123801V000000000000038295395670","GE Wind Energy GmbH","GE 2.5-120",2530,"14.11.2014",7339062,"49,975338","7,798027",139,120,733901045,55413,"Oberheimbach",2530,"2014-11-14","11YR00000003039P",10003764,6928471,7339,"Mainz-Bingen",2738.52608695652,6928,733901,"Rhein-Nahe"
"1417","E3123801V000000000000038849400823","Senvion Deutschland GmbH","Repower 3.4M104",3370,"19.12.2014",7331015,"49,751525","8,266347",128,104,733907201,67585,"Dorn-DÃ¼rkheim",3370,"2014-12-19",NA,10003764,5832008,7339,"Mainz-Bingen",1730.56617210682,5832,733907,"Rhein-Selz"
"1418","E3123801V000000000000038849406188","Senvion Deutschland GmbH","Repower 3.4M104",3370,"04.06.2015",7331015,"49,748773","8,267707",128,104,733907201,67585,"Dorn-DÃ¼rkheim",3370,"2015-06-04",NA,10003764,5832008,7339,"Mainz-Bingen",1730.56617210682,5832,733907,"Rhein-Selz"
"1419","E3123801V000000000000038849406189","Senvion Deutschland GmbH","Repower 3.4M104",3370,"04.06.2015",7331015,"49,746156","8,269329",128,104,733907201,67585,"Dorn-DÃ¼rkheim",3370,"2015-06-04",NA,10003764,5832008,7339,"Mainz-Bingen",1730.56617210682,5832,733907,"Rhein-Selz"
"1424","E3123801V000000000000039539289327","ENERCON GmbH","E-92",2350,"16.12.2014",7143029,"50,607408","7,775155",138,92,714307066,56244,"Schenkelberg",2350,"2014-12-16",NA,10003764,4131307,7143,"Westerwald",1758.0029787234,4131,714307,"Selters (Westerwald)"
"1429","E3123801V000000000000042827604714","ENERCON GmbH","E-101-3.050",3050,"27.11.2015",7231087,"49,857302","7,06161",149,101,723101040,54472,"Gornhausen",3050,"2015-11-27",NA,10003764,9396323,7231,"Bernkastel-Wittlich",3080.76163934426,9396,723101,"Bernkastel-Kues"
"1430","E3123801V000000000000042827604715","ENERCON GmbH","E-101-3.050",3050,"11.12.2015",7231087,"49,852938","7,069075",149,101,723101040,54472,"Gornhausen",3050,"2015-12-11",NA,10003764,9396323,7231,"Bernkastel-Wittlich",3080.76163934426,9396,723101,"Bernkastel-Kues"
"1431","E3123801V000000000000042827704713","ENERCON GmbH","E-101-3.050",3050,"26.10.2015",7231087,"49,853151","7,058145",149,101,723101040,54472,"Gornhausen",3050,"2015-10-26",NA,10003764,9315054,7231,"Bernkastel-Wittlich",3054.11606557377,9315,723101,"Bernkastel-Kues"
"1432","E3123801V000000000000042827707438","ENERCON GmbH","E-101-3.050",3050,"04.11.2015",7231087,"49,850065","7,061872",149,101,723101040,54472,"Gornhausen",3050,"2015-11-04",NA,10003764,9315054,7231,"Bernkastel-Wittlich",3054.11606557377,9315,723101,"Bernkastel-Kues"
"1433","E3123801V000000000000042827805112","ENERCON GmbH","E-101-3.050",3050,"21.12.2015",7231040,"49,840826","7,03932",149,101,723101126,54472,"Veldenz",3050,"2015-12-21",NA,10003764,7751096,7231,"Bernkastel-Wittlich",2541.34295081967,7751,723101,"Bernkastel-Kues"
"1434","E3123801V000000000000042827839389","ENERCON GmbH","E-101-3.050",3050,"13.11.2015",7231040,"49,844964","7,040975",149,101,723101126,54472,"Veldenz",3050,"2015-11-13",NA,10003764,7751096,7231,"Bernkastel-Wittlich",2541.34295081967,7751,723101,"Bernkastel-Kues"
"1435","E3123801V000000000000046747515736","Vestas Deutschland GmbH","V112",3300,"16.11.2016",7233235,"50,31105","6,477599",NA,112,NA,NA,NA,NA,NA,NA,NA,NA,NA,NA,NA,NA,NA,NA
"1436","E3123801V000000000000046747516572","Vestas Deutschland GmbH","V112",3300,"30.12.2016",7233235,"50,311328","6,484659",NA,112,NA,NA,NA,NA,NA,NA,NA,NA,NA,NA,NA,NA,NA,NA
"1437","E3123801V000000000000047525090951","Vestas Deutschland GmbH","V112-3,3 MW",3300,"19.08.2016",7231058,"49,830822","6,983196",140,112,723106058,54497,"Horath",3300,"2016-09-15",NA,10003764,7140397,7231,"Bernkastel-Wittlich",2163.75666666667,7140,723106,"Thalfang am Erbeskopf"
"1438","E3123801V000000000000047525090952","Vestas Deutschland GmbH","V112-3,3 MW",3300,"30.08.2016",7231058,"49,828878","6,977465",140,112,723106058,54497,"Horath",3300,"2016-08-29",NA,10003764,7140397,7231,"Bernkastel-Wittlich",2163.75666666667,7140,723106,"Thalfang am Erbeskopf"
"1439","E3123801V000000000000047525090953","Vestas Deutschland GmbH","V112-3,3 MW",3300,"26.09.2016",7231058,"49,82445","6,964982",140,112,723106058,54497,"Horath",3300,"2016-08-30",NA,10003764,7140397,7231,"Bernkastel-Wittlich",2163.75666666667,7140,723106,"Thalfang am Erbeskopf"
"1440","E3123801V000000000000047525090954","Vestas Deutschland GmbH","V112-3,3 MW",3300,"15.09.2016",7231058,"49,832005","6,976208",140,112,723106058,54497,"Horath",3300,"2016-09-26",NA,10003764,7140397,7231,"Bernkastel-Wittlich",2163.75666666667,7140,723106,"Thalfang am Erbeskopf"
"1441","E3123801V000000000000047525090955","Vestas Deutschland GmbH","V112-3,3 MW",3300,"21.09.2016",7231058,"49,82777","6,965524",140,112,723106058,54497,"Horath",3300,"2016-09-21",NA,10003764,7140397,7231,"Bernkastel-Wittlich",2163.75666666667,7140,723106,"Thalfang am Erbeskopf"
"1442","E3123801V000000000000047525090956","Vestas Deutschland GmbH","V112-3,3 MW",3300,"29.08.2016",7231058,"49,823842","6,976507",140,112,723106058,54497,"Horath",3300,"2016-09-21",NA,10003764,7140397,7231,"Bernkastel-Wittlich",2163.75666666667,7140,723106,"Thalfang am Erbeskopf"
"1443","E3123801V000000000000047525090957","Vestas Deutschland GmbH","V112-3,3 MW",3300,"15.08.2016",7231058,"49,825686","6,988916",140,112,723106058,54497,"Horath",3300,"2016-08-19",NA,10003764,7140397,7231,"Bernkastel-Wittlich",2163.75666666667,7140,723106,"Thalfang am Erbeskopf"
"1444","E3123801V000000000000047525090958","Vestas Deutschland GmbH","V112-3,3 MW",3300,"15.08.2016",7231058,"49,828231","6,985751",140,112,723106058,54497,"Horath",3300,"2016-08-15",NA,10003764,7140397,7231,"Bernkastel-Wittlich",2163.75666666667,7140,723106,"Thalfang am Erbeskopf"
"1445","E3123801V000000000000047525090959","Vestas Deutschland GmbH","V112-3,3 MW",3300,"21.09.2016",7231058,"49,824933","6,971011",140,112,NA,NA,NA,NA,NA,NA,NA,NA,NA,NA,NA,NA,NA,NA
"1446","E3123801V000000000000047879304717","ENERCON GmbH","E-101",3050,"31.05.2017",7231040,"49,843888","7,052382",149,101,723101040,54472,"Gornhausen",3050,"2017-05-31",NA,10003764,7823957,7231,"Bernkastel-Wittlich",2565.23180327869,7824,723101,"Bernkastel-Kues"
"1447","E3123801V000000000000047879304718","ENERCON GmbH","E-101",3050,"28.04.2017",7231040,"49,84158","7,055243",135.4,101,723101040,54472,"Gornhausen",3050,"2017-04-28",NA,10003764,7823957,7231,"Bernkastel-Wittlich",2565.23180327869,7824,723101,"Bernkastel-Kues"
"1448","E3123801V000000000000050928012243","ENERCON GmbH","E-115",3000,"29.06.2017",7333021,"49,678824","7,722762",135,115,713310065,55590,"Meisenheim",3000,"2017-06-29",NA,10003764,6496225,7133,"Bad Kreuznach",2165.40833333333,6496,713310,"Nahe Glan"
"1449","E3123801V000000000000050928012244","ENERCON GmbH","E-115",3000,"12.05.2017",7333021,"49,690647","7,727999",135,115,713310065,55590,"Meisenheim",3000,"2017-05-12",NA,10003764,6496225,7133,"Bad Kreuznach",2165.40833333333,6496,713310,"Nahe Glan"
"1450","E3123801V000000000000050928017292","ENERCON GmbH","E-115",3000,"29.05.2017",7333021,"49,68635","7,72495",135,115,713310065,55590,"Meisenheim",3000,"2017-05-29",NA,10003764,6496225,7133,"Bad Kreuznach",2165.40833333333,6496,713310,"Nahe Glan"
"1451","E3123801W000000000000025131238865","ENERCON GmbH","E-92",2350,"07.02.2019",7134042,"49,59997","7,212961",138,92,713401075,55776,"Ruschberg",2350,"2019-02-07",NA,10003764,4124755,7134,"Birkenfeld",1755.21489361702,4125,713401,"Baumholder"
"1452","E3123801W000000000000112910108114","ENERCON GmbH","E 92",2350,"01.12.2017",7134034,"49,69311","7,17386",138,92,713402034,55767,"Hattgenstein",2350,"2017-12-01",NA,10003764,4745276,7134,"Birkenfeld",2019.26638297872,4745,713402,"Birkefeld"
"1453","E3123801W000000000000115761183348","Nordex Energy GmbH","N 117-2.4",2400,"06.03.2017",7134020,"49,644732","7,202057",141,116.8,713402020,55765,"Dienstweiler",2400,"2017-03-06",NA,10003764,5318617,7134,"Birkenfeld",2216.09041666667,5319,713402,"Birkefeld"
"1454","E3123801W000000000000131851180600","Vestas Deutschland GmbH","V126-3.0",3300,"22.12.2016",7336084,"49,55162","7,283568",137,126,713401075,55776,"Ruschberg",3450,"2016-12-22",NA,10003764,10030175,7134,"Birkenfeld",2907.29710144928,10030,713401,"Baumholder"
"1455","E3123801W000000000000461651219968","ENERCON GmbH","E82",2300,"26.04.2017",7232201,"50,114717","6,315638",138,82,723201201,54687,"Arzfeld",2300,"2017-04-25",NA,10003764,3508596,7232,"Eifelkreis Bitburg-Prüm",1525.47652173913,3509,723201,"Arzfeld"
"1456","E3123801W000000000001404481242491","ENERCON GmbH","E-82",2300,"26.07.2019",7140010,"50,113422","13,449273",98,82,NA,NA,NA,NA,NA,NA,NA,NA,NA,NA,NA,NA,NA,NA
"1457","E3123801W000000000001624361171016","ENERCON GmbH","E-82",2300,"06.12.2017",7131211,"50,411694","7,170454",108.38,NA,713104211,56745,"Weibern",2300,"2017-12-20",NA,10003764,4577131,7131,"Ahrweiler",1990.05695652174,4577,713104,"Brohltal"
"1458","E3123801W000000000002771761215599","ENERCON GmbH","E-82 E2",2300,"23.11.2016",7235068,"49,649581","6,65908",138,82,723503106,54331,"Pellingen",2300,"2016-11-23",NA,10003764,5930833,7235,"Trier-Saarburg",2578.62304347826,5931,723503,"Konz"
"1459","E3123801W000000000002771761226679","ENERCON GmbH","E-82 E2",2300,"29.03.2018",7235068,"49,647389","6,658705",138,82,723503106,54331,"Pellingen",2300,"2018-03-29",NA,10003764,5930833,7235,"Trier-Saarburg",2578.62304347826,5931,723503,"Konz"
"1460","E3123801W000000000003104781216340","ENERCON GmbH","E-92",2350,"29.12.2016",7339062,"49,972484","7,78479",138,92,733901063,55413,"Weiler bei Bingen",2350,"2016-12-29",NA,10003764,3928189,7339,"Mainz-Bingen",1671.56978723404,3928,733901,"Rhein-Nahe"
"1461","E3123801W000000000003104781216341","ENERCON GmbH","E-92",2350,"24.03.2017",7339062,"49,969897","7,791474",138,92,733901063,55413,"Weiler bei Bingen",2350,"2017-03-24",NA,10003764,3928189,7339,"Mainz-Bingen",1671.56978723404,3928,733901,"Rhein-Nahe"
"1462","E3123801W000000000003104781216342","ENERCON GmbH","E-92",2350,"31.03.2017",7339062,"49,971001","7,788126",138,92,733901063,55413,"Weiler bei Bingen",2350,"2017-03-31",NA,10003764,3928189,7339,"Mainz-Bingen",1671.56978723404,3928,733901,"Rhein-Nahe"
"1463","E3123801W000000000003114481216530","ENERCON GmbH","E-82 E2 TES",2300,"08.11.2016",7140154,"49,981083","7,431074",138,82,714008144,55469,"Simmern",2300,"2016-11-08",NA,10003764,3716943,7140,"Rhein-Hundsrück",1616.06217391304,3717,714008,"Simmern-Rheinböllen"
"1464","E3123801W000000000003114481216531","ENERCON GmbH","E-115",3000,"04.01.2017",7140049,"49,981816","7,422137",135,115,714008144,55469,"Simmern",3000,"2017-01-04",NA,10003764,5821716,7140,"Rhein-Hundsrück",1940.572,5822,714008,"Simmern-Rheinböllen"
"1467","E3123801W000000000003119321006081","Vestas Deutschland GmbH","V 126",3300,"29.08.2016",7140095,"50,022152","7,445345",149,126,714003095,56288,"Michelbach",3300,"2016-08-29",NA,10003764,7462962,7140,"Rhein-Hundsrück",2261.50363636364,7463,714003,"Kastellaun"
"1468","E3123801W000000000003160841212099","Vestas Deutschland GmbH","V136",3600,"31.12.2018",7134082,"49,683209","7,519205",149,136,713405083,55758,"Sienhachenbach",3600,"2018-12-31",NA,10003764,6730225,7134,"Birkenfeld",1869.50694444444,6730,713405,"Herstein-Rhaunen"
"1469","E3123801W000000000003160841212100","Vestas Deutschland GmbH","V136",3600,"02.02.2019",7134082,"49,68639","7,521022",149,136,713405083,55758,"Sienhachenbach",3600,"2019-02-02",NA,10003764,6300956,7134,"Birkenfeld",1750.26555555556,6301,713405,"Herstein-Rhaunen"
"1470","E3123801W000000000003163651173390","Nordex Energy GmbH","N-117",2400,"22.04.2017",7135038,"55,64963","3,68882",140.6,116.8,713502038,56761,"Hambuch",2400,"2017-04-22",NA,10003764,5802876,7135,"Cochem-Zell",2417.865,5803,713502,"Kaisersesch"
"1474","E3123801W000000000003484410071574","GE Wind Energy GmbH","GE 2.5",2530,"04.11.2016",7135026,"50,272019","7,091496",139,120,713502045,56759,"Kaisersesch",2530,"2016-11-04",NA,10003764,7805774,7135,"Cochem-Zell",3085.28616600791,7806,713502,"Kaisersesch"
"1475","E3123801W000000000003484410071577","GE Wind Energy GmbH","GE 2.5",2530,"22.11.2016",7135026,"50,270511","7,080779",139,120,713502045,56759,"Kaisersesch",2530,"2016-11-22",NA,10003764,7805774,7135,"Cochem-Zell",3085.28616600791,7806,713502,"Kaisersesch"
"1476","E3123801W000000000003484410071578","GE Wind Energy GmbH","GE 2.5",2530,"16.11.2016",7135026,"50,268691","7,085497",139,120,713502045,56759,"Kaisersesch",2530,"2016-11-16",NA,10003764,7805774,7135,"Cochem-Zell",3085.28616600791,7806,713502,"Kaisersesch"
"1477","E3123801W000000000003528601167290","Senvion Deutschland GmbH","SEN 3.2M114",3200,"24.03.2018",7140014,"50,13803","7,587343",143,114,714009031,56281,"DÃ¶rth",3170,"2018-03-24",NA,10003764,8031466,7140,"Rhein-Hundsrück",2533.58548895899,8031,714009,"Hundsrück-Mittelrhein"
"1478","E3123801W000000000003595481188136","ENERCON GmbH","E-115",3000,"23.03.2017",7233232,"50,320052","6,458766",149,115,723306214,54611,"Hallschlag",3000,"2017-03-23",NA,10003764,9311509,7233,"Vulkaneifel",3103.83633333333,9312,723306,"Geroldstein"
"1479","E3123801W000000000003595481188137","ENERCON GmbH","E-115",3000,"28.02.2017",7233232,"50,317351","6,461523",149,115,723306214,54611,"Hallschlag",3000,"2017-02-28",NA,10003764,9311509,7233,"Vulkaneifel",3103.83633333333,9312,723306,"Geroldstein"
"1480","E3123801W000000000003595481188138","ENERCON GmbH","E-115",3000,"30.03.2017",7233232,"50,315906","6,467866",149,115,723306214,54611,"Hallschlag",3000,"2017-03-30",NA,10003764,9311509,7233,"Vulkaneifel",3103.83633333333,9312,723306,"Geroldstein"
"1481","E3123801W000000000003595481188139","ENERCON GmbH","E-115",3000,"08.02.2017",7233232,"50,320214","6,469899",149,115,723306214,54611,"Hallschlag",3000,"2017-02-08",NA,10003764,9311509,7233,"Vulkaneifel",3103.83633333333,9312,723306,"Geroldstein"
"1483","E3123801W000000000003605371189724","GE Wind Energy GmbH","GE-120-2,75/139,00/120,00/2,78MW",2780,"03.08.2016",7133060,"49,678869","7,595091",139,120,713310060,67744,"LÃ¶llbach",2780,"2016-08-03",NA,10003764,6038854,7133,"Bad Kreuznach",2172.24964028777,6039,713310,"Nahe Glan"
"1485","E3123801W000000000003672131214793","ENERCON GmbH","E-141 EP4",4200,"21.03.2017",7331024,"49,671945","8,196543",129,141,733107036,67598,"Gundersheim",4200,"2017-03-21",NA,10003764,8797734,7331,"Alzey-Worms",2094.69857142857,8798,733107,"Wonnegau"
"1492","E3123801W000000000003807051225828","ENERCON GmbH","E82",2300,"30.12.2017",7232231,"50,16855","6,238719",138,82,723206231,54597,"Habscheid",2300,"2017-12-30",NA,10003764,4981752,7232,"Eifelkreis Bitburg-Prüm",2165.97913043478,4982,723206,"Prüm"
"1493","E3123801W000000000003880851194784","ENERCON GmbH","E-82 E2",2300,"12.08.2016",7233237,"50,350775","6,407605",138,82,723306237,54611,"Scheid",2300,"2016-08-17",NA,10003764,5003229,7233,"Vulkaneifel",2175.31695652174,5003,723306,"Geroldstein"
"1494","E3123801W000000000004242291178082","ENERCON GmbH","E-115",3000,"25.03.2017",7233035,"50,328792","6,505922",149,115,723306214,54611,"Hallschlag",3000,"2017-03-25",NA,10003764,8637095,7233,"Vulkaneifel",2879.03166666667,8637,723306,"Geroldstein"
"1495","E3123801W000000000004242291178083","ENERCON GmbH","E-115",3000,"17.03.2017",7233035,"50,325069","6,50599",149,115,723306214,54611,"Hallschlag",3000,"2017-03-17",NA,10003764,8637095,7233,"Vulkaneifel",2879.03166666667,8637,723306,"Geroldstein"
"1496","E3123801W000000000004242291178084","ENERCON GmbH","E-115",3000,"26.04.2017",7233035,"50,319631","6,499447",149,115,723306214,54611,"Hallschlag",3000,"2017-04-26",NA,10003764,8637095,7233,"Vulkaneifel",2879.03166666667,8637,723306,"Geroldstein"
"1497","E3123801W000000000004242291178085","ENERCON GmbH","E-115",3000,"22.02.2017",7233035,"50,315067","6,492635",149,115,723306214,54611,"Hallschlag",3000,"2017-02-22",NA,10003764,8637095,7233,"Vulkaneifel",2879.03166666667,8637,723306,"Geroldstein"
"1498","E3123801W000000000004242291204109","ENERCON GmbH","E115",3000,"30.03.2017",7233035,"50,311289","6,492229",149,115,723306214,54611,"Hallschlag",3000,"2017-03-30",NA,10003764,8637091,7233,"Vulkaneifel",2879.03033333333,8637,723306,"Geroldstein"
"1502","E3123801W000000000004674601212218","Vestas Deutschland GmbH","V112",3300,"04.11.2016",7233235,"50,312527","6,472532",NA,112,NA,NA,NA,NA,NA,NA,NA,NA,NA,NA,NA,NA,NA,NA
"1503","E3123801W000000000004697680090121","ENERCON GmbH","E-82",2300,"28.07.2017",7232217,"50,130806","6,402346",138.38,82,723201217,54649,"Eilscheid",2300,"2017-07-28",NA,10003764,5155351,7232,"Eifelkreis Bitburg-Prüm",2241.45695652174,5155,723201,"Arzfeld"
"1504","E3123801W000000000004697680090137","ENERCON GmbH","E-82",2300,"30.08.2017",7232217,"50,13152","6,406115",138.38,82,723201217,54649,"Eilscheid",2300,"2017-08-30",NA,10003764,5155351,7232,"Eifelkreis Bitburg-Prüm",2241.45695652174,5155,723201,"Arzfeld"
"1505","E3123801W000000000004787901204716","ENERCON GmbH","E-101",3050,"10.11.2016",7231040,"49,845077","7,047104",149,101,723101040,54472,"Gornhausen",3050,"2016-11-10",NA,10003764,7823957,7231,"Bernkastel-Wittlich",2565.23180327869,7824,723101,"Bernkastel-Kues"
"1508","E3123801W000000000004939660117927","ENERCON GmbH","E-101",3050,"31.03.2017",7232262,"50,142","6,402",149,101,723206290,54595,"Orlenbach",3050,"2017-03-31",NA,10003764,7702931,7232,"Eifelkreis Bitburg-Prüm",2525.55114754098,7703,723206,"Prüm"
"1510","E3123801W000000000005092531212242","ENERCON GmbH","E-115",3000,"27.04.2017",7333021,"49,695923","7,733352",135,115,713310065,55590,"Meisenheim",3000,"2017-04-27",NA,10003764,6496225,7133,"Bad Kreuznach",2165.40833333333,6496,713310,"Nahe Glan"
"1511","E3123801W000000000005180781177653","Vestas Deutschland GmbH","V 112",3450,"11.06.2018",7232308,"50,196222","6,336681",140,112,723206320,54595,"Watzerath",3450,"2018-06-11",NA,10003764,4415850,7232,"Eifelkreis Bitburg-Prüm",1279.95652173913,4416,723206,"Prüm"
"1512","E3123801W000000000005180781219776","GE Wind Energy GmbH","GE 2.75-120",2750,"13.07.2017",7232292,"50,187655","6,338124",139,120,723206320,54595,"Watzerath",2780,"2017-07-05",NA,10003764,4142851,7232,"Eifelkreis Bitburg-Prüm",1490.23417266187,4143,723206,"Prüm"
"1513","E3123801W000000000005258220151966","Nordex SE","N117/2400 PH141",2400,"09.09.2017",7231006,"49,774174","6,959297",140.6,116.8,723106006,54426,"Berglicht",2400,"2017-09-09",NA,10003764,6287325,7231,"Bernkastel-Wittlich",2619.71875,6287,723106,"Thalfang am Erbeskopf"
"1514","E3123801W000000000005263711190971","Vestas Deutschland GmbH","Vestas V112 3,3 MW",3300,"27.07.2017",7231202,"49,782954","6,930907",140,112,723106202,54426,"Breit",3300,"2017-07-27",NA,10003764,5943759,7231,"Bernkastel-Wittlich",1801.13909090909,5944,723106,"Thalfang am Erbeskopf"
"1515","E3123801W000000000005263711190972","Vestas Deutschland GmbH","Vestas V112 3,3 MW",3300,"30.08.2017",7231115,"49,766419","6,934375",140,112,723106202,54426,"Breit",3300,"2017-08-30",NA,10003764,5943759,7231,"Bernkastel-Wittlich",1801.13909090909,5944,723106,"Thalfang am Erbeskopf"
"1516","E3123801W000000000005263711190975","Vestas Deutschland GmbH","Vestas V112 3,3 MW",3300,"30.07.2017",7231203,"49,779759","6,932377",140,112,723106202,54426,"Breit",3300,"2017-07-30",NA,10003764,5943759,7231,"Bernkastel-Wittlich",1801.13909090909,5944,723106,"Thalfang am Erbeskopf"
"1517","E3123801W000000000005263711190976","Vestas Deutschland GmbH","Vestas V112 3,3 MW",3300,"30.08.2017",7231202,"49,766534","6,924704",140,112,723106202,54426,"Breit",3300,"2017-08-30",NA,10003764,5943759,7231,"Bernkastel-Wittlich",1801.13909090909,5944,723106,"Thalfang am Erbeskopf"
"1518","E3123801W000000000005297981208865","Vestas Deutschland GmbH","V126",3300,"28.12.2017",7140094,"49,969778","7,379481",166,126,714004145,55487,"Sohren",3300,"2017-12-28",NA,10003764,7785301,7140,"Rhein-Hundsrück",2359.18212121212,7785,714004,"Kirchberg (Hunsrück)"
"1519","E3123801W000000000005297981212893","Vestas Deutschland GmbH","V 126 NH 166",3300,"19.12.2017",7140094,"49,968536","7,347306",166,126,714004145,55487,"Sohren",3300,"2017-12-19",NA,10003764,7785301,7140,"Rhein-Hundsrück",2359.18212121212,7785,714004,"Kirchberg (Hunsrück)"
"1520","E3123801W000000000005297981212895","Vestas Deutschland GmbH","V 126 NH 166",3300,"11.12.2017",7140111,"49,966264","7,349703",166,126,714004145,55487,"Sohren",3300,"2017-12-11",NA,10003764,7785301,7140,"Rhein-Hundsrück",2359.18212121212,7785,714004,"Kirchberg (Hunsrück)"
"1521","E3123801W000000000005364851006162","ENERCON GmbH","E-115 TES",3000,"28.03.2018",7231133,"49,851837","6,988985",149,115.72,723101133,54487,"Wintrich",3000,"2018-03-28",NA,10003764,6997084,7231,"Bernkastel-Wittlich",2332.36133333333,6997,723101,"Bernkastel-Kues"
"1522","E3123801W000000000005364851231093","ENERCON GmbH","E-115 TES",3000,"28.03.2018",7231133,"49,851796","6,980988",149,115.72,723101133,54487,"Wintrich",3000,"2018-03-28",NA,10003764,6997084,7231,"Bernkastel-Wittlich",2332.36133333333,6997,723101,"Bernkastel-Kues"
"1523","E3123801W000000000005364851231095","ENERCON GmbH","E-115 TES",3000,"18.05.2018",7231133,"49,848496","6,982558",149,115.72,723101133,54487,"Wintrich",3000,"2018-05-18",NA,10003764,6997084,7231,"Bernkastel-Wittlich",2332.36133333333,6997,723101,"Bernkastel-Kues"
"1524","E3123801W000000000005364851231096","ENERCON GmbH","E-115 TES",3000,"30.05.2018",7231133,"49,847475","6,988026",149,115.72,723101133,54487,"Wintrich",3000,"2018-05-30",NA,10003764,6997084,7231,"Bernkastel-Wittlich",2332.36133333333,6997,723101,"Bernkastel-Kues"
"1525","E3123801W000000000005364851231097","ENERCON GmbH","E-115 TES",3000,"30.05.2018",7231133,"49,849864","7,002868",149,115.72,723101133,54487,"Wintrich",3000,"2018-05-30",NA,10003764,6997084,7231,"Bernkastel-Wittlich",2332.36133333333,6997,723101,"Bernkastel-Kues"
"1526","E3123801W000000000005364851231098","ENERCON GmbH","E-115 TES",3000,"05.06.2018",7231133,"49,846782","7,005707",149,115.72,723101133,54487,"Wintrich",3000,"2018-06-05",NA,10003764,6997111,7231,"Bernkastel-Wittlich",2332.37033333333,6997,723101,"Bernkastel-Kues"
"1527","E3123801W000000000005364851231099","ENERCON GmbH","E-115 TES",3000,"27.06.2018",7231133,"49,842398","7,017516",149,115.72,723101133,54487,"Wintrich",3000,"2018-06-27",NA,10003764,6997084,7231,"Bernkastel-Wittlich",2332.36133333333,6997,723101,"Bernkastel-Kues"
"1528","E3123801W000000000005364851231100","ENERCON GmbH","E-115 TES",3000,"25.06.2018",7231133,"49,8468","6,97456",149,115.72,723101133,54487,"Wintrich",3000,"2018-06-25",NA,10003764,6997084,7231,"Bernkastel-Wittlich",2332.36133333333,6997,723101,"Bernkastel-Kues"
"1529","E3123801W000000000005364851231101","ENERCON GmbH","E-115 TES",3000,"28.06.2018",7231133,"49,850777","7,009939",149,115.72,723101133,54487,"Wintrich",3000,"2018-06-28",NA,10003764,6997111,7231,"Bernkastel-Wittlich",2332.37033333333,6997,723101,"Bernkastel-Kues"
"1530","E3123801W000000000005364851231102","ENERCON GmbH","E-115 TES",3000,"16.06.2018",7231133,"49,844554","6,979857",149,115.72,723101133,54487,"Wintrich",3000,"2018-06-16",NA,10003764,6997084,7231,"Bernkastel-Wittlich",2332.36133333333,6997,723101,"Bernkastel-Kues"
"1531","E3123801W000000000005364851231104","ENERCON GmbH","E-115 TES",3000,"11.06.2018",7231133,"49,841212","6,971901",149,115.72,723101133,54487,"Wintrich",3000,"2018-06-11",NA,10003764,6997111,7231,"Bernkastel-Wittlich",2332.37033333333,6997,723101,"Bernkastel-Kues"
"1532","E3123801W000000000005364851231106","ENERCON GmbH","E-115 TES",3000,"15.06.2018",7231133,"49,846313","7,015019",149,115.72,723101133,54487,"Wintrich",3000,"2018-06-15",NA,10003764,6997111,7231,"Bernkastel-Wittlich",2332.37033333333,6997,723101,"Bernkastel-Kues"
"1533","E3123801W000000000005365291210281","Vestas Deutschland GmbH","V136",3600,"01.02.2018",7232229,"50,168119","6,196456",149,136,723201201,54687,"Arzfeld",3600,"2018-02-01",NA,10003764,9668138,7232,"Eifelkreis Bitburg-Prüm",2685.59388888889,9668,723201,"Arzfeld"
"1534","E3123801W000000000005365291210283","Vestas Deutschland GmbH","V136",3600,"23.02.2018",7232229,"50,171247","6,202702",149,136,723201201,54687,"Arzfeld",3600,"2018-02-23",NA,10003764,9668138,7232,"Eifelkreis Bitburg-Prüm",2685.59388888889,9668,723201,"Arzfeld"
"1535","E3123801W000000000005365291210284","Vestas Deutschland GmbH","V136",3600,"21.02.2018",7232229,"50,172611","6,196207",149,136,723201201,54687,"Arzfeld",3600,"2018-02-21",NA,10003764,9668138,7232,"Eifelkreis Bitburg-Prüm",2685.59388888889,9668,723201,"Arzfeld"
"1536","E3123801W000000000005374811211078","Vestas Deutschland GmbH","Vestas V136 (3,6 MW)",3600,"04.02.2019",7232262,"50,127334","6,315615",149,136,723201201,54687,"Arzfeld",3600,"2019-02-04",NA,10003764,5450761,7232,"Eifelkreis Bitburg-Prüm",1514.10027777778,5451,723201,"Arzfeld"
"1537","E3123801W000000000005374811211079","Vestas Deutschland GmbH","Vestas V136 (3,6 MW)",3600,"28.02.2019",7232262,"50,12932","6,325649",149,136,NA,NA,NA,NA,NA,NA,NA,NA,NA,NA,NA,NA,NA,NA
"1538","E3123801W000000000005374811211080","Vestas Deutschland GmbH","Vestas V136 (3,6 MW)",3600,"18.02.2019",7232262,"50,131733","6,331616",149,136,NA,NA,NA,NA,NA,NA,NA,NA,NA,NA,NA,NA,NA,NA
"1539","E3123801W000000000005374811211081","Vestas Deutschland GmbH","Vestas V136 (3,6 MW)",3600,"14.01.2019",7232262,"50,123982","6,319622",149,136,723201201,54687,"Arzfeld",3600,"2019-01-14",NA,10003764,6035880,7232,"Eifelkreis Bitburg-Prüm",1676.63333333333,6036,723201,"Arzfeld"
"1540","E3123801W000000000005374811211082","Vestas Deutschland GmbH","Vestas V136 (3,6 MW)",3600,"09.01.2019",7232262,"50,124914","6,328064",149,136,723201201,54687,"Arzfeld",3600,"2019-01-09",NA,10003764,6243155,7232,"Eifelkreis Bitburg-Prüm",1734.20972222222,6243,723201,"Arzfeld"
"1541","E3123801W000000000005374811211083","Vestas Deutschland GmbH","Vestas V136 (3,6 MW)",3600,"08.01.2019",7232201,"50,118336","6,325226",149,136,723201201,54687,"Arzfeld",3600,"2019-01-08",NA,10003764,6243155,7232,"Eifelkreis Bitburg-Prüm",1734.20972222222,6243,723201,"Arzfeld"
"1542","E3123801W000000000005515501204559","ENERCON GmbH","E-115",3000,"11.05.2018",7231087,"49,827564","7,020625",149,115,723100502,54497,"Morbach",3000,"2018-05-11",NA,10003764,7753610,7231,"Bernkastel-Wittlich",2584.53666666667,7754,723100,"vfr Bernkastel-Wittlich"
"1543","E3123801W000000000005515501221216","ENERCON GmbH","E-115",3000,"18.05.2018",7231012,"49,84106","7,026111",149,115,723101012,54472,"Brauneberg",3000,"2018-05-18",NA,10003764,7753610,7231,"Bernkastel-Wittlich",2584.53666666667,7754,723101,"Bernkastel-Kues"
"1544","E3123801W000000000005515501221217","ENERCON GmbH","E-115",3000,"23.05.2018",7231133,"49,841028","7,011062",149,115,723101133,54487,"Wintrich",3000,"2018-05-23",NA,10003764,7753610,7231,"Bernkastel-Wittlich",2584.53666666667,7754,723101,"Bernkastel-Kues"
"1545","E3123801W000000000005515501221218","ENERCON GmbH","E-115",3000,"11.06.2018",7231087,"49,823871","7,008276",149,115,723100502,54497,"Morbach",3000,"2018-06-11",NA,10003764,7753610,7231,"Bernkastel-Wittlich",2584.53666666667,7754,723100,"vfr Bernkastel-Wittlich"
"1546","E3123801W000000000005515501221220","ENERCON GmbH","E-115",3000,"15.06.2018",7231087,"49,827456","7,014317",149,115,723100502,54497,"Morbach",3000,"2018-06-15",NA,10003764,7753610,7231,"Bernkastel-Wittlich",2584.53666666667,7754,723100,"vfr Bernkastel-Wittlich"
"1547","E3123801W000000000005515501221221","ENERCON GmbH","E-115",3000,"26.06.2018",7231133,"49,832402","7,012167",149,115,723101133,54487,"Wintrich",3000,"2018-06-26",NA,10003764,7753610,7231,"Bernkastel-Wittlich",2584.53666666667,7754,723101,"Bernkastel-Kues"
"1548","E3123801W000000000005515501221222","ENERCON GmbH","E-115",3000,"26.06.2018",7231133,"49,833779","7,017451",149,115,723101133,54487,"Wintrich",3000,"2018-06-26",NA,10003764,7753610,7231,"Bernkastel-Wittlich",2584.53666666667,7754,723101,"Bernkastel-Kues"
"1549","E3123801W000000000005515501221223","ENERCON GmbH","E-115",3000,"27.03.2018",7231087,"49,832835","7,025361",149,115,723100502,54497,"Morbach",3000,"2018-03-27",NA,10003764,7753610,7231,"Bernkastel-Wittlich",2584.53666666667,7754,723100,"vfr Bernkastel-Wittlich"
"1550","E3123801W000000000005515501221224","ENERCON GmbH","E-115",3000,"06.06.2018",7231133,"49,837921","7,018756",149,115,723101133,54487,"Wintrich",3000,"2018-06-06",NA,10003764,7753610,7231,"Bernkastel-Wittlich",2584.53666666667,7754,723101,"Bernkastel-Kues"
"1551","E3123801W000000000005515501221225","ENERCON GmbH","E-115",3000,"18.05.2018",7231133,"49,835867","7,023819",149,115,723101133,54487,"Wintrich",3000,"2018-05-18",NA,10003764,7753610,7231,"Bernkastel-Wittlich",2584.53666666667,7754,723101,"Bernkastel-Kues"
"1552","E31280100000000000000000174201515","DeWind GmbH","D6",1250,"21.12.2002",7134033,"49,567652","7,21169",91.5,62,713401074,55776,"RÃ¼ckweiler",1250,"2002-12-20","11YR00000003039P",10003764,1950842,7134,"Birkenfeld",1560.6736,1951,713401,"Baumholder"
"1555","E31280100000000000000000251301517","GE Wind Energy GmbH","GE1.5sl",1500,"27.06.2003",7134042,"49,596368","7,206811",85,77,713401075,55776,"Ruschberg",1500,"2003-06-27","11YR00000003039P",10003764,2590699,7134,"Birkenfeld",1727.13266666667,2591,713401,"Baumholder"
"1556","E31280100000000000000000251301553","GE Wind Energy GmbH","GE1.5sl",1500,"02.12.2003",7134042,"49,596521","7,21032",85,77,713401075,55776,"Ruschberg",1500,"2003-12-02","11YR00000003039P",10003764,2590699,7134,"Birkenfeld",1727.13266666667,2591,713401,"Baumholder"
"1557","E31280100000000000000000251322342","GE Wind Energy GmbH","1,5 sl",1500,"16.07.2003",7134051,"49,599367","7,222215",85,77,713401075,55776,"Ruschberg",1500,"2003-07-16","11YR00000003039P",10003764,2590699,7134,"Birkenfeld",1727.13266666667,2591,713401,"Baumholder"
"1558","E31280100000000000000000251322857","Nordex SE","S77",1500,"31.03.2006",7134042,"49,596053","7,202344",100,77,713401075,55776,"Ruschberg",1500,"2006-03-31","11YR00000003039P",10003764,2619767,7134,"Birkenfeld",1746.51133333333,2620,713401,"Baumholder"
"1559","E31280100000000000000000331501459","Vestas Deutschland GmbH","V90",2000,"11.11.2004",7134020,"49,638191","7,209721",105,90,713402020,55765,"Dienstweiler",2000,"2004-11-11","11YR00000003039P",10003764,3349326,7134,"Birkenfeld",1674.663,3349,713402,"Birkefeld"
"1560","E31280100000000000000000331513065","Vestas Deutschland GmbH","V90",2000,"12.11.2004",7134020,"49,64136","7,214653",105,90,713402020,55765,"Dienstweiler",2000,"2004-11-12","11YR00000003039P",10003764,3349326,7134,"Birkenfeld",1674.663,3349,713402,"Birkefeld"
"1561","E31280100000000000000000331513066","Vestas Deutschland GmbH","V90",2000,"20.10.2004",7134020,"49,642184","7,205446",105,90,713402020,55765,"Dienstweiler",2000,"2004-10-20","11YR00000003039P",10003764,3349326,7134,"Birkenfeld",1674.663,3349,713402,"Birkefeld"
"1562","E31280100000000000000000331513067","Vestas Deutschland GmbH","V90",2000,"16.11.2004",7134020,"49,642056","7,210463",105,90,713402020,55765,"Dienstweiler",2000,"2004-11-16","11YR00000003039P",10003764,3349326,7134,"Birkenfeld",1674.663,3349,713402,"Birkefeld"
"1563","E31280100000000000000000584431564","Fuhrländer AG","FL MD 77",1500,"29.09.2006",7134019,"49,701702","7,409601",100,77,713405055,55758,"Mittelreidenbach",1500,"2006-09-28","11YR00000003039P",10003764,2750088,7134,"Birkenfeld",1833.392,2750,713405,"Herstein-Rhaunen"
"1564","E31280100000000000000000584431567","Fuhrländer AG","FL MD 77",1500,"29.09.2006",7134019,"49,701099","7,41553",100,77,713405055,55758,"Mittelreidenbach",1500,"2006-09-29","11YR00000003039P",10003764,2750088,7134,"Birkenfeld",1833.392,2750,713405,"Herstein-Rhaunen"
"1565","E31280100000000000000000843959621","Nordex SE","N100",2500,"15.06.2010",7134008,"49,570607","7,270193",100,100,713401026,55777,"Fohren-Linden",2500,"2010-06-15","11YR00000003039P",10003764,3417404,7134,"Birkenfeld",1366.9616,3417,713401,"Baumholder"
"1567","E31280100000000340000005110101196","ENERCON GmbH","Enercon 40",500,"29.06.1995",7134018,"49,627936","7,12756",50,40.3,713402018,55765,"Dambach",500,"1995-06-29","11YR00000003039P",10003764,552665,7134,"Birkenfeld",1105.33,553,713402,"Birkefeld"
"1568","E31280100000000340000005623701516","ENERCON GmbH","E-40",500,"20.12.1996",7134062,"49,698357","7,249995",50,40,NA,NA,NA,NA,NA,NA,NA,NA,NA,NA,NA,NA,NA,NA
"1569","E31280100000000340000005946201197","ENERCON GmbH","Enercon 40",500,"19.12.1996",7134042,"49,624862","7,203325",NA,40.3,713402042,55768,"HoppstÃ¤dten-Weiersbach",500,"1996-12-01","11YR00000003039P",10003764,580806,7134,"Birkenfeld",1161.612,581,713402,"Birkefeld"
"1570","E31280100000000340000005946222337","ENERCON GmbH","Enercon 40",500,"19.12.1996",7134042,"49,623569","7,204228",65,40.3,713402042,55768,"HoppstÃ¤dten-Weiersbach",500,"1996-12-01","11YR00000003039P",10003764,580806,7134,"Birkenfeld",1161.612,581,713402,"Birkefeld"
"1572","E31280100000000340000006639401325","ENERCON GmbH","Enercon 66",1500,"12.10.2000",7134054,"49,586467","7,331331",67,66,713401054,55777,"Mettweiler",1500,"2000-10-12","11YR00000003039P",10003764,2045664,7134,"Birkenfeld",1363.776,2046,713401,"Baumholder"
"1573","E31280100000000340000006639401420","ENERCON GmbH","E-58/10.58",1000,"06.05.2003",7134054,"49,58585","7,326792",70.5,58.6,713401054,55777,"Mettweiler",1000,"2003-05-07","11YR00000003039P",10003764,1698278,7134,"Birkenfeld",1698.278,1698,713401,"Baumholder"
"1574","E31280100000000340000006639401421","ENERCON GmbH","E-40/6.44",600,"06.05.2003",7134054,"49,58785","7,330864",77.7,44,713401054,55777,"Mettweiler",600,"2003-05-06","11YR00000003039P",10003764,960733,7134,"Birkenfeld",1601.22166666667,961,713401,"Baumholder"
"1575","E31280100000000340000006640022339","ENERCON GmbH","Enercon 40",500,"01.12.1996",7134054,"49,587714","7,323148",NA,40.3,713401054,55777,"Mettweiler",500,"1996-12-01","11YR00000003039P",10003764,796658,7134,"Birkenfeld",1593.316,797,713401,"Baumholder"
"1576","E31280110000000000000000174201515","DeWind GmbH","D6",1250,"21.12.2002",7134033,"49,566232","7,213383",91.5,62,NA,NA,NA,NA,NA,NA,NA,NA,NA,NA,NA,NA,NA,NA
"1582","E31495010000000000060208034400000","AN-Maschinenbau- und Umweltschutzanlagen GmbH","Bonus 1300",1300,"19.09.2001",7141010,"50,256844","8,016799",59,62,714111010,56368,"Berghausen",1300,"2001-10-25","11YR00000001715L",10001495,1424441,7141,"Rhein-Lahn",1095.72384615385,1424,714111,"Aar-Einrich"
"1586","E31495010000000000060208043100000","ENERCON GmbH","ENERCON-40 E2 6.44",600,"15.03.2002",7141117,"50,236944","7,945",65,44,714111117,56370,"Rettert",600,"2002-03-12","11YR00000001715L",10001495,887764,7141,"Rhein-Lahn",1479.60666666667,888,714111,"Aar-Einrich"
"1587","E31495010000000000060208047000000","Fuhrländer AG","FL1000",1000,"27.09.2001",7141011,"50,243078","7,974453",70,54,714111011,56370,"Berndroth",3000,"2001-09-27","11YR00000001715L",10001495,2975282,7141,"Rhein-Lahn",991.760666666667,2975,714111,"Aar-Einrich"
"1588","E31495010000000000060208047600000","NEG Micon Deutschland GmbH","NM 52-0.9",900,"27.12.2001",7141038,"50,394061","7,930412",73.8,52.2,714103038,65558,"Eppenrod",3900,"2001-12-17","11YR00000001715L",10001495,4380374,7141,"Rhein-Lahn",1123.17282051282,4380,714103,"Diez"
"1590","E31495010000000000060235572900000","ENERCON GmbH","E-53",800,"20.12.2013",7141011,"50,246624","7,97376",73,53,714111088,56370,"Mittelfischbach",808,"2013-12-19","11YR00000001715L",10001495,1079982,7141,"Rhein-Lahn",1336.61138613861,1080,714111,"Aar-Einrich"
"1592","E31654010000000000000031736000961","Nordex Energy GmbH","N 90",2300,"29.12.2006",7134026,"49,576389","7,271667",100,90,NA,NA,NA,NA,NA,NA,NA,NA,NA,NA,NA,NA,NA,NA
"1595","E32954010000000000001603603000001","Nordex Energy GmbH","N117/2400",2400,"09.06.2016",7338015,"49,589912","8,303337",141,116.8,731900000,67547,"Worms",2400,"2016-06-09",NA,10002954,4836034.5,7319,"Worms",2015.014375,4836,731900,"Worms"
"1596","E32954010000000000001603603000002","Nordex SE","N117/2400",2400,"09.06.2016",7338015,"49,58962","8,295192",141,116.8,731900000,67547,"Worms",2400,"2016-06-09",NA,10002954,4836034.5,7319,"Worms",2015.014375,4836,731900,"Worms"
"1597","E32954010000000000001603603000003","Nordex SE","N117/2400",2400,"16.06.2016",7338015,"49,586708","8,298443",141,116.8,731900000,67547,"Worms",2400,"2016-06-16",NA,10002954,4836034.5,7319,"Worms",2015.014375,4836,731900,"Worms"
"1598","E32954010000000000001603603000004","Nordex SE","N117/2400",2400,"20.06.2016",7338015,"49,58304","8,298814",141,116.8,731900000,67547,"Worms",2400,"2016-06-20",NA,10002954,4836034.5,7319,"Worms",2015.014375,4836,731900,"Worms"
"1602","E32954010000000000003610200900001","ENERCON GmbH","E-92",2350,"23.12.2013",7339066,"49,773","8,302",138,92,733907066,67587,"Wintersheim",2350,"2013-12-16","11YR00000002978L",10002954,4762758,7339,"Mainz-Bingen",2026.70553191489,4763,733907,"Rhein-Selz"
"1604","E32954010000000000003613500500001","ENERCON GmbH","E-101",3050,"29.09.2013",7339028,"49,777756","8,307269",135,101,733907024,67583,"Guntersblum",3050,"2013-09-23","11YR00000002978L",10002954,5587294,7339,"Mainz-Bingen",1831.89967213115,5587,733907,"Rhein-Selz"
"1605","E32954010000000000003613500500002","ENERCON GmbH","E-101",3050,"16.10.2013",7339028,"49,774558","8,307561",135,101,733907024,67583,"Guntersblum",3050,"2013-09-23","11YR00000002978L",10002954,5803505,7339,"Mainz-Bingen",1902.78852459016,5804,733907,"Rhein-Selz"
"1606","E32954010000000000003613500500003","ENERCON GmbH","E-101",3050,"21.11.2013",7339028,"49,773458","8,302139",135,101,733907024,67583,"Guntersblum",3050,"2013-09-23","11YR00000002978L",10002954,5925121,7339,"Mainz-Bingen",1942.66262295082,5925,733907,"Rhein-Selz"
"1607","E32954010000000000003613500500004","ENERCON GmbH","E-101",3050,"29.11.2013",7339028,"49,778575","8,300969",135,101,733907024,67583,"Guntersblum",3050,"2013-09-23","11YR00000002978L",10002954,5381206,7339,"Mainz-Bingen",1764.32983606557,5381,733907,"Rhein-Selz"
"1608","E32954010000000000003613500500005","ENERCON GmbH","E 101 FTQ",3050,"23.09.2014",7339015,"49,791167","8,312389",135,101,733907024,67583,"Guntersblum",3050,"2014-09-23","11YR00000002978L",10002954,6235212,7339,"Mainz-Bingen",2044.33180327869,6235,733907,"Rhein-Selz"
"1613","E32954010000000000003615001015600","Kenersys Europe GmbH","K-100-2.5",2500,"19.01.2012",7333083,"49,753703","7,868596",135,100,733307083,67822,"Winterborn",2500,"2012-01-18","11YR00000002978L",10002954,5127793.2,7333,"Donnersbergkreis",2051.11728,5128,733307,"Nordpfälzer Land"
"1614","E32954010000000000003615100500001","ENERCON GmbH","E-92",2350,"08.06.2016",7339060,"49,826203","8,204783",138,92,733106029,55288,"Gabsheim",2300,"2016-06-08",NA,10002954,4313399,7331,"Alzey-Worms",1875.39086956522,4313,733106,"Wörrstadt"
"1615","E32954010000000000003615100500002","ENERCON GmbH","E-92",2350,"13.06.2016",7339060,"49,825683","8,208922",138,92,733106029,55288,"Gabsheim",2300,"2016-06-13",NA,10002954,4313399,7331,"Alzey-Worms",1875.39086956522,4313,733106,"Wörrstadt"
"1616","E32954010000000000003615100500003","ENERCON GmbH","E-92",2350,"21.06.2016",7339060,"49,822604","8,209639",138,92,733106029,55288,"Gabsheim",2300,"2016-06-21",NA,10002954,4313399,7331,"Alzey-Worms",1875.39086956522,4313,733106,"Wörrstadt"
"1617","E32954010000000000003615500200001","ENERCON GmbH","E115",3000,"11.12.2015",7331031,"49,730275","8,170978",149,115,733107039,55234,"Hangen-Weisheim",3000,"2015-12-11",NA,10002954,7390449,7331,"Alzey-Worms",2463.483,7390,733107,"Wonnegau"
"1618","E32954010000000000003615925000001","ENERCON GmbH","E-53",800,"30.12.2015",7339021,"49,911765","7,951871",73,53,733908021,55457,"Gensingen",800,"2015-12-24",NA,10002954,687174.5,7339,"Mainz-Bingen",858.968125,687,733908,"Sprendlingen-Gensingen"
"1619","E32954010000000000003615925000002","ENERCON GmbH","E-53",800,"24.12.2015",7339021,"49,907339","7,950867",73,53,733908021,55457,"Gensingen",800,"2015-12-24",NA,10002954,687174.5,7339,"Mainz-Bingen",858.968125,687,733908,"Sprendlingen-Gensingen"
"1620","E32954010000000000003615925000003","ENERCON GmbH","E-53",800,"24.12.2015",7339021,"49,909182","7,946774",73,53,733908021,55457,"Gensingen",800,"2015-12-30",NA,10002954,687174.5,7339,"Mainz-Bingen",858.968125,687,733908,"Sprendlingen-Gensingen"
"1621","E32954010000000000003616501000001","Senvion Deutschland GmbH","3.4M104",3370,"10.01.2013",7331020,"49,719433","8,172924",128,104,733101020,55234,"Eppelsheim",3370,"2013-01-10","11YR00000002978L",10002954,5658642,7331,"Alzey-Worms",1679.12225519288,5659,733101,"Alzey-Land"
"1622","E32954010000000000003616501000002","Senvion Deutschland GmbH","3.4M104",3370,"11.02.2013",7331011,"49,727468","8,173287",128,104,733107039,55234,"Hangen-Weisheim",3370,"2013-02-02","11YR00000002978L",10002954,5658642,7331,"Alzey-Worms",1679.12225519288,5659,733107,"Wonnegau"
"1623","E32954010000000000003616501000003","Senvion Deutschland GmbH","3.4M104",3370,"02.03.2013",7331011,"49,724727","8,177441",128,104,733107039,55234,"Hangen-Weisheim",3370,"2013-02-11","11YR00000002978L",10002954,5658642,7331,"Alzey-Worms",1679.12225519288,5659,733107,"Wonnegau"
"1624","E32954010000000000003616501900001","Vestas Deutschland GmbH","V112",3075,"03.12.2013",7331020,"49,724463","8,168232",140,112,733101020,55234,"Eppelsheim",3075,"2013-12-03","11YR00000002978L",10002954,6577628,7331,"Alzey-Worms",2139.06601626016,6578,733101,"Alzey-Land"
"1625","E32954010000000000003616501900002","Vestas Deutschland GmbH","V112",3075,"28.12.2013",7331020,"49,722277","8,171946",140,112,733101020,55234,"Eppelsheim",3075,"2013-12-28","11YR00000002978L",10002954,6577628,7331,"Alzey-Worms",2139.06601626016,6578,733101,"Alzey-Land"
"1626","E32954010000000000003616502300001","Vestas Deutschland GmbH","V 112",3075,"11.12.2013",7331024,"49,834964","8,108155",140,112,733101024,55234,"Flomborn",3075,"2013-12-11","11YR00000002978L",10002954,6736364.4,7331,"Alzey-Worms",2190.6876097561,6736,733101,"Alzey-Land"
"1627","E32954010000000000003616502300002","Vestas Deutschland GmbH","V 112",3075,"19.12.2013",7331024,"49,696328","9",140,112,733101024,55234,"Flomborn",3075,"2013-12-19","11YR00000002978L",10002954,6736364.4,7331,"Alzey-Worms",2190.6876097561,6736,733101,"Alzey-Land"
"1628","E32954010000000000003616502300003","Vestas Deutschland GmbH","V 112",3075,"19.12.2013",7331024,"50,505609","8,096741",140,112,733101024,55234,"Flomborn",3075,"2013-12-19","11YR00000002978L",10002954,6736364.4,7331,"Alzey-Worms",2190.6876097561,6736,733101,"Alzey-Land"
"1629","E32954010000000000003616502300004","Vestas Deutschland GmbH","V 112",3075,"20.12.2013",7331024,"49,696817","8,109466",140,112,733101024,55234,"Flomborn",3075,"2013-12-20","11YR00000002978L",10002954,6736364.4,7331,"Alzey-Worms",2190.6876097561,6736,733101,"Alzey-Land"
"1630","E32954010000000000003616502300005","Vestas Deutschland GmbH","V 112",3075,"20.12.2013",7331024,"49,682388","8,113875",140,112,733101024,55234,"Flomborn",3075,"2013-12-20","11YR00000002978L",10002954,6736364.4,7331,"Alzey-Worms",2190.6876097561,6736,733101,"Alzey-Land"
"1631","E32954010000000000003616703100001","ENERCON GmbH","Enercon  E101",3050,"14.11.2014",7339024,"49,788689","8,315234",135.4,101,733907024,67583,"Guntersblum",3050,"2014-11-14","11YR00000002978L",10002954,6184324,7339,"Mainz-Bingen",2027.64721311475,6184,733907,"Rhein-Selz"
"1632","E32954010000000000003616703100002","ENERCON GmbH","Enercon  E101",3050,"25.11.2014",7339024,"49,792433","8,318269",135.4,101,733907024,67583,"Guntersblum",3050,"2014-11-25","11YR00000002978L",10002954,6184324,7339,"Mainz-Bingen",2027.64721311475,6184,733907,"Rhein-Selz"
"1633","E32954010000000000003616703100003","ENERCON GmbH","E101",3050,"17.12.2014",7339024,"49,786923","8,319349",135.4,101,733907024,67583,"Guntersblum",3050,"2014-12-17","11YR00000002978L",10002954,6184324,7339,"Mainz-Bingen",2027.64721311475,6184,733907,"Rhein-Selz"
"1634","E32954010000000000003617201000001","Vestas Deutschland GmbH","V112",3075,"19.12.2014",7331011,"49,721743","8,179003",140,112,733107036,67598,"Gundersheim",3075,"2014-12-19","11YR00000002978L",10002954,6466577,7331,"Alzey-Worms",2102.9518699187,6467,733107,"Wonnegau"
"1635","E32954010000000000003619500400001","ENERCON GmbH","E-101",3000,"13.06.2014",7331021,"49,755798","8,053352",135,101,733101043,55237,"Lonsheim",3050,"2014-04-17","11YR00000002978L",10002954,6673545,7331,"Alzey-Worms",2188.04754098361,6674,733101,"Alzey-Land"
"1636","E32954010000000000003623500815599","ENERCON GmbH","E-101 3.0 MW",3050,"24.01.2012",7331029,"49,814256","8,15921",135.4,101,733106029,55288,"Gabsheim",3050,"2011-12-30","11YR00000002978L",10002954,5871756.02,7331,"Alzey-Worms",1925.16590819672,5872,733106,"Wörrstadt"
"1637","E32954010000000000003623500815600","ENERCON GmbH","E-101 3.0MW",3050,"16.04.2012",7331029,"49,811471","8,15955",135.4,101,733106029,55288,"Gabsheim",3050,"2012-04-16","11YR00000002978L",10002954,5939867.62,7331,"Alzey-Worms",1947.49758032787,5940,733106,"Wörrstadt"
"1638","E32954010000000000003623500815601","ENERCON GmbH","E-101 3.0 MW",3050,"04.05.2012",7331029,"49,817264","8,15995",135.4,101,733106029,55288,"Gabsheim",3050,"2012-05-04","11YR00000002978L",10002954,5562644.6,7331,"Alzey-Worms",1823.81790163934,5563,733106,"Wörrstadt"
"1639","E32954010000000000003623500815602","ENERCON GmbH","E-101",3050,"10.05.2012",7331029,"49,815566","8,171645",135,101,733106029,55288,"Gabsheim",3050,"2012-05-11","11YR00000002978L",10002954,5918498.04,7331,"Alzey-Worms",1940.49116065574,5918,733106,"Wörrstadt"
"1640","E32954010000000000003623500815603","ENERCON GmbH","E-101 3.0 MW",3050,"06.06.2012",7331029,"49,816781","8,16642",135.4,101,733106029,55288,"Gabsheim",3050,"2012-06-06","11YR00000002978L",10002954,5318065.72,7331,"Alzey-Worms",1743.62810491803,5318,733106,"Wörrstadt"
"1641","E32954010000000000003625400100001","Senvion Deutschland GmbH","3.2M114",3200,"13.09.2013",7331046,"49,6243","8,155215",143,114,733103066,67591,"Wachenheim",3200,"2013-09-05","11YR00000002978L",10002954,7026060,7331,"Alzey-Worms",2195.64375,7026,733103,"Monsheim"
"1643","E32954010000000000003625400200001","Senvion Deutschland GmbH","3,2M114",3200,"28.09.2013",7331046,"49,630192","8,154443",143,114,733103066,67591,"Wachenheim",3200,"2013-09-13","11YR00000002978L",10002954,6817890,7331,"Alzey-Worms",2130.590625,6818,733103,"Monsheim"
"1644","E32954010000000000003625400200002","Senvion Deutschland GmbH","3.2M114",3200,"13.09.2013",7331046,"49,627286","8,154125",143,114,733103066,67591,"Wachenheim",3200,"2013-09-13","11YR00000002978L",10002954,6817890,7331,"Alzey-Worms",2130.590625,6818,733103,"Monsheim"
"1645","E32954010000000000003625400200003","Senvion Deutschland GmbH","3.2M114",3200,"13.09.2013",7331046,"49,628387","8,166993",143,114,733103066,67591,"Wachenheim",3200,"2013-09-13","11YR00000002978L",10002954,6817890,7331,"Alzey-Worms",2130.590625,6818,733103,"Monsheim"
"1646","E32954010000000000011100S00000001","ENERCON GmbH","E101",3050,"29.06.2016",7339004,"49,824745","7,987538",135.4,101,733105072,55597,"WÃ¶llstein",3050,"2016-06-29",NA,10002954,4467171,7331,"Alzey-Worms",1464.6462295082,4467,733105,"Wöllstein"
"1651","E32954010200000000001600120811216","GE Wind Energy GmbH","GE-1,5SL",1500,"13.11.2001",7319000,"49,653086","8,302393",85,77,731900000,67550,"Worms-Herrnsheim",1500,"2001-10-12","11YR00000002978L",10002954,1738281.42,7319,"Worms",1158.85428,1738,731900,"Worms"
"1652","E32954010200000000001600120811217","Enron Wind GmbH","1.5 sl",1500,"21.11.2001",7319000,"49,653727","8,293892",100,77,731900000,67550,"Worms-Herrnsheim",1500,"2001-11-21","11YR00000002978L",10002954,1636721.11,7319,"Worms",1091.14740666667,1637,731900,"Worms"
"1653","E32954010200000000001600120811218","GE Wind Energy GmbH","GE-1,5SL",1500,"21.11.2001",7319000,"49,653146","8,297462",85,77,731900000,67550,"Worms-Herrnsheim",1500,"2001-11-21","11YR00000002978L",10002954,1480775.52,7319,"Worms",987.18368,1481,731900,"Worms"
"1654","E32954010200000000001600120811226","Fuhrländer AG","Fuhrländer WP3100",1500,"01.02.2006",7319000,"49,655136","8,29008",85,77,731900000,67550,"Worms-Herrnsheim",1500,"2006-02-01","11YR00000002978L",10002954,1828797.95,7319,"Worms",1219.19863333333,1829,731900,"Worms"
"1655","E32954010200000000001600317015563","Vestas Deutschland GmbH","V112",3000,"22.02.2012",7319000,"49,657308","8,301973",119,112,731900000,67550,"Worms-Herrnsheim",3000,"2011-12-29","11YR00000002978L",10002954,5427870.86,7319,"Worms",1809.29028666667,5428,731900,"Worms"
"1656","E32954010200000000001600317015564","Vestas Deutschland GmbH","V112",3000,"13.01.2012",7319000,"49,649227","8,271765",119,112,731900000,67551,"Worms-Pfeddersheim",3000,"2012-01-13","11YR00000002978L",10002954,5427870.86,7319,"Worms",1809.29028666667,5428,731900,"Worms"
"1657","E32954010200000000001600317015565","Vestas Deutschland GmbH","V112",3000,"21.01.2012",7319000,"49,650905","8,28551",119,112,731900000,67551,"Worms-Pfeddersheim",3000,"2012-01-21","11YR00000002978L",10002954,5427870.86,7319,"Worms",1809.29028666667,5428,731900,"Worms"
"1658","E32954010200000000001600317015566","Vestas Deutschland GmbH","V112",3000,"24.01.2012",7319000,"49,65902","8,291696",119,112,731900000,67550,"Worms-Abenheim",3000,"2012-01-24","11YR00000002978L",10002954,5427870.86,7319,"Worms",1809.29028666667,5428,731900,"Worms"
"1659","E32954010200000000001600317015567","Vestas Deutschland GmbH","V112",3000,"09.02.2012",7319000,"49,652306","8,280835",119,112,731900000,67551,"Worms-Pfeddersheim",3000,"2012-02-09","11YR00000002978L",10002954,5427870.86,7319,"Worms",1809.29028666667,5428,731900,"Worms"
"1660","E32954010200000000001600317015568","Vestas Deutschland GmbH","V112",3000,"09.02.2012",7319000,"49,658572","8,286653",119,112,731900000,67550,"Worms-Abenheim",3000,"2012-02-09","11YR00000002978L",10002954,5427870.86,7319,"Worms",1809.29028666667,5428,731900,"Worms"
"1661","E32954010200000000001600317015569","Vestas Deutschland GmbH","V112",3000,"29.12.2011",7319000,"49,660986","8,299842",119,112,731900000,67550,"Worms-Herrnsheim",3000,"2012-02-22","11YR00000002978L",10002954,5427870.86,7319,"Worms",1809.29028666667,5428,731900,"Worms"
"1662","E32954010200000000003613500211219","ENERCON GmbH","E-58",1000,"20.12.2002",7339015,"49,784283","8,275704",70,58,733907015,55278,"Eimsheim",5800,"2002-07-19","11YR00000002978L",10002954,8349056,7339,"Mainz-Bingen",1439.4924137931,8349,733907,"Rhein-Selz"
"1663","E32954010200000000003615000111202","Nordex Energy GmbH","N43",600,"23.06.1999",7133032,"49,759553","7,873831",77.5,43,713301032,55546,"FÃ¼rfeld",600,"1999-06-23","11YR00000002978L",10002954,671154.22,7133,"Bad Kreuznach",1118.59036666667,671,713301,"Bad Kreuznach"
"1664","E32954010200000000003615000111203","Nordex Energy GmbH","N43",600,"22.07.1999",7133032,"49,759301","7,871033",77.5,43,713301032,55546,"FÃ¼rfeld",600,"1999-07-22","11YR00000002978L",10002954,671154.22,7133,"Bad Kreuznach",1118.59036666667,671,713301,"Bad Kreuznach"
"1665","E32954010200000000003615000111214","Nordex Energy GmbH","N43",600,"01.07.2001",7133032,"49,757093","7,872361",77.5,43,713301032,55546,"FÃ¼rfeld",600,"2001-07-01","11YR00000002978L",10002954,671154.22,7133,"Bad Kreuznach",1118.59036666667,671,713301,"Bad Kreuznach"
"1668","E32954010200000000003616500511201","Nordex Energy GmbH","N43/600",600,"09.06.1999",7331031,"49,738404","8,19873",77.5,43,733107011,55234,"Hochborn",3000,"1999-03-01","11YR00000002978L",10002954,3979649.22,7331,"Alzey-Worms",1326.54974,3980,733107,"Wonnegau"
"1670","E32954010200000000003616500611206","NEG Micon Deutschland GmbH","1500C/64",1500,"10.05.2000",7333076,"49,691096","8,103774",68,64,NA,NA,NA,NA,NA,NA,NA,NA,NA,NA,NA,NA,NA,NA
"1672","E32954010200000000003616900611200","Nordex Energy GmbH","N 54 Mk3",1000,"29.12.1998",7339067,"49,878705","8,232687",70,54,733906067,55270,"Zornheim",1000,"1999-01-01","11YR00000002978L",10002954,1271893.75,7339,"Mainz-Bingen",1271.89375,1272,733906,"Nieder-Olm"
"1674","E32954010200000000003617500011215","ENERCON GmbH","E66/18.70-2",1800,"19.09.2001",7331003,"49,757306","8,064478",65,70,733100003,55232,"Alzey-Heimersheim",5400,"2001-09-14","11YR00000002978L",10002954,6610082.03,7331,"Alzey-Worms",1224.08926481481,6610,733100,"Alzey"
"1675","E32954010200000000003617500011223","ENERCON GmbH","E-48",800,"12.01.2006",7331003,"49,761338","8,059445",76,48,733100003,55232,"Alzey-Heimersheim",800,"2005-12-20","11YR00000002978L",10002954,1132362.41,7331,"Alzey-Worms",1415.4530125,1132,733100,"Alzey"
"1676","E32954010200000000003617500011225","ENERCON GmbH","E-48",800,"29.12.2005",7331003,"49,758895","8,058564",76,48,733100003,55232,"Alzey-Heimersheim",800,"2006-01-12","11YR00000002978L",10002954,1105683.59,7331,"Alzey-Worms",1382.1044875,1106,733100,"Alzey"
"1677","E32954010200000000003618000112857","Fuhrländer AG","FL1000",1000,"23.12.1998",7331031,"49,739803","8,203067",70,54,733101031,55234,"Gau-Heppenheim",1000,"1998-12-23","11YR00000002978L",10002954,1186770,7331,"Alzey-Worms",1186.77,1187,733101,"Alzey-Land"
"1678","E32954010200000000003618000414524","ENERCON GmbH","E-53",800,"05.07.2010",7331011,"49,733711","8,199479",73.25,52.9,733107011,55234,"Hochborn",800,"2010-06-23","11YR00000002978L",10002954,1205154.75,7331,"Alzey-Worms",1506.4434375,1205,733107,"Wonnegau"
"1682","E32954010200000000003619600114530","ENERCON GmbH","E53",800,"17.10.2010",7339034,"49,885472","8,30175",73,53,733902034,55296,"LÃ¶rzweiler",800,"2010-10-15","11YR00000002978L",10002954,1272076,7339,"Mainz-Bingen",1590.095,1272,733902,"Bodenheim"
"1683","E32954010200000000003619600114531","ENERCON GmbH","E53",800,"19.10.2010",7339034,"49,884111","8,305416",73,53,733902034,55296,"LÃ¶rzweiler",800,"2010-10-15","11YR00000002978L",10002954,1272076,7339,"Mainz-Bingen",1590.095,1272,733902,"Bodenheim"
"1685","E32954010200000000003620500513047","Vestas Deutschland GmbH","V90",2000,"01.04.2009",7331037,"49,654587","8,26968",105,90,733103047,67591,"MÃ¶rstadt",2000,"2009-03-25","11YR00000002978L",10002954,3566624,7331,"Alzey-Worms",1783.312,3567,733103,"Monsheim"
"1686","E32954010200000000003620500513048","Vestas Deutschland GmbH","V90",2000,"08.04.2009",7331037,"49,655679","8,277489",105,90,733103047,67591,"MÃ¶rstadt",2000,"2009-03-26",NA,10002954,3566624,7331,"Alzey-Worms",1783.312,3567,733103,"Monsheim"
"1687","E32954010200000000003620500513049","Vestas Deutschland GmbH","V90",2000,"02.04.2009",7331037,"49,658476","8,276118",105,90,733103047,67591,"MÃ¶rstadt",2000,"2009-03-26",NA,10002954,3566624,7331,"Alzey-Worms",1783.312,3567,733103,"Monsheim"
"1688","E32954010200000000003621301811210","ENERCON GmbH","E-40/6.44",600,"25.07.2000",7339017,"49,915677","8,22528",65,44,733906042,55268,"Nieder-Olm",600,"2000-07-31","11YR00000002978L",10002954,980087,7339,"Mainz-Bingen",1633.47833333333,980,733906,"Nieder-Olm"
"1689","E32954010200000000003621700111220","GE Wind Energy GmbH","GE-70-1,5",1500,"10.12.2002",7331024,"49,677213","8,11946",65,70.5,NA,NA,NA,NA,NA,NA,NA,NA,NA,NA,NA,NA,NA,NA
"1690","E32954010200000000003621700111221","ENERCON GmbH","E-66",1800,"21.04.2004",7331024,"49,689498","8,106987",60,70,733101052,55234,"Ober-FlÃ¶rsheim",1800,"2004-04-08","11YR00000002978L",10002954,2537681,7331,"Alzey-Worms",1409.82277777778,2538,733101,"Alzey-Land"
"1691","E32954010200000000003623500515469","Kenersys Europe GmbH","K100",2500,"01.12.2011",7331073,"49,843832","8,148647",135,100,733106059,55288,"Schornsheim",2500,"2011-12-01","11YR00000002978L",10002954,3342967.44,7331,"Alzey-Worms",1337.186976,3343,733106,"Wörrstadt"
"1692","E32954010200000000003623500515470","Kenersys Europe GmbH","K100",2500,"02.12.2011",7331073,"49,84677","8,149541",135,100,733106059,55288,"Schornsheim",2500,"2011-12-02","11YR00000002978L",10002954,3342967.44,7331,"Alzey-Worms",1337.186976,3343,733106,"Wörrstadt"
"1693","E32954010200000000003623500515471","Kenersys Europe GmbH","K100",2500,"14.12.2011",7331073,"49,850392","8,152789",135,100,733106059,55288,"Schornsheim",2500,"2011-12-14","11YR00000002978L",10002954,3342967.44,7331,"Alzey-Worms",1337.186976,3343,733106,"Wörrstadt"
"1694","E32954010200000000003623500515472","Kenersys Europe GmbH","K100",2500,"29.12.2011",7331073,"49,85393","8,153214",135,100,733106064,55288,"Udenheim",2500,"2011-12-29","11YR00000002978L",10002954,3342967.44,7331,"Alzey-Worms",1337.186976,3343,733106,"Wörrstadt"
"1695","E32954010200000000003623500515473","Kenersys Europe GmbH","K100",2500,"01.10.2012",7331073,"49,856809","8,159493",135,100,733106064,55288,"Udenheim",2500,"2012-10-01","11YR00000002978L",10002954,3342967.44,7331,"Alzey-Worms",1337.186976,3343,733106,"Wörrstadt"
"1699","E32954010200000000003624100111194","ENERCON GmbH","Enercon E-40",500,"21.05.1997",7331061,"49,815521","8,116954",65,40,NA,NA,NA,NA,NA,NA,NA,NA,NA,NA,NA,NA,NA,NA
"1700","E32954010200000000003624100111195","ENERCON GmbH","Enercon E-40",500,"17.05.1997",7331061,"49,81344","8,117547",65,40,733106061,55288,"Spiesheim",1500,"1997-05-17","11YR00000002978L",10002954,2204629.48,7331,"Alzey-Worms",1469.75298666667,2205,733106,"Wörrstadt"
"1701","E32954010200000000003624100111196","ENERCON GmbH","Enercon E-40",500,"23.05.1997",7331061,"49,817502","8,116139",65,40,NA,NA,NA,NA,NA,NA,NA,NA,NA,NA,NA,NA,NA,NA
"1702","E32954010200000000003624100111197","ENERCON GmbH","Enercon E-40",500,"08.10.1998",7331061,"49,819148","8,11629",65,40,733106061,55288,"Spiesheim",500,"1998-10-08","11YR00000002978L",10002954,690005.24,7331,"Alzey-Worms",1380.01048,690,733106,"Wörrstadt"
"1703","E32954010200000000003624100111198","ENERCON GmbH","Enercon E-40",500,"09.10.1998",7331061,"49,821108","8,116296",65,40,733106061,55288,"Spiesheim",500,"1998-10-09","11YR00000002978L",10002954,709612.29,7331,"Alzey-Worms",1419.22458,710,733106,"Wörrstadt"
"1704","E32954010200000000003625100711224","GE Wind Energy GmbH","GE 1,5 sl",1500,"29.12.2005",7339060,"49,826631","8,203827",85,77,733907060,55278,"Undenheim",3000,"2005-12-21","11YR00000002978L",10002954,4057590,7339,"Mainz-Bingen",1352.53,4058,733907,"Rhein-Selz"
"1705","E32954010200000000003627150313576","ENERCON GmbH","E82-E4",2000,"14.12.2009",7331073,"49,834521","8,139496",138.38,82,733106073,55286,"WÃ¶rrstadt",2000,"2009-12-14","11YR00000002978L",10002954,4226810.17,7331,"Alzey-Worms",2113.405085,4227,733106,"Wörrstadt"
"1706","E32954010200000000003627150313577","ENERCON GmbH","E82 E4",2000,"11.12.2009",7331073,"49,83007","8,138268",138.38,82,733106073,55286,"WÃ¶rrstadt",2000,"2009-12-11","11YR00000002978L",10002954,4270265.49,7331,"Alzey-Worms",2135.132745,4270,733106,"Wörrstadt"
"1707","E32954010200000000003627150313578","ENERCON GmbH","E82 E4",2000,"11.12.2009",7331073,"49,832318","8,138298",138.38,82,733106073,55286,"WÃ¶rrstadt",2000,"2009-12-11","11YR00000002978L",10002954,4031188.91,7331,"Alzey-Worms",2015.594455,4031,733106,"Wörrstadt"
"1708","E32954010200000000003627150313579","ENERCON GmbH","E82 E4",2000,"17.12.2009",7331073,"49,827821","8,138058",138.38,82,733106073,55286,"WÃ¶rrstadt",2000,"2009-12-17","11YR00000002978L",10002954,4216533.74,7331,"Alzey-Worms",2108.26687,4217,733106,"Wörrstadt"
"1709","E32954010200000000003627150313580","ENERCON GmbH","E82 E4",2000,"18.12.2009",7331073,"49,825801","8,139609",138.38,82,733106073,55286,"WÃ¶rrstadt",2000,"2009-12-18","11YR00000002978L",10002954,4167540.38,7331,"Alzey-Worms",2083.77019,4168,733106,"Wörrstadt"
"1710","E32954010200000000003627150313581","ENERCON GmbH","E-101 3.0 MW",3000,"23.03.2012",7331073,"49,823696","8,127444",135.4,101,733106073,55286,"WÃ¶rrstadt",3000,"2012-03-23","11YR00000002978L",10002954,6612091.36,7331,"Alzey-Worms",2204.03045333333,6612,733106,"Wörrstadt"
"1711","E32954010200000000003627150313582","ENERCON GmbH","E-101 3.0 MW",3000,"30.01.2012",7331073,"49,827441","8,128113",135.4,101,733106073,55286,"WÃ¶rrstadt",3000,"2011-12-30","11YR00000002978L",10002954,5496569.95,7331,"Alzey-Worms",1832.18998333333,5497,733106,"Wörrstadt"
"1712","E32954010200000000003627152014740","ENERCON GmbH","E-82 E2",2300,"29.03.2011",7331073,"49,837315","8,147997",138,82,733106059,55288,"Schornsheim",2300,"2011-03-29","11YR00000002978L",10002954,4036845.6,7331,"Alzey-Worms",1755.15026086957,4037,733106,"Wörrstadt"
"1713","E32954010200000000003627152014741","ENERCON GmbH","E-80 E2",2300,"28.03.2011",7331073,"49,8368","8,155043",138,82,733106059,55288,"Schornsheim",2300,"2011-03-28","11YR00000002978L",10002954,4036845.6,7331,"Alzey-Worms",1755.15026086957,4037,733106,"Wörrstadt"
"1714","E32954010200000000003627152014742","ENERCON GmbH","E-82 E2",2300,"31.03.2011",7331073,"49,835227","8,161383",138,82,733106073,55286,"WÃ¶rrstadt",2300,"2011-03-31","11YR00000002978L",10002954,4036845.6,7331,"Alzey-Worms",1755.15026086957,4037,733106,"Wörrstadt"
"1715","E32954010200000000003627152014743","ENERCON GmbH","E-82 E2",2300,"30.03.2011",7331073,"49,832681","8,147758",138,82,733106073,55286,"WÃ¶rrstadt",2300,"2011-03-30","11YR00000002978L",10002954,4036845.6,7331,"Alzey-Worms",1755.15026086957,4037,733106,"Wörrstadt"
"1716","E32954010200000000003627152014744","ENERCON GmbH","E-82 E2",2300,"31.03.2011",7331073,"49,829916","8,148558",138,82,733106029,55288,"Gabsheim",2300,"2011-03-31","11YR00000002978L",10002954,4036845.6,7331,"Alzey-Worms",1755.15026086957,4037,733106,"Wörrstadt"
"1721","E33021010000000000000031736002135","Nordex Energy GmbH","N 90",2300,"22.12.2006",7134026,"49,573889","7,266667",100,90,NA,NA,NA,NA,NA,NA,NA,NA,NA,NA,NA,NA,NA,NA
"1722","E33021010000000000000031736002136","Nordex Energy GmbH","N 90",2300,"27.02.2007",7134026,"49,571389","7,264722",105,90,NA,NA,NA,NA,NA,NA,NA,NA,NA,NA,NA,NA,NA,NA
"1723","E33021010000000000000031736002137","Nordex Energy GmbH","N 90",2300,"08.03.2007",7134021,"49,551944","7,276667",105,100,NA,NA,NA,NA,NA,NA,NA,NA,NA,NA,NA,NA,NA,NA
"1724","E33021010000000000000031736002138","Nordex Energy GmbH","N 90",2300,"29.03.2007",7134021,"49,549444","7,276389",105,90,NA,NA,NA,NA,NA,NA,NA,NA,NA,NA,NA,NA,NA,NA
"1725","E33021010000000000000033739601769","Vestas Deutschland GmbH","V-90/2MW",2000,"11.04.2008",7134029,"49,5907","7,203511",105,90,NA,NA,NA,NA,NA,NA,NA,NA,NA,NA,NA,NA,NA,NA
"1726","E33021010000000000000033739602141","Vestas Deutschland GmbH","V-90/2MW",2000,"09.04.2008",7134029,"49,588075","7,207942",105,90,NA,NA,NA,NA,NA,NA,NA,NA,NA,NA,NA,NA,NA,NA
"1727","E33021011000000000000000406300002","ENERCON GmbH","E 82",2300,"25.04.2017",7134029,"49,578707","7,202786",138,82,NA,NA,NA,NA,NA,NA,NA,NA,NA,NA,NA,NA,NA,NA
"1728","E33021012000000000000000406309261","ENERCON GmbH","E 82",2300,"27.12.2013",7134029,"49,579717","7,212021",138,82,NA,NA,NA,NA,NA,NA,NA,NA,NA,NA,NA,NA,NA,NA
"1729","E33021012000000000000000406309262","ENERCON GmbH","E 82",2300,"06.02.2014",7134029,"49,578707","7,202786",138,82,NA,NA,NA,NA,NA,NA,NA,NA,NA,NA,NA,NA,NA,NA
"1730","E3302101R1I4459000000000018202153","Südwind Borsig Energy GmbH","S-77",1500,"16.07.2004",7134008,"49,567417","7,273982",85,77,NA,NA,NA,NA,NA,NA,NA,NA,NA,NA,NA,NA,NA,NA
"1731","E3302101R1I4459000000000018202154","Südwind Borsig Energy GmbH","S-77",1500,"30.07.2004",7134008,"49,566967","7,270361",100,77,NA,NA,NA,NA,NA,NA,NA,NA,NA,NA,NA,NA,NA,NA
"1732","E3302101V1I4461000000000041909343","Vestas Deutschland GmbH","V-90",2000,"08.03.2012",7134008,"49,563771","7,269035",125,90,NA,NA,NA,NA,NA,NA,NA,NA,NA,NA,NA,NA,NA,NA
"1733","E33079010000000060019115990010654","ENERCON GmbH","E-82 E2",2000,"11.03.2010",7339032,"49,93989","8,23729",108,82,731500000,55129,"Mainz",2000,"2010-03-11","11YR00000001258N",10003079,3936756.2,7315,"Mainz",1968.3781,3937,731500,"Mainz"
"1734","E33079010000000100000002737200289","ENERCON GmbH","E-115",3000,"28.02.2017",7339032,"49,93545","8,237018",135,115,731500000,55129,"Mainz",3000,"2017-02-28",NA,10003079,7611851.36,7315,"Mainz",2537.28378666667,7612,731500,"Mainz"
"1735","E33079010000000100000003563600001","ENERCON GmbH","E141",4200,"20.11.2019",7315000,"49,942011","8,245619",159,141,NA,NA,NA,NA,NA,NA,NA,NA,NA,NA,NA,NA,NA,NA
"1736","E4183201RS50419162000084428000001","ENERCON GmbH","E-101",3050,"15.10.2013",7331003,"49,729713","8,15575",135.4,101,NA,NA,NA,NA,NA,NA,NA,NA,NA,NA,NA,NA,NA,NA
